"Status","Start Time","Stop Time","Duration in ms","Parent Suite","Suite","Sub Suite","Test Class","Test Method","Name","Description"
"passed","Tue Apr 19 04:08:25 GMT 2022","Tue Apr 19 04:08:27 GMT 2022","2136","Contract: ERC777","with default operators","operator management","","","accounts are their own operator",""
"passed","Tue Apr 19 04:10:41 GMT 2022","Tue Apr 19 04:10:45 GMT 2022","4089","Contract: ERC721Enumerable","with minted tokens","transfers > via safeTransferFrom > without data > to a user account > when called by the owner","","","emits an Approval event",""
"passed","Tue Apr 19 04:11:12 GMT 2022","Tue Apr 19 04:11:15 GMT 2022","3297","Contract: ERC721Enumerable","with minted tokens","transfers > via safeTransferFrom > without data > to a user account > when called by the operator","","","transfers the ownership of the given token ID to the given address",""
"passed","Tue Apr 19 04:03:54 GMT 2022","Tue Apr 19 04:03:58 GMT 2022","3747","Contract: ERC721","with minted tokens","transfers > via transferFrom > when the sender is not authorized for the token id","","","reverts",""
"passed","Tue Apr 19 04:04:57 GMT 2022","Tue Apr 19 04:04:58 GMT 2022","1321","Contract: Math","ceilDiv","","","","does not round up on exact division",""
"passed","Tue Apr 19 03:53:10 GMT 2022","Tue Apr 19 03:53:13 GMT 2022","2694","Contract: AccessControl","setting role admin","","","","a role's admin role can be changed",""
"passed","Tue Apr 19 04:14:41 GMT 2022","Tue Apr 19 04:14:45 GMT 2022","4627","Contract: ERC721Enumerable","with minted tokens","transfers > via safeTransferFrom > without data > to a valid receiver contract > when sent to the owner","","","keeps the owner balance",""
"passed","Tue Apr 19 04:08:16 GMT 2022","Tue Apr 19 04:08:19 GMT 2022","2650","Contract: ERC777","with default operators","with no ERC777TokensSender and no ERC777TokensRecipient implementers > mint (internal extended) > to non ERC777TokensRecipient implementer > with default operator","","","with requireReceptionAck",""
"passed","Tue Apr 19 04:02:12 GMT 2022","Tue Apr 19 04:02:15 GMT 2022","2792","Contract: Arrays","findUpperBound","Even number of elements","","","returns correct index for the basic case",""
"passed","Tue Apr 19 04:12:09 GMT 2022","Tue Apr 19 04:12:12 GMT 2022","3456","Contract: ERC721Enumerable","with minted tokens","transfers > via safeTransferFrom > without data > to a user account > when sent to the owner","","","keeps the owner balance",""
"passed","Tue Apr 19 04:06:26 GMT 2022","Tue Apr 19 04:06:29 GMT 2022","2484","Contract: EnumerableMap","set","","","","returns false when adding keys already in the set",""
"passed","Tue Apr 19 04:05:56 GMT 2022","Tue Apr 19 04:05:58 GMT 2022","2738","Contract: ERC777","with default operators","with no ERC777TokensSender and no ERC777TokensRecipient implementers > send/burn > with first default operator > operator send > when the sender has no tokens","","","reverts when sending from the zero address",""
"passed","Tue Apr 19 04:05:40 GMT 2022","Tue Apr 19 04:05:41 GMT 2022","1313","Contract: SignedSafeMath","mul","","","","multiplies correctly",""
"passed","Tue Apr 19 03:53:39 GMT 2022","Tue Apr 19 03:53:41 GMT 2022","2573","Contract: MinimalForwarder","with message","execute > invalid signature","","","tampered from",""
"passed","Tue Apr 19 04:02:17 GMT 2022","Tue Apr 19 04:02:23 GMT 2022","5716","Contract: Address","sendValue","when sender contract has funds","","","sends non-zero amounts",""
"passed","Tue Apr 19 04:03:44 GMT 2022","Tue Apr 19 04:03:47 GMT 2022","2273","Contract: RefundEscrow","once deployed","","","","only the owner can enter closed state",""
"passed","Tue Apr 19 04:00:20 GMT 2022","Tue Apr 19 04:00:22 GMT 2022","2615","Contract: ERC721Enumerable","with minted tokens","balanceOf > when querying the zero address","","","throws",""
"passed","Tue Apr 19 04:06:31 GMT 2022","Tue Apr 19 04:06:34 GMT 2022","2687","Contract: EnumerableMap","remove","","","","removes added keys",""
"skipped","Tue Apr 19 03:58:00 GMT 2022","Tue Apr 19 03:58:00 GMT 2022","0","Contract: ERC20Votes","getPastTotalSupply","","","","reverts if block number >= current block",""
"passed","Tue Apr 19 04:04:58 GMT 2022","Tue Apr 19 04:05:12 GMT 2022","14107","Contract: ConditionalEscrow","when withdrawal is allowed","as an escrow > withdrawals","","","can do an empty withdrawal",""
"passed","Tue Apr 19 03:54:57 GMT 2022","Tue Apr 19 03:55:00 GMT 2022","2862","Contract: Clones","cloneDeterministic","initialization with parameters > non payable > when not sending balance","","","has expected balance",""
"passed","Tue Apr 19 04:11:59 GMT 2022","Tue Apr 19 04:12:02 GMT 2022","3268","Contract: ERC721Enumerable","with minted tokens","transfers > via safeTransferFrom > without data > to a user account > when sent to the owner","","","keeps ownership of the token",""
"passed","Tue Apr 19 04:04:31 GMT 2022","Tue Apr 19 04:04:35 GMT 2022","3705","Contract: ERC165Checker","ERC165 and single interface supported","","","","supports ERC165",""
"broken","Tue Apr 19 03:59:30 GMT 2022","Tue Apr 19 03:59:36 GMT 2022","6137","Contract: TokenTimelock","with token","once deployed","","","can be released after time limit",""
"passed","Tue Apr 19 03:58:38 GMT 2022","Tue Apr 19 03:58:41 GMT 2022","3032","Contract: ERC20","_mint","for a non zero account","","","increments totalSupply",""
"passed","Tue Apr 19 04:02:24 GMT 2022","Tue Apr 19 04:02:27 GMT 2022","2871","Contract: Context","msgData","","","","returns the transaction data when called from an EOA",""
"passed","Tue Apr 19 04:04:02 GMT 2022","Tue Apr 19 04:04:15 GMT 2022","12790","Contract: RefundEscrow","once deployed","closed state","","","allows beneficiary withdrawal",""
"passed","Tue Apr 19 03:59:14 GMT 2022","Tue Apr 19 03:59:19 GMT 2022","4181","Contract: ERC20","erc20 behaviour","total supply","","","returns the total amount of tokens",""
"passed","Tue Apr 19 03:59:56 GMT 2022","Tue Apr 19 04:00:00 GMT 2022","4351","Contract: SafeERC20","with token that returns true on all calls","approvals > with non-zero allowance","","","reverts when approving a non-zero allowance",""
"passed","Tue Apr 19 04:08:46 GMT 2022","Tue Apr 19 04:08:48 GMT 2022","1918","Contract: ERC777","with default operators","operator management > default operators > with revoked default operator","","","default operator is not revoked for other holders",""
"passed","Tue Apr 19 04:07:10 GMT 2022","Tue Apr 19 04:07:11 GMT 2022","1190","Contract: SafeCast","toInt128","","","","reverts when downcasting -2^127 - 2 (-170141183460469231731687303715884105730)",""
"passed","Tue Apr 19 04:02:15 GMT 2022","Tue Apr 19 04:02:23 GMT 2022","7924","Contract: ERC721Enumerable","with minted tokens","transfers > via transferFrom > when called by the operator","","","emits an Approval event",""
"passed","Tue Apr 19 04:02:08 GMT 2022","Tue Apr 19 04:02:09 GMT 2022","1282","Contract: ERC721PresetMinterPauserAutoId","Contract interface","ERC721Enumerable > totalSupply()","","","has to be implemented",""
"passed","Tue Apr 19 04:08:35 GMT 2022","Tue Apr 19 04:08:37 GMT 2022","1696","Contract: ERC777","with default operators","operator management > new operators","","","are not added to the default operators list",""
"passed","Tue Apr 19 04:01:22 GMT 2022","Tue Apr 19 04:01:24 GMT 2022","2167","Contract: ERC721URIStorage","token URI","","","","reverts when queried for non existent token id",""
"passed","Tue Apr 19 04:05:43 GMT 2022","Tue Apr 19 04:05:44 GMT 2022","1114","Contract: SignedSafeMath","mul","","","","reverts on multiplication overflow, positive operands",""
"passed","Tue Apr 19 03:56:44 GMT 2022","Tue Apr 19 03:56:50 GMT 2022","6495","Contract: ERC20","transfer","when the recipient is not the zero address > when the sender transfers all balance","","","transfers the requested amount",""
"passed","Tue Apr 19 04:02:09 GMT 2022","Tue Apr 19 04:02:11 GMT 2022","2077","Contract: ERC777PresetFixedSupply","","","","","returns the total supply equal to initial supply",""
"passed","Tue Apr 19 04:02:37 GMT 2022","Tue Apr 19 04:02:38 GMT 2022","1661","Contract: Counters","increment","starting from 0","","","increments the current value by one",""
"passed","Tue Apr 19 04:11:25 GMT 2022","Tue Apr 19 04:11:28 GMT 2022","3411","Contract: ERC721Enumerable","with minted tokens","transfers > via safeTransferFrom > without data > to a user account > when called by the operator","","","adjusts owners balances",""
"passed","Tue Apr 19 04:08:42 GMT 2022","Tue Apr 19 04:08:47 GMT 2022","5385","Contract: ERC721Enumerable","with minted tokens","transfers > via safeTransferFrom > with data > to a valid receiver contract > when called by the approved individual","","","adjusts owners tokens by index",""
"passed","Tue Apr 19 04:03:50 GMT 2022","Tue Apr 19 04:03:54 GMT 2022","3497","Contract: ERC721","with minted tokens","transfers > via transferFrom > when the address of the previous owner is incorrect","","","reverts",""
"passed","Tue Apr 19 03:57:52 GMT 2022","Tue Apr 19 03:57:56 GMT 2022","3763","Contract: ERC1155","like an ERC1155","safeTransferFrom > to a receiver contract returning unexpected value","","","reverts",""
"broken","Tue Apr 19 03:55:33 GMT 2022","Tue Apr 19 03:55:33 GMT 2022","0","tests.brownie.token.tests","test_transferFrom","","","","test_transfer_to_self",""
"passed","Tue Apr 19 04:06:29 GMT 2022","Tue Apr 19 04:06:34 GMT 2022","4621","Contract: ERC721","with minted tokens","transfers > via safeTransferFrom > with data > to a user account > when called by the owner without an approved user","","","emits an Approval event",""
"passed","Tue Apr 19 04:06:03 GMT 2022","Tue Apr 19 04:06:04 GMT 2022","1247","Contract: SafeCast","toUint256","","","","reverts when casting INT256_MIN (-57896044618658097711785492504343953926634992332820282019728792003956564819968)",""
"passed","Tue Apr 19 03:56:54 GMT 2022","Tue Apr 19 03:57:00 GMT 2022","6666","Contract: ERC1155","like an ERC1155","safeTransferFrom > when called by an operator on behalf of the multiTokenHolder > when operator is approved by multiTokenHolder","","","preserves operator's balances not involved in the transfer",""
"passed","Tue Apr 19 03:57:29 GMT 2022","Tue Apr 19 03:57:31 GMT 2022","2026","Contract: ERC20Capped","once deployed","capped token","","","fails to mint after cap is reached",""
"passed","Tue Apr 19 04:05:33 GMT 2022","Tue Apr 19 04:05:34 GMT 2022","1437","Contract: SafeMath","with default revert message","add","","","adds correctly",""
"passed","Tue Apr 19 04:06:45 GMT 2022","Tue Apr 19 04:06:46 GMT 2022","1250","Contract: SafeCast","toInt32","","","","reverts when downcasting 2^31 (2147483648)",""
"passed","Tue Apr 19 04:00:42 GMT 2022","Tue Apr 19 04:00:49 GMT 2022","6877","Contract: SafeERC20","with token that returns no boolean values","approvals > with zero allowance","","","doesn't revert when approving a zero allowance",""
"passed","Tue Apr 19 04:06:59 GMT 2022","Tue Apr 19 04:07:00 GMT 2022","1239","Contract: SafeCast","toInt64","","","","reverts when downcasting -2^63 - 2 (-9223372036854775810)",""
"passed","Tue Apr 19 04:05:58 GMT 2022","Tue Apr 19 04:05:59 GMT 2022","1308","Contract: SafeMath","with default revert message","mod > modulos correctly","","","when the dividend is larger than the divisor",""
"passed","Tue Apr 19 04:09:39 GMT 2022","Tue Apr 19 04:09:44 GMT 2022","5022","Contract: ERC777","with default operators","send and receive hooks > tokensReceived > with ERC777TokensRecipient implementer > with contract as implementer for another contract > when TokensRecipient reverts","","","send reverts",""
"skipped","Tue Apr 19 03:52:49 GMT 2022","Tue Apr 19 03:52:49 GMT 2022","0","Contract: TimelockController","methods","batch > execute > with scheduled operation > on time","","","length mismatch #1",""
"passed","Tue Apr 19 04:04:11 GMT 2022","Tue Apr 19 04:04:17 GMT 2022","5355","Contract: ERC777","with default operators","with no ERC777TokensSender and no ERC777TokensRecipient implementers > send/burn > direct send > when the sender has tokens","","","reverts when sending more than the balance",""
"passed","Tue Apr 19 04:06:35 GMT 2022","Tue Apr 19 04:06:36 GMT 2022","1329","Contract: SafeCast","toInt32","","","","downcasts -1",""
"passed","Tue Apr 19 04:09:20 GMT 2022","Tue Apr 19 04:09:24 GMT 2022","4621","Contract: ERC721Enumerable","with minted tokens","transfers > via safeTransferFrom > with data > to a valid receiver contract > when called by the owner without an approved user","","","emits a Transfer event",""
"passed","Tue Apr 19 03:57:34 GMT 2022","Tue Apr 19 03:57:37 GMT 2022","2930","Contract: ERC20","approve","when the spender is not the zero address > when the sender has enough balance > when the spender had an approved amount","","","approves the requested amount and replaces the previous one",""
"passed","Tue Apr 19 04:03:51 GMT 2022","Tue Apr 19 04:03:53 GMT 2022","1632","Contract: ERC777","with default operators","basic information","","","returns the total supply",""
"passed","Tue Apr 19 03:54:28 GMT 2022","Tue Apr 19 03:54:37 GMT 2022","9522","Contract: Governor","Contract interface","Governor > state(uint256)","","","has to be implemented",""
"passed","Tue Apr 19 03:53:53 GMT 2022","Tue Apr 19 03:53:54 GMT 2022","1389","Contract: ERC1967Proxy","without initialization","when not sending balance","","","initializes the proxy",""
"passed","Tue Apr 19 04:05:44 GMT 2022","Tue Apr 19 04:05:55 GMT 2022","10878","Contract: ERC721","with minted tokens","transfers > via safeTransferFrom > with data > to a user account > when called by the operator","","","clears the approval for the token ID",""
"passed","Tue Apr 19 04:03:58 GMT 2022","Tue Apr 19 04:04:02 GMT 2022","4698","Contract: ERC721","with minted tokens","transfers > via transferFrom > when the given token ID does not exist","","","reverts",""
"passed","Tue Apr 19 03:52:49 GMT 2022","Tue Apr 19 03:53:07 GMT 2022","17880","Contract: GovernorTimelockControl","Contract interface","ERC165 > supportsInterface(bytes4)","","","has to be implemented",""
"passed","Tue Apr 19 04:06:02 GMT 2022","Tue Apr 19 04:06:03 GMT 2022","1333","Contract: Strings","from uint256 - decimal format","","","","converts MAX_UINT256",""
"passed","Tue Apr 19 04:04:36 GMT 2022","Tue Apr 19 04:04:50 GMT 2022","14032","Contract: ERC721Enumerable","with minted tokens","transfers > via safeTransferFrom > with data > to a user account > when called by the owner","","","clears the approval for the token ID",""
"passed","Tue Apr 19 04:02:39 GMT 2022","Tue Apr 19 04:02:40 GMT 2022","1584","Contract: ERC721PresetMinterPauserAutoId","minting","","","","other accounts cannot mint tokens",""
"passed","Tue Apr 19 04:06:53 GMT 2022","Tue Apr 19 04:06:55 GMT 2022","2137","Contract: SafeCast","toInt64","","","","downcasts -1",""
"passed","Tue Apr 19 03:57:59 GMT 2022","Tue Apr 19 03:58:03 GMT 2022","4653","Contract: ERC20Snapshot","snapshot","","","","creates increasing snapshots ids, starting from 1",""
"passed","Tue Apr 19 04:07:28 GMT 2022","Tue Apr 19 04:07:30 GMT 2022","2574","Contract: EnumerableSet","EnumerableUintSet","add","","","returns false when adding values already in the set",""
"passed","Tue Apr 19 04:07:50 GMT 2022","Tue Apr 19 04:07:52 GMT 2022","2504","Contract: ERC777","with default operators","with no ERC777TokensSender and no ERC777TokensRecipient implementers > send/burn > with new authorized operator > with revoked operator > operator burn","","","reverts",""
"passed","Tue Apr 19 04:08:04 GMT 2022","Tue Apr 19 04:08:06 GMT 2022","1648","Contract: ERC777","with default operators","with no ERC777TokensSender and no ERC777TokensRecipient implementers > mint (internal) > with non operator","","","reverts when minting tokens for the zero address",""
"passed","Tue Apr 19 03:59:55 GMT 2022","Tue Apr 19 04:00:00 GMT 2022","4930","Contract: ERC1155","like an ERC1155","safeBatchTransferFrom > to a receiver contract that reverts","","","reverts",""
"passed","Tue Apr 19 04:04:18 GMT 2022","Tue Apr 19 04:04:20 GMT 2022","2368","Contract: ERC165","Contract interface","ERC165 > supportsInterface(bytes4)","","","has to be implemented",""
"passed","Tue Apr 19 04:01:49 GMT 2022","Tue Apr 19 04:01:52 GMT 2022","2699","Contract: ERC777","with default operators","","","","does not emit AuthorizedOperator events for default operators",""
"passed","Tue Apr 19 03:57:09 GMT 2022","Tue Apr 19 03:57:17 GMT 2022","8671","Contract: ERC20","transfer from","when the token owner is not the zero address > when the recipient is not the zero address > when the spender has enough approved balance > when the token owner has enough balance","","","emits an approval event",""
"passed","Tue Apr 19 03:57:04 GMT 2022","Tue Apr 19 03:57:06 GMT 2022","1946","Contract: ERC20Permit","permit","","","","rejects other signature",""
"passed","Tue Apr 19 04:01:27 GMT 2022","Tue Apr 19 04:01:29 GMT 2022","2228","Contract: ERC721PresetMinterPauserAutoId","","","","","token has correct name",""
"passed","Tue Apr 19 04:05:33 GMT 2022","Tue Apr 19 04:05:39 GMT 2022","5898","Contract: ERC721","with minted tokens","transfers > via safeTransferFrom > with data > to a user account > when called by the operator","","","transfers the ownership of the given token ID to the given address",""
"skipped","Tue Apr 19 03:52:49 GMT 2022","Tue Apr 19 03:52:49 GMT 2022","0","Contract: TimelockController","usage scenario","","","","call",""
"passed","Tue Apr 19 04:03:50 GMT 2022","Tue Apr 19 04:03:51 GMT 2022","1609","Contract: RefundEscrow","once deployed","active state","","","accepts deposits",""
"passed","Tue Apr 19 04:14:45 GMT 2022","Tue Apr 19 04:14:49 GMT 2022","3895","Contract: ERC721","with minted tokens","transfers > via safeTransferFrom > without data > to a valid receiver contract > when the address of the previous owner is incorrect","","","reverts",""
"passed","Tue Apr 19 03:59:44 GMT 2022","Tue Apr 19 03:59:46 GMT 2022","1776","Contract: ERC721","Contract interface","ERC165 > ERC165's supportsInterface(bytes4)","","","uses less than 30k gas [skip-on-coverage]",""
"passed","Tue Apr 19 04:03:17 GMT 2022","Tue Apr 19 04:03:23 GMT 2022","5366","Contract: ERC721Enumerable","with minted tokens","transfers > via transferFrom > when called by the owner without an approved user","","","adjusts owners tokens by index",""
"passed","Tue Apr 19 03:59:57 GMT 2022","Tue Apr 19 03:59:59 GMT 2022","1341","Contract: ERC721Enumerable","Contract interface","ERC721 > isApprovedForAll(address,address)","","","has to be implemented",""
"passed","Tue Apr 19 04:02:07 GMT 2022","Tue Apr 19 04:02:09 GMT 2022","1638","Contract: ERC777PresetFixedSupply","","","","","default operators are operators for all accounts",""
"passed","Tue Apr 19 04:07:35 GMT 2022","Tue Apr 19 04:07:38 GMT 2022","3180","Contract: ERC777","with default operators","with no ERC777TokensSender and no ERC777TokensRecipient implementers > send/burn > with new authorized operator > operator burn > when the sender has tokens","","","reverts when burning more than the balance",""
"passed","Tue Apr 19 04:07:10 GMT 2022","Tue Apr 19 04:07:11 GMT 2022","1611","Contract: EnumerableSet","EnumerableAddressSet","remove","","","returns false when removing values not in the set",""
"passed","Tue Apr 19 04:00:57 GMT 2022","Tue Apr 19 04:01:11 GMT 2022","13573","Contract: ERC721Enumerable","with minted tokens","transfers > via transferFrom > when called by the owner","","","adjusts owners balances",""
"passed","Tue Apr 19 04:02:11 GMT 2022","Tue Apr 19 04:02:17 GMT 2022","6537","Contract: Address","sendValue","when sender contract has funds","","","sends 0 wei",""
"skipped","Tue Apr 19 04:04:16 GMT 2022","Tue Apr 19 04:04:16 GMT 2022","0","Contract: Governor","Proposal length","","","","missmatch #2",""
"passed","Tue Apr 19 03:53:19 GMT 2022","Tue Apr 19 03:53:20 GMT 2022","1699","Contract: MinimalForwarder","with message","verify > valid signature","","","success",""
"skipped","Tue Apr 19 03:52:23 GMT 2022","Tue Apr 19 03:52:23 GMT 2022","0","Contract: GovernorTimelockCompound","","","","","doesn't accept ether transfers",""
"broken","Tue Apr 19 03:52:59 GMT 2022","Tue Apr 19 03:52:59 GMT 2022","508","Ethers.js","","","","","testReadOnlyMethods",""
"passed","Tue Apr 19 04:06:11 GMT 2022","Tue Apr 19 04:06:14 GMT 2022","2853","Contract: ERC777","with default operators","with no ERC777TokensSender and no ERC777TokensRecipient implementers > send/burn > with first default operator > operator burn > when the sender has no tokens","","","reverts when burning from the zero address",""
"passed","Tue Apr 19 03:58:27 GMT 2022","Tue Apr 19 03:58:30 GMT 2022","3384","Contract: ERC1155","like an ERC1155","safeBatchTransferFrom > when called by the multiTokenHolder","","","emits a TransferBatch log",""
"passed","Tue Apr 19 03:58:52 GMT 2022","Tue Apr 19 03:58:55 GMT 2022","3373","Contract: ERC20PresetMinterPauser","pausing","","","","deployer can unpause",""
"passed","Tue Apr 19 04:07:05 GMT 2022","Tue Apr 19 04:07:09 GMT 2022","4467","Contract: ERC721Enumerable","with minted tokens","transfers > via safeTransferFrom > with data > to a user account > when sent to the owner","","","clears the approval for the token ID",""
"skipped","Tue Apr 19 03:53:53 GMT 2022","Tue Apr 19 03:53:53 GMT 2022","0","Contract: ERC1967Proxy","without initialization","when not sending balance","","","sets the implementation address",""
"passed","Tue Apr 19 04:02:16 GMT 2022","Tue Apr 19 04:02:20 GMT 2022","4388","Contract: Context","msgSender","","","","returns the transaction sender when called from an EOA",""
"passed","Tue Apr 19 04:00:18 GMT 2022","Tue Apr 19 04:00:21 GMT 2022","2738","Contract: ERC721","with minted tokens","balanceOf > when the given address does not own any tokens","","","returns 0",""
"passed","Tue Apr 19 04:02:34 GMT 2022","Tue Apr 19 04:02:40 GMT 2022","5860","Contract: ERC721","with minted tokens","transfers > via transferFrom > when called by the owner without an approved user","","","transfers the ownership of the given token ID to the given address",""
"passed","Tue Apr 19 04:08:25 GMT 2022","Tue Apr 19 04:08:30 GMT 2022","5572","Contract: ERC721","with minted tokens","transfers > via safeTransferFrom > with data > to a valid receiver contract > when called by the approved individual","","","adjusts owners balances",""
"passed","Tue Apr 19 03:53:10 GMT 2022","Tue Apr 19 03:53:18 GMT 2022","7555","Contract: Governor","Contract interface","ERC165 > ERC165's supportsInterface(bytes4)","","","claims support [skip-on-coverage]",""
"broken","Tue Apr 19 03:55:28 GMT 2022","Tue Apr 19 03:55:28 GMT 2022","0","tests.brownie.token.tests","test_approve","","","","test_initial_approval_is_zero[2]",""
"passed","Tue Apr 19 04:03:17 GMT 2022","Tue Apr 19 04:03:22 GMT 2022","4519","Contract: ERC721","with minted tokens","transfers > via transferFrom > when sent to the owner","","","keeps ownership of the token",""
"passed","Tue Apr 19 03:54:27 GMT 2022","Tue Apr 19 03:54:30 GMT 2022","2504","Contract: UUPSUpgradeable","","","","","upgrade to upgradeable implementation",""
"passed","Tue Apr 19 04:05:59 GMT 2022","Tue Apr 19 04:06:00 GMT 2022","1384","Contract: StorageSlot","boolean storage slot","get","","","from right slot",""
"passed","Tue Apr 19 04:02:50 GMT 2022","Tue Apr 19 04:02:53 GMT 2022","2967","Contract: ERC721PresetMinterPauserAutoId","pausing","","","","other accounts cannot pause",""
"passed","Tue Apr 19 04:06:30 GMT 2022","Tue Apr 19 04:06:33 GMT 2022","2125","Contract: EnumerableSet","EnumerableBytes32Set","add","","","adds several values",""
"passed","Tue Apr 19 03:56:57 GMT 2022","Tue Apr 19 03:56:58 GMT 2022","1637","Contract: TransparentUpgradeableProxy","storage","","","","should store the implementation address in specified location",""
"passed","Tue Apr 19 04:07:03 GMT 2022","Tue Apr 19 04:07:05 GMT 2022","1789","Contract: ERC777","with default operators","with no ERC777TokensSender and no ERC777TokensRecipient implementers > send/burn > before authorizing a new operator > operator burn","","","reverts",""
"passed","Tue Apr 19 04:02:20 GMT 2022","Tue Apr 19 04:02:26 GMT 2022","5623","Contract: ERC721","with minted tokens","transfers > via transferFrom > when called by the operator","","","adjusts owners balances",""
"passed","Tue Apr 19 03:54:01 GMT 2022","Tue Apr 19 03:54:02 GMT 2022","971","Contract: Initializable","basic testing without inheritance","before initialize","","","initializer has not run",""
"passed","Tue Apr 19 03:56:36 GMT 2022","Tue Apr 19 03:56:38 GMT 2022","2597","Contract: ERC1155PresetMinterPauser","Contract interface","AccessControlEnumerable > ERC165's supportsInterface(bytes4)","","","claims support [skip-on-coverage]",""
"passed","Tue Apr 19 03:54:46 GMT 2022","Tue Apr 19 03:54:49 GMT 2022","2623","Contract: Pausable","when unpaused","when paused > unpausing","","","is unpausable by the pauser",""
"passed","Tue Apr 19 03:55:56 GMT 2022","Tue Apr 19 03:55:58 GMT 2022","2227","Contract: ERC1155PresetMinterPauser","","","","","minter and pauser role admin is the default admin",""
"passed","Tue Apr 19 03:52:30 GMT 2022","Tue Apr 19 03:52:33 GMT 2022","3245","Contract: PaymentSplitter","once deployed","accepts payments","","","Ether",""
"passed","Tue Apr 19 03:57:23 GMT 2022","Tue Apr 19 03:57:30 GMT 2022","6762","Contract: ERC1155","like an ERC1155","safeTransferFrom > when sending to a valid receiver > without data","","","calls onERC1155Received",""
"passed","Tue Apr 19 03:55:13 GMT 2022","Tue Apr 19 03:55:15 GMT 2022","2247","Contract: TransparentUpgradeableProxy","upgradeTo","when the sender is the admin > when the given implementation is different from the current one","","","upgrades to the requested implementation",""
"broken","Tue Apr 19 03:55:30 GMT 2022","Tue Apr 19 03:55:30 GMT 2022","0","tests.brownie.token.tests","test_transfer","","","","test_total_supply_not_affected",""
