"Status","Start Time","Stop Time","Duration in ms","Parent Suite","Suite","Sub Suite","Test Class","Test Method","Name","Description"
"broken","Tue Apr 19 04:15:01 GMT 2022","Tue Apr 19 04:15:01 GMT 2022","144","Contract: ERC721Enumerable","with minted tokens","transfers > via safeTransferFrom > without data > to a valid receiver contract > when the address to transfer the token to is the zero address","","","reverts",""
"passed","Tue Apr 19 03:52:35 GMT 2022","Tue Apr 19 03:52:36 GMT 2022","1302","Contract: AccessControl","default admin","","","","other roles's admin is the default admin role",""
"skipped","Tue Apr 19 03:52:49 GMT 2022","Tue Apr 19 03:52:49 GMT 2022","0","Contract: TimelockController","usage scenario","","","","call payable with eth",""
"passed","Tue Apr 19 03:53:55 GMT 2022","Tue Apr 19 03:53:57 GMT 2022","2597","Contract: BeaconProxy","initialization","","","","payable initialization",""
"passed","Tue Apr 19 03:58:53 GMT 2022","Tue Apr 19 03:58:58 GMT 2022","5302","Contract: ERC1155","like an ERC1155","safeBatchTransferFrom > when called by an operator on behalf of the multiTokenHolder > when operator is approved by multiTokenHolder","","","preserves operator's balances not involved in the transfer",""
"passed","Tue Apr 19 04:00:46 GMT 2022","Tue Apr 19 04:00:48 GMT 2022","2434","Contract: ERC1155","like an ERC1155","Contract interface > ERC1155 > ERC165's supportsInterface(bytes4)","","","uses less than 30k gas [skip-on-coverage]",""
"skipped","Tue Apr 19 03:52:49 GMT 2022","Tue Apr 19 03:52:49 GMT 2022","0","Contract: TimelockController","methods","simple > execute > with scheduled operation","","","revert if execution comes too early 1/2",""
"passed","Tue Apr 19 04:03:51 GMT 2022","Tue Apr 19 04:03:54 GMT 2022","2578","Contract: Address","functionDelegateCall","","","","bubbles up revert reason",""
"passed","Tue Apr 19 04:02:32 GMT 2022","Tue Apr 19 04:02:35 GMT 2022","2900","Contract: ERC721PresetMinterPauserAutoId","Contract interface","AccessControlEnumerable > getRoleMember(bytes32,uint256)","","","has to be implemented",""
"passed","Tue Apr 19 03:58:06 GMT 2022","Tue Apr 19 03:58:12 GMT 2022","5778","Contract: ERC20Snapshot","totalSupplyAt","with initial snapshot > with no supply changes after the snapshot","","","returns the current total supply",""
"passed","Tue Apr 19 03:54:22 GMT 2022","Tue Apr 19 03:54:25 GMT 2022","2952","Contract: TransparentUpgradeableProxy","initialization without parameters","non payable > when not sending balance","","","initializes the proxy",""
"passed","Tue Apr 19 04:08:33 GMT 2022","Tue Apr 19 04:08:35 GMT 2022","2062","Contract: ERC777","with default operators","operator management","","","non-operators can be authorized",""
"passed","Tue Apr 19 03:56:00 GMT 2022","Tue Apr 19 03:56:11 GMT 2022","10853","Contract: ERC1155","like an ERC1155","safeTransferFrom > when called by the multiTokenHolder","","","credits transferred balance to receiver",""
"passed","Tue Apr 19 04:13:55 GMT 2022","Tue Apr 19 04:14:00 GMT 2022","5256","Contract: ERC721","with minted tokens","transfers > via safeTransferFrom > without data > to a valid receiver contract > when called by the owner without an approved user","","","transfers the ownership of the given token ID to the given address",""
"passed","Tue Apr 19 03:55:30 GMT 2022","Tue Apr 19 03:55:36 GMT 2022","5819","Contract: ERC1155Supply","after mint","batch","","","totalSupply",""
"passed","Tue Apr 19 04:00:50 GMT 2022","Tue Apr 19 04:00:51 GMT 2022","1199","Contract: ERC1155","like an ERC1155","Contract interface > ERC1155 > balanceOf(address,uint256)","","","has to be implemented",""
"passed","Tue Apr 19 04:04:26 GMT 2022","Tue Apr 19 04:04:28 GMT 2022","1744","Contract: ERC1820Implementer","with registered interfaces","","","","returns true when interface implementation is queried",""
"broken","Tue Apr 19 03:59:42 GMT 2022","Tue Apr 19 03:59:42 GMT 2022","0","Contract: GovernorTimelockCompound","updateTimelock","using workflow","","","""after each"" hook for ""run""",""
"passed","Tue Apr 19 03:53:57 GMT 2022","Tue Apr 19 03:53:59 GMT 2022","2280","Contract: Clones","clone","initialization without parameters > payable > when sending some balance","","","initializes the proxy",""
"passed","Tue Apr 19 04:00:00 GMT 2022","Tue Apr 19 04:00:02 GMT 2022","2275","Contract: ERC721","Contract interface","ERC721 > isApprovedForAll(address,address)","","","has to be implemented",""
"passed","Tue Apr 19 04:08:29 GMT 2022","Tue Apr 19 04:08:31 GMT 2022","2074","Contract: ERC777","with default operators","operator management","","","reverts when self-revoking",""
"passed","Tue Apr 19 04:06:36 GMT 2022","Tue Apr 19 04:06:54 GMT 2022","17834","Contract: EnumerableMap","remove","","","","adds and removes multiple keys",""
"passed","Tue Apr 19 03:56:29 GMT 2022","Tue Apr 19 03:56:36 GMT 2022","6906","Contract: ERC1155Holder","Contract interface","ERC1155Receiver > ERC165's supportsInterface(bytes4)","","","claims support [skip-on-coverage]",""
"passed","Tue Apr 19 04:04:58 GMT 2022","Tue Apr 19 04:05:00 GMT 2022","1508","Contract: Math","ceilDiv","","","","rounds up on division with remainders",""
"passed","Tue Apr 19 04:03:56 GMT 2022","Tue Apr 19 04:03:58 GMT 2022","1754","Contract: ERC777","with default operators","basic information","","","the ERC20Token interface is registered in the registry",""
"passed","Tue Apr 19 04:05:10 GMT 2022","Tue Apr 19 04:05:13 GMT 2022","2430","Contract: SafeMath","with flag","sub","","","subtracts correctly",""
"passed","Tue Apr 19 04:01:02 GMT 2022","Tue Apr 19 04:01:11 GMT 2022","9613","Contract: SafeERC20","with token that returns no boolean values","approvals > with non-zero allowance","","","doesn't revert when approving a zero allowance",""
"passed","Tue Apr 19 04:05:21 GMT 2022","Tue Apr 19 04:05:23 GMT 2022","1284","Contract: SafeCast","toUint32","","","","reverts when downcasting 2^32 (4294967296)",""
"passed","Tue Apr 19 04:03:29 GMT 2022","Tue Apr 19 04:03:33 GMT 2022","4403","Contract: ERC777","with default operators","as an ERC20 token > _approve > when the spender is the zero address","","","reverts",""
"skipped","Tue Apr 19 03:52:49 GMT 2022","Tue Apr 19 03:52:49 GMT 2022","0","Contract: TimelockController","methods","batch > execute > with scheduled operation","","","revert if execution comes too early 2/2",""
"passed","Tue Apr 19 03:55:21 GMT 2022","Tue Apr 19 03:55:23 GMT 2022","1816","Contract: ERC1155","like an ERC1155","balanceOfBatch > when accounts don't own tokens","","","returns zeros for each account",""
"passed","Tue Apr 19 04:09:24 GMT 2022","Tue Apr 19 04:09:29 GMT 2022","5039","Contract: ERC721Enumerable","with minted tokens","transfers > via safeTransferFrom > with data > to a valid receiver contract > when called by the owner without an approved user","","","clears the approval for the token ID",""
"passed","Tue Apr 19 04:04:45 GMT 2022","Tue Apr 19 04:04:50 GMT 2022","4817","Contract: ERC777","with default operators","with no ERC777TokensSender and no ERC777TokensRecipient implementers > send/burn > direct burn > when the sender has no tokens","","","reverts when burning a non-zero amount",""
"passed","Tue Apr 19 04:07:37 GMT 2022","Tue Apr 19 04:07:42 GMT 2022","4677","Contract: ERC721Enumerable","with minted tokens","transfers > via safeTransferFrom > with data > to a valid receiver contract","","","calls onERC721Received",""
"passed","Tue Apr 19 03:52:33 GMT 2022","Tue Apr 19 03:52:36 GMT 2022","3117","Contract: PaymentSplitter","once deployed","accepts payments","","","Token",""
"passed","Tue Apr 19 04:03:13 GMT 2022","Tue Apr 19 04:03:15 GMT 2022","1761","Contract: MerkleProof","verify","","","","returns false for an invalid Merkle proof",""
"passed","Tue Apr 19 03:57:54 GMT 2022","Tue Apr 19 03:58:04 GMT 2022","10172","Contract: GovernorTimelockControl","Contract interface","GovernorTimelock > queue(address[],uint256[],bytes[],bytes32)","","","has to be implemented",""
"passed","Tue Apr 19 04:07:02 GMT 2022","Tue Apr 19 04:07:03 GMT 2022","1237","Contract: SafeCast","toInt64","","","","reverts when downcasting 2^63 + 1 (9223372036854775809)",""
"passed","Tue Apr 19 04:05:39 GMT 2022","Tue Apr 19 04:05:47 GMT 2022","8138","Contract: ERC721Enumerable","with minted tokens","transfers > via safeTransferFrom > with data > to a user account > when called by the approved individual","","","adjusts owners tokens by index",""
"passed","Tue Apr 19 03:52:53 GMT 2022","Tue Apr 19 03:53:05 GMT 2022","12113","Contract: GovernorTimelockCompound","Contract interface","Governor > ERC165's supportsInterface(bytes4)","","","claims support [skip-on-coverage]",""
"passed","Tue Apr 19 03:55:08 GMT 2022","Tue Apr 19 03:55:17 GMT 2022","9400","Contract: Governor","Contract interface","Governor > votingPeriod()","","","has to be implemented",""
"passed","Tue Apr 19 04:05:39 GMT 2022","Tue Apr 19 04:05:44 GMT 2022","5420","Contract: ERC721","with minted tokens","transfers > via safeTransferFrom > with data > to a user account > when called by the operator","","","emits a Transfer event",""
"skipped","Tue Apr 19 03:52:49 GMT 2022","Tue Apr 19 03:52:49 GMT 2022","0","Contract: TimelockController","methods","batch > schedule","","","prevent overwritting active operation",""
"passed","Tue Apr 19 04:06:02 GMT 2022","Tue Apr 19 04:06:04 GMT 2022","2095","Contract: BitMap","setTo","","","","set a key to true",""
"passed","Tue Apr 19 04:06:36 GMT 2022","Tue Apr 19 04:06:38 GMT 2022","2437","Contract: ERC777","with default operators","with no ERC777TokensSender and no ERC777TokensRecipient implementers > send/burn > with second default operator > operator send > when the sender has no tokens","","","reverts when sending from the zero address",""
"passed","Tue Apr 19 03:58:43 GMT 2022","Tue Apr 19 03:58:45 GMT 2022","2084","Contract: ERC20","_mint","for a non zero account","","","emits Transfer event",""
"passed","Tue Apr 19 03:56:15 GMT 2022","Tue Apr 19 03:56:17 GMT 2022","2278","Contract: ERC1155PresetMinterPauser","Contract interface","ERC1155 > safeTransferFrom(address,address,uint256,uint256,bytes)","","","has to be implemented",""
"passed","Tue Apr 19 03:55:46 GMT 2022","Tue Apr 19 03:55:49 GMT 2022","2367","Contract: TransparentUpgradeableProxy","upgradeToAndCall","without migrations > when the call does fail","","","reverts",""
"passed","Tue Apr 19 03:54:20 GMT 2022","Tue Apr 19 03:54:23 GMT 2022","2344","Contract: Initializable","complex testing with inheritance","","","","initializes father",""
"passed","Tue Apr 19 04:00:05 GMT 2022","Tue Apr 19 04:00:08 GMT 2022","3435","Contract: ERC721","Contract interface","ERC721 > safeTransferFrom(address,address,uint256)","","","has to be implemented",""
"skipped","Tue Apr 19 03:52:49 GMT 2022","Tue Apr 19 03:52:49 GMT 2022","0","Contract: TimelockController","usage scenario","","","","call reverting with eth",""
"passed","Tue Apr 19 04:02:16 GMT 2022","Tue Apr 19 04:02:18 GMT 2022","1335","Contract: ERC721PresetMinterPauserAutoId","Contract interface","AccessControl > ERC165's supportsInterface(bytes4)","","","claims support [skip-on-coverage]",""
"passed","Tue Apr 19 04:03:56 GMT 2022","Tue Apr 19 04:04:08 GMT 2022","12281","Contract: ConditionalEscrow","when withdrawal is allowed","as an escrow > deposits","","","emits a deposited event",""
"broken","Tue Apr 19 03:58:54 GMT 2022","Tue Apr 19 03:58:54 GMT 2022","1","Contract: GovernorTimelockControl","executed by other proposer","","","","""after each"" hook for ""run""",""
"passed","Tue Apr 19 03:52:24 GMT 2022","Tue Apr 19 03:52:24 GMT 2022","100","Contract: PaymentSplitter","","","","","rejects zero-valued shares",""
"passed","Tue Apr 19 04:03:49 GMT 2022","Tue Apr 19 04:03:56 GMT 2022","6546","Contract: ConditionalEscrow","when withdrawal is allowed","as an escrow > deposits","","","only the owner can deposit",""
"passed","Tue Apr 19 04:05:40 GMT 2022","Tue Apr 19 04:05:42 GMT 2022","1522","Contract: SafeCast","toUint128","","","","downcasts 1",""
"passed","Tue Apr 19 04:11:23 GMT 2022","Tue Apr 19 04:11:26 GMT 2022","3300","Contract: ERC721","with minted tokens","transfers > via safeTransferFrom > without data > to a user account > when called by the operator","","","adjusts owners tokens by index",""
"passed","Tue Apr 19 04:02:45 GMT 2022","Tue Apr 19 04:02:50 GMT 2022","4950","Contract: Create2","deploy","","","","deploys a ERC20Mock with correct balances",""
"passed","Tue Apr 19 04:03:07 GMT 2022","Tue Apr 19 04:03:10 GMT 2022","2510","Contract: Address","functionCall","with non-contract receiver","","","reverts when address is not a contract",""
"passed","Tue Apr 19 03:59:19 GMT 2022","Tue Apr 19 03:59:45 GMT 2022","26325","Contract: GovernorTimelockControl","to early","","","","run",""
"passed","Tue Apr 19 04:08:00 GMT 2022","Tue Apr 19 04:08:05 GMT 2022","4555","Contract: ERC721","with minted tokens","transfers > via safeTransferFrom > with data > to a valid receiver contract > when called by the owner","","","adjusts owners tokens by index",""
"failed","Tue Apr 19 03:57:45 GMT 2022","Tue Apr 19 03:58:02 GMT 2022","16470","tests.truffle","test_truffle","","","","test_issue_364_self_destruct_contract",""
"passed","Tue Apr 19 04:01:38 GMT 2022","Tue Apr 19 04:01:42 GMT 2022","4222","Contract: ERC721PresetMinterPauserAutoId","","","","","minter role admin is the default admin",""
"passed","Tue Apr 19 04:06:56 GMT 2022","Tue Apr 19 04:06:59 GMT 2022","3062","Contract: ERC777","with default operators","with no ERC777TokensSender and no ERC777TokensRecipient implementers > send/burn > with second default operator > operator burn > when the sender has no tokens","","","reverts when burning a non-zero amount",""
"passed","Tue Apr 19 04:07:06 GMT 2022","Tue Apr 19 04:07:07 GMT 2022","1033","Contract: EnumerableSet","EnumerableAddressSet","at","","","reverts when retrieving non-existent elements",""
"passed","Tue Apr 19 04:04:25 GMT 2022","Tue Apr 19 04:04:29 GMT 2022","4629","Contract: ERC721Enumerable","with minted tokens","transfers > via safeTransferFrom > with data > to a user account > when called by the owner","","","transfers the ownership of the given token ID to the given address",""
"passed","Tue Apr 19 03:52:44 GMT 2022","Tue Apr 19 03:52:53 GMT 2022","8534","Contract: GovernorTimelockCompound","Contract interface","Governor > ERC165's supportsInterface(bytes4)","","","uses less than 30k gas [skip-on-coverage]",""
"passed","Tue Apr 19 04:06:25 GMT 2022","Tue Apr 19 04:06:26 GMT 2022","1524","Contract: SafeCast","toInt16","","","","downcasts -2^15 (-32768)",""
"passed","Tue Apr 19 03:55:23 GMT 2022","Tue Apr 19 03:55:28 GMT 2022","5453","Contract: ERC1155","like an ERC1155","balanceOfBatch > when accounts own some tokens","","","returns amounts owned by each account in order passed",""
"passed","Tue Apr 19 04:02:28 GMT 2022","Tue Apr 19 04:02:32 GMT 2022","3345","Contract: ERC721PresetMinterPauserAutoId","Contract interface","AccessControlEnumerable > ERC165's supportsInterface(bytes4)","","","claims support [skip-on-coverage]",""
"passed","Tue Apr 19 04:02:05 GMT 2022","Tue Apr 19 04:02:10 GMT 2022","5263","Contract: ERC20","erc20 behaviour","approve > when the spender is the zero address","","","reverts",""
"skipped","Tue Apr 19 03:57:57 GMT 2022","Tue Apr 19 03:57:57 GMT 2022","0","Contract: ERC20VotesComp","getPastTotalSupply","","","","generally returns the voting balance at the appropriate checkpoint",""
"passed","Tue Apr 19 04:10:21 GMT 2022","Tue Apr 19 04:10:25 GMT 2022","3800","Contract: ERC721Enumerable","with minted tokens","transfers > via safeTransferFrom > with data > to a valid receiver contract > when the address to transfer the token to is the zero address","","","reverts",""
"passed","Tue Apr 19 04:00:12 GMT 2022","Tue Apr 19 04:00:19 GMT 2022","7328","Contract: SafeERC20","with token that returns true on all calls","approvals > with non-zero allowance","","","doesn't revert when increasing the allowance",""
"passed","Tue Apr 19 03:58:27 GMT 2022","Tue Apr 19 03:58:31 GMT 2022","3658","Contract: ERC20","deposit","","","","missing balance",""
"passed","Tue Apr 19 04:05:26 GMT 2022","Tue Apr 19 04:05:28 GMT 2022","1309","Contract: SafeMath","with flag","mod","","","reverts with a 0 divisor",""
"passed","Tue Apr 19 04:04:22 GMT 2022","Tue Apr 19 04:04:25 GMT 2022","3360","Contract: ERC721","with minted tokens","transfers > via safeTransferFrom > with data > to a user account > when called by the owner","","","emits a Transfer event",""
"passed","Tue Apr 19 04:06:28 GMT 2022","Tue Apr 19 04:06:29 GMT 2022","1511","Contract: ERC777","with default operators","with no ERC777TokensSender and no ERC777TokensRecipient implementers > send/burn > with second default operator > operator send > when the sender has tokens","","","reverts when sending to the zero address",""
"passed","Tue Apr 19 04:09:46 GMT 2022","Tue Apr 19 04:09:51 GMT 2022","4614","Contract: ERC721","with minted tokens","transfers > via safeTransferFrom > with data > to a valid receiver contract > when sent to the owner","","","clears the approval for the token ID",""
"passed","Tue Apr 19 03:57:57 GMT 2022","Tue Apr 19 03:57:59 GMT 2022","1768","Contract: ERC20Snapshot","snapshot","","","","emits a snapshot event",""
"broken","Tue Apr 19 03:52:55 GMT 2022","Tue Apr 19 03:52:55 GMT 2022","414","Ethers.js","","","","","shouldCreateAcccountWithEthersJs",""
"passed","Tue Apr 19 03:55:40 GMT 2022","Tue Apr 19 03:55:45 GMT 2022","4600","Contract: ERC1155Pausable","when token is paused","","","","reverts when trying to mint",""
"passed","Tue Apr 19 04:00:15 GMT 2022","Tue Apr 19 04:00:20 GMT 2022","4543","Contract: ERC721Enumerable","with minted tokens","balanceOf > when the given address does not own any tokens","","","returns 0",""
"passed","Tue Apr 19 04:00:57 GMT 2022","Tue Apr 19 04:01:08 GMT 2022","11056","Contract: ERC721","with minted tokens","transfers > via transferFrom > when called by the owner","","","adjusts owners balances",""
"passed","Tue Apr 19 04:07:02 GMT 2022","Tue Apr 19 04:07:04 GMT 2022","2308","Contract: EnumerableSet","EnumerableAddressSet","add","","","adds several values",""
"passed","Tue Apr 19 03:56:52 GMT 2022","Tue Apr 19 03:56:55 GMT 2022","2414","Contract: ERC1155PresetMinterPauser","batched minting","","","","deployer can batch mint tokens",""
"passed","Tue Apr 19 04:09:36 GMT 2022","Tue Apr 19 04:09:46 GMT 2022","10588","Contract: ERC721","with minted tokens","transfers > via safeTransferFrom > with data > to a valid receiver contract > when sent to the owner","","","keeps ownership of the token",""
"passed","Tue Apr 19 03:56:54 GMT 2022","Tue Apr 19 03:56:55 GMT 2022","1611","Contract: ERC20Permit","","","","","initial nonce is 0",""
"passed","Tue Apr 19 03:52:36 GMT 2022","Tue Apr 19 03:52:37 GMT 2022","1262","Contract: AccessControl","default admin","","","","default admin role's admin is itself",""
"passed","Tue Apr 19 04:12:55 GMT 2022","Tue Apr 19 04:12:59 GMT 2022","4064","Contract: ERC721","with minted tokens","transfers > via safeTransferFrom > without data > to a valid receiver contract > when called by the owner","","","adjusts owners tokens by index",""
"passed","Tue Apr 19 03:58:41 GMT 2022","Tue Apr 19 03:58:43 GMT 2022","2301","Contract: ERC20","_mint","for a non zero account","","","increments recipient balance",""
"passed","Tue Apr 19 04:01:27 GMT 2022","Tue Apr 19 04:01:33 GMT 2022","6484","Contract: ERC721","with minted tokens","transfers > via transferFrom > when called by the approved individual","","","clears the approval for the token ID",""
"passed","Tue Apr 19 03:59:21 GMT 2022","Tue Apr 19 03:59:24 GMT 2022","2669","Contract: ERC20","_approve","when the spender is not the zero address > when the sender has enough balance > when there was no approved amount before","","","approves the requested amount",""
"passed","Tue Apr 19 03:54:12 GMT 2022","Tue Apr 19 03:54:15 GMT 2022","3708","Contract: Initializable","complex testing with inheritance","","","","initializes mother",""
"passed","Tue Apr 19 04:07:29 GMT 2022","Tue Apr 19 04:07:32 GMT 2022","3394","Contract: ERC777","with default operators","with no ERC777TokensSender and no ERC777TokensRecipient implementers > send/burn > with new authorized operator > operator burn > when the sender has tokens","","","operator can burn an amount of 0",""
"passed","Tue Apr 19 03:58:02 GMT 2022","Tue Apr 19 03:58:05 GMT 2022","3257","Contract: ERC20","","","","","has a name",""
"skipped","Tue Apr 19 03:57:57 GMT 2022","Tue Apr 19 03:57:57 GMT 2022","0","Contract: ERC20VotesComp","set delegation","with signature","","","rejects bad delegatee",""
"passed","Tue Apr 19 04:04:22 GMT 2022","Tue Apr 19 04:04:24 GMT 2022","2638","Contract: RefundEscrow","once deployed","closed state","","","prevents re-entering the closed state",""
"passed","Tue Apr 19 04:02:58 GMT 2022","Tue Apr 19 04:03:05 GMT 2022","7160","Contract: ERC721PresetMinterPauserAutoId","burning","","","","holders can burn their tokens",""
"passed","Tue Apr 19 04:02:37 GMT 2022","Tue Apr 19 04:02:40 GMT 2022","2934","Contract: ERC777","with default operators","as an ERC20 token > transfer from > when the token owner is not the zero address > when the recipient is not the zero address > when the spender does not have enough approved balance > when the token owner has enough balance","","","reverts",""
"passed","Tue Apr 19 03:52:56 GMT 2022","Tue Apr 19 03:53:08 GMT 2022","12795","Contract: PaymentSplitter","once deployed","distributes funds to payees","","","Ether",""
"passed","Tue Apr 19 04:06:12 GMT 2022","Tue Apr 19 04:06:13 GMT 2022","1179","Contract: SafeMath","with custom revert message","mod > modulos correctly","","","when the dividend is larger than the divisor",""
"passed","Tue Apr 19 04:01:32 GMT 2022","Tue Apr 19 04:01:37 GMT 2022","4428","Contract: ERC1155","internal functions","_burnBatch","","","reverts if length of inputs do not match",""
"passed","Tue Apr 19 04:02:43 GMT 2022","Tue Apr 19 04:02:46 GMT 2022","2903","Contract: ERC721PresetMinterPauserAutoId","pausing","","","","deployer can unpause",""
"skipped","Tue Apr 19 03:52:49 GMT 2022","Tue Apr 19 03:52:49 GMT 2022","0","Contract: TimelockController","methods","batch > execute > with scheduled operation","","","revert if execution comes too early 1/2",""
"passed","Tue Apr 19 04:01:29 GMT 2022","Tue Apr 19 04:01:31 GMT 2022","2214","Contract: ERC721PresetMinterPauserAutoId","","","","","token has correct symbol",""
"passed","Tue Apr 19 03:56:24 GMT 2022","Tue Apr 19 03:56:26 GMT 2022","1878","Contract: ERC1155PresetMinterPauser","Contract interface","AccessControl > hasRole(bytes32,address)","","","has to be implemented",""
"passed","Tue Apr 19 03:56:02 GMT 2022","Tue Apr 19 03:56:05 GMT 2022","2365","Contract: ERC1155PresetMinterPauser","Contract interface","ERC1155 > balanceOf(address,uint256)","","","has to be implemented",""
"passed","Tue Apr 19 03:58:22 GMT 2022","Tue Apr 19 03:58:25 GMT 2022","2884","Contract: ERC20","increase allowance","when the spender is not the zero address > when the sender has enough balance > when the spender had an approved amount","","","increases the spender allowance adding the requested amount",""
"passed","Tue Apr 19 04:06:37 GMT 2022","Tue Apr 19 04:06:42 GMT 2022","4816","Contract: EnumerableSet","EnumerableBytes32Set","remove","","","removes added values",""
"passed","Tue Apr 19 03:58:26 GMT 2022","Tue Apr 19 03:58:29 GMT 2022","3360","Contract: ERC20Pausable","pausable token","burn","","","allows to burn when paused and then unpaused",""
"skipped","Tue Apr 19 03:58:00 GMT 2022","Tue Apr 19 03:58:00 GMT 2022","0","Contract: ERC20Votes","transfers","","","","full delegation",""
"passed","Tue Apr 19 03:58:58 GMT 2022","Tue Apr 19 03:59:08 GMT 2022","9860","Contract: ERC1155","like an ERC1155","safeBatchTransferFrom > when sending to a valid receiver > without data","","","debits transferred balances from sender",""
"passed","Tue Apr 19 03:53:26 GMT 2022","Tue Apr 19 03:53:26 GMT 2022","1","migrate-imports.js","","","","","replaces import paths in a file",""
"passed","Tue Apr 19 04:02:35 GMT 2022","Tue Apr 19 04:02:36 GMT 2022","1542","Contract: Arrays","findUpperBound","Empty array","","","always returns 0 for empty array",""
"passed","Tue Apr 19 04:07:13 GMT 2022","Tue Apr 19 04:07:17 GMT 2022","4233","Contract: ERC721Enumerable","with minted tokens","transfers > via safeTransferFrom > with data > to a user account > when sent to the owner","","","keeps the owner balance",""
"passed","Tue Apr 19 04:04:29 GMT 2022","Tue Apr 19 04:04:32 GMT 2022","2791","Contract: ERC777","with default operators","with no ERC777TokensSender and no ERC777TokensRecipient implementers > send/burn > direct burn > when the sender has tokens","","","can burn an amount of 1",""
"passed","Tue Apr 19 03:59:39 GMT 2022","Tue Apr 19 03:59:40 GMT 2022","1116","Contract: ERC20","_approve","when the spender is the zero address","","","reverts",""
"passed","Tue Apr 19 04:05:25 GMT 2022","Tue Apr 19 04:05:28 GMT 2022","3472","Contract: ERC777","with default operators","with no ERC777TokensSender and no ERC777TokensRecipient implementers > send/burn > with self operator > operator burn > when the sender has no tokens","","","operator can burn an amount of 0",""
"passed","Tue Apr 19 04:02:03 GMT 2022","Tue Apr 19 04:02:06 GMT 2022","3054","Contract: ERC777","with default operators","as an ERC20 token > transfer > when the recipient is not the zero address > when the sender transfers all balance","","","emits a transfer event",""
"passed","Tue Apr 19 03:52:27 GMT 2022","Tue Apr 19 03:52:30 GMT 2022","2600","Contract: PaymentSplitter","once deployed","","","","has payees",""
"passed","Tue Apr 19 03:53:55 GMT 2022","Tue Apr 19 03:53:57 GMT 2022","1348","Contract: ERC1967Proxy","without initialization","when sending some balance","","","initializes the proxy",""
