"Status","Start Time","Stop Time","Duration in ms","Parent Suite","Suite","Sub Suite","Test Class","Test Method","Name","Description"
"passed","Tue Apr 19 04:11:15 GMT 2022","Tue Apr 19 04:11:18 GMT 2022","3264","Contract: ERC721Enumerable","with minted tokens","transfers > via safeTransferFrom > without data > to a user account > when called by the operator","","","emits a Transfer event",""
"passed","Tue Apr 19 03:53:30 GMT 2022","Tue Apr 19 03:53:34 GMT 2022","3688","Contract: MinimalForwarder","with message","verify > invalid signature","","","tampered signature",""
"skipped","Tue Apr 19 03:52:49 GMT 2022","Tue Apr 19 03:52:49 GMT 2022","0","Contract: TimelockController","methods","batch > schedule","","","enforce minimum delay",""
"passed","Tue Apr 19 03:59:51 GMT 2022","Tue Apr 19 03:59:53 GMT 2022","1617","Contract: ERC721Enumerable","Contract interface","ERC721 > ownerOf(uint256)","","","has to be implemented",""
"passed","Tue Apr 19 03:52:23 GMT 2022","Tue Apr 19 03:52:23 GMT 2022","124","Contract: PaymentSplitter","","","","","rejects more shares than payees",""
"passed","Tue Apr 19 04:06:54 GMT 2022","Tue Apr 19 04:06:56 GMT 2022","2522","Contract: EnumerableMap","read","get","","","existing value",""
"passed","Tue Apr 19 04:10:55 GMT 2022","Tue Apr 19 04:10:58 GMT 2022","3321","Contract: ERC721Enumerable","with minted tokens","transfers > via safeTransferFrom > without data > to a user account > when called by the approved individual","","","emits a Transfer event",""
"passed","Tue Apr 19 03:54:48 GMT 2022","Tue Apr 19 03:55:00 GMT 2022","12092","Contract: GovernorTimelockCompound","Contract interface","Governor > propose(address[],uint256[],bytes[],string)","","","has to be implemented",""
"passed","Tue Apr 19 03:58:35 GMT 2022","Tue Apr 19 03:58:38 GMT 2022","2796","Contract: ERC20Snapshot","balanceOfAt","with initial snapshot > with no balance changes after the snapshot","","","returns the current balance for all accounts",""
"passed","Tue Apr 19 03:56:28 GMT 2022","Tue Apr 19 03:56:36 GMT 2022","7937","Contract: ERC1155","like an ERC1155","safeTransferFrom > when called by an operator on behalf of the multiTokenHolder > when operator is approved by multiTokenHolder","","","debits transferred balance from sender",""
"passed","Tue Apr 19 04:12:18 GMT 2022","Tue Apr 19 04:12:21 GMT 2022","2889","Contract: ERC721Enumerable","with minted tokens","transfers > via safeTransferFrom > without data > to a user account > when the sender is not authorized for the token id","","","reverts",""
"passed","Tue Apr 19 03:59:59 GMT 2022","Tue Apr 19 04:00:00 GMT 2022","1686","Contract: ERC721Enumerable","Contract interface","ERC721 > transferFrom(address,address,uint256)","","","has to be implemented",""
"skipped","Tue Apr 19 03:57:57 GMT 2022","Tue Apr 19 03:57:57 GMT 2022","0","Contract: ERC20VotesComp","Compound test suite","getPriorVotes","","","generally returns the voting balance at the appropriate checkpoint",""
"passed","Tue Apr 19 03:54:30 GMT 2022","Tue Apr 19 03:54:34 GMT 2022","3386","Contract: Pausable","when unpaused","","","","cannot take drastic measure in non-pause",""
"skipped","Tue Apr 19 03:52:49 GMT 2022","Tue Apr 19 03:52:49 GMT 2022","0","Contract: TimelockController","methods","cancel","","","prevent non-proposer from canceling",""
"passed","Tue Apr 19 04:02:25 GMT 2022","Tue Apr 19 04:02:27 GMT 2022","2091","Contract: Address","sendValue","when sender contract has funds","","","reverts when sending more than the balance",""
"passed","Tue Apr 19 04:04:58 GMT 2022","Tue Apr 19 04:04:59 GMT 2022","1554","Contract: ERC777","with default operators","with no ERC777TokensSender and no ERC777TokensRecipient implementers > send/burn > with self operator > operator send > when the sender has tokens","","","reverts when sending to the zero address",""
"passed","Tue Apr 19 04:02:09 GMT 2022","Tue Apr 19 04:02:12 GMT 2022","3147","Contract: ERC777","with default operators","as an ERC20 token > transfer > when the recipient is not the zero address > when the sender transfers zero tokens","","","emits a transfer event",""
"skipped","Tue Apr 19 03:55:43 GMT 2022","Tue Apr 19 03:55:43 GMT 2022","0","Contract: TransparentUpgradeableProxy","upgradeToAndCall","without migrations > when the call does not fail > when the sender is the admin","","","uses the storage of the proxy",""
"passed","Tue Apr 19 03:59:08 GMT 2022","Tue Apr 19 03:59:09 GMT 2022","1198","Contract: ERC20","_transfer","when the recipient is not the zero address > when the sender does not have enough balance","","","reverts",""
"skipped","Tue Apr 19 03:52:49 GMT 2022","Tue Apr 19 03:52:49 GMT 2022","0","Contract: TimelockController","maintenance","","","","timelock scheduled maintenance",""
"passed","Tue Apr 19 04:10:08 GMT 2022","Tue Apr 19 04:10:13 GMT 2022","4329","Contract: ERC721Enumerable","with minted tokens","transfers > via safeTransferFrom > with data > to a valid receiver contract > when the address of the previous owner is incorrect","","","reverts",""
"passed","Tue Apr 19 03:58:49 GMT 2022","Tue Apr 19 03:58:51 GMT 2022","2244","Contract: ERC20","_burn","for a non zero account > for entire balance","","","decrements totalSupply",""
"passed","Tue Apr 19 03:53:53 GMT 2022","Tue Apr 19 03:53:53 GMT 2022","146","Contract: ERC1967Proxy","","","","","cannot be initialized with a non-contract address",""
"passed","Tue Apr 19 03:58:58 GMT 2022","Tue Apr 19 03:59:00 GMT 2022","2105","Contract: ERC20PresetMinterPauser","pausing","","","","other accounts cannot pause",""
"passed","Tue Apr 19 04:13:47 GMT 2022","Tue Apr 19 04:13:54 GMT 2022","6739","Contract: ERC721Enumerable","with minted tokens","transfers > via safeTransferFrom > without data > to a valid receiver contract > when called by the operator","","","adjusts owners balances",""
"passed","Tue Apr 19 03:58:25 GMT 2022","Tue Apr 19 03:58:27 GMT 2022","2225","Contract: ERC20","increase allowance","when the spender is not the zero address > when the sender does not have enough balance","","","emits an approval event",""
"passed","Tue Apr 19 04:03:37 GMT 2022","Tue Apr 19 04:03:47 GMT 2022","9568","Contract: ERC721","with minted tokens","transfers > via transferFrom > when sent to the owner","","","keeps the owner balance",""
"passed","Tue Apr 19 03:56:37 GMT 2022","Tue Apr 19 03:56:39 GMT 2022","2535","Contract: ERC20","balanceOf","when the requested account has some tokens","","","returns the total amount of tokens",""
"skipped","Tue Apr 19 03:59:19 GMT 2022","Tue Apr 19 03:59:19 GMT 2022","0","Contract: GovernorTimelockCompound","updateTimelock","","","","protected",""
"passed","Tue Apr 19 04:00:25 GMT 2022","Tue Apr 19 04:00:27 GMT 2022","2147","Contract: ERC721Burnable","like a burnable ERC721","burn > when the given token ID was not tracked by this contract","","","reverts",""
"passed","Tue Apr 19 03:57:49 GMT 2022","Tue Apr 19 03:57:52 GMT 2022","2548","Contract: ERC20FlashMint","flashLoan","","","","unavailable funds",""
"passed","Tue Apr 19 04:01:04 GMT 2022","Tue Apr 19 04:01:11 GMT 2022","7521","Contract: ERC721Pausable","when token is paused","exists","","","returns token existence",""
"passed","Tue Apr 19 04:05:29 GMT 2022","Tue Apr 19 04:05:30 GMT 2022","1112","Contract: SafeMath","with flag","mod > modulos correctly","","","when the dividend is equal to the divisor",""
"passed","Tue Apr 19 03:58:37 GMT 2022","Tue Apr 19 03:58:37 GMT 2022","42","Contract: ERC20PresetFixedSupply","burning","","","","decrements totalSupply",""
"passed","Tue Apr 19 03:57:16 GMT 2022","Tue Apr 19 03:57:21 GMT 2022","5546","Contract: ERC20Burnable","burn","when the given amount is not greater than balance of the sender > for a zero amount","","","emits a transfer event",""
"passed","Tue Apr 19 03:52:26 GMT 2022","Tue Apr 19 03:52:27 GMT 2022","1241","Contract: AccessControl","Contract interface","AccessControl > ERC165's supportsInterface(bytes4)","","","claims support [skip-on-coverage]",""
"passed","Tue Apr 19 03:59:09 GMT 2022","Tue Apr 19 03:59:11 GMT 2022","1863","Contract: ERC20","_transfer","when the recipient is not the zero address > when the sender transfers all balance","","","transfers the requested amount",""
"passed","Tue Apr 19 03:57:58 GMT 2022","Tue Apr 19 03:58:00 GMT 2022","1175","Contract: ERC20","decrease allowance","when the spender is not the zero address > when the sender does not have enough balance > when there was no approved amount before","","","reverts",""
"broken","Tue Apr 19 04:00:05 GMT 2022","Tue Apr 19 04:00:05 GMT 2022","0","Contract: GovernorTimelockCompound","transfer timelock to new governor","using workflow","","","""after each"" hook for ""run""",""
"passed","Tue Apr 19 03:54:09 GMT 2022","Tue Apr 19 03:54:12 GMT 2022","2934","Contract: Initializable","complex testing with inheritance","","","","initializes human",""
"passed","Tue Apr 19 04:05:35 GMT 2022","Tue Apr 19 04:05:37 GMT 2022","1942","Contract: SafeMath","with default revert message","sub","","","subtracts correctly",""
"passed","Tue Apr 19 04:05:42 GMT 2022","Tue Apr 19 04:05:43 GMT 2022","1561","Contract: SafeCast","toUint128","","","","downcasts 2^128 - 1 (340282366920938463463374607431768211455)",""
"passed","Tue Apr 19 03:56:50 GMT 2022","Tue Apr 19 03:56:52 GMT 2022","1584","Contract: ERC20","transfer","when the recipient is not the zero address > when the sender transfers all balance","","","emits a transfer event",""
"broken","Tue Apr 19 03:55:30 GMT 2022","Tue Apr 19 03:55:30 GMT 2022","1","tests.brownie.token.tests","test_transfer","","","","test_transfer_zero_tokens",""
"passed","Tue Apr 19 04:03:15 GMT 2022","Tue Apr 19 04:03:15 GMT 2022","44","Contract: SignatureChecker (ERC1271)","EOA account","","","","with invalid signer",""
"passed","Tue Apr 19 04:04:54 GMT 2022","Tue Apr 19 04:04:56 GMT 2022","2214","Contract: ERC165Checker","ERC165 and many interfaces supported","","","","supports each interfaceId via supportsInterface",""
"passed","Tue Apr 19 03:56:08 GMT 2022","Tue Apr 19 03:56:18 GMT 2022","9232","Contract: ERC1155Holder","Contract interface","ERC165 > ERC165's supportsInterface(bytes4)","","","uses less than 30k gas [skip-on-coverage]",""
"passed","Tue Apr 19 04:11:05 GMT 2022","Tue Apr 19 04:11:08 GMT 2022","3403","Contract: ERC721Enumerable","with minted tokens","transfers > via safeTransferFrom > without data > to a user account > when called by the approved individual","","","adjusts owners balances",""
"passed","Tue Apr 19 04:00:30 GMT 2022","Tue Apr 19 04:00:58 GMT 2022","27760","Contract: Governor","scenario","score not reached","","","run",""
"passed","Tue Apr 19 04:07:19 GMT 2022","Tue Apr 19 04:07:20 GMT 2022","1235","Contract: SafeCast","toInt256","","","","reverts when casting UINT256_MAX (115792089237316195423570985008687907853269984665640564039457584007913129639935)",""
"passed","Tue Apr 19 04:01:56 GMT 2022","Tue Apr 19 04:01:58 GMT 2022","2155","Contract: ERC777","with default operators","as an ERC20 token > balanceOf > when the requested account has some tokens","","","returns the total amount of tokens",""
"passed","Tue Apr 19 04:00:57 GMT 2022","Tue Apr 19 04:01:02 GMT 2022","4960","Contract: SafeERC20","with token that returns no boolean values","approvals > with non-zero allowance","","","reverts when approving a non-zero allowance",""
"passed","Tue Apr 19 04:01:11 GMT 2022","Tue Apr 19 04:01:17 GMT 2022","5431","Contract: ERC721Pausable","when token is paused","isApprovedForAll","","","returns the approval of the operator",""
"passed","Tue Apr 19 03:53:42 GMT 2022","Tue Apr 19 03:53:43 GMT 2022","1092","Contract: AccessControl","Contract interface","AccessControlEnumerable > ERC165's supportsInterface(bytes4)","","","claims support [skip-on-coverage]",""
"passed","Tue Apr 19 04:05:19 GMT 2022","Tue Apr 19 04:05:23 GMT 2022","4362","Contract: ERC721Enumerable","with minted tokens","transfers > via safeTransferFrom > with data > to a user account > when called by the approved individual","","","emits a Transfer event",""
"passed","Tue Apr 19 04:02:48 GMT 2022","Tue Apr 19 04:02:53 GMT 2022","5528","Contract: ERC777","with default operators","as an ERC20 token > approve > when the spender is not the zero address > when the sender has enough balance","","","emits an approval event",""
"passed","Tue Apr 19 03:59:40 GMT 2022","Tue Apr 19 03:59:45 GMT 2022","5343","Contract: ERC1155","like an ERC1155","safeBatchTransferFrom > when sending to a valid receiver > with data","","","emits a TransferBatch log",""
"passed","Tue Apr 19 03:53:51 GMT 2022","Tue Apr 19 03:53:58 GMT 2022","6295","Contract: Governor","Contract interface","Governor > name()","","","has to be implemented",""
"passed","Tue Apr 19 04:06:59 GMT 2022","Tue Apr 19 04:07:02 GMT 2022","2712","Contract: ERC777","with default operators","with no ERC777TokensSender and no ERC777TokensRecipient implementers > send/burn > with second default operator > operator burn > when the sender has no tokens","","","reverts when burning from the zero address",""
"passed","Tue Apr 19 03:57:38 GMT 2022","Tue Apr 19 03:57:40 GMT 2022","1981","Contract: ERC20FlashMint","flashFee","","","","token mismatch",""
"passed","Tue Apr 19 03:53:28 GMT 2022","Tue Apr 19 03:53:41 GMT 2022","13483","Contract: GovernorTimelockCompound","Contract interface","Governor > hashProposal(address[],uint256[],bytes[],bytes32)","","","has to be implemented",""
"passed","Tue Apr 19 04:05:09 GMT 2022","Tue Apr 19 04:05:14 GMT 2022","4277","Contract: SafeCast","toUint16","","","","reverts when downcasting 2^16 (65536)",""
"passed","Tue Apr 19 03:55:33 GMT 2022","Tue Apr 19 03:55:39 GMT 2022","5816","Contract: TransparentUpgradeableProxy","upgradeToAndCall","without migrations > when the call does not fail > when the sender is the admin","","","calls the initializer function",""
"passed","Tue Apr 19 03:52:25 GMT 2022","Tue Apr 19 03:52:26 GMT 2022","1222","Contract: VestingWallet","","","","","check vesting contract",""
"passed","Tue Apr 19 03:54:03 GMT 2022","Tue Apr 19 03:54:04 GMT 2022","1303","Contract: ERC1967Proxy","initialization without parameters","payable > when sending some balance","","","initializes the proxy",""
"passed","Tue Apr 19 03:59:41 GMT 2022","Tue Apr 19 03:59:46 GMT 2022","5328","Contract: ERC20","erc20 behaviour","transfer > when the recipient is not the zero address > when the sender transfers all balance","","","transfers the requested amount",""
"passed","Tue Apr 19 04:06:38 GMT 2022","Tue Apr 19 04:06:47 GMT 2022","9124","Contract: ERC721Enumerable","with minted tokens","transfers > via safeTransferFrom > with data > to a user account > when called by the owner without an approved user","","","emits an Approval event",""
"passed","Tue Apr 19 03:57:54 GMT 2022","Tue Apr 19 03:57:58 GMT 2022","4308","Contract: ERC20Pausable","pausable token","transfer","","","allows to transfer when paused and then unpaused",""
"skipped","Tue Apr 19 03:57:57 GMT 2022","Tue Apr 19 03:57:57 GMT 2022","0","Contract: ERC20VotesComp","","","","","minting restriction",""
"passed","Tue Apr 19 04:10:16 GMT 2022","Tue Apr 19 04:10:20 GMT 2022","3659","Contract: ERC721","with minted tokens","transfers > via safeTransferFrom > with data > to a valid receiver contract > when the address to transfer the token to is the zero address","","","reverts",""
"passed","Tue Apr 19 04:04:06 GMT 2022","Tue Apr 19 04:04:08 GMT 2022","1226","Contract: ERC165Storage","Contract interface","ERC165 > supportsInterface(bytes4)","","","has to be implemented",""
"passed","Tue Apr 19 04:14:28 GMT 2022","Tue Apr 19 04:14:32 GMT 2022","4140","Contract: ERC721","with minted tokens","transfers > via safeTransferFrom > without data > to a valid receiver contract > when sent to the owner","","","clears the approval for the token ID",""
"broken","Tue Apr 19 03:59:42 GMT 2022","Tue Apr 19 04:00:05 GMT 2022","23515","Contract: GovernorTimelockCompound","transfer timelock to new governor","using workflow","","","run",""
"passed","Tue Apr 19 03:55:47 GMT 2022","Tue Apr 19 03:55:55 GMT 2022","8626","Contract: GovernorTimelockCompound","Contract interface","GovernorTimelock > ERC165's supportsInterface(bytes4)","","","claims support [skip-on-coverage]",""
"passed","Tue Apr 19 03:56:17 GMT 2022","Tue Apr 19 03:56:19 GMT 2022","2090","Contract: ERC1155PresetMinterPauser","Contract interface","ERC1155 > safeBatchTransferFrom(address,address,uint256[],uint256[],bytes)","","","has to be implemented",""
"passed","Tue Apr 19 04:04:27 GMT 2022","Tue Apr 19 04:04:32 GMT 2022","4559","Contract: RefundEscrow","once deployed","refund state","","","refunds refundees",""
"passed","Tue Apr 19 03:52:39 GMT 2022","Tue Apr 19 03:52:42 GMT 2022","3091","Contract: AccessControl","granting","","","","accounts can be granted a role multiple times",""
"passed","Tue Apr 19 04:03:19 GMT 2022","Tue Apr 19 04:03:21 GMT 2022","1368","Contract: ECDSA","recover with valid signature","with v0 signature","","","reverts with 00 as version value",""
"passed","Tue Apr 19 03:54:30 GMT 2022","Tue Apr 19 03:54:34 GMT 2022","4618","Contract: UUPSUpgradeable","","","","","upgrade to upgradeable implementation with call",""
"passed","Tue Apr 19 04:03:26 GMT 2022","Tue Apr 19 04:03:37 GMT 2022","10902","Contract: ERC721","with minted tokens","transfers > via transferFrom > when sent to the owner","","","emits only a transfer event",""
"passed","Tue Apr 19 04:01:20 GMT 2022","Tue Apr 19 04:01:21 GMT 2022","1365","Contract: ERC1155","internal functions","_burn","","","reverts when burning the zero account's tokens",""
"passed","Tue Apr 19 04:08:25 GMT 2022","Tue Apr 19 04:08:30 GMT 2022","5557","Contract: ERC721Enumerable","with minted tokens","transfers > via safeTransferFrom > with data > to a valid receiver contract > when called by the approved individual","","","clears the approval for the token ID",""
"passed","Tue Apr 19 03:55:03 GMT 2022","Tue Apr 19 03:55:06 GMT 2022","2979","Contract: Pausable","when unpaused","when paused > unpausing > when unpaused","","","reverts when re-unpausing",""
"passed","Tue Apr 19 04:12:15 GMT 2022","Tue Apr 19 04:12:18 GMT 2022","2996","Contract: ERC721Enumerable","with minted tokens","transfers > via safeTransferFrom > without data > to a user account > when the address of the previous owner is incorrect","","","reverts",""
"skipped","Tue Apr 19 03:54:22 GMT 2022","Tue Apr 19 03:54:22 GMT 2022","1","Contract: TransparentUpgradeableProxy","initialization without parameters","non payable > when not sending balance","","","sets the implementation address",""
"broken","Tue Apr 19 03:55:32 GMT 2022","Tue Apr 19 03:55:32 GMT 2022","0","tests.brownie.token.tests","test_transferFrom","","","","test_receiver_approval_not_affected",""
"passed","Tue Apr 19 03:55:30 GMT 2022","Tue Apr 19 03:55:43 GMT 2022","13337","Contract: Governor","Contract interface","Governor > getVotes(address,uint256)","","","has to be implemented",""
"skipped","Tue Apr 19 03:58:00 GMT 2022","Tue Apr 19 03:58:00 GMT 2022","0","Contract: ERC20Votes","Compound test suite","getPastVotes","","","returns zero if < first checkpoint block",""
"passed","Tue Apr 19 03:58:59 GMT 2022","Tue Apr 19 03:59:13 GMT 2022","13884","Contract: Governor","scenario","duplicate pending proposal","","","run",""
"passed","Tue Apr 19 04:05:53 GMT 2022","Tue Apr 19 04:05:55 GMT 2022","2004","Contract: SignedSafeMath","div","","","","returns complete number result on non-even division",""
"passed","Tue Apr 19 04:12:41 GMT 2022","Tue Apr 19 04:12:45 GMT 2022","4796","Contract: ERC721","with minted tokens","transfers > via safeTransferFrom > without data > to a valid receiver contract > when called by the owner","","","clears the approval for the token ID",""
"passed","Tue Apr 19 04:02:45 GMT 2022","Tue Apr 19 04:02:48 GMT 2022","3116","Contract: Address","functionCall","with valid contract receiver","","","reverts when the called function reverts with no reason",""
"passed","Tue Apr 19 04:02:21 GMT 2022","Tue Apr 19 04:02:23 GMT 2022","1849","Contract: Arrays","findUpperBound","Even number of elements","","","returns 0 for the element under the lower boundary",""
"passed","Tue Apr 19 03:53:43 GMT 2022","Tue Apr 19 03:53:44 GMT 2022","1156","Contract: AccessControl","Contract interface","AccessControlEnumerable > getRoleMember(bytes32,uint256)","","","has to be implemented",""
"passed","Tue Apr 19 04:07:32 GMT 2022","Tue Apr 19 04:07:35 GMT 2022","2821","Contract: ERC777","with default operators","with no ERC777TokensSender and no ERC777TokensRecipient implementers > send/burn > with new authorized operator > operator burn > when the sender has tokens","","","operator can burn an amount of 1",""
"passed","Tue Apr 19 04:05:28 GMT 2022","Tue Apr 19 04:05:33 GMT 2022","4687","Contract: ERC721Enumerable","with minted tokens","transfers > via safeTransferFrom > with data > to a user account > when called by the approved individual","","","emits an Approval event",""
"passed","Tue Apr 19 04:11:44 GMT 2022","Tue Apr 19 04:11:51 GMT 2022","6394","Contract: ERC721","with minted tokens","transfers > via safeTransferFrom > without data > to a user account > when called by the owner without an approved user","","","adjusts owners balances",""
"passed","Tue Apr 19 04:14:36 GMT 2022","Tue Apr 19 04:14:41 GMT 2022","4219","Contract: ERC721","with minted tokens","transfers > via safeTransferFrom > without data > to a valid receiver contract > when sent to the owner","","","keeps the owner balance",""
"passed","Tue Apr 19 04:05:28 GMT 2022","Tue Apr 19 04:05:33 GMT 2022","5144","Contract: ERC721","with minted tokens","transfers > via safeTransferFrom > with data > to a user account > when called by the approved individual","","","adjusts owners tokens by index",""
"passed","Tue Apr 19 04:14:54 GMT 2022","Tue Apr 19 04:14:57 GMT 2022","3799","Contract: ERC721Enumerable","with minted tokens","transfers > via safeTransferFrom > without data > to a valid receiver contract > when the sender is not authorized for the token id","","","reverts",""
"passed","Tue Apr 19 04:09:21 GMT 2022","Tue Apr 19 04:09:26 GMT 2022","5147","Contract: ERC777","with default operators","send and receive hooks > tokensReceived > with ERC777TokensRecipient implementer > with contract as implementer for an externally owned account > when TokensRecipient does not revert","","","TokensRecipient receives send data and is called after state mutation",""
"skipped","Tue Apr 19 03:58:00 GMT 2022","Tue Apr 19 03:58:00 GMT 2022","0","Contract: ERC20Votes","Compound test suite","getPastVotes","","","reverts if block number >= current block",""
"passed","Tue Apr 19 03:52:24 GMT 2022","Tue Apr 19 03:52:27 GMT 2022","3408","Contract: PaymentSplitter","once deployed","","","","has total shares",""
"passed","Tue Apr 19 04:03:11 GMT 2022","Tue Apr 19 04:03:12 GMT 2022","1368","Contract: ECDSA","recover with invalid signature","","","","with long signature",""
"passed","Tue Apr 19 04:03:25 GMT 2022","Tue Apr 19 04:03:29 GMT 2022","3525","Contract: ERC777","with default operators","as an ERC20 token > _approve > when the spender is not the zero address > when the sender does not have enough balance > when the spender had an approved amount","","","approves the requested amount and replaces the previous one",""
"passed","Tue Apr 19 04:03:05 GMT 2022","Tue Apr 19 04:03:07 GMT 2022","1998","Contract: Counters","reset","null counter","","","does not throw",""
"passed","Tue Apr 19 03:53:57 GMT 2022","Tue Apr 19 03:53:58 GMT 2022","1294","Contract: ERC1967Proxy","without initialization","when sending some balance","","","has expected balance",""
"passed","Tue Apr 19 04:09:17 GMT 2022","Tue Apr 19 04:09:21 GMT 2022","4144","Contract: ERC777","with default operators","send and receive hooks > tokensReceived > with ERC777TokensRecipient implementer > with contract as implementer for an externally owned account > when TokensRecipient reverts","","","mint (internal) reverts",""
"passed","Tue Apr 19 04:09:09 GMT 2022","Tue Apr 19 04:09:13 GMT 2022","3943","Contract: ERC777","with default operators","send and receive hooks > tokensReceived > with ERC777TokensRecipient implementer > with contract as implementer for an externally owned account > when TokensRecipient reverts","","","send reverts",""
"passed","Tue Apr 19 04:06:04 GMT 2022","Tue Apr 19 04:06:05 GMT 2022","1265","Contract: Strings","from uint256 - hex format","","","","converts a positive number",""
"passed","Tue Apr 19 04:08:52 GMT 2022","Tue Apr 19 04:08:54 GMT 2022","2070","Contract: ERC777","with default operators","operator management > default operators > with revoked default operator","","","revoked default operator can be re-authorized",""
"passed","Tue Apr 19 03:57:26 GMT 2022","Tue Apr 19 03:57:27 GMT 2022","1555","Contract: ERC20Burnable","burn","when the given amount is greater than the balance of the sender","","","reverts",""
"passed","Tue Apr 19 04:02:25 GMT 2022","Tue Apr 19 04:02:26 GMT 2022","1517","Contract: ERC721PresetMinterPauserAutoId","Contract interface","AccessControl > renounceRole(bytes32,address)","","","has to be implemented",""
"passed","Tue Apr 19 03:59:04 GMT 2022","Tue Apr 19 03:59:08 GMT 2022","3515","Contract: ERC20","_burn","for a non zero account > for less amount than balance","","","emits Transfer event",""
"passed","Tue Apr 19 04:02:09 GMT 2022","Tue Apr 19 04:02:11 GMT 2022","1626","Contract: ERC721PresetMinterPauserAutoId","Contract interface","ERC721Enumerable > tokenOfOwnerByIndex(address,uint256)","","","has to be implemented",""
"passed","Tue Apr 19 03:57:05 GMT 2022","Tue Apr 19 03:57:10 GMT 2022","4926","Contract: TransparentUpgradeableProxy","transparent proxy","when function names clash","","","when sender is proxy admin should run the proxy function",""
"passed","Tue Apr 19 04:03:22 GMT 2022","Tue Apr 19 04:03:23 GMT 2022","1069","Contract: ECDSA","recover with valid signature","with v0 signature","","","reverts with wrong version",""
