"Status","Start Time","Stop Time","Duration in ms","Parent Suite","Suite","Sub Suite","Test Class","Test Method","Name","Description"
"skipped","Fri Nov 19 16:43:40 GMT 2021","Fri Nov 19 16:43:40 GMT 2021","0","","Contract: ERC20VotesComp set delegation with signature","","Contract: ERC20VotesComp set delegation with signature","accept signed delegation","accept signed delegation",""
"skipped","Fri Nov 19 16:43:40 GMT 2021","Fri Nov 19 16:43:40 GMT 2021","0","","Contract: ERC20VotesComp set delegation with signature","","Contract: ERC20VotesComp set delegation with signature","rejects expired permit","rejects expired permit",""
"skipped","Fri Nov 19 16:43:40 GMT 2021","Fri Nov 19 16:43:40 GMT 2021","0","","Contract: ERC20VotesComp getPastTotalSupply","","Contract: ERC20VotesComp getPastTotalSupply","returns 0 if there are no checkpoints","returns 0 if there are no checkpoints",""
"skipped","Fri Nov 19 16:42:14 GMT 2021","Fri Nov 19 16:42:14 GMT 2021","0","","Contract: GovernorTimelockControl","","Contract: GovernorTimelockControl","post deployment check","post deployment check",""
"broken","Fri Nov 19 16:45:13 GMT 2021","Fri Nov 19 16:45:16 GMT 2021","2221","","Contract: ConditionalEscrow when withdrawal is allowed as an escrow deposits","","Contract: ConditionalEscrow when withdrawal is allowed as an escrow deposits","can accept a single deposit","can accept a single deposit",""
"broken","Fri Nov 19 16:42:11 GMT 2021","Fri Nov 19 16:42:14 GMT 2021","2620","","Contract: GovernorTimelockCompound Contract interface ERC165 ERC165's supportsInterface(bytes4)","","Contract: GovernorTimelockCompound Contract interface ERC165 ERC165's supportsInterface(bytes4)","uses less than 30k gas [skip-on-coverage]","uses less than 30k gas [skip-on-coverage]",""
"broken","Fri Nov 19 16:43:38 GMT 2021","Fri Nov 19 16:43:40 GMT 2021","2525","","Contract: ERC20Snapshot snapshot","","Contract: ERC20Snapshot snapshot","emits a snapshot event","emits a snapshot event",""
