"Status","Start Time","Stop Time","Duration in ms","Parent Suite","Suite","Sub Suite","Test Class","Test Method","Name","Description"
"passed","Sat Mar 05 00:45:44 GMT 2022","Sat Mar 05 00:46:04 GMT 2022","19626","Contract: GovernorTimelockControl","Contract interface","Governor > hasVoted(uint256,address)","","","has to be implemented",""
"broken","Sat Mar 05 00:40:10 GMT 2022","Sat Mar 05 00:40:12 GMT 2022","1441","Contract: MinimalForwarder","with message","execute > valid signature","","","success",""
"passed","Sat Mar 05 01:12:49 GMT 2022","Sat Mar 05 01:12:52 GMT 2022","2562","Contract: ERC721Enumerable","with minted tokens","approve > when approving a non-zero address > when there was no prior approval","","","sets the approval for the target address",""
"passed","Sat Mar 05 00:54:48 GMT 2022","Sat Mar 05 00:55:06 GMT 2022","18445","Contract: ERC721","with minted tokens","transfers > via transferFrom > when called by the approved individual","","","emits a Transfer event",""
"skipped","Sat Mar 05 00:48:06 GMT 2022","Sat Mar 05 00:48:06 GMT 2022","0","Contract: ERC20VotesComp","","","","","minting restriction",""
"passed","Sat Mar 05 00:43:44 GMT 2022","Sat Mar 05 00:44:00 GMT 2022","15330","Contract: GovernorTimelockCompound","Contract interface","Governor > castVote(uint256,uint8)","","","has to be implemented",""
"passed","Sat Mar 05 01:00:15 GMT 2022","Sat Mar 05 01:00:17 GMT 2022","1349","Contract: SafeMath","with default revert message","add","","","adds correctly",""
"passed","Sat Mar 05 00:47:23 GMT 2022","Sat Mar 05 00:47:29 GMT 2022","6768","Contract: ERC20Burnable","burnFrom","on success > for a non-zero amount","","","burns the requested amount",""
"passed","Sat Mar 05 00:57:04 GMT 2022","Sat Mar 05 00:57:09 GMT 2022","5453","Contract: Escrow","as an escrow","deposits","","","can accept an empty deposit",""
"passed","Sat Mar 05 00:43:04 GMT 2022","Sat Mar 05 00:43:13 GMT 2022","8646","Contract: ReentrancyGuard","","","","","does not allow local recursion",""
"passed","Sat Mar 05 01:12:54 GMT 2022","Sat Mar 05 01:12:57 GMT 2022","2995","Contract: ERC721Enumerable","with minted tokens","approve > when approving a non-zero address > when there was a prior approval to the same address","","","sets the approval for the target address",""
"passed","Sat Mar 05 00:53:21 GMT 2022","Sat Mar 05 00:53:29 GMT 2022","7369","Contract: ERC721Pausable","when token is paused","balanceOf","","","returns the amount of tokens owned by the given address",""
"passed","Sat Mar 05 01:03:23 GMT 2022","Sat Mar 05 01:03:28 GMT 2022","4785","Contract: ERC721Enumerable","with minted tokens","transfers > via safeTransferFrom > with data > to a user account > when called by the approved individual","","","adjusts owners tokens by index",""
"passed","Sat Mar 05 00:55:50 GMT 2022","Sat Mar 05 00:55:56 GMT 2022","6156","Contract: Address","sendValue","when sender contract has funds","","","sends 0 wei",""
"passed","Sat Mar 05 00:54:13 GMT 2022","Sat Mar 05 00:54:17 GMT 2022","4194","Contract: ERC721URIStorage","token URI","","","","base URI can be set",""
"passed","Sat Mar 05 00:50:07 GMT 2022","Sat Mar 05 00:50:44 GMT 2022","36290","Contract: Governor","scenario","receiver revert with reason","","","run",""
"passed","Sat Mar 05 00:47:47 GMT 2022","Sat Mar 05 00:47:50 GMT 2022","2961","Contract: ERC20Pausable","pausable token","transfer","","","allows to transfer when unpaused",""
"passed","Sat Mar 05 01:01:53 GMT 2022","Sat Mar 05 01:02:03 GMT 2022","10104","Contract: BitMap","set","","","","adds several keys",""
"passed","Sat Mar 05 01:00:21 GMT 2022","Sat Mar 05 01:00:24 GMT 2022","2907","Contract: SignedSafeMath","sub","","","","reverts on positive subtraction overflow",""
"passed","Sat Mar 05 00:55:43 GMT 2022","Sat Mar 05 00:55:54 GMT 2022","11083","Contract: ERC721Enumerable","with minted tokens","transfers > via transferFrom > when called by the operator","","","transfers the ownership of the given token ID to the given address",""
"passed","Sat Mar 05 00:42:47 GMT 2022","Sat Mar 05 00:42:53 GMT 2022","5099","Contract: UUPSUpgradeable","","","","","reject proxy address as implementation",""
"passed","Sat Mar 05 01:05:12 GMT 2022","Sat Mar 05 01:05:17 GMT 2022","4627","Contract: ERC721","with minted tokens","transfers > via safeTransferFrom > with data > to a valid receiver contract > when called by the owner","","","adjusts owners tokens by index",""
"passed","Sat Mar 05 01:08:54 GMT 2022","Sat Mar 05 01:08:57 GMT 2022","3416","Contract: ERC721","with minted tokens","transfers > via safeTransferFrom > without data > to a user account > when sent to the owner","","","keeps the owner balance",""
"passed","Sat Mar 05 01:05:20 GMT 2022","Sat Mar 05 01:05:25 GMT 2022","4280","Contract: ERC721Enumerable","with minted tokens","transfers > via safeTransferFrom > with data > to a valid receiver contract > when called by the owner","","","adjusts owners tokens by index",""
"passed","Sat Mar 05 00:38:59 GMT 2022","Sat Mar 05 00:39:06 GMT 2022","7763","Contract: PaymentSplitter","once deployed","release > Ether","","","reverts if non-payee want to claim",""
"skipped","Sat Mar 05 00:39:06 GMT 2022","Sat Mar 05 00:39:06 GMT 2022","0","Contract: TimelockController","methods","batch > schedule","","","length of batch parameter must match #1",""
"passed","Sat Mar 05 01:06:23 GMT 2022","Sat Mar 05 01:06:28 GMT 2022","4610","Contract: ERC721","with minted tokens","transfers > via safeTransferFrom > with data > to a valid receiver contract > when called by the owner without an approved user","","","emits an Approval event",""
"passed","Sat Mar 05 01:06:05 GMT 2022","Sat Mar 05 01:06:09 GMT 2022","4205","Contract: ERC721","with minted tokens","transfers > via safeTransferFrom > with data > to a valid receiver contract > when called by the operator","","","adjusts owners tokens by index",""
"passed","Sat Mar 05 01:13:50 GMT 2022","Sat Mar 05 01:13:51 GMT 2022","1249","Contract: ERC721","_burn","","","","reverts when burning a non-existent token id",""
"passed","Sat Mar 05 00:58:25 GMT 2022","Sat Mar 05 00:58:28 GMT 2022","3893","Contract: ERC165Checker","ERC165 supported","","","","does not support mock interface via supportsInterface",""
"passed","Sat Mar 05 00:47:18 GMT 2022","Sat Mar 05 00:47:23 GMT 2022","5117","Contract: ERC20Burnable","burnFrom","on success > for a zero amount","","","emits a transfer event",""
"passed","Sat Mar 05 01:01:25 GMT 2022","Sat Mar 05 01:01:26 GMT 2022","1226","Contract: SafeCast","toInt16","","","","downcasts 0",""
"passed","Sat Mar 05 01:12:07 GMT 2022","Sat Mar 05 01:12:10 GMT 2022","2886","Contract: ERC721","with minted tokens","transfers > via safeTransferFrom > to a contract that does not implement the required function","","","reverts",""
"passed","Sat Mar 05 01:03:09 GMT 2022","Sat Mar 05 01:03:20 GMT 2022","10813","Contract: EnumerableSet","EnumerableAddressSet","remove","","","adds and removes multiple values",""
"passed","Sat Mar 05 00:40:54 GMT 2022","Sat Mar 05 00:40:59 GMT 2022","5096","Contract: BeaconProxy","initialization","","","","payable initialization",""
"passed","Sat Mar 05 00:54:31 GMT 2022","Sat Mar 05 00:54:42 GMT 2022","10583","Contract: ERC721Enumerable","with minted tokens","transfers > via transferFrom > when called by the approved individual","","","emits a Transfer event",""
"passed","Sat Mar 05 01:14:12 GMT 2022","Sat Mar 05 01:14:14 GMT 2022","1709","Contract: ERC721","metadata","token URI","","","reverts when queried for non existent token id",""
"passed","Sat Mar 05 00:52:22 GMT 2022","Sat Mar 05 00:52:30 GMT 2022","7644","Contract: SafeERC20","with token that returns no boolean values","","","","doesn't revert on transfer",""
"passed","Sat Mar 05 00:58:59 GMT 2022","Sat Mar 05 00:59:09 GMT 2022","9411","Contract: ERC721","with minted tokens","transfers > via transferFrom > when called by the owner without an approved user","","","adjusts owners tokens by index",""
"passed","Sat Mar 05 00:56:53 GMT 2022","Sat Mar 05 00:56:56 GMT 2022","3518","Contract: ECDSA","recover with valid signature","with v1 signature","","","reverts with 01 as version value",""
"passed","Sat Mar 05 01:11:21 GMT 2022","Sat Mar 05 01:11:26 GMT 2022","4291","Contract: ERC721Enumerable","with minted tokens","transfers > via safeTransferFrom > without data > to a valid receiver contract > when sent to the owner","","","clears the approval for the token ID",""
"passed","Sat Mar 05 01:08:44 GMT 2022","Sat Mar 05 01:08:47 GMT 2022","3895","Contract: ERC721Enumerable","with minted tokens","transfers > via safeTransferFrom > without data > to a user account > when called by the owner without an approved user","","","adjusts owners balances",""
"passed","Sat Mar 05 01:06:59 GMT 2022","Sat Mar 05 01:07:03 GMT 2022","4071","Contract: ERC721","with minted tokens","transfers > via safeTransferFrom > with data > to a valid receiver contract > when the address of the previous owner is incorrect","","","reverts",""
"skipped","Sat Mar 05 00:41:10 GMT 2022","Sat Mar 05 00:41:10 GMT 2022","0","Contract: ERC1967Proxy","without initialization","when sending some balance","","","sets the implementation address",""
"passed","Sat Mar 05 00:56:44 GMT 2022","Sat Mar 05 00:57:01 GMT 2022","16643","Contract: Counters","decrement","after incremented to 3","","","can be called multiple times",""
"passed","Sat Mar 05 00:51:33 GMT 2022","Sat Mar 05 00:51:43 GMT 2022","9885","Contract: ERC1155","like an ERC1155","safeBatchTransferFrom > when sending to a valid receiver > with data","","","debits transferred balances from sender",""
"passed","Sat Mar 05 00:44:08 GMT 2022","Sat Mar 05 00:44:43 GMT 2022","35339","Contract: GovernorTimelockControl","Contract interface","Governor > votingPeriod()","","","has to be implemented",""
"passed","Sat Mar 05 01:07:11 GMT 2022","Sat Mar 05 01:07:14 GMT 2022","3771","Contract: ERC721Enumerable","with minted tokens","transfers > via safeTransferFrom > with data > to a valid receiver contract > when the sender is not authorized for the token id","","","reverts",""
"passed","Sat Mar 05 00:47:38 GMT 2022","Sat Mar 05 00:47:42 GMT 2022","4398","Contract: ERC20","approve","when the spender is not the zero address > when the sender does not have enough balance > when there was no approved amount before","","","approves the requested amount",""
"passed","Sat Mar 05 00:54:11 GMT 2022","Sat Mar 05 00:54:13 GMT 2022","1676","Contract: ERC721PresetMinterPauserAutoId","","","","","deployer has the default admin role",""
"passed","Sat Mar 05 00:43:16 GMT 2022","Sat Mar 05 00:43:21 GMT 2022","4854","Contract: ERC1155","like an ERC1155","balanceOf > when accounts don't own tokens","","","returns zero for given addresses",""
"passed","Sat Mar 05 01:02:23 GMT 2022","Sat Mar 05 01:02:27 GMT 2022","4199","Contract: EnumerableSet","EnumerableBytes32Set","remove","","","returns false when removing values not in the set",""
"passed","Sat Mar 05 00:50:22 GMT 2022","Sat Mar 05 00:50:28 GMT 2022","6827","Contract: ERC20PresetMinterPauser","burning","","","","holders can burn their tokens",""
"passed","Sat Mar 05 00:48:40 GMT 2022","Sat Mar 05 00:49:03 GMT 2022","22911","Contract: GovernorTimelockControl","Contract interface","GovernorTimelock > ERC165's supportsInterface(bytes4)","","","claims support [skip-on-coverage]",""
"passed","Sat Mar 05 01:01:35 GMT 2022","Sat Mar 05 01:01:40 GMT 2022","5068","Contract: StorageSlot","uint256 storage slot","get","","","from other slot",""
"passed","Sat Mar 05 00:45:36 GMT 2022","Sat Mar 05 00:45:57 GMT 2022","21388","Contract: ERC1155","like an ERC1155","safeTransferFrom > when called by an operator on behalf of the multiTokenHolder > when operator is not approved by multiTokenHolder","","","reverts",""
"passed","Sat Mar 05 00:59:19 GMT 2022","Sat Mar 05 00:59:47 GMT 2022","27673","Contract: ConditionalEscrow","when withdrawal is allowed","as an escrow > deposits","","","can track deposits to multiple accounts",""
"passed","Sat Mar 05 00:56:44 GMT 2022","Sat Mar 05 00:56:44 GMT 2022","52","Contract: SignatureChecker (ERC1271)","EOA account","","","","with invalid signer",""
"passed","Sat Mar 05 01:05:52 GMT 2022","Sat Mar 05 01:05:56 GMT 2022","4331","Contract: ERC721","with minted tokens","transfers > via safeTransferFrom > with data > to a valid receiver contract > when called by the operator","","","clears the approval for the token ID",""
"passed","Sat Mar 05 00:52:11 GMT 2022","Sat Mar 05 00:52:16 GMT 2022","4999","Contract: ERC721Enumerable","Contract interface","ERC721 > safeTransferFrom(address,address,uint256,bytes)","","","has to be implemented",""
"passed","Sat Mar 05 01:07:29 GMT 2022","Sat Mar 05 01:07:32 GMT 2022","3343","Contract: ERC721","with minted tokens","transfers > via safeTransferFrom > without data > to a user account > when called by the owner","","","emits an Approval event",""
"passed","Sat Mar 05 00:46:23 GMT 2022","Sat Mar 05 00:46:33 GMT 2022","9760","Contract: ERC20","transfer from","when the token owner is not the zero address > when the recipient is not the zero address > when the spender has enough approved balance > when the token owner has enough balance","","","transfers the requested amount",""
"skipped","Sat Mar 05 00:39:06 GMT 2022","Sat Mar 05 00:39:06 GMT 2022","0","Contract: TimelockController","maintenance","","","","prevent unauthorized maintenance",""
"passed","Sat Mar 05 01:10:26 GMT 2022","Sat Mar 05 01:10:31 GMT 2022","4226","Contract: ERC721Enumerable","with minted tokens","transfers > via safeTransferFrom > without data > to a valid receiver contract > when called by the operator","","","emits a Transfer event",""
"passed","Sat Mar 05 01:11:00 GMT 2022","Sat Mar 05 01:11:06 GMT 2022","5172","Contract: ERC721","with minted tokens","transfers > via safeTransferFrom > without data > to a valid receiver contract > when called by the owner without an approved user","","","adjusts owners balances",""
"passed","Sat Mar 05 01:05:22 GMT 2022","Sat Mar 05 01:05:26 GMT 2022","4184","Contract: ERC721","with minted tokens","transfers > via safeTransferFrom > with data > to a valid receiver contract > when called by the approved individual","","","emits a Transfer event",""
"passed","Sat Mar 05 01:08:20 GMT 2022","Sat Mar 05 01:08:24 GMT 2022","3969","Contract: ERC721","with minted tokens","transfers > via safeTransferFrom > without data > to a user account > when called by the owner without an approved user","","","transfers the ownership of the given token ID to the given address",""
"passed","Sat Mar 05 00:56:32 GMT 2022","Sat Mar 05 00:56:33 GMT 2022","1238","Contract: MerkleProof","verify","","","","returns false for an invalid Merkle proof",""
"passed","Sat Mar 05 00:55:27 GMT 2022","Sat Mar 05 00:55:30 GMT 2022","3391","Contract: ERC721PresetMinterPauserAutoId","Contract interface","AccessControlEnumerable > getRoleMember(bytes32,uint256)","","","has to be implemented",""
"skipped","Sat Mar 05 00:39:06 GMT 2022","Sat Mar 05 00:39:06 GMT 2022","1","Contract: TimelockController","methods","operation hashing","","","hashOperationBatch",""
"passed","Sat Mar 05 00:56:17 GMT 2022","Sat Mar 05 00:56:27 GMT 2022","10344","Contract: ERC721Enumerable","with minted tokens","transfers > via transferFrom > when called by the operator","","","emits an Approval event",""
"passed","Sat Mar 05 00:39:39 GMT 2022","Sat Mar 05 00:39:46 GMT 2022","7230","Contract: AccessControl","renouncing","","","","roles that are not had can be renounced",""
"passed","Sat Mar 05 01:04:33 GMT 2022","Sat Mar 05 01:04:36 GMT 2022","3444","Contract: ERC721Enumerable","with minted tokens","transfers > via safeTransferFrom > with data > to a user account > when sent to the owner","","","keeps same tokens by index",""
"passed","Sat Mar 05 00:54:44 GMT 2022","Sat Mar 05 00:54:49 GMT 2022","5150","Contract: ERC1155","internal functions","_burn","","","reverts when burning a non-existent token id",""
"passed","Sat Mar 05 00:42:51 GMT 2022","Sat Mar 05 00:42:55 GMT 2022","3538","Contract: Pausable","when unpaused","when paused","","","cannot perform normal process in pause",""
"passed","Sat Mar 05 00:48:53 GMT 2022","Sat Mar 05 00:49:04 GMT 2022","10921","Contract: ERC20","deposit","","","","to other account",""
"passed","Sat Mar 05 00:55:20 GMT 2022","Sat Mar 05 00:55:23 GMT 2022","2926","Contract: ERC721PresetMinterPauserAutoId","Contract interface","AccessControl > renounceRole(bytes32,address)","","","has to be implemented",""
"passed","Sat Mar 05 00:41:18 GMT 2022","Sat Mar 05 00:41:23 GMT 2022","4190","Contract: Clones","clone","initialization without parameters > payable > when sending some balance","","","has expected balance",""
"passed","Sat Mar 05 00:39:46 GMT 2022","Sat Mar 05 00:39:50 GMT 2022","3577","Contract: AccessControl","renouncing","with granted role","","","bearer can renounce role",""
"passed","Sat Mar 05 00:59:00 GMT 2022","Sat Mar 05 00:59:03 GMT 2022","3012","Contract: Math","max","","","","is correctly detected in second argument position",""
"passed","Sat Mar 05 00:49:46 GMT 2022","Sat Mar 05 00:50:09 GMT 2022","22738","Contract: GovernorTimelockCompound","cancel before queue prevents scheduling","","","","run",""
"passed","Sat Mar 05 01:01:23 GMT 2022","Sat Mar 05 01:01:28 GMT 2022","4683","Contract: SafeMath","with custom revert message","mod","","","reverts with a 0 divisor",""
"broken","Sat Mar 05 00:46:27 GMT 2022","Sat Mar 05 00:47:00 GMT 2022","32326","Contract: GovernorTimelockCompound","nominal","","","","run",""
"passed","Sat Mar 05 00:46:34 GMT 2022","Sat Mar 05 00:46:54 GMT 2022","20077","Contract: GovernorTimelockControl","Contract interface","Governor > execute(address[],uint256[],bytes[],bytes32)","","","has to be implemented",""
"passed","Sat Mar 05 01:11:38 GMT 2022","Sat Mar 05 01:11:42 GMT 2022","3898","Contract: ERC721Enumerable","with minted tokens","transfers > via safeTransferFrom > without data > to a valid receiver contract > when the address of the previous owner is incorrect","","","reverts",""
"passed","Sat Mar 05 00:47:54 GMT 2022","Sat Mar 05 00:47:59 GMT 2022","5362","Contract: ERC20","decrease allowance","when the spender is not the zero address > when the sender has enough balance > when the spender had an approved amount","","","emits an approval event",""
"passed","Sat Mar 05 00:38:22 GMT 2022","Sat Mar 05 00:38:33 GMT 2022","11510","Contract: VestingWallet","vesting schedule","Eth vesting","","","check vesting schedule",""
"passed","Sat Mar 05 01:10:40 GMT 2022","Sat Mar 05 01:10:45 GMT 2022","4708","Contract: ERC721Enumerable","with minted tokens","transfers > via safeTransferFrom > without data > to a valid receiver contract > when called by the operator","","","adjusts owners balances",""
"passed","Sat Mar 05 00:43:36 GMT 2022","Sat Mar 05 00:43:51 GMT 2022","14093","Contract: Pausable","when unpaused","when paused > unpausing > when unpaused","","","should resume allowing normal process",""
"passed","Sat Mar 05 00:43:56 GMT 2022","Sat Mar 05 00:44:05 GMT 2022","8243","Contract: TransparentUpgradeableProxy","upgradeToAndCall","without migrations > when the call does not fail > when the sender is not the admin","","","reverts",""
"passed","Sat Mar 05 01:04:36 GMT 2022","Sat Mar 05 01:04:39 GMT 2022","2944","Contract: ERC721","with minted tokens","transfers > via safeTransferFrom > with data > to a user account > when the given token ID does not exist","","","reverts",""
"passed","Sat Mar 05 00:51:32 GMT 2022","Sat Mar 05 00:51:33 GMT 2022","1597","Contract: ERC721","Contract interface","ERC165 > supportsInterface(bytes4)","","","has to be implemented",""
"passed","Sat Mar 05 00:52:16 GMT 2022","Sat Mar 05 00:52:23 GMT 2022","6398","Contract: ERC1155","like an ERC1155","safeBatchTransferFrom > to a receiver contract returning unexpected value","","","reverts",""
"passed","Sat Mar 05 00:44:06 GMT 2022","Sat Mar 05 00:44:09 GMT 2022","3177","Contract: ERC1155Supply","before mint","","","","exist",""
"broken","Sat Mar 05 00:41:14 GMT 2022","Sat Mar 05 00:41:14 GMT 2022","0","tests.brownie.token.tests","test_transferFrom","","","","test_transfer_zero_tokens_without_approval",""
"skipped","Sat Mar 05 00:39:06 GMT 2022","Sat Mar 05 00:39:06 GMT 2022","0","Contract: TimelockController","methods","batch > execute > with scheduled operation > on time","","","length mismatch #1",""
"passed","Sat Mar 05 00:54:31 GMT 2022","Sat Mar 05 00:54:32 GMT 2022","1645","Contract: ERC721PresetMinterPauserAutoId","Contract interface","ERC721 > approve(address,uint256)","","","has to be implemented",""
"passed","Sat Mar 05 00:45:24 GMT 2022","Sat Mar 05 00:45:36 GMT 2022","12135","Contract: ERC1155","like an ERC1155","safeTransferFrom > when called by the multiTokenHolder","","","preserves existing balances which are not transferred by multiTokenHolder",""
"passed","Sat Mar 05 01:01:15 GMT 2022","Sat Mar 05 01:01:18 GMT 2022","2984","Contract: SafeCast","toInt8","","","","reverts when downcasting -2^7 - 1 (-129)",""
"passed","Sat Mar 05 01:03:40 GMT 2022","Sat Mar 05 01:03:46 GMT 2022","5495","Contract: ERC721","with minted tokens","transfers > via safeTransferFrom > with data > to a user account > when called by the operator","","","adjusts owners tokens by index",""
"passed","Sat Mar 05 01:10:54 GMT 2022","Sat Mar 05 01:10:58 GMT 2022","4657","Contract: ERC721Enumerable","with minted tokens","transfers > via safeTransferFrom > without data > to a valid receiver contract > when called by the owner without an approved user","","","emits a Transfer event",""
"passed","Sat Mar 05 00:52:49 GMT 2022","Sat Mar 05 00:53:06 GMT 2022","16856","Contract: ERC20","erc20 behaviour","transfer from > when the token owner is not the zero address > when the recipient is not the zero address > when the spender has enough approved balance > when the token owner has enough balance","","","emits a transfer event",""
"passed","Sat Mar 05 00:54:08 GMT 2022","Sat Mar 05 00:54:13 GMT 2022","4709","Contract: ERC721URIStorage","token URI","","","","reverts when setting for non existent token id",""
"passed","Sat Mar 05 01:00:04 GMT 2022","Sat Mar 05 01:00:08 GMT 2022","3389","Contract: SafeMath","with flag","mod > modulos correctly","","","when the dividend is smaller than the divisor",""
"passed","Sat Mar 05 00:51:48 GMT 2022","Sat Mar 05 00:51:50 GMT 2022","2118","Contract: ERC721","Contract interface","ERC721 > approve(address,uint256)","","","has to be implemented",""
"broken","Sat Mar 05 00:41:11 GMT 2022","Sat Mar 05 00:41:11 GMT 2022","0","tests.brownie.token.tests","test_approve","","","","test_approve_self",""
"passed","Sat Mar 05 00:42:17 GMT 2022","Sat Mar 05 00:42:20 GMT 2022","2999","Contract: ProxyAdmin","#upgradeAndCall","with unauthorized account","","","fails to upgrade",""
"passed","Sat Mar 05 01:01:44 GMT 2022","Sat Mar 05 01:01:53 GMT 2022","9212","Contract: BitMap","set","","","","adds a key",""
"broken","Sat Mar 05 00:50:54 GMT 2022","Sat Mar 05 00:51:02 GMT 2022","8842","Contract: TokenTimelock","with token","once deployed","","","can be released just after limit",""
"passed","Sat Mar 05 01:02:48 GMT 2022","Sat Mar 05 01:02:57 GMT 2022","9045","Contract: ERC721Enumerable","with minted tokens","transfers > via safeTransferFrom > with data > to a user account > when called by the owner","","","adjusts owners tokens by index",""
"passed","Sat Mar 05 00:59:31 GMT 2022","Sat Mar 05 00:59:36 GMT 2022","4811","Contract: Address","functionCallWithValue","with non-zero value","","","calls the requested function with existing value",""
"passed","Sat Mar 05 00:58:43 GMT 2022","Sat Mar 05 00:58:46 GMT 2022","2596","Contract: ERC165Checker","ERC165 and single interface supported","","","","supports mock interface via supportsAllInterfaces",""
"passed","Sat Mar 05 00:40:18 GMT 2022","Sat Mar 05 00:40:41 GMT 2022","23485","Contract: Governor","Contract interface","ERC165 > supportsInterface(bytes4)","","","has to be implemented",""
"passed","Sat Mar 05 00:38:25 GMT 2022","Sat Mar 05 00:38:28 GMT 2022","3025","Contract: AccessControl","Contract interface","AccessControl > ERC165's supportsInterface(bytes4)","","","claims support [skip-on-coverage]",""
"passed","Sat Mar 05 00:58:59 GMT 2022","Sat Mar 05 00:59:00 GMT 2022","1281","Contract: Math","max","","","","is correctly detected in first argument position",""
"passed","Sat Mar 05 00:50:37 GMT 2022","Sat Mar 05 00:50:40 GMT 2022","3155","Contract: ERC20","_approve","when the spender is not the zero address > when the sender has enough balance","","","emits an approval event",""
"passed","Sat Mar 05 00:56:26 GMT 2022","Sat Mar 05 00:56:29 GMT 2022","2941","Contract: ECDSA","recover with invalid signature","","","","with long signature",""
"passed","Sat Mar 05 00:39:17 GMT 2022","Sat Mar 05 00:39:42 GMT 2022","24252","Contract: GovernorTimelockControl","Contract interface","ERC165 > supportsInterface(bytes4)","","","has to be implemented",""
"broken","Sat Mar 05 00:41:12 GMT 2022","Sat Mar 05 00:41:12 GMT 2022","0","tests.brownie.token.tests","test_transfer","","","","test_total_supply_not_affected",""
"skipped","Sat Mar 05 00:48:06 GMT 2022","Sat Mar 05 00:48:06 GMT 2022","0","Contract: ERC20VotesComp","getPastTotalSupply","","","","returns zero if < first checkpoint block",""
"passed","Sat Mar 05 00:51:56 GMT 2022","Sat Mar 05 00:52:05 GMT 2022","8676","Contract: ERC1155","like an ERC1155","safeBatchTransferFrom > when sending to a valid receiver > with data","","","emits a TransferBatch log",""
"passed","Sat Mar 05 00:50:15 GMT 2022","Sat Mar 05 00:50:17 GMT 2022","1863","Contract: ERC20","_transfer","when the recipient is not the zero address > when the sender does not have enough balance","","","reverts",""
"passed","Sat Mar 05 00:46:04 GMT 2022","Sat Mar 05 00:46:07 GMT 2022","2611","Contract: ERC20","transfer","when the recipient is not the zero address > when the sender does not have enough balance","","","reverts",""
