"Status","Start Time","Stop Time","Duration in ms","Parent Suite","Suite","Sub Suite","Test Class","Test Method","Name","Description"
"passed","Thu Nov 25 12:03:48 GMT 2021","Thu Nov 25 12:04:10 GMT 2021","21848","","Contract: ERC721 with minted tokens transfers via safeTransferFrom without data to a valid receiver contract when called by the operator","","Contract: ERC721 with minted tokens transfers via safeTransferFrom without data to a valid receiver contract when called by the operator","adjusts owners tokens by index","adjusts owners tokens by index",""
"passed","Thu Nov 25 12:14:58 GMT 2021","Thu Nov 25 12:15:03 GMT 2021","4656","","Contract: SafeCast toInt64","","Contract: SafeCast toInt64","downcasts -1","downcasts -1",""
"failed","Thu Nov 25 11:15:48 GMT 2021","Thu Nov 25 11:15:57 GMT 2021","8974","","Contract: ERC721PresetMinterPauserAutoId Contract interface AccessControl ERC165's supportsInterface(bytes4)","","Contract: ERC721PresetMinterPauserAutoId Contract interface AccessControl ERC165's supportsInterface(bytes4)","uses less than 30k gas [skip-on-coverage]","uses less than 30k gas [skip-on-coverage]",""
"passed","Thu Nov 25 11:22:34 GMT 2021","Thu Nov 25 11:22:50 GMT 2021","15819","","Contract: ERC721 with minted tokens transfers via transferFrom when sent to the owner","","Contract: ERC721 with minted tokens transfers via transferFrom when sent to the owner","emits only a transfer event","emits only a transfer event",""
"passed","Thu Nov 25 11:16:02 GMT 2021","Thu Nov 25 11:16:09 GMT 2021","7100","","Contract: ERC20 decrease allowance when the spender is the zero address","","Contract: ERC20 decrease allowance when the spender is the zero address","reverts","reverts",""
"passed","Thu Nov 25 11:34:08 GMT 2021","Thu Nov 25 11:34:31 GMT 2021","22509","","Contract: ERC721Enumerable with minted tokens transfers via safeTransferFrom with data to a valid receiver contract when called by the owner","","Contract: ERC721Enumerable with minted tokens transfers via safeTransferFrom with data to a valid receiver contract when called by the owner","emits a Transfer event","emits a Transfer event",""
"passed","Thu Nov 25 11:10:57 GMT 2021","Thu Nov 25 11:11:04 GMT 2021","7158","","Contract: ERC20 balanceOf when the requested account has no tokens","","Contract: ERC20 balanceOf when the requested account has no tokens","returns zero","returns zero",""
"passed","Thu Nov 25 12:09:54 GMT 2021","Thu Nov 25 12:10:01 GMT 2021","6525","","Contract: ECDSA recover with valid signature with v1 signature","","Contract: ECDSA recover with valid signature with v1 signature","works with 28 as version value","works with 28 as version value",""
"passed","Thu Nov 25 12:12:12 GMT 2021","Thu Nov 25 12:12:26 GMT 2021","13994","","Contract: ERC721 with minted tokens safe mint via safeMint to a receiver contract that reverts with message","","Contract: ERC721 with minted tokens safe mint via safeMint to a receiver contract that reverts with message","reverts","reverts",""
"passed","Thu Nov 25 11:15:34 GMT 2021","Thu Nov 25 11:15:51 GMT 2021","17327","","Contract: ERC721 with minted tokens transfers via transferFrom when called by the owner","","Contract: ERC721 with minted tokens transfers via transferFrom when called by the owner","clears the approval for the token ID","clears the approval for the token ID",""
"passed","Thu Nov 25 12:13:29 GMT 2021","Thu Nov 25 12:13:43 GMT 2021","13964","","Contract: ERC721 with minted tokens approve when clearing approval when there was a prior approval","","Contract: ERC721 with minted tokens approve when clearing approval when there was a prior approval","clears approval for the token","clears approval for the token",""
"skipped","Thu Nov 25 10:22:46 GMT 2021","Thu Nov 25 10:22:46 GMT 2021","0","","Contract: TimelockController usage scenario","","Contract: TimelockController usage scenario","call reverting with eth","call reverting with eth",""
"passed","Thu Nov 25 11:27:12 GMT 2021","Thu Nov 25 11:27:30 GMT 2021","17953","","Contract: ERC721 with minted tokens transfers via safeTransferFrom with data to a user account when called by the approved individual","","Contract: ERC721 with minted tokens transfers via safeTransferFrom with data to a user account when called by the approved individual","adjusts owners balances","adjusts owners balances",""
"passed","Thu Nov 25 10:42:18 GMT 2021","Thu Nov 25 10:42:47 GMT 2021","28969","","Contract: Governor state Unset","","Contract: Governor state Unset","run","run",""
"skipped","Thu Nov 25 11:08:36 GMT 2021","Thu Nov 25 11:08:36 GMT 2021","0","","Contract: ERC20Votes set delegation call","","Contract: ERC20Votes set delegation call","delegation with balance","delegation with balance",""
"passed","Thu Nov 25 11:36:07 GMT 2021","Thu Nov 25 11:36:32 GMT 2021","24770","","Contract: ERC721Enumerable with minted tokens transfers via safeTransferFrom with data to a valid receiver contract when called by the approved individual","","Contract: ERC721Enumerable with minted tokens transfers via safeTransferFrom with data to a valid receiver contract when called by the approved individual","transfers the ownership of the given token ID to the given address","transfers the ownership of the given token ID to the given address",""
"passed","Thu Nov 25 10:56:03 GMT 2021","Thu Nov 25 10:56:15 GMT 2021","11662","","Contract: ProxyAdmin #changeProxyAdmin","","Contract: ProxyAdmin #changeProxyAdmin","changes proxy admin","changes proxy admin",""
"passed","Thu Nov 25 11:14:08 GMT 2021","Thu Nov 25 11:14:18 GMT 2021","9843","","Contract: ERC721 with minted tokens balanceOf when the given address owns some tokens","","Contract: ERC721 with minted tokens balanceOf when the given address owns some tokens","returns the amount of tokens owned by the given address","returns the amount of tokens owned by the given address",""
"passed","Thu Nov 25 11:25:12 GMT 2021","Thu Nov 25 11:25:28 GMT 2021","15869","","Contract: ERC721 with minted tokens transfers via safeTransferFrom with data to a user account when called by the owner","","Contract: ERC721 with minted tokens transfers via safeTransferFrom with data to a user account when called by the owner","emits an Approval event","emits an Approval event",""
"passed","Thu Nov 25 12:11:50 GMT 2021","Thu Nov 25 12:11:57 GMT 2021","6415","","Contract: Arrays findUpperBound Even number of elements","","Contract: Arrays findUpperBound Even number of elements","returns 0 for the element under the lower boundary","returns 0 for the element under the lower boundary",""
"skipped","Thu Nov 25 11:08:37 GMT 2021","Thu Nov 25 11:08:37 GMT 2021","0","","Contract: ERC20Votes transfers","","Contract: ERC20Votes transfers","no delegation","no delegation",""
"passed","Thu Nov 25 11:11:53 GMT 2021","Thu Nov 25 11:12:18 GMT 2021","25258","","Contract: ERC20 withdraw","","Contract: ERC20 withdraw","to other account","to other account",""
"broken","Thu Nov 25 10:33:17 GMT 2021","Thu Nov 25 10:34:10 GMT 2021","52530","","Contract: Governor scenario vote with signature","","Contract: Governor scenario vote with signature","run","run",""
"passed","Thu Nov 25 11:17:23 GMT 2021","Thu Nov 25 11:17:32 GMT 2021","8549","","Contract: ERC20 _mint for a non zero account","","Contract: ERC20 _mint for a non zero account","increments recipient balance","increments recipient balance",""
"passed","Thu Nov 25 12:12:20 GMT 2021","Thu Nov 25 12:12:25 GMT 2021","4740","","Contract: SafeCast toUint256","","Contract: SafeCast toUint256","casts 0","casts 0",""
"passed","Thu Nov 25 11:09:28 GMT 2021","Thu Nov 25 11:09:38 GMT 2021","9152","","Contract: SafeERC20 with token that returns false on all calls","","Contract: SafeERC20 with token that returns false on all calls","reverts on increaseAllowance","reverts on increaseAllowance",""
"broken","Thu Nov 25 11:10:41 GMT 2021","Thu Nov 25 11:10:49 GMT 2021","7580","","Contract: ERC777 relative order of hooks","","Contract: ERC777 relative order of hooks","send","send",""
"skipped","Thu Nov 25 11:08:37 GMT 2021","Thu Nov 25 11:08:37 GMT 2021","0","","Contract: ERC20Votes set delegation with signature","","Contract: ERC20Votes set delegation with signature","rejects bad nonce","rejects bad nonce",""
"passed","Thu Nov 25 10:25:36 GMT 2021","Thu Nov 25 10:26:02 GMT 2021","26644","","Contract: Governor Contract interface Governor version()","","Contract: Governor Contract interface Governor version()","has to be implemented","has to be implemented",""
"passed","Thu Nov 25 11:16:19 GMT 2021","Thu Nov 25 11:16:46 GMT 2021","27172","","Contract: ERC20 erc20 behaviour transfer from when the token owner is not the zero address when the recipient is not the zero address when the spender has enough approved balance when the token owner has enough balance","","Contract: ERC20 erc20 behaviour transfer from when the token owner is not the zero address when the recipient is not the zero address when the spender has enough approved balance when the token owner has enough balance","transfers the requested amount","transfers the requested amount",""
"passed","Thu Nov 25 11:08:55 GMT 2021","Thu Nov 25 11:09:02 GMT 2021","6448","","Contract: ERC20FlashMint flashFee","","Contract: ERC20FlashMint flashFee","token match","token match",""
"passed","Thu Nov 25 10:57:20 GMT 2021","Thu Nov 25 10:57:27 GMT 2021","6704","","Contract: Clones cloneDeterministic","","Contract: Clones cloneDeterministic","address already used","address already used",""
"broken","Thu Nov 25 10:35:24 GMT 2021","Thu Nov 25 10:36:09 GMT 2021","44919","","Contract: Governor scenario receiver revert with reason","","Contract: Governor scenario receiver revert with reason","run","run",""
"passed","Thu Nov 25 11:59:36 GMT 2021","Thu Nov 25 12:00:00 GMT 2021","23497","","Contract: ERC721 with minted tokens transfers via safeTransferFrom without data to a valid receiver contract when called by the approved individual","","Contract: ERC721 with minted tokens transfers via safeTransferFrom without data to a valid receiver contract when called by the approved individual","transfers the ownership of the given token ID to the given address","transfers the ownership of the given token ID to the given address",""
"failed","Thu Nov 25 11:14:01 GMT 2021","Thu Nov 25 11:14:17 GMT 2021","15553","","Contract: ERC1155Holder Contract interface ERC165 ERC165's supportsInterface(bytes4)","","Contract: ERC1155Holder Contract interface ERC165 ERC165's supportsInterface(bytes4)","uses less than 30k gas [skip-on-coverage]","uses less than 30k gas [skip-on-coverage]",""
"passed","Thu Nov 25 10:14:56 GMT 2021","Thu Nov 25 10:15:05 GMT 2021","9282","","Contract: AccessControl granting","","Contract: AccessControl granting","accounts can be granted a role multiple times","accounts can be granted a role multiple times",""
"passed","Thu Nov 25 11:42:41 GMT 2021","Thu Nov 25 11:43:07 GMT 2021","25639","","Contract: ERC721Enumerable with minted tokens transfers via safeTransferFrom with data to a valid receiver contract when called by the owner without an approved user","","Contract: ERC721Enumerable with minted tokens transfers via safeTransferFrom with data to a valid receiver contract when called by the owner without an approved user","adjusts owners balances","adjusts owners balances",""
"passed","Thu Nov 25 12:06:39 GMT 2021","Thu Nov 25 12:06:59 GMT 2021","20612","","Contract: ERC721 with minted tokens transfers via safeTransferFrom without data to a valid receiver contract when sent to the owner","","Contract: ERC721 with minted tokens transfers via safeTransferFrom without data to a valid receiver contract when sent to the owner","keeps ownership of the token","keeps ownership of the token",""
"passed","Thu Nov 25 11:06:56 GMT 2021","Thu Nov 25 11:07:03 GMT 2021","7861","","Contract: Pausable when unpaused when paused","","Contract: Pausable when unpaused when paused","cannot perform normal process in pause","cannot perform normal process in pause",""
"passed","Thu Nov 25 11:14:15 GMT 2021","Thu Nov 25 11:14:21 GMT 2021","5742","","Contract: ERC1155Supply before mint","","Contract: ERC1155Supply before mint","exist","exist",""
"skipped","Thu Nov 25 11:08:36 GMT 2021","Thu Nov 25 11:08:36 GMT 2021","0","","Contract: ERC20Votes","","Contract: ERC20Votes","minting restriction","minting restriction",""
"skipped","Thu Nov 25 11:09:13 GMT 2021","Thu Nov 25 11:09:13 GMT 2021","0","","Contract: ERC20VotesComp getPastTotalSupply","","Contract: ERC20VotesComp getPastTotalSupply","generally returns the voting balance at the appropriate checkpoint","generally returns the voting balance at the appropriate checkpoint",""
"passed","Thu Nov 25 11:26:54 GMT 2021","Thu Nov 25 11:27:12 GMT 2021","17664","","Contract: ERC721Enumerable with minted tokens transfers via safeTransferFrom with data to a user account when called by the operator","","Contract: ERC721Enumerable with minted tokens transfers via safeTransferFrom with data to a user account when called by the operator","emits a Transfer event","emits a Transfer event",""
"passed","Thu Nov 25 11:09:36 GMT 2021","Thu Nov 25 11:09:46 GMT 2021","9543","","Contract: ERC20Permit permit","","Contract: ERC20Permit permit","rejects expired permit","rejects expired permit",""
"skipped","Thu Nov 25 11:09:13 GMT 2021","Thu Nov 25 11:09:13 GMT 2021","0","","Contract: ERC20VotesComp set delegation with signature","","Contract: ERC20VotesComp set delegation with signature","rejects bad nonce","rejects bad nonce",""
"skipped","Thu Nov 25 11:09:13 GMT 2021","Thu Nov 25 11:09:13 GMT 2021","0","","Contract: ERC20VotesComp set delegation call","","Contract: ERC20VotesComp set delegation call","delegation without balance","delegation without balance",""
"passed","Thu Nov 25 11:51:34 GMT 2021","Thu Nov 25 11:51:51 GMT 2021","17070","","Contract: ERC721 with minted tokens transfers via safeTransferFrom without data to a user account when called by the operator","","Contract: ERC721 with minted tokens transfers via safeTransferFrom without data to a user account when called by the operator","emits an Approval event","emits an Approval event",""
"passed","Thu Nov 25 11:13:38 GMT 2021","Thu Nov 25 11:13:53 GMT 2021","14752","","Contract: ERC1155Pausable when token is paused","","Contract: ERC1155Pausable when token is paused","reverts when trying to safeBatchTransferFrom from holder","reverts when trying to safeBatchTransferFrom from holder",""
"passed","Thu Nov 25 12:13:49 GMT 2021","Thu Nov 25 12:13:58 GMT 2021","9348","","Contract: Counters decrement starting from 1","","Contract: Counters decrement starting from 1","decrements the current value by one","decrements the current value by one",""
"passed","Thu Nov 25 11:08:39 GMT 2021","Thu Nov 25 11:08:44 GMT 2021","5712","","Contract: ERC20Capped once deployed capped token","","Contract: ERC20Capped once deployed capped token","starts with the correct cap","starts with the correct cap",""
"broken","Thu Nov 25 10:21:22 GMT 2021","Thu Nov 25 10:21:36 GMT 2021","13417","","Contract: PaymentSplitter once deployed distributes funds to payees","","Contract: PaymentSplitter once deployed distributes funds to payees","Ether","Ether",""
"passed","Thu Nov 25 12:13:43 GMT 2021","Thu Nov 25 12:13:49 GMT 2021","6293","","Contract: StorageSlot boolean storage slot get","","Contract: StorageSlot boolean storage slot get","from other slot","from other slot",""
"passed","Thu Nov 25 11:14:03 GMT 2021","Thu Nov 25 11:14:08 GMT 2021","5086","","Contract: ERC721 Contract interface ERC721 safeTransferFrom(address,address,uint256,bytes)","","Contract: ERC721 Contract interface ERC721 safeTransferFrom(address,address,uint256,bytes)","has to be implemented","has to be implemented",""
"skipped","Thu Nov 25 10:55:38 GMT 2021","Thu Nov 25 10:55:38 GMT 2021","0","","Contract: ERC1967Proxy without initialization when sending some balance","","Contract: ERC1967Proxy without initialization when sending some balance","sets the implementation address","sets the implementation address",""
"passed","Thu Nov 25 11:25:39 GMT 2021","Thu Nov 25 11:25:57 GMT 2021","17950","","Contract: ERC721Enumerable with minted tokens transfers via safeTransferFrom with data to a user account when called by the approved individual","","Contract: ERC721Enumerable with minted tokens transfers via safeTransferFrom with data to a user account when called by the approved individual","emits an Approval event","emits an Approval event",""
"passed","Thu Nov 25 11:13:22 GMT 2021","Thu Nov 25 11:13:33 GMT 2021","10510","","Contract: SafeERC20 with token that returns no boolean values approvals with non-zero allowance","","Contract: SafeERC20 with token that returns no boolean values approvals with non-zero allowance","doesn't revert when approving a zero allowance","doesn't revert when approving a zero allowance",""
"skipped","Thu Nov 25 10:56:52 GMT 2021","Thu Nov 25 10:56:52 GMT 2021","0","","Contract: TransparentUpgradeableProxy initialization without parameters payable when not sending balance","","Contract: TransparentUpgradeableProxy initialization without parameters payable when not sending balance","sets the implementation address","sets the implementation address",""
"passed","Thu Nov 25 12:10:56 GMT 2021","Thu Nov 25 12:11:14 GMT 2021","18356","","Contract: ERC721Enumerable with minted tokens transfers via safeTransferFrom to a receiver contract that reverts without message","","Contract: ERC721Enumerable with minted tokens transfers via safeTransferFrom to a receiver contract that reverts without message","reverts","reverts",""
"passed","Thu Nov 25 10:55:34 GMT 2021","Thu Nov 25 10:55:43 GMT 2021","9651","","Contract: ProxyAdmin #getProxyAdmin","","Contract: ProxyAdmin #getProxyAdmin","returns proxyAdmin as admin of the proxy","returns proxyAdmin as admin of the proxy",""
"broken","Thu Nov 25 10:36:50 GMT 2021","Thu Nov 25 10:37:32 GMT 2021","42254","","Contract: Governor scenario duplicate pending proposal","","Contract: Governor scenario duplicate pending proposal","run","run",""
"passed","Thu Nov 25 11:08:51 GMT 2021","Thu Nov 25 11:09:04 GMT 2021","13108","","Contract: ERC20Pausable pausable token transfer","","Contract: ERC20Pausable pausable token transfer","allows to transfer when paused and then unpaused","allows to transfer when paused and then unpaused",""
"passed","Thu Nov 25 11:20:17 GMT 2021","Thu Nov 25 11:20:27 GMT 2021","10310","","Contract: ERC20 _approve when the spender is not the zero address when the sender does not have enough balance when the spender had an approved amount","","Contract: ERC20 _approve when the spender is not the zero address when the sender does not have enough balance when the spender had an approved amount","approves the requested amount and replaces the previous one","approves the requested amount and replaces the previous one",""
"passed","Thu Nov 25 11:26:20 GMT 2021","Thu Nov 25 11:26:37 GMT 2021","17348","","Contract: ERC721 with minted tokens transfers via safeTransferFrom with data to a user account when called by the approved individual","","Contract: ERC721 with minted tokens transfers via safeTransferFrom with data to a user account when called by the approved individual","emits a Transfer event","emits a Transfer event",""
"passed","Thu Nov 25 12:11:48 GMT 2021","Thu Nov 25 12:11:55 GMT 2021","6447","","Contract: EnumerableMap read get","","Contract: EnumerableMap read get","missing value","missing value",""
"passed","Thu Nov 25 11:11:59 GMT 2021","Thu Nov 25 11:12:13 GMT 2021","13378","","Contract: ERC20 transfer from when the token owner is not the zero address when the recipient is not the zero address when the spender has enough approved balance when the token owner has enough balance","","Contract: ERC20 transfer from when the token owner is not the zero address when the recipient is not the zero address when the spender has enough approved balance when the token owner has enough balance","transfers the requested amount","transfers the requested amount",""
"passed","Thu Nov 25 12:15:21 GMT 2021","Thu Nov 25 12:15:26 GMT 2021","4572","","Contract: SafeCast toInt64","","Contract: SafeCast toInt64","reverts when downcasting 2^63 (9223372036854775808)","reverts when downcasting 2^63 (9223372036854775808)",""
"passed","Thu Nov 25 12:12:48 GMT 2021","Thu Nov 25 12:12:53 GMT 2021","4660","","Contract: ERC165Checker account address does not support ERC165","","Contract: ERC165Checker account address does not support ERC165","does not support mock interface via supportsInterface","does not support mock interface via supportsInterface",""
"passed","Thu Nov 25 11:24:06 GMT 2021","Thu Nov 25 11:24:20 GMT 2021","14247","","Contract: ERC721 with minted tokens transfers via transferFrom when the address to transfer the token to is the zero address","","Contract: ERC721 with minted tokens transfers via transferFrom when the address to transfer the token to is the zero address","reverts","reverts",""
"passed","Thu Nov 25 11:10:41 GMT 2021","Thu Nov 25 11:11:03 GMT 2021","21227","","Contract: ERC20 withdraw","","Contract: ERC20 withdraw","missing balance","missing balance",""
"passed","Thu Nov 25 11:16:02 GMT 2021","Thu Nov 25 11:16:21 GMT 2021","18701","","Contract: ERC721Enumerable with minted tokens transfers via transferFrom when called by the approved individual","","Contract: ERC721Enumerable with minted tokens transfers via transferFrom when called by the approved individual","adjusts owners balances","adjusts owners balances",""
"broken","Thu Nov 25 10:23:32 GMT 2021","Thu Nov 25 10:24:17 GMT 2021","44879","","Contract: GovernorVotesQuorumFraction update quorum ratio through proposal","","Contract: GovernorVotesQuorumFraction update quorum ratio through proposal","run","run",""
"passed","Thu Nov 25 10:55:34 GMT 2021","Thu Nov 25 10:55:41 GMT 2021","6164","","Contract: Initializable basic testing without inheritance after nested initialize","","Contract: Initializable basic testing without inheritance after nested initialize","initializer has run","initializer has run",""
"passed","Thu Nov 25 11:13:10 GMT 2021","Thu Nov 25 11:13:24 GMT 2021","13860","","Contract: ERC1155Pausable when token is paused","","Contract: ERC1155Pausable when token is paused","reverts when trying to safeTransferFrom from holder","reverts when trying to safeTransferFrom from holder",""
"passed","Thu Nov 25 11:51:18 GMT 2021","Thu Nov 25 11:51:36 GMT 2021","17622","","Contract: ERC721Enumerable with minted tokens transfers via safeTransferFrom without data to a user account when called by the operator","","Contract: ERC721Enumerable with minted tokens transfers via safeTransferFrom without data to a user account when called by the operator","emits an Approval event","emits an Approval event",""
"passed","Thu Nov 25 12:12:06 GMT 2021","Thu Nov 25 12:12:16 GMT 2021","9837","","Contract: ERC165Checker ERC165 and many interfaces supported","","Contract: ERC165Checker ERC165 and many interfaces supported","supports not all of the interfaces queried via supportsAllInterfaces","supports not all of the interfaces queried via supportsAllInterfaces",""
"passed","Thu Nov 25 11:58:52 GMT 2021","Thu Nov 25 11:59:15 GMT 2021","22664","","Contract: ERC721 with minted tokens transfers via safeTransferFrom without data to a valid receiver contract when called by the owner","","Contract: ERC721 with minted tokens transfers via safeTransferFrom without data to a valid receiver contract when called by the owner","adjusts owners balances","adjusts owners balances",""
"passed","Thu Nov 25 10:14:11 GMT 2021","Thu Nov 25 10:14:15 GMT 2021","4560","","Contract: AccessControl Contract interface AccessControl ERC165's supportsInterface(bytes4)","","Contract: AccessControl Contract interface AccessControl ERC165's supportsInterface(bytes4)","claims support [skip-on-coverage]","claims support [skip-on-coverage]",""
"passed","Thu Nov 25 10:17:58 GMT 2021","Thu Nov 25 10:18:07 GMT 2021","9116","","Contract: AccessControl setting role admin","","Contract: AccessControl setting role admin","a role's previous admins no longer grant roles","a role's previous admins no longer grant roles",""
"passed","Thu Nov 25 11:16:40 GMT 2021","Thu Nov 25 11:16:58 GMT 2021","18158","","Contract: ERC721Enumerable with minted tokens transfers via transferFrom when called by the operator","","Contract: ERC721Enumerable with minted tokens transfers via transferFrom when called by the operator","transfers the ownership of the given token ID to the given address","transfers the ownership of the given token ID to the given address",""
"broken","Thu Nov 25 10:24:17 GMT 2021","Thu Nov 25 10:25:03 GMT 2021","46382","","Contract: GovernorVotesQuorumFraction update quorum over the maximum","","Contract: GovernorVotesQuorumFraction update quorum over the maximum","run","run",""
"failed","Thu Nov 25 11:13:08 GMT 2021","Thu Nov 25 11:13:14 GMT 2021","5894","","Contract: ERC721 Contract interface ERC721 ERC165's supportsInterface(bytes4)","","Contract: ERC721 Contract interface ERC721 ERC165's supportsInterface(bytes4)","uses less than 30k gas [skip-on-coverage]","uses less than 30k gas [skip-on-coverage]",""
"skipped","Thu Nov 25 10:22:46 GMT 2021","Thu Nov 25 10:22:46 GMT 2021","0","","Contract: GovernorComp","","Contract: GovernorComp","deployment check","deployment check",""
"passed","Thu Nov 25 11:41:10 GMT 2021","Thu Nov 25 11:41:32 GMT 2021","21951","","Contract: ERC721 with minted tokens transfers via safeTransferFrom with data to a valid receiver contract when called by the operator","","Contract: ERC721 with minted tokens transfers via safeTransferFrom with data to a valid receiver contract when called by the operator","adjusts owners tokens by index","adjusts owners tokens by index",""
