"Status","Start Time","Stop Time","Duration in ms","Parent Suite","Suite","Sub Suite","Test Class","Test Method","Name","Description"
"passed","Thu Nov 25 11:39:20 GMT 2021","Thu Nov 25 11:39:44 GMT 2021","23989","","Contract: ERC721Enumerable with minted tokens transfers via safeTransferFrom with data to a valid receiver contract when called by the operator","","Contract: ERC721Enumerable with minted tokens transfers via safeTransferFrom with data to a valid receiver contract when called by the operator","clears the approval for the token ID","clears the approval for the token ID",""
"passed","Thu Nov 25 11:19:05 GMT 2021","Thu Nov 25 11:19:14 GMT 2021","8945","","Contract: ERC20 _transfer when the recipient is not the zero address when the sender transfers zero tokens","","Contract: ERC20 _transfer when the recipient is not the zero address when the sender transfers zero tokens","transfers the requested amount","transfers the requested amount",""
"passed","Thu Nov 25 12:12:56 GMT 2021","Thu Nov 25 12:13:04 GMT 2021","7649","","Contract: RefundEscrow once deployed","","Contract: RefundEscrow once deployed","only the owner can enter refund state","only the owner can enter refund state",""
"passed","Thu Nov 25 12:10:45 GMT 2021","Thu Nov 25 12:10:50 GMT 2021","4569","","Contract: SafeCast toUint64","","Contract: SafeCast toUint64","downcasts 0","downcasts 0",""
"passed","Thu Nov 25 11:11:20 GMT 2021","Thu Nov 25 11:11:30 GMT 2021","10288","","Contract: ERC20Snapshot balanceOfAt with initial snapshot with no balance changes after the snapshot","","Contract: ERC20Snapshot balanceOfAt with initial snapshot with no balance changes after the snapshot","returns the current balance for all accounts","returns the current balance for all accounts",""
"passed","Thu Nov 25 12:08:50 GMT 2021","Thu Nov 25 12:08:59 GMT 2021","8794","","Contract: TimersBlockNumber","","Contract: TimersBlockNumber","unset","unset",""
"passed","Thu Nov 25 11:55:05 GMT 2021","Thu Nov 25 11:55:23 GMT 2021","17651","","Contract: ERC721Enumerable with minted tokens transfers via safeTransferFrom without data to a user account when sent to the owner","","Contract: ERC721Enumerable with minted tokens transfers via safeTransferFrom without data to a user account when sent to the owner","keeps the owner balance","keeps the owner balance",""
"passed","Thu Nov 25 11:10:49 GMT 2021","Thu Nov 25 11:11:00 GMT 2021","10373","","Contract: SafeERC20 with token that returns true on all calls approvals with zero allowance","","Contract: SafeERC20 with token that returns true on all calls approvals with zero allowance","reverts when decreasing the allowance","reverts when decreasing the allowance",""
"passed","Thu Nov 25 11:57:45 GMT 2021","Thu Nov 25 11:58:07 GMT 2021","21476","","Contract: ERC721 with minted tokens transfers via safeTransferFrom without data to a valid receiver contract when called by the owner","","Contract: ERC721 with minted tokens transfers via safeTransferFrom without data to a valid receiver contract when called by the owner","emits a Transfer event","emits a Transfer event",""
"passed","Thu Nov 25 11:52:25 GMT 2021","Thu Nov 25 11:52:45 GMT 2021","19239","","Contract: ERC721 with minted tokens transfers via safeTransferFrom without data to a user account when called by the owner without an approved user","","Contract: ERC721 with minted tokens transfers via safeTransferFrom without data to a user account when called by the owner without an approved user","transfers the ownership of the given token ID to the given address","transfers the ownership of the given token ID to the given address",""
"failed","Thu Nov 25 10:56:41 GMT 2021","Thu Nov 25 10:56:52 GMT 2021","10971","","Contract: TransparentUpgradeableProxy initialization without parameters non payable when sending some balance","","Contract: TransparentUpgradeableProxy initialization without parameters non payable when sending some balance","reverts","reverts",""
"passed","Thu Nov 25 11:28:03 GMT 2021","Thu Nov 25 11:28:20 GMT 2021","17222","","Contract: ERC721 with minted tokens transfers via safeTransferFrom with data to a user account when called by the operator","","Contract: ERC721 with minted tokens transfers via safeTransferFrom with data to a user account when called by the operator","emits a Transfer event","emits a Transfer event",""
"broken","Thu Nov 25 11:16:02 GMT 2021","Thu Nov 25 11:16:15 GMT 2021","13535","","Contract: ERC1155Burnable burn","","Contract: ERC1155Burnable burn","approved operators can burn the holder's tokens","approved operators can burn the holder's tokens",""
"passed","Thu Nov 25 12:12:02 GMT 2021","Thu Nov 25 12:12:08 GMT 2021","6407","","Contract: EnumerableMap read get with message","","Contract: EnumerableMap read get with message","missing value","missing value",""
"passed","Thu Nov 25 11:07:12 GMT 2021","Thu Nov 25 11:07:20 GMT 2021","7764","","Contract: Pausable when unpaused when paused","","Contract: Pausable when unpaused when paused","reverts when re-pausing","reverts when re-pausing",""
"passed","Thu Nov 25 12:12:59 GMT 2021","Thu Nov 25 12:13:12 GMT 2021","12752","","Contract: Create2 deploy","","Contract: Create2 deploy","fails deploying a contract in an existent address","fails deploying a contract in an existent address",""
"passed","Thu Nov 25 12:09:43 GMT 2021","Thu Nov 25 12:09:49 GMT 2021","6194","","Contract: MulticallToken","","Contract: MulticallToken","bubbles up revert reasons","bubbles up revert reasons",""
"passed","Thu Nov 25 11:15:23 GMT 2021","Thu Nov 25 11:15:32 GMT 2021","8804","","Contract: ERC721PresetMinterPauserAutoId Contract interface ERC721Enumerable totalSupply()","","Contract: ERC721PresetMinterPauserAutoId Contract interface ERC721Enumerable totalSupply()","has to be implemented","has to be implemented",""
"passed","Thu Nov 25 11:26:35 GMT 2021","Thu Nov 25 11:26:57 GMT 2021","21632","","Contract: ERC1155 like an ERC1155 safeBatchTransferFrom when called by an operator on behalf of the multiTokenHolder when operator is approved by multiTokenHolder","","Contract: ERC1155 like an ERC1155 safeBatchTransferFrom when called by an operator on behalf of the multiTokenHolder when operator is approved by multiTokenHolder","debits transferred balances from sender","debits transferred balances from sender",""
"passed","Thu Nov 25 11:25:03 GMT 2021","Thu Nov 25 11:25:21 GMT 2021","17526","","Contract: ERC721Enumerable with minted tokens transfers via safeTransferFrom with data to a user account when called by the approved individual","","Contract: ERC721Enumerable with minted tokens transfers via safeTransferFrom with data to a user account when called by the approved individual","emits a Transfer event","emits a Transfer event",""
"passed","Thu Nov 25 12:11:19 GMT 2021","Thu Nov 25 12:11:23 GMT 2021","4602","","Contract: SafeCast toUint96","","Contract: SafeCast toUint96","downcasts 2^96 - 1 (79228162514264337593543950335)","downcasts 2^96 - 1 (79228162514264337593543950335)",""
"skipped","Thu Nov 25 10:12:36 GMT 2021","Thu Nov 25 10:12:36 GMT 2021","0","tests.brownie","test_brownie","","","","test_one",""
"failed","Thu Nov 25 10:14:03 GMT 2021","Thu Nov 25 10:15:04 GMT 2021","61503","tests.truffle","test_truffle","","","","test_truffle_contract",""
"passed","Thu Nov 25 11:16:38 GMT 2021","Thu Nov 25 11:16:46 GMT 2021","8124","","Contract: ERC721PresetMinterPauserAutoId Contract interface AccessControl renounceRole(bytes32,address)","","Contract: ERC721PresetMinterPauserAutoId Contract interface AccessControl renounceRole(bytes32,address)","has to be implemented","has to be implemented",""
"passed","Thu Nov 25 11:09:02 GMT 2021","Thu Nov 25 11:09:08 GMT 2021","6328","","Contract: ERC20FlashMint flashFee","","Contract: ERC20FlashMint flashFee","token mismatch","token mismatch",""
"passed","Thu Nov 25 11:15:35 GMT 2021","Thu Nov 25 11:15:50 GMT 2021","14707","","Contract: ERC1155Holder Contract interface ERC1155Receiver onERC1155BatchReceived(address,address,uint256[],uint256[],bytes)","","Contract: ERC1155Holder Contract interface ERC1155Receiver onERC1155BatchReceived(address,address,uint256[],uint256[],bytes)","has to be implemented","has to be implemented",""
"passed","Thu Nov 25 10:55:28 GMT 2021","Thu Nov 25 10:55:33 GMT 2021","5176","","Contract: ERC1967Proxy without initialization when not sending balance","","Contract: ERC1967Proxy without initialization when not sending balance","initializes the proxy","initializes the proxy",""
"passed","Thu Nov 25 10:55:27 GMT 2021","Thu Nov 25 10:55:34 GMT 2021","6942","","Contract: Initializable basic testing without inheritance after initialize","","Contract: Initializable basic testing without inheritance after initialize","initializer does not run again","initializer does not run again",""
"passed","Thu Nov 25 11:19:22 GMT 2021","Thu Nov 25 11:19:29 GMT 2021","7733","","Contract: ERC20 _transfer when the recipient is the zero address","","Contract: ERC20 _transfer when the recipient is the zero address","reverts","reverts",""
"passed","Thu Nov 25 11:29:32 GMT 2021","Thu Nov 25 11:29:50 GMT 2021","18559","","Contract: ERC721 with minted tokens transfers via safeTransferFrom with data to a user account when called by the owner without an approved user","","Contract: ERC721 with minted tokens transfers via safeTransferFrom with data to a user account when called by the owner without an approved user","transfers the ownership of the given token ID to the given address","transfers the ownership of the given token ID to the given address",""
"passed","Thu Nov 25 11:51:00 GMT 2021","Thu Nov 25 11:51:16 GMT 2021","16786","","Contract: ERC721 with minted tokens transfers via safeTransferFrom without data to a user account when called by the operator","","Contract: ERC721 with minted tokens transfers via safeTransferFrom without data to a user account when called by the operator","emits a Transfer event","emits a Transfer event",""
"passed","Thu Nov 25 11:36:11 GMT 2021","Thu Nov 25 11:36:18 GMT 2021","6784","","Contract: ERC1155 internal functions _burn","","Contract: ERC1155 internal functions _burn","reverts when burning a non-existent token id","reverts when burning a non-existent token id",""
"failed","Thu Nov 25 11:10:49 GMT 2021","Thu Nov 25 11:10:56 GMT 2021","6661","","Contract: ERC721Enumerable Contract interface ERC165 ERC165's supportsInterface(bytes4)","","Contract: ERC721Enumerable Contract interface ERC165 ERC165's supportsInterface(bytes4)","uses less than 30k gas [skip-on-coverage]","uses less than 30k gas [skip-on-coverage]",""
"passed","Thu Nov 25 11:11:27 GMT 2021","Thu Nov 25 11:11:34 GMT 2021","7419","","Contract: ERC20 transfer when the recipient is not the zero address when the sender transfers all balance","","Contract: ERC20 transfer when the recipient is not the zero address when the sender transfers all balance","emits a transfer event","emits a transfer event",""
"skipped","Thu Nov 25 10:22:46 GMT 2021","Thu Nov 25 10:22:46 GMT 2021","0","","Contract: TimelockController methods batch execute with scheduled operation on time","","Contract: TimelockController methods batch execute with scheduled operation on time","executor can reveal","executor can reveal",""
"passed","Thu Nov 25 11:16:17 GMT 2021","Thu Nov 25 11:16:25 GMT 2021","8049","","Contract: ERC20 increase allowance when the spender is not the zero address when the sender has enough balance when there was no approved amount before","","Contract: ERC20 increase allowance when the spender is not the zero address when the sender has enough balance when there was no approved amount before","approves the requested amount","approves the requested amount",""
"passed","Thu Nov 25 12:10:13 GMT 2021","Thu Nov 25 12:10:18 GMT 2021","4659","","Contract: SafeCast toUint16","","Contract: SafeCast toUint16","reverts when downcasting 2^16 (65536)","reverts when downcasting 2^16 (65536)",""
"passed","Thu Nov 25 12:10:32 GMT 2021","Thu Nov 25 12:10:37 GMT 2021","4383","","Contract: SafeMath with flag mod modulos correctly","","Contract: SafeMath with flag mod modulos correctly","when the dividend is smaller than the divisor","when the dividend is smaller than the divisor",""
"passed","Thu Nov 25 11:16:30 GMT 2021","Thu Nov 25 11:16:36 GMT 2021","5820","","Contract: ERC1155 like an ERC1155 balanceOfBatch","","Contract: ERC1155 like an ERC1155 balanceOfBatch","reverts when one of the addresses is the zero address","reverts when one of the addresses is the zero address",""
"passed","Thu Nov 25 10:53:33 GMT 2021","Thu Nov 25 10:53:46 GMT 2021","13318","","Contract: ERC2771Context when called directly msgSender","","Contract: ERC2771Context when called directly msgSender","returns the transaction sender when from another contract","returns the transaction sender when from another contract",""
"passed","Thu Nov 25 11:30:09 GMT 2021","Thu Nov 25 11:30:29 GMT 2021","19294","","Contract: ERC721 with minted tokens transfers via safeTransferFrom with data to a user account when called by the owner without an approved user","","Contract: ERC721 with minted tokens transfers via safeTransferFrom with data to a user account when called by the owner without an approved user","clears the approval for the token ID","clears the approval for the token ID",""
"passed","Thu Nov 25 12:13:07 GMT 2021","Thu Nov 25 12:13:12 GMT 2021","4695","","Contract: SafeCast toInt8","","Contract: SafeCast toInt8","reverts when downcasting -2^7 - 1 (-129)","reverts when downcasting -2^7 - 1 (-129)",""
"passed","Thu Nov 25 11:13:42 GMT 2021","Thu Nov 25 11:14:05 GMT 2021","22226","","Contract: ERC20 erc20 behaviour balanceOf when the requested account has some tokens","","Contract: ERC20 erc20 behaviour balanceOf when the requested account has some tokens","returns the total amount of tokens","returns the total amount of tokens",""
"passed","Thu Nov 25 11:21:42 GMT 2021","Thu Nov 25 11:22:00 GMT 2021","17995","","Contract: ERC721 with minted tokens transfers via transferFrom when called by the owner without an approved user","","Contract: ERC721 with minted tokens transfers via transferFrom when called by the owner without an approved user","adjusts owners tokens by index","adjusts owners tokens by index",""
"passed","Thu Nov 25 11:49:12 GMT 2021","Thu Nov 25 11:49:31 GMT 2021","18035","","Contract: ERC721Enumerable with minted tokens transfers via safeTransferFrom without data to a user account when called by the approved individual","","Contract: ERC721Enumerable with minted tokens transfers via safeTransferFrom without data to a user account when called by the approved individual","clears the approval for the token ID","clears the approval for the token ID",""
"passed","Thu Nov 25 12:13:59 GMT 2021","Thu Nov 25 12:14:14 GMT 2021","14549","","Contract: ERC721Enumerable with minted tokens approve when clearing approval when there was a prior approval","","Contract: ERC721Enumerable with minted tokens approve when clearing approval when there was a prior approval","clears approval for the token","clears approval for the token",""
"passed","Thu Nov 25 11:50:59 GMT 2021","Thu Nov 25 11:51:18 GMT 2021","18895","","Contract: ERC721Enumerable with minted tokens transfers via safeTransferFrom without data to a user account when called by the operator","","Contract: ERC721Enumerable with minted tokens transfers via safeTransferFrom without data to a user account when called by the operator","clears the approval for the token ID","clears the approval for the token ID",""
"passed","Thu Nov 25 10:57:00 GMT 2021","Thu Nov 25 10:57:08 GMT 2021","8626","","Contract: Clones clone initialization with parameters payable when sending some balance","","Contract: Clones clone initialization with parameters payable when sending some balance","initializes the proxy","initializes the proxy",""
"passed","Thu Nov 25 10:24:39 GMT 2021","Thu Nov 25 10:25:07 GMT 2021","28303","","Contract: Governor Contract interface Governor ERC165's supportsInterface(bytes4)","","Contract: Governor Contract interface Governor ERC165's supportsInterface(bytes4)","claims support [skip-on-coverage]","claims support [skip-on-coverage]",""
"passed","Thu Nov 25 11:53:13 GMT 2021","Thu Nov 25 11:53:32 GMT 2021","19266","","Contract: ERC721Enumerable with minted tokens transfers via safeTransferFrom without data to a user account when called by the owner without an approved user","","Contract: ERC721Enumerable with minted tokens transfers via safeTransferFrom without data to a user account when called by the owner without an approved user","emits an Approval event","emits an Approval event",""
"failed","Thu Nov 25 10:18:53 GMT 2021","Thu Nov 25 10:18:55 GMT 2021","1787","","Contract: PaymentSplitter","","Contract: PaymentSplitter","rejects more shares than payees","rejects more shares than payees",""
"passed","Thu Nov 25 11:10:19 GMT 2021","Thu Nov 25 11:10:28 GMT 2021","9361","","Contract: ERC20Pausable pausable token mint","","Contract: ERC20Pausable pausable token mint","reverts when trying to mint when paused","reverts when trying to mint when paused",""
"passed","Thu Nov 25 12:13:49 GMT 2021","Thu Nov 25 12:13:54 GMT 2021","4437","","Contract: EnumerableSet EnumerableUintSet at","","Contract: EnumerableSet EnumerableUintSet at","reverts when retrieving non-existent elements","reverts when retrieving non-existent elements",""
"broken","Thu Nov 25 12:13:42 GMT 2021","Thu Nov 25 12:13:47 GMT 2021","5030","","Contract: Escrow as an escrow deposits","","Contract: Escrow as an escrow deposits","can track deposits to multiple accounts","can track deposits to multiple accounts",""
"skipped","Thu Nov 25 10:22:46 GMT 2021","Thu Nov 25 10:22:46 GMT 2021","0","","Contract: TimelockController usage scenario","","Contract: TimelockController usage scenario","call reverting","call reverting",""
"passed","Thu Nov 25 11:11:31 GMT 2021","Thu Nov 25 11:11:36 GMT 2021","5067","","Contract: ERC721Enumerable Contract interface ERC721 approve(address,uint256)","","Contract: ERC721Enumerable Contract interface ERC721 approve(address,uint256)","has to be implemented","has to be implemented",""
"broken","Thu Nov 25 12:12:59 GMT 2021","Thu Nov 25 12:13:07 GMT 2021","8323","","Contract: Address functionCallWithValue with non-zero value","","Contract: Address functionCallWithValue with non-zero value","reverts when calling non-payable functions","reverts when calling non-payable functions",""
"passed","Thu Nov 25 12:04:02 GMT 2021","Thu Nov 25 12:04:28 GMT 2021","25905","","Contract: ERC721Enumerable with minted tokens transfers via safeTransferFrom without data to a valid receiver contract when called by the operator","","Contract: ERC721Enumerable with minted tokens transfers via safeTransferFrom without data to a valid receiver contract when called by the operator","adjusts owners tokens by index","adjusts owners tokens by index",""
"failed","Thu Nov 25 10:18:55 GMT 2021","Thu Nov 25 10:18:57 GMT 2021","1732","","Contract: PaymentSplitter","","Contract: PaymentSplitter","rejects null payees","rejects null payees",""
"passed","Thu Nov 25 11:10:23 GMT 2021","Thu Nov 25 11:10:36 GMT 2021","12582","","Contract: SafeERC20 with token that returns true on all calls approvals with zero allowance","","Contract: SafeERC20 with token that returns true on all calls approvals with zero allowance","doesn't revert when approving a zero allowance","doesn't revert when approving a zero allowance",""
"passed","Thu Nov 25 11:19:46 GMT 2021","Thu Nov 25 11:19:54 GMT 2021","8432","","Contract: ERC1155PresetMinterPauser batched minting","","Contract: ERC1155PresetMinterPauser batched minting","other accounts cannot batch mint tokens","other accounts cannot batch mint tokens",""
"skipped","Thu Nov 25 11:08:37 GMT 2021","Thu Nov 25 11:08:37 GMT 2021","0","","Contract: ERC20Votes set delegation with signature","","Contract: ERC20Votes set delegation with signature","accept signed delegation","accept signed delegation",""
"skipped","Thu Nov 25 10:52:43 GMT 2021","Thu Nov 25 10:52:43 GMT 2021","0","","Contract: Governor Settings update update protected","","Contract: Governor Settings update update protected","setProposalThreshold","setProposalThreshold",""
"passed","Thu Nov 25 12:11:51 GMT 2021","Thu Nov 25 12:12:00 GMT 2021","9339","","Contract: Address functionCall with valid contract receiver","","Contract: Address functionCall with valid contract receiver","reverts when the called function throws","reverts when the called function throws",""
"passed","Thu Nov 25 11:13:52 GMT 2021","Thu Nov 25 11:13:57 GMT 2021","5144","","Contract: ERC721 Contract interface ERC721 transferFrom(address,address,uint256)","","Contract: ERC721 Contract interface ERC721 transferFrom(address,address,uint256)","has to be implemented","has to be implemented",""
"skipped","Thu Nov 25 11:09:13 GMT 2021","Thu Nov 25 11:09:13 GMT 2021","0","","Contract: ERC20VotesComp Compound test suite balanceOf","","Contract: ERC20VotesComp Compound test suite balanceOf","grants to initial account","grants to initial account",""
"passed","Thu Nov 25 10:56:30 GMT 2021","Thu Nov 25 10:56:41 GMT 2021","11192","","Contract: TransparentUpgradeableProxy initialization without parameters non payable when not sending balance","","Contract: TransparentUpgradeableProxy initialization without parameters non payable when not sending balance","has expected balance","has expected balance",""
"passed","Thu Nov 25 11:19:53 GMT 2021","Thu Nov 25 11:20:12 GMT 2021","19059","","Contract: ERC1155 like an ERC1155 safeTransferFrom when called by an operator on behalf of the multiTokenHolder when operator is approved by multiTokenHolder","","Contract: ERC1155 like an ERC1155 safeTransferFrom when called by an operator on behalf of the multiTokenHolder when operator is approved by multiTokenHolder","credits transferred balance to receiver","credits transferred balance to receiver",""
"passed","Thu Nov 25 12:10:24 GMT 2021","Thu Nov 25 12:10:33 GMT 2021","8869","","Contract: ERC165Checker ERC165 supported","","Contract: ERC165Checker ERC165 supported","does not support mock interface via supportsInterface","does not support mock interface via supportsInterface",""
"failed","Thu Nov 25 11:02:28 GMT 2021","Thu Nov 25 11:02:58 GMT 2021","29353","","Contract: TransparentUpgradeableProxy upgradeToAndCall with migrations when the sender is the admin when upgrading to V1 when upgrading to V2 when upgrading to V3","","Contract: TransparentUpgradeableProxy upgradeToAndCall with migrations when the sender is the admin when upgrading to V1 when upgrading to V2 when upgrading to V3","calls the 'migrate' function and sends given value to the proxy","calls the 'migrate' function and sends given value to the proxy",""
"passed","Thu Nov 25 11:18:58 GMT 2021","Thu Nov 25 11:19:05 GMT 2021","6635","","Contract: ERC1155PresetMinterPauser Contract interface AccessControlEnumerable getRoleMember(bytes32,uint256)","","Contract: ERC1155PresetMinterPauser Contract interface AccessControlEnumerable getRoleMember(bytes32,uint256)","has to be implemented","has to be implemented",""
"passed","Thu Nov 25 12:14:54 GMT 2021","Thu Nov 25 12:14:58 GMT 2021","4524","","Contract: SafeCast toInt64","","Contract: SafeCast toInt64","downcasts 1","downcasts 1",""
"passed","Thu Nov 25 11:48:37 GMT 2021","Thu Nov 25 11:48:56 GMT 2021","18516","","Contract: ERC721Enumerable with minted tokens transfers via safeTransferFrom without data to a user account when called by the approved individual","","Contract: ERC721Enumerable with minted tokens transfers via safeTransferFrom without data to a user account when called by the approved individual","transfers the ownership of the given token ID to the given address","transfers the ownership of the given token ID to the given address",""
"passed","Thu Nov 25 11:18:34 GMT 2021","Thu Nov 25 11:18:41 GMT 2021","7592","","Contract: ERC20 _burn for a non zero account for less amount than balance","","Contract: ERC20 _burn for a non zero account for less amount than balance","emits Transfer event","emits Transfer event",""
"passed","Thu Nov 25 12:12:16 GMT 2021","Thu Nov 25 12:12:20 GMT 2021","4681","","Contract: SafeCast toUint224","","Contract: SafeCast toUint224","reverts when downcasting 2^224 + 1 (26959946667150639794667015087019630673637144422540572481103610249217)","reverts when downcasting 2^224 + 1 (26959946667150639794667015087019630673637144422540572481103610249217)",""
"passed","Thu Nov 25 10:59:28 GMT 2021","Thu Nov 25 10:59:35 GMT 2021","6363","","Contract: TransparentUpgradeableProxy upgradeTo when the sender is the admin when the given implementation is the zero address","","Contract: TransparentUpgradeableProxy upgradeTo when the sender is the admin when the given implementation is the zero address","reverts","reverts",""
"passed","Thu Nov 25 11:59:18 GMT 2021","Thu Nov 25 11:59:43 GMT 2021","25226","","Contract: ERC721Enumerable with minted tokens transfers via safeTransferFrom without data to a valid receiver contract when called by the owner","","Contract: ERC721Enumerable with minted tokens transfers via safeTransferFrom without data to a valid receiver contract when called by the owner","adjusts owners tokens by index","adjusts owners tokens by index",""
"passed","Thu Nov 25 11:15:36 GMT 2021","Thu Nov 25 11:15:57 GMT 2021","21547","","Contract: ERC20 erc20 behaviour transfer when the recipient is not the zero address when the sender transfers zero tokens","","Contract: ERC20 erc20 behaviour transfer when the recipient is not the zero address when the sender transfers zero tokens","emits a transfer event","emits a transfer event",""
"passed","Thu Nov 25 11:09:15 GMT 2021","Thu Nov 25 11:09:25 GMT 2021","10433","","Contract: ERC20Burnable burnFrom on success for a zero amount","","Contract: ERC20Burnable burnFrom on success for a zero amount","burns the requested amount","burns the requested amount",""
