"Status","Start Time","Stop Time","Duration in ms","Parent Suite","Suite","Sub Suite","Test Class","Test Method","Name","Description"
"passed","Thu Nov 25 11:13:15 GMT 2021","Thu Nov 25 11:13:24 GMT 2021","9339","","Contract: ERC20 transfer from when the token owner is not the zero address when the recipient is the zero address","","Contract: ERC20 transfer from when the token owner is not the zero address when the recipient is the zero address","reverts","reverts",""
"passed","Thu Nov 25 12:15:35 GMT 2021","Thu Nov 25 12:15:40 GMT 2021","4602","","Contract: SafeCast toInt128","","Contract: SafeCast toInt128","downcasts 1","downcasts 1",""
"passed","Thu Nov 25 11:38:51 GMT 2021","Thu Nov 25 11:39:13 GMT 2021","22152","","Contract: ERC721 with minted tokens transfers via safeTransferFrom with data to a valid receiver contract when called by the approved individual","","Contract: ERC721 with minted tokens transfers via safeTransferFrom with data to a valid receiver contract when called by the approved individual","adjusts owners tokens by index","adjusts owners tokens by index",""
"skipped","Thu Nov 25 10:22:46 GMT 2021","Thu Nov 25 10:22:46 GMT 2021","0","","Contract: TimelockController methods simple schedule","","Contract: TimelockController methods simple schedule","enforce minimum delay","enforce minimum delay",""
"broken","Thu Nov 25 10:22:46 GMT 2021","Thu Nov 25 10:23:02 GMT 2021","15960","","Contract: GovernorTimelockControl Contract interface ERC165 ERC165's supportsInterface(bytes4)","","Contract: GovernorTimelockControl Contract interface ERC165 ERC165's supportsInterface(bytes4)","uses less than 30k gas [skip-on-coverage]","uses less than 30k gas [skip-on-coverage]",""
"passed","Thu Nov 25 11:15:24 GMT 2021","Thu Nov 25 11:15:37 GMT 2021","13498","","Contract: ERC1155Supply after burn single","","Contract: ERC1155Supply after burn single","totalSupply","totalSupply",""
"passed","Thu Nov 25 11:13:53 GMT 2021","Thu Nov 25 11:14:06 GMT 2021","13716","","Contract: ERC1155Pausable when token is paused","","Contract: ERC1155Pausable when token is paused","reverts when trying to safeBatchTransferFrom from operator","reverts when trying to safeBatchTransferFrom from operator",""
"passed","Thu Nov 25 12:12:11 GMT 2021","Thu Nov 25 12:12:15 GMT 2021","4710","","Contract: SafeMath with custom revert message sub","","Contract: SafeMath with custom revert message sub","subtracts correctly","subtracts correctly",""
"passed","Thu Nov 25 11:22:41 GMT 2021","Thu Nov 25 11:22:55 GMT 2021","14194","","Contract: ERC721Enumerable with minted tokens transfers via transferFrom when the address to transfer the token to is the zero address","","Contract: ERC721Enumerable with minted tokens transfers via transferFrom when the address to transfer the token to is the zero address","reverts","reverts",""
"passed","Thu Nov 25 11:31:06 GMT 2021","Thu Nov 25 11:31:24 GMT 2021","17617","","Contract: ERC721Enumerable with minted tokens transfers via safeTransferFrom with data to a user account when sent to the owner","","Contract: ERC721Enumerable with minted tokens transfers via safeTransferFrom with data to a user account when sent to the owner","emits only a transfer event","emits only a transfer event",""
"skipped","Thu Nov 25 10:22:46 GMT 2021","Thu Nov 25 10:22:46 GMT 2021","0","","Contract: TimelockController methods batch execute with scheduled operation","","Contract: TimelockController methods batch execute with scheduled operation","revert if execution comes too early 1/2","revert if execution comes too early 1/2",""
"passed","Thu Nov 25 12:10:46 GMT 2021","Thu Nov 25 12:10:51 GMT 2021","4728","","Contract: SafeMath with flag mod modulos correctly","","Contract: SafeMath with flag mod modulos correctly","when the dividend is a multiple of the divisor","when the dividend is a multiple of the divisor",""
"passed","Thu Nov 25 11:15:57 GMT 2021","Thu Nov 25 11:16:06 GMT 2021","8943","","Contract: ERC721PresetMinterPauserAutoId Contract interface AccessControl ERC165's supportsInterface(bytes4)","","Contract: ERC721PresetMinterPauserAutoId Contract interface AccessControl ERC165's supportsInterface(bytes4)","claims support [skip-on-coverage]","claims support [skip-on-coverage]",""
"passed","Thu Nov 25 10:23:15 GMT 2021","Thu Nov 25 10:23:43 GMT 2021","28041","","Contract: Governor Contract interface ERC165 ERC165's supportsInterface(bytes4)","","Contract: Governor Contract interface ERC165 ERC165's supportsInterface(bytes4)","claims support [skip-on-coverage]","claims support [skip-on-coverage]",""
"skipped","Thu Nov 25 10:22:46 GMT 2021","Thu Nov 25 10:22:46 GMT 2021","0","","Contract: TimelockController methods simple schedule","","Contract: TimelockController methods simple schedule","prevent non-proposer from commiting","prevent non-proposer from commiting",""
"failed","Thu Nov 25 10:22:46 GMT 2021","Thu Nov 25 10:23:15 GMT 2021","29207","","Contract: Governor Contract interface ERC165 ERC165's supportsInterface(bytes4)","","Contract: Governor Contract interface ERC165 ERC165's supportsInterface(bytes4)","uses less than 30k gas [skip-on-coverage]","uses less than 30k gas [skip-on-coverage]",""
"passed","Thu Nov 25 12:10:16 GMT 2021","Thu Nov 25 12:10:21 GMT 2021","4676","","Contract: SignedSafeMath sub","","Contract: SignedSafeMath sub","subtracts correctly if it does not overflow and the result is positive","subtracts correctly if it does not overflow and the result is positive",""
"passed","Thu Nov 25 11:44:25 GMT 2021","Thu Nov 25 11:44:46 GMT 2021","20947","","Contract: ERC721 with minted tokens transfers via safeTransferFrom with data to a valid receiver contract when sent to the owner","","Contract: ERC721 with minted tokens transfers via safeTransferFrom with data to a valid receiver contract when sent to the owner","clears the approval for the token ID","clears the approval for the token ID",""
"passed","Thu Nov 25 11:18:14 GMT 2021","Thu Nov 25 11:18:21 GMT 2021","6785","","Contract: ERC1155PresetMinterPauser Contract interface AccessControl getRoleAdmin(bytes32)","","Contract: ERC1155PresetMinterPauser Contract interface AccessControl getRoleAdmin(bytes32)","has to be implemented","has to be implemented",""
"passed","Thu Nov 25 11:20:02 GMT 2021","Thu Nov 25 11:20:09 GMT 2021","7109","","Contract: ERC20 _approve when the spender is not the zero address when the sender does not have enough balance","","Contract: ERC20 _approve when the spender is not the zero address when the sender does not have enough balance","emits an approval event","emits an approval event",""
"failed","Thu Nov 25 11:12:51 GMT 2021","Thu Nov 25 11:12:57 GMT 2021","6597","","Contract: ERC721 Contract interface ERC165 ERC165's supportsInterface(bytes4)","","Contract: ERC721 Contract interface ERC165 ERC165's supportsInterface(bytes4)","uses less than 30k gas [skip-on-coverage]","uses less than 30k gas [skip-on-coverage]",""
"passed","Thu Nov 25 11:17:01 GMT 2021","Thu Nov 25 11:17:08 GMT 2021","7131","","Contract: ERC20 increase allowance when the spender is the zero address","","Contract: ERC20 increase allowance when the spender is the zero address","reverts","reverts",""
"passed","Thu Nov 25 11:17:34 GMT 2021","Thu Nov 25 11:17:51 GMT 2021","17309","","Contract: ERC721Enumerable with minted tokens transfers via transferFrom when called by the operator","","Contract: ERC721Enumerable with minted tokens transfers via transferFrom when called by the operator","emits an Approval event","emits an Approval event",""
"passed","Thu Nov 25 11:17:16 GMT 2021","Thu Nov 25 11:17:23 GMT 2021","7243","","Contract: ERC1155PresetMinterPauser Contract interface ERC1155 balanceOfBatch(address[],uint256[])","","Contract: ERC1155PresetMinterPauser Contract interface ERC1155 balanceOfBatch(address[],uint256[])","has to be implemented","has to be implemented",""
"broken","Thu Nov 25 10:40:49 GMT 2021","Thu Nov 25 10:41:34 GMT 2021","45315","","Contract: Governor scenario score not reached","","Contract: Governor scenario score not reached","run","run",""
"passed","Thu Nov 25 10:55:48 GMT 2021","Thu Nov 25 10:55:53 GMT 2021","5604","","Contract: ERC1967Proxy initialization without parameters non payable when not sending balance","","Contract: ERC1967Proxy initialization without parameters non payable when not sending balance","initializes the proxy","initializes the proxy",""
"passed","Thu Nov 25 10:19:14 GMT 2021","Thu Nov 25 10:19:28 GMT 2021","14774","","Contract: PaymentSplitter once deployed","","Contract: PaymentSplitter once deployed","has payees","has payees",""
"passed","Thu Nov 25 12:09:15 GMT 2021","Thu Nov 25 12:09:33 GMT 2021","18500","","Contract: ERC721 with minted tokens transfers via safeTransferFrom without data to a valid receiver contract when the address to transfer the token to is the zero address","","Contract: ERC721 with minted tokens transfers via safeTransferFrom without data to a valid receiver contract when the address to transfer the token to is the zero address","reverts","reverts",""
"passed","Thu Nov 25 11:14:41 GMT 2021","Thu Nov 25 11:14:49 GMT 2021","7973","","Contract: ERC721PresetMinterPauserAutoId Contract interface ERC721 transferFrom(address,address,uint256)","","Contract: ERC721PresetMinterPauserAutoId Contract interface ERC721 transferFrom(address,address,uint256)","has to be implemented","has to be implemented",""
"broken","Thu Nov 25 10:48:49 GMT 2021","Thu Nov 25 10:49:41 GMT 2021","52321","","Contract: Governor Cancel After execution","","Contract: Governor Cancel After execution","run","run",""
"passed","Thu Nov 25 12:13:40 GMT 2021","Thu Nov 25 12:13:44 GMT 2021","4779","","Contract: SafeCast toInt16","","Contract: SafeCast toInt16","downcasts -2^15 (-32768)","downcasts -2^15 (-32768)",""
"passed","Thu Nov 25 10:55:49 GMT 2021","Thu Nov 25 10:55:57 GMT 2021","7958","","Contract: Initializable complex testing with inheritance","","Contract: Initializable complex testing with inheritance","initializes mother","initializes mother",""
"passed","Thu Nov 25 11:27:30 GMT 2021","Thu Nov 25 11:27:48 GMT 2021","17541","","Contract: ERC721Enumerable with minted tokens transfers via safeTransferFrom with data to a user account when called by the operator","","Contract: ERC721Enumerable with minted tokens transfers via safeTransferFrom with data to a user account when called by the operator","emits an Approval event","emits an Approval event",""
"passed","Thu Nov 25 10:56:10 GMT 2021","Thu Nov 25 10:56:15 GMT 2021","5145","","Contract: BeaconProxy bad beacon is not accepted","","Contract: BeaconProxy bad beacon is not accepted","non-compliant beacon","non-compliant beacon",""
"passed","Thu Nov 25 11:13:25 GMT 2021","Thu Nov 25 11:13:33 GMT 2021","8888","","Contract: ERC721PresetMinterPauserAutoId","","Contract: ERC721PresetMinterPauserAutoId","minter role admin is the default admin","minter role admin is the default admin",""
"passed","Thu Nov 25 11:11:41 GMT 2021","Thu Nov 25 11:11:49 GMT 2021","8634","","Contract: ERC721URIStorage token URI","","Contract: ERC721URIStorage token URI","reverts when setting for non existent token id","reverts when setting for non existent token id",""
"passed","Thu Nov 25 11:28:55 GMT 2021","Thu Nov 25 11:29:14 GMT 2021","19418","","Contract: ERC721 with minted tokens transfers via safeTransferFrom with data to a user account when called by the operator","","Contract: ERC721 with minted tokens transfers via safeTransferFrom with data to a user account when called by the operator","adjusts owners balances","adjusts owners balances",""
"passed","Thu Nov 25 11:29:29 GMT 2021","Thu Nov 25 11:29:49 GMT 2021","19692","","Contract: ERC721Enumerable with minted tokens transfers via safeTransferFrom with data to a user account when called by the owner without an approved user","","Contract: ERC721Enumerable with minted tokens transfers via safeTransferFrom with data to a user account when called by the owner without an approved user","emits an Approval event","emits an Approval event",""
"passed","Thu Nov 25 12:11:43 GMT 2021","Thu Nov 25 12:11:51 GMT 2021","8576","","Contract: Address functionCall with valid contract receiver","","Contract: Address functionCall with valid contract receiver","reverts when the called function runs out of gas","reverts when the called function runs out of gas",""
"passed","Thu Nov 25 11:14:20 GMT 2021","Thu Nov 25 11:14:34 GMT 2021","14005","","Contract: ERC1155Pausable when token is paused","","Contract: ERC1155Pausable when token is paused","reverts when trying to mintBatch","reverts when trying to mintBatch",""
"passed","Thu Nov 25 10:19:00 GMT 2021","Thu Nov 25 10:19:14 GMT 2021","13434","","Contract: PaymentSplitter once deployed","","Contract: PaymentSplitter once deployed","has total shares","has total shares",""
"broken","Thu Nov 25 10:22:46 GMT 2021","Thu Nov 25 10:23:47 GMT 2021","60694","","Contract: GovernorComp voting with comp token","","Contract: GovernorComp voting with comp token","run","run",""
"passed","Thu Nov 25 11:58:07 GMT 2021","Thu Nov 25 11:58:29 GMT 2021","22631","","Contract: ERC721 with minted tokens transfers via safeTransferFrom without data to a valid receiver contract when called by the owner","","Contract: ERC721 with minted tokens transfers via safeTransferFrom without data to a valid receiver contract when called by the owner","clears the approval for the token ID","clears the approval for the token ID",""
"passed","Thu Nov 25 11:58:31 GMT 2021","Thu Nov 25 11:58:55 GMT 2021","23906","","Contract: ERC721Enumerable with minted tokens transfers via safeTransferFrom without data to a valid receiver contract when called by the owner","","Contract: ERC721Enumerable with minted tokens transfers via safeTransferFrom without data to a valid receiver contract when called by the owner","emits an Approval event","emits an Approval event",""
"passed","Thu Nov 25 11:18:09 GMT 2021","Thu Nov 25 11:18:28 GMT 2021","18946","","Contract: ERC721Enumerable with minted tokens transfers via transferFrom when called by the operator","","Contract: ERC721Enumerable with minted tokens transfers via transferFrom when called by the operator","adjusts owners tokens by index","adjusts owners tokens by index",""
"passed","Thu Nov 25 12:09:28 GMT 2021","Thu Nov 25 12:09:33 GMT 2021","4703","","Contract: Strings from uint256 - fixed hex format","","Contract: Strings from uint256 - fixed hex format","converts MAX_UINT256","converts MAX_UINT256",""
"passed","Thu Nov 25 10:18:16 GMT 2021","Thu Nov 25 10:18:23 GMT 2021","7206","","Contract: AccessControl onlyRole modifier","","Contract: AccessControl onlyRole modifier","do not revert if sender has role","do not revert if sender has role",""
"passed","Thu Nov 25 10:14:17 GMT 2021","Thu Nov 25 10:14:22 GMT 2021","5171","","Contract: Ownable transfer ownership","","Contract: Ownable transfer ownership","prevents non-owners from transferring","prevents non-owners from transferring",""
"passed","Thu Nov 25 12:13:45 GMT 2021","Thu Nov 25 12:13:55 GMT 2021","10174","","Contract: TimersTimestamp","","Contract: TimersTimestamp","reset","reset",""
"passed","Thu Nov 25 11:15:54 GMT 2021","Thu Nov 25 11:16:00 GMT 2021","6178","","Contract: ERC1155 like an ERC1155 balanceOf","","Contract: ERC1155 like an ERC1155 balanceOf","reverts when queried about the zero address","reverts when queried about the zero address",""
"passed","Thu Nov 25 12:08:55 GMT 2021","Thu Nov 25 12:08:59 GMT 2021","4515","","Contract: Strings from uint256 - decimal format","","Contract: Strings from uint256 - decimal format","converts a positive number","converts a positive number",""
"passed","Thu Nov 25 10:58:15 GMT 2021","Thu Nov 25 10:58:23 GMT 2021","8524","","Contract: Clones cloneDeterministic initialization without parameters payable when sending some balance","","Contract: Clones cloneDeterministic initialization without parameters payable when sending some balance","initializes the proxy","initializes the proxy",""
"passed","Thu Nov 25 11:15:56 GMT 2021","Thu Nov 25 11:16:14 GMT 2021","18339","","Contract: ERC1155Supply after burn batch","","Contract: ERC1155Supply after burn batch","totalSupply","totalSupply",""
"passed","Thu Nov 25 11:47:36 GMT 2021","Thu Nov 25 11:47:53 GMT 2021","17140","","Contract: ERC721 with minted tokens transfers via safeTransferFrom without data to a user account when called by the owner","","Contract: ERC721 with minted tokens transfers via safeTransferFrom without data to a user account when called by the owner","emits a Transfer event","emits a Transfer event",""
"skipped","Thu Nov 25 10:56:03 GMT 2021","Thu Nov 25 10:56:03 GMT 2021","0","","Contract: ERC1967Proxy initialization without parameters payable when not sending balance","","Contract: ERC1967Proxy initialization without parameters payable when not sending balance","sets the implementation address","sets the implementation address",""
"passed","Thu Nov 25 12:09:11 GMT 2021","Thu Nov 25 12:09:19 GMT 2021","8053","","Contract: ERC165Checker ERC165 missing return data","","Contract: ERC165Checker ERC165 missing return data","does not support ERC165","does not support ERC165",""
"broken","Thu Nov 25 10:20:38 GMT 2021","Thu Nov 25 10:20:52 GMT 2021","14117","","Contract: PaymentSplitter once deployed release Ether","","Contract: PaymentSplitter once deployed release Ether","reverts if non-payee want to claim","reverts if non-payee want to claim",""
"passed","Thu Nov 25 11:08:36 GMT 2021","Thu Nov 25 11:08:45 GMT 2021","8468","","Contract: ERC20Burnable burn when the given amount is not greater than balance of the sender for a zero amount","","Contract: ERC20Burnable burn when the given amount is not greater than balance of the sender for a zero amount","burns the requested amount","burns the requested amount",""
"passed","Thu Nov 25 11:21:28 GMT 2021","Thu Nov 25 11:21:50 GMT 2021","21986","","Contract: ERC20 erc20 behaviour approve when the spender is not the zero address when the sender does not have enough balance when there was no approved amount before","","Contract: ERC20 erc20 behaviour approve when the spender is not the zero address when the sender does not have enough balance when there was no approved amount before","approves the requested amount","approves the requested amount",""
"passed","Thu Nov 25 11:20:49 GMT 2021","Thu Nov 25 11:21:07 GMT 2021","18380","","Contract: ERC721Enumerable with minted tokens transfers via transferFrom when sent to the owner","","Contract: ERC721Enumerable with minted tokens transfers via transferFrom when sent to the owner","clears the approval for the token ID","clears the approval for the token ID",""
"passed","Thu Nov 25 11:16:56 GMT 2021","Thu Nov 25 11:17:09 GMT 2021","13046","","Contract: ERC1155Burnable burnBatch","","Contract: ERC1155Burnable burnBatch","unapproved accounts cannot burn the holder's tokens","unapproved accounts cannot burn the holder's tokens",""
"passed","Thu Nov 25 10:59:22 GMT 2021","Thu Nov 25 10:59:28 GMT 2021","6708","","Contract: TransparentUpgradeableProxy upgradeTo when the sender is the admin when the given implementation is different from the current one","","Contract: TransparentUpgradeableProxy upgradeTo when the sender is the admin when the given implementation is different from the current one","emits an event","emits an event",""
"skipped","Thu Nov 25 10:52:43 GMT 2021","Thu Nov 25 10:52:43 GMT 2021","0","","Contract: Governor Settings update update protected","","Contract: Governor Settings update update protected","setVotingPeriod","setVotingPeriod",""
"passed","Thu Nov 25 11:16:25 GMT 2021","Thu Nov 25 11:16:35 GMT 2021","10199","","Contract: ERC20 increase allowance when the spender is not the zero address when the sender has enough balance when the spender had an approved amount","","Contract: ERC20 increase allowance when the spender is not the zero address when the sender has enough balance when the spender had an approved amount","increases the spender allowance adding the requested amount","increases the spender allowance adding the requested amount",""
"passed","Thu Nov 25 11:16:15 GMT 2021","Thu Nov 25 11:16:29 GMT 2021","13511","","Contract: ERC1155Burnable burn","","Contract: ERC1155Burnable burn","unapproved accounts cannot burn the holder's tokens","unapproved accounts cannot burn the holder's tokens",""
"passed","Thu Nov 25 10:20:52 GMT 2021","Thu Nov 25 10:21:06 GMT 2021","14074","","Contract: PaymentSplitter once deployed release Token","","Contract: PaymentSplitter once deployed release Token","reverts if no funds to claim","reverts if no funds to claim",""
"passed","Thu Nov 25 11:12:17 GMT 2021","Thu Nov 25 11:12:32 GMT 2021","14464","","Contract: ERC721Burnable like a burnable ERC721 burn when there is a previous approval burned getApproved","","Contract: ERC721Burnable like a burnable ERC721 burn when there is a previous approval burned getApproved","reverts","reverts",""
"passed","Thu Nov 25 12:10:30 GMT 2021","Thu Nov 25 12:10:35 GMT 2021","4797","","Contract: SignedSafeMath sub","","Contract: SignedSafeMath sub","reverts on negative subtraction overflow","reverts on negative subtraction overflow",""
"passed","Thu Nov 25 12:09:45 GMT 2021","Thu Nov 25 12:09:50 GMT 2021","4610","","Contract: SafeCast toUint8","","Contract: SafeCast toUint8","downcasts 2^8 - 1 (255)","downcasts 2^8 - 1 (255)",""
"failed","Thu Nov 25 11:01:38 GMT 2021","Thu Nov 25 11:02:00 GMT 2021","21776","","Contract: TransparentUpgradeableProxy upgradeToAndCall with migrations when the sender is the admin when upgrading to V1 when upgrading to V2","","Contract: TransparentUpgradeableProxy upgradeToAndCall with migrations when the sender is the admin when upgrading to V1 when upgrading to V2","calls the 'migrate' function and sends given value to the proxy","calls the 'migrate' function and sends given value to the proxy",""
"passed","Thu Nov 25 10:53:10 GMT 2021","Thu Nov 25 10:53:19 GMT 2021","9071","","Contract: ERC2771Context","","Contract: ERC2771Context","recognize trusted forwarder","recognize trusted forwarder",""
"passed","Thu Nov 25 11:11:13 GMT 2021","Thu Nov 25 11:11:20 GMT 2021","6679","","Contract: ERC20Snapshot balanceOfAt","","Contract: ERC20Snapshot balanceOfAt","reverts with a not-yet-created snapshot id","reverts with a not-yet-created snapshot id",""
"passed","Thu Nov 25 11:34:37 GMT 2021","Thu Nov 25 11:34:42 GMT 2021","4543","","Contract: ERC1155 like an ERC1155 Contract interface ERC1155 balanceOfBatch(address[],uint256[])","","Contract: ERC1155 like an ERC1155 Contract interface ERC1155 balanceOfBatch(address[],uint256[])","has to be implemented","has to be implemented",""
"passed","Thu Nov 25 12:09:09 GMT 2021","Thu Nov 25 12:09:19 GMT 2021","10006","","Contract: TimersBlockNumber","","Contract: TimersBlockNumber","expired","expired",""
"skipped","Thu Nov 25 10:22:46 GMT 2021","Thu Nov 25 10:22:46 GMT 2021","0","","Contract: TimelockController methods cancel","","Contract: TimelockController methods cancel","cannot cancel invalid operation","cannot cancel invalid operation",""
"passed","Thu Nov 25 11:15:26 GMT 2021","Thu Nov 25 11:15:45 GMT 2021","18236","","Contract: ERC721Enumerable with minted tokens transfers via transferFrom when called by the approved individual","","Contract: ERC721Enumerable with minted tokens transfers via transferFrom when called by the approved individual","clears the approval for the token ID","clears the approval for the token ID",""
"passed","Thu Nov 25 12:14:38 GMT 2021","Thu Nov 25 12:14:44 GMT 2021","6233","","Contract: StorageSlot uint256 storage slot get","","Contract: StorageSlot uint256 storage slot get","from other slot","from other slot",""
"passed","Thu Nov 25 12:09:43 GMT 2021","Thu Nov 25 12:09:47 GMT 2021","4287","","Contract: Math max","","Contract: Math max","is correctly detected in second argument position","is correctly detected in second argument position",""
"passed","Thu Nov 25 11:20:12 GMT 2021","Thu Nov 25 11:20:30 GMT 2021","18179","","Contract: ERC1155 like an ERC1155 safeTransferFrom when called by an operator on behalf of the multiTokenHolder when operator is approved by multiTokenHolder","","Contract: ERC1155 like an ERC1155 safeTransferFrom when called by an operator on behalf of the multiTokenHolder when operator is approved by multiTokenHolder","emits a TransferSingle log","emits a TransferSingle log",""
"skipped","Thu Nov 25 11:08:37 GMT 2021","Thu Nov 25 11:08:37 GMT 2021","0","","Contract: ERC20Votes getPastTotalSupply","","Contract: ERC20Votes getPastTotalSupply","returns 0 if there are no checkpoints","returns 0 if there are no checkpoints",""
"passed","Thu Nov 25 12:03:38 GMT 2021","Thu Nov 25 12:04:02 GMT 2021","23592","","Contract: ERC721Enumerable with minted tokens transfers via safeTransferFrom without data to a valid receiver contract when called by the operator","","Contract: ERC721Enumerable with minted tokens transfers via safeTransferFrom without data to a valid receiver contract when called by the operator","adjusts owners balances","adjusts owners balances",""
"passed","Thu Nov 25 12:10:28 GMT 2021","Thu Nov 25 12:10:32 GMT 2021","4630","","Contract: SafeMath with flag mod","","Contract: SafeMath with flag mod","reverts with a 0 divisor","reverts with a 0 divisor",""
"passed","Thu Nov 25 11:41:24 GMT 2021","Thu Nov 25 11:41:50 GMT 2021","26173","","Contract: ERC721Enumerable with minted tokens transfers via safeTransferFrom with data to a valid receiver contract when called by the owner without an approved user","","Contract: ERC721Enumerable with minted tokens transfers via safeTransferFrom with data to a valid receiver contract when called by the owner without an approved user","emits a Transfer event","emits a Transfer event",""
"passed","Thu Nov 25 11:10:53 GMT 2021","Thu Nov 25 11:11:05 GMT 2021","12247","","Contract: ERC20PresetMinterPauser pausing","","Contract: ERC20PresetMinterPauser pausing","deployer can unpause","deployer can unpause",""
