"Status","Start Time","Stop Time","Duration in ms","Parent Suite","Suite","Sub Suite","Test Class","Test Method","Name","Description"
"skipped","Tue Dec 14 03:16:09 GMT 2021","Tue Dec 14 03:16:09 GMT 2021","0","","Contract: ERC20VotesComp getPastTotalSupply","","Contract: ERC20VotesComp getPastTotalSupply","reverts if block number >= current block","reverts if block number >= current block",""
"passed","Tue Dec 14 03:33:09 GMT 2021","Tue Dec 14 03:33:24 GMT 2021","15054","","Contract: ERC721Enumerable with minted tokens transfers via safeTransferFrom with data to a user account when called by the operator","","Contract: ERC721Enumerable with minted tokens transfers via safeTransferFrom with data to a user account when called by the operator","adjusts owners tokens by index","adjusts owners tokens by index",""
"passed","Tue Dec 14 04:12:44 GMT 2021","Tue Dec 14 04:12:53 GMT 2021","8105","","Contract: ERC721 with minted tokens getApproved when token is not minted","","Contract: ERC721 with minted tokens getApproved when token is not minted","reverts","reverts",""
"passed","Tue Dec 14 03:26:40 GMT 2021","Tue Dec 14 03:26:54 GMT 2021","13742","","Contract: ERC1155 like an ERC1155 safeTransferFrom when sending to a valid receiver with data","","Contract: ERC1155 like an ERC1155 safeTransferFrom when sending to a valid receiver with data","emits a TransferSingle log","emits a TransferSingle log",""
"passed","Tue Dec 14 03:29:46 GMT 2021","Tue Dec 14 03:30:01 GMT 2021","15404","","Contract: ERC1155 like an ERC1155 safeBatchTransferFrom when called by an operator on behalf of the multiTokenHolder when operator is approved by multiTokenHolder","","Contract: ERC1155 like an ERC1155 safeBatchTransferFrom when called by an operator on behalf of the multiTokenHolder when operator is approved by multiTokenHolder","preserves operator's balances not involved in the transfer","preserves operator's balances not involved in the transfer",""
"skipped","Tue Dec 14 04:14:56 GMT 2021","Tue Dec 14 04:15:02 GMT 2021","5454","","Contract: ERC721 metadata token URI base URI","","Contract: ERC721 metadata token URI base URI","base URI can be set","base URI can be set",""
"passed","Tue Dec 14 03:30:17 GMT 2021","Tue Dec 14 03:30:28 GMT 2021","11547","","Contract: TransparentUpgradeableProxy transparent proxy","","Contract: TransparentUpgradeableProxy transparent proxy","proxy admin cannot call delegated functions","proxy admin cannot call delegated functions",""
"passed","Tue Dec 14 03:25:58 GMT 2021","Tue Dec 14 03:26:06 GMT 2021","7826","","Contract: TransparentUpgradeableProxy initialization with parameters payable when not sending balance","","Contract: TransparentUpgradeableProxy initialization with parameters payable when not sending balance","initializes the proxy","initializes the proxy",""
"passed","Tue Dec 14 03:22:54 GMT 2021","Tue Dec 14 03:23:01 GMT 2021","7080","","Contract: ERC721PresetMinterPauserAutoId pausing","","Contract: ERC721PresetMinterPauserAutoId pausing","cannot mint while paused","cannot mint while paused",""
"passed","Tue Dec 14 03:34:33 GMT 2021","Tue Dec 14 03:34:39 GMT 2021","5516","","Contract: ERC1155 internal functions _mintBatch","","Contract: ERC1155 internal functions _mintBatch","reverts with a zero destination address","reverts with a zero destination address",""
"passed","Tue Dec 14 03:39:01 GMT 2021","Tue Dec 14 03:39:05 GMT 2021","4145","","Contract: SafeCast toInt16","","Contract: SafeCast toInt16","reverts when downcasting -2^15 - 2 (-32770)","reverts when downcasting -2^15 - 2 (-32770)",""
"passed","Tue Dec 14 03:36:19 GMT 2021","Tue Dec 14 03:36:23 GMT 2021","4047","","Contract: SafeMath with flag mod modulos correctly","","Contract: SafeMath with flag mod modulos correctly","when the dividend is equal to the divisor","when the dividend is equal to the divisor",""
"passed","Tue Dec 14 03:36:15 GMT 2021","Tue Dec 14 03:36:21 GMT 2021","5963","","Contract: ERC1155 ERC1155MetadataURI","","Contract: ERC1155 ERC1155MetadataURI","sets the initial URI for all token types","sets the initial URI for all token types",""
"passed","Tue Dec 14 04:11:01 GMT 2021","Tue Dec 14 04:11:11 GMT 2021","10493","","Contract: ERC721 with minted tokens approve when the sender is an operator","","Contract: ERC721 with minted tokens approve when the sender is an operator","emits an approval event","emits an approval event",""
"passed","Tue Dec 14 03:35:28 GMT 2021","Tue Dec 14 03:35:32 GMT 2021","4287","","Contract: Math min","","Contract: Math min","is correctly detected in first argument position","is correctly detected in first argument position",""
"passed","Tue Dec 14 03:31:02 GMT 2021","Tue Dec 14 03:31:17 GMT 2021","14495","","Contract: ERC721Enumerable with minted tokens transfers via safeTransferFrom with data to a user account when called by the approved individual","","Contract: ERC721Enumerable with minted tokens transfers via safeTransferFrom with data to a user account when called by the approved individual","clears the approval for the token ID","clears the approval for the token ID",""
"passed","Tue Dec 14 03:26:39 GMT 2021","Tue Dec 14 03:26:56 GMT 2021","17878","","Contract: ERC721Enumerable with minted tokens transfers via transferFrom when called by the owner without an approved user","","Contract: ERC721Enumerable with minted tokens transfers via transferFrom when called by the owner without an approved user","adjusts owners tokens by index","adjusts owners tokens by index",""
"passed","Tue Dec 14 03:43:06 GMT 2021","Tue Dec 14 03:43:11 GMT 2021","4936","","Contract: StorageSlot address storage slot","","Contract: StorageSlot address storage slot","set","set",""
"passed","Tue Dec 14 03:50:20 GMT 2021","Tue Dec 14 03:50:40 GMT 2021","20308","","Contract: Governor Contract interface Governor votingPeriod()","","Contract: Governor Contract interface Governor votingPeriod()","has to be implemented","has to be implemented",""
"passed","Tue Dec 14 03:31:45 GMT 2021","Tue Dec 14 03:32:02 GMT 2021","16990","","Contract: TransparentUpgradeableProxy regression","","Contract: TransparentUpgradeableProxy regression","should add fallback function","should add fallback function",""
"passed","Tue Dec 14 03:20:11 GMT 2021","Tue Dec 14 03:20:22 GMT 2021","10129","","Contract: ERC721URIStorage token URI","","Contract: ERC721URIStorage token URI","base URI is added as a prefix to the token URI","base URI is added as a prefix to the token URI",""
"passed","Tue Dec 14 03:21:46 GMT 2021","Tue Dec 14 03:22:00 GMT 2021","14392","","Contract: ERC721 with minted tokens transfers via transferFrom when called by the owner","","Contract: ERC721 with minted tokens transfers via transferFrom when called by the owner","transfers the ownership of the given token ID to the given address","transfers the ownership of the given token ID to the given address",""
"failed","Tue Dec 14 03:24:09 GMT 2021","Tue Dec 14 03:24:16 GMT 2021","6893","","Contract: Clones cloneDeterministic initialization without parameters non payable when not sending balance","","Contract: Clones cloneDeterministic initialization without parameters non payable when not sending balance","has expected balance","has expected balance",""
"passed","Tue Dec 14 03:41:17 GMT 2021","Tue Dec 14 03:41:35 GMT 2021","17928","","Contract: ERC721 with minted tokens transfers via safeTransferFrom with data to a valid receiver contract when called by the approved individual","","Contract: ERC721 with minted tokens transfers via safeTransferFrom with data to a valid receiver contract when called by the approved individual","adjusts owners balances","adjusts owners balances",""
"passed","Tue Dec 14 03:27:17 GMT 2021","Tue Dec 14 03:27:25 GMT 2021","8208","","Contract: UpgradeableBeacon once deployed","","Contract: UpgradeableBeacon once deployed","cannot be upgraded to a non-contract","cannot be upgraded to a non-contract",""
"passed","Tue Dec 14 03:22:44 GMT 2021","Tue Dec 14 03:23:00 GMT 2021","15396","","Contract: ERC721 with minted tokens transfers via transferFrom when called by the owner","","Contract: ERC721 with minted tokens transfers via transferFrom when called by the owner","adjusts owners balances","adjusts owners balances",""
"passed","Tue Dec 14 03:33:38 GMT 2021","Tue Dec 14 03:33:46 GMT 2021","7411","","Contract: ERC165Checker ERC165 missing return data","","Contract: ERC165Checker ERC165 missing return data","does not support mock interface via supportsAllInterfaces","does not support mock interface via supportsAllInterfaces",""
"passed","Tue Dec 14 03:16:41 GMT 2021","Tue Dec 14 03:16:46 GMT 2021","5576","","Contract: ERC20PresetMinterPauser","","Contract: ERC20PresetMinterPauser","deployer has the minter role","deployer has the minter role",""
"passed","Tue Dec 14 03:20:26 GMT 2021","Tue Dec 14 03:20:33 GMT 2021","7820","","Contract: ERC721Pausable when token is paused balanceOf","","Contract: ERC721Pausable when token is paused balanceOf","returns the amount of tokens owned by the given address","returns the amount of tokens owned by the given address",""
"passed","Tue Dec 14 03:40:05 GMT 2021","Tue Dec 14 03:40:09 GMT 2021","4135","","Contract: Arrays findUpperBound Array with gap","","Contract: Arrays findUpperBound Array with gap","returns index of first element in next filled range","returns index of first element in next filled range",""
"passed","Tue Dec 14 03:30:36 GMT 2021","Tue Dec 14 03:30:39 GMT 2021","3216","","Contract: AccessControl Contract interface AccessControlEnumerable getRoleMember(bytes32,uint256)","","Contract: AccessControl Contract interface AccessControlEnumerable getRoleMember(bytes32,uint256)","has to be implemented","has to be implemented",""
"passed","Tue Dec 14 04:06:14 GMT 2021","Tue Dec 14 04:06:33 GMT 2021","19238","","Contract: ERC721 with minted tokens transfers via safeTransferFrom to a receiver contract that reverts with message","","Contract: ERC721 with minted tokens transfers via safeTransferFrom to a receiver contract that reverts with message","reverts","reverts",""
"passed","Tue Dec 14 03:20:29 GMT 2021","Tue Dec 14 03:20:38 GMT 2021","8445","","Contract: ERC721Enumerable with minted tokens ownerOf when the given token ID was tracked by this token","","Contract: ERC721Enumerable with minted tokens ownerOf when the given token ID was tracked by this token","returns the owner of the given token ID","returns the owner of the given token ID",""
"passed","Tue Dec 14 04:01:38 GMT 2021","Tue Dec 14 04:02:00 GMT 2021","22722","","Contract: Governor Cancel Before proposal","","Contract: Governor Cancel Before proposal","run","run",""
"failed","Tue Dec 14 03:25:04 GMT 2021","Tue Dec 14 03:25:10 GMT 2021","6496","","Contract: Clones cloneDeterministic initialization with parameters non payable when sending some balance","","Contract: Clones cloneDeterministic initialization with parameters non payable when sending some balance","reverts","reverts",""
"failed","Tue Dec 14 03:25:51 GMT 2021","Tue Dec 14 03:25:58 GMT 2021","6832","","Contract: TransparentUpgradeableProxy initialization with parameters non payable when sending some balance","","Contract: TransparentUpgradeableProxy initialization with parameters non payable when sending some balance","reverts","reverts",""
"passed","Tue Dec 14 03:54:59 GMT 2021","Tue Dec 14 03:55:11 GMT 2021","11520","","Contract: ERC721 with minted tokens transfers via safeTransferFrom without data to a user account when the address of the previous owner is incorrect","","Contract: ERC721 with minted tokens transfers via safeTransferFrom without data to a user account when the address of the previous owner is incorrect","reverts","reverts",""
"passed","Tue Dec 14 03:26:58 GMT 2021","Tue Dec 14 03:27:03 GMT 2021","4623","","Contract: TransparentUpgradeableProxy upgradeTo when the sender is not the admin","","Contract: TransparentUpgradeableProxy upgradeTo when the sender is not the admin","reverts","reverts",""
"passed","Tue Dec 14 04:14:06 GMT 2021","Tue Dec 14 04:14:16 GMT 2021","9808","","Contract: ERC721 _burn with minted tokens with burnt token","","Contract: ERC721 _burn with minted tokens with burnt token","reverts when burning a token id that has been deleted","reverts when burning a token id that has been deleted",""
"passed","Tue Dec 14 03:55:57 GMT 2021","Tue Dec 14 03:56:14 GMT 2021","17342","","Contract: ERC721Enumerable with minted tokens transfers via safeTransferFrom without data to a valid receiver contract","","Contract: ERC721Enumerable with minted tokens transfers via safeTransferFrom without data to a valid receiver contract","calls onERC721Received from approved","calls onERC721Received from approved",""
"passed","Tue Dec 14 03:25:39 GMT 2021","Tue Dec 14 03:25:54 GMT 2021","14860","","Contract: ERC721 with minted tokens transfers via transferFrom when called by the operator","","Contract: ERC721 with minted tokens transfers via transferFrom when called by the operator","adjusts owners balances","adjusts owners balances",""
"passed","Tue Dec 14 03:35:25 GMT 2021","Tue Dec 14 03:35:29 GMT 2021","3896","","Contract: SafeCast toUint8","","Contract: SafeCast toUint8","reverts when downcasting 2^8 + 1 (257)","reverts when downcasting 2^8 + 1 (257)",""
"passed","Tue Dec 14 03:35:57 GMT 2021","Tue Dec 14 03:36:02 GMT 2021","4338","","Contract: Math ceilDiv","","Contract: Math ceilDiv","rounds up on division with remainders","rounds up on division with remainders",""
"skipped","Tue Dec 14 03:14:40 GMT 2021","Tue Dec 14 03:14:40 GMT 2021","0","","Contract: ERC20Votes Compound test suite balanceOf","","Contract: ERC20Votes Compound test suite balanceOf","grants to initial account","grants to initial account",""
"passed","Tue Dec 14 03:22:27 GMT 2021","Tue Dec 14 03:22:35 GMT 2021","7750","","Contract: Clones clone initialization without parameters payable when not sending balance","","Contract: Clones clone initialization without parameters payable when not sending balance","initializes the proxy","initializes the proxy",""
"passed","Tue Dec 14 03:36:02 GMT 2021","Tue Dec 14 03:36:05 GMT 2021","3890","","Contract: Math ceilDiv","","Contract: Math ceilDiv","does not overflow","does not overflow",""
"passed","Tue Dec 14 04:16:51 GMT 2021","Tue Dec 14 04:16:59 GMT 2021","7839","","Contract: ERC721Enumerable with minted tokens tokenByIndex","","Contract: ERC721Enumerable with minted tokens tokenByIndex","returns all tokens","returns all tokens",""
"passed","Tue Dec 14 03:34:27 GMT 2021","Tue Dec 14 03:34:33 GMT 2021","6826","","Contract: ERC1155 internal functions _mint with minted tokens","","Contract: ERC1155 internal functions _mint with minted tokens","credits the minted amount of tokens","credits the minted amount of tokens",""
"passed","Tue Dec 14 03:35:27 GMT 2021","Tue Dec 14 03:35:36 GMT 2021","8474","","Contract: ERC1155 internal functions _burn with minted-then-burnt tokens","","Contract: ERC1155 internal functions _burn with minted-then-burnt tokens","accounts for both minting and burning","accounts for both minting and burning",""
"passed","Tue Dec 14 03:43:39 GMT 2021","Tue Dec 14 03:43:44 GMT 2021","5247","","Contract: MinimalForwarder with message verify invalid signature","","Contract: MinimalForwarder with message verify invalid signature","tampered signature","tampered signature",""
"passed","Tue Dec 14 03:37:09 GMT 2021","Tue Dec 14 03:37:13 GMT 2021","3864","","Contract: SafeMath with default revert message div","","Contract: SafeMath with default revert message div","divides zero correctly","divides zero correctly",""
"failed","Tue Dec 14 03:26:55 GMT 2021","Tue Dec 14 03:26:57 GMT 2021","2239","","Contract: UpgradeableBeacon","","Contract: UpgradeableBeacon","cannot be created with non-contract implementation","cannot be created with non-contract implementation",""
"passed","Tue Dec 14 03:20:26 GMT 2021","Tue Dec 14 03:20:31 GMT 2021","4871","","Contract: ERC721PresetMinterPauserAutoId Contract interface ERC721 ERC165's supportsInterface(bytes4)","","Contract: ERC721PresetMinterPauserAutoId Contract interface ERC721 ERC165's supportsInterface(bytes4)","uses less than 30k gas [skip-on-coverage]","uses less than 30k gas [skip-on-coverage]",""
"passed","Tue Dec 14 03:21:38 GMT 2021","Tue Dec 14 03:21:46 GMT 2021","8302","","Contract: ERC721 with minted tokens ownerOf when the given token ID was not tracked by this token","","Contract: ERC721 with minted tokens ownerOf when the given token ID was not tracked by this token","reverts","reverts",""
"passed","Tue Dec 14 03:43:11 GMT 2021","Tue Dec 14 03:43:16 GMT 2021","5374","","Contract: MinimalForwarder with message verify invalid signature","","Contract: MinimalForwarder with message verify invalid signature","tampered from","tampered from",""
"failed","Tue Dec 14 03:23:10 GMT 2021","Tue Dec 14 03:23:16 GMT 2021","6209","","Contract: Clones clone initialization with parameters non payable when sending some balance","","Contract: Clones clone initialization with parameters non payable when sending some balance","reverts","reverts",""
"passed","Tue Dec 14 03:38:20 GMT 2021","Tue Dec 14 03:38:39 GMT 2021","19060","","Contract: ERC721 with minted tokens transfers via safeTransferFrom with data to a valid receiver contract when called by the owner","","Contract: ERC721 with minted tokens transfers via safeTransferFrom with data to a valid receiver contract when called by the owner","transfers the ownership of the given token ID to the given address","transfers the ownership of the given token ID to the given address",""
"passed","Tue Dec 14 03:33:14 GMT 2021","Tue Dec 14 03:33:25 GMT 2021","10838","","Contract: MulticallToken","","Contract: MulticallToken","batches function calls","batches function calls",""
"passed","Tue Dec 14 03:35:43 GMT 2021","Tue Dec 14 03:35:58 GMT 2021","15368","","Contract: ERC721 with minted tokens transfers via safeTransferFrom with data to a user account when sent to the owner","","Contract: ERC721 with minted tokens transfers via safeTransferFrom with data to a user account when sent to the owner","keeps ownership of the token","keeps ownership of the token",""
"passed","Tue Dec 14 03:54:34 GMT 2021","Tue Dec 14 03:54:48 GMT 2021","14545","","Contract: ERC721Enumerable with minted tokens transfers via safeTransferFrom without data to a user account when sent to the owner","","Contract: ERC721Enumerable with minted tokens transfers via safeTransferFrom without data to a user account when sent to the owner","keeps same tokens by index","keeps same tokens by index",""
"failed","Tue Dec 14 03:48:40 GMT 2021","Tue Dec 14 03:48:49 GMT 2021","8892","","Contract: PaymentSplitter once deployed distributes funds to payees","","Contract: PaymentSplitter once deployed distributes funds to payees","Ether","Ether",""
"passed","Tue Dec 14 03:38:57 GMT 2021","Tue Dec 14 03:39:07 GMT 2021","9562","","Contract: EnumerableSet EnumerableAddressSet remove","","Contract: EnumerableSet EnumerableAddressSet remove","removes added values","removes added values",""
"passed","Tue Dec 14 04:00:17 GMT 2021","Tue Dec 14 04:00:34 GMT 2021","16634","","Contract: ERC721 with minted tokens transfers via safeTransferFrom without data to a valid receiver contract when called by the operator","","Contract: ERC721 with minted tokens transfers via safeTransferFrom without data to a valid receiver contract when called by the operator","clears the approval for the token ID","clears the approval for the token ID",""
"passed","Tue Dec 14 03:36:08 GMT 2021","Tue Dec 14 03:36:12 GMT 2021","4034","","Contract: SafeCast toUint32","","Contract: SafeCast toUint32","reverts when downcasting 2^32 + 1 (4294967297)","reverts when downcasting 2^32 + 1 (4294967297)",""
"passed","Tue Dec 14 03:30:02 GMT 2021","Tue Dec 14 03:30:17 GMT 2021","14331","","Contract: ERC721Enumerable with minted tokens transfers via safeTransferFrom with data to a user account when called by the owner","","Contract: ERC721Enumerable with minted tokens transfers via safeTransferFrom with data to a user account when called by the owner","adjusts owners balances","adjusts owners balances",""
"passed","Tue Dec 14 04:14:14 GMT 2021","Tue Dec 14 04:14:26 GMT 2021","11792","","Contract: ERC721Enumerable _burn with minted tokens with burnt token","","Contract: ERC721Enumerable _burn with minted tokens with burnt token","reverts when burning a token id that has been deleted","reverts when burning a token id that has been deleted",""
"passed","Tue Dec 14 03:40:06 GMT 2021","Tue Dec 14 03:40:25 GMT 2021","18461","","Contract: ERC721Enumerable with minted tokens transfers via safeTransferFrom with data to a valid receiver contract when called by the approved individual","","Contract: ERC721Enumerable with minted tokens transfers via safeTransferFrom with data to a valid receiver contract when called by the approved individual","clears the approval for the token ID","clears the approval for the token ID",""
"passed","Tue Dec 14 03:35:05 GMT 2021","Tue Dec 14 03:35:10 GMT 2021","5413","","Contract: ERC1155 internal functions _burn","","Contract: ERC1155 internal functions _burn","reverts when burning a non-existent token id","reverts when burning a non-existent token id",""
"passed","Tue Dec 14 03:28:52 GMT 2021","Tue Dec 14 03:29:04 GMT 2021","12066","","Contract: ERC1155 like an ERC1155 safeBatchTransferFrom when called by an operator on behalf of the multiTokenHolder when operator is not approved by multiTokenHolder","","Contract: ERC1155 like an ERC1155 safeBatchTransferFrom when called by an operator on behalf of the multiTokenHolder when operator is not approved by multiTokenHolder","reverts","reverts",""
"broken","Tue Dec 14 03:58:26 GMT 2021","Tue Dec 14 03:58:54 GMT 2021","27566","","Contract: Governor scenario score not reached","","Contract: Governor scenario score not reached","run","run",""
"passed","Tue Dec 14 04:15:34 GMT 2021","Tue Dec 14 04:15:39 GMT 2021","4471","","Contract: ERC721Enumerable Contract interface ERC721Enumerable ERC165's supportsInterface(bytes4)","","Contract: ERC721Enumerable Contract interface ERC721Enumerable ERC165's supportsInterface(bytes4)","uses less than 30k gas [skip-on-coverage]","uses less than 30k gas [skip-on-coverage]",""
"passed","Tue Dec 14 03:16:09 GMT 2021","Tue Dec 14 03:16:19 GMT 2021","10075","","Contract: ERC20Pausable pausable token transfer","","Contract: ERC20Pausable pausable token transfer","allows to transfer when paused and then unpaused","allows to transfer when paused and then unpaused",""
"passed","Tue Dec 14 03:47:46 GMT 2021","Tue Dec 14 03:47:54 GMT 2021","8069","","Contract: PaymentSplitter once deployed shares","","Contract: PaymentSplitter once deployed shares","stores shares if address is payee","stores shares if address is payee",""
"passed","Tue Dec 14 03:43:11 GMT 2021","Tue Dec 14 03:43:17 GMT 2021","6049","","Contract: StorageSlot address storage slot get","","Contract: StorageSlot address storage slot get","from right slot","from right slot",""
"passed","Tue Dec 14 03:40:25 GMT 2021","Tue Dec 14 03:40:42 GMT 2021","17176","","Contract: ERC721 with minted tokens transfers via safeTransferFrom with data to a valid receiver contract when called by the approved individual","","Contract: ERC721 with minted tokens transfers via safeTransferFrom with data to a valid receiver contract when called by the approved individual","emits a Transfer event","emits a Transfer event",""
"passed","Tue Dec 14 03:39:13 GMT 2021","Tue Dec 14 03:39:32 GMT 2021","18926","","Contract: ERC721Enumerable with minted tokens transfers via safeTransferFrom with data to a valid receiver contract when called by the owner","","Contract: ERC721Enumerable with minted tokens transfers via safeTransferFrom with data to a valid receiver contract when called by the owner","adjusts owners tokens by index","adjusts owners tokens by index",""
"passed","Tue Dec 14 03:20:42 GMT 2021","Tue Dec 14 03:20:46 GMT 2021","3414","","Contract: ERC721 Contract interface ERC721 getApproved(uint256)","","Contract: ERC721 Contract interface ERC721 getApproved(uint256)","has to be implemented","has to be implemented",""
"skipped","Tue Dec 14 03:16:09 GMT 2021","Tue Dec 14 03:16:09 GMT 2021","0","","Contract: ERC20VotesComp set delegation with signature","","Contract: ERC20VotesComp set delegation with signature","accept signed delegation","accept signed delegation",""
"passed","Tue Dec 14 03:37:40 GMT 2021","Tue Dec 14 03:37:45 GMT 2021","4302","","Contract: SafeCast toUint256","","Contract: SafeCast toUint256","casts 1","casts 1",""
"failed","Tue Dec 14 03:47:27 GMT 2021","Tue Dec 14 03:47:36 GMT 2021","8870","","Contract: PaymentSplitter once deployed accepts payments","","Contract: PaymentSplitter once deployed accepts payments","Ether","Ether",""
"passed","Tue Dec 14 03:31:02 GMT 2021","Tue Dec 14 03:31:11 GMT 2021","8843","","Contract: Context msgSender","","Contract: Context msgSender","returns the transaction sender when called from an EOA","returns the transaction sender when called from an EOA",""
"passed","Tue Dec 14 04:02:37 GMT 2021","Tue Dec 14 04:02:55 GMT 2021","18458","","Contract: ERC721 with minted tokens transfers via safeTransferFrom without data to a valid receiver contract when called by the owner without an approved user","","Contract: ERC721 with minted tokens transfers via safeTransferFrom without data to a valid receiver contract when called by the owner without an approved user","adjusts owners balances","adjusts owners balances",""
"passed","Tue Dec 14 03:51:35 GMT 2021","Tue Dec 14 03:51:50 GMT 2021","14995","","Contract: ERC721Enumerable with minted tokens transfers via safeTransferFrom without data to a user account when called by the operator","","Contract: ERC721Enumerable with minted tokens transfers via safeTransferFrom without data to a user account when called by the operator","adjusts owners balances","adjusts owners balances",""
