"Status","Start Time","Stop Time","Duration in ms","Parent Suite","Suite","Sub Suite","Test Class","Test Method","Name","Description"
"passed","Tue Dec 14 03:23:22 GMT 2021","Tue Dec 14 03:23:30 GMT 2021","7654","","Contract: ProxyAdmin #getProxyImplementation","","Contract: ProxyAdmin #getProxyImplementation","call to invalid proxy","call to invalid proxy",""
"passed","Tue Dec 14 03:24:46 GMT 2021","Tue Dec 14 03:25:01 GMT 2021","15495","","Contract: ERC721Enumerable with minted tokens transfers via transferFrom when called by the operator","","Contract: ERC721Enumerable with minted tokens transfers via transferFrom when called by the operator","adjusts owners balances","adjusts owners balances",""
"passed","Tue Dec 14 03:38:11 GMT 2021","Tue Dec 14 03:38:15 GMT 2021","4246","","Contract: SafeCast toInt8","","Contract: SafeCast toInt8","downcasts -2^7 (-128)","downcasts -2^7 (-128)",""
"skipped","Tue Dec 14 04:04:08 GMT 2021","Tue Dec 14 04:04:08 GMT 2021","0","","Contract: Governor Proposal length","","Contract: Governor Proposal length","missmatch #1","missmatch #1",""
"passed","Tue Dec 14 03:23:14 GMT 2021","Tue Dec 14 03:23:29 GMT 2021","14447","","Contract: ERC721 with minted tokens transfers via transferFrom when called by the approved individual","","Contract: ERC721 with minted tokens transfers via transferFrom when called by the approved individual","transfers the ownership of the given token ID to the given address","transfers the ownership of the given token ID to the given address",""
"passed","Tue Dec 14 03:27:13 GMT 2021","Tue Dec 14 03:27:22 GMT 2021","8636","","Contract: TransparentUpgradeableProxy upgradeToAndCall without migrations when the call does not fail when the sender is the admin","","Contract: TransparentUpgradeableProxy upgradeToAndCall without migrations when the call does not fail when the sender is the admin","emits an event","emits an event",""
"passed","Tue Dec 14 03:23:58 GMT 2021","Tue Dec 14 03:24:12 GMT 2021","14161","","Contract: ERC721 with minted tokens transfers via transferFrom when called by the approved individual","","Contract: ERC721 with minted tokens transfers via transferFrom when called by the approved individual","emits an Approval event","emits an Approval event",""
"passed","Tue Dec 14 03:15:28 GMT 2021","Tue Dec 14 03:15:36 GMT 2021","7145","","Contract: ERC20Burnable burnFrom on success for a zero amount","","Contract: ERC20Burnable burnFrom on success for a zero amount","emits a transfer event","emits a transfer event",""
"passed","Tue Dec 14 03:15:08 GMT 2021","Tue Dec 14 03:15:19 GMT 2021","11030","","Contract: ERC20Burnable burnFrom on success for a zero amount","","Contract: ERC20Burnable burnFrom on success for a zero amount","burns the requested amount","burns the requested amount",""
"passed","Tue Dec 14 03:36:51 GMT 2021","Tue Dec 14 03:36:55 GMT 2021","4243","","Contract: SafeCast toUint96","","Contract: SafeCast toUint96","reverts when downcasting 2^96 + 1 (79228162514264337593543950337)","reverts when downcasting 2^96 + 1 (79228162514264337593543950337)",""
"passed","Tue Dec 14 03:20:47 GMT 2021","Tue Dec 14 03:20:51 GMT 2021","3962","","Contract: ERC721PresetMinterPauserAutoId Contract interface ERC721 getApproved(uint256)","","Contract: ERC721PresetMinterPauserAutoId Contract interface ERC721 getApproved(uint256)","has to be implemented","has to be implemented",""
"passed","Tue Dec 14 03:20:01 GMT 2021","Tue Dec 14 03:20:05 GMT 2021","3862","","Contract: ERC721Enumerable Contract interface ERC721 safeTransferFrom(address,address,uint256,bytes)","","Contract: ERC721Enumerable Contract interface ERC721 safeTransferFrom(address,address,uint256,bytes)","has to be implemented","has to be implemented",""
"passed","Tue Dec 14 03:21:20 GMT 2021","Tue Dec 14 03:21:29 GMT 2021","9254","","Contract: ERC721 with minted tokens balanceOf when querying the zero address","","Contract: ERC721 with minted tokens balanceOf when querying the zero address","throws","throws",""
"passed","Tue Dec 14 03:30:01 GMT 2021","Tue Dec 14 03:30:16 GMT 2021","14778","","Contract: ERC1155 like an ERC1155 safeBatchTransferFrom when sending to a valid receiver without data","","Contract: ERC1155 like an ERC1155 safeBatchTransferFrom when sending to a valid receiver without data","debits transferred balances from sender","debits transferred balances from sender",""
"failed","Tue Dec 14 03:47:00 GMT 2021","Tue Dec 14 03:47:02 GMT 2021","2335","","Contract: PaymentSplitter","","Contract: PaymentSplitter","rejects an empty set of payees","rejects an empty set of payees",""
"passed","Tue Dec 14 03:30:49 GMT 2021","Tue Dec 14 03:31:03 GMT 2021","14240","","Contract: ERC721 with minted tokens transfers via safeTransferFrom with data to a user account when called by the owner","","Contract: ERC721 with minted tokens transfers via safeTransferFrom with data to a user account when called by the owner","adjusts owners balances","adjusts owners balances",""
"failed","Tue Dec 14 03:26:21 GMT 2021","Tue Dec 14 03:26:28 GMT 2021","7778","","Contract: TransparentUpgradeableProxy initialization with parameters payable when sending some balance","","Contract: TransparentUpgradeableProxy initialization with parameters payable when sending some balance","has expected balance","has expected balance",""
"passed","Tue Dec 14 03:32:40 GMT 2021","Tue Dec 14 03:32:54 GMT 2021","13670","","Contract: ERC721 with minted tokens transfers via safeTransferFrom with data to a user account when called by the operator","","Contract: ERC721 with minted tokens transfers via safeTransferFrom with data to a user account when called by the operator","transfers the ownership of the given token ID to the given address","transfers the ownership of the given token ID to the given address",""
"skipped","Tue Dec 14 03:16:09 GMT 2021","Tue Dec 14 03:16:09 GMT 2021","0","","Contract: ERC20VotesComp set delegation call","","Contract: ERC20VotesComp set delegation call","delegation without balance","delegation without balance",""
"passed","Tue Dec 14 03:31:47 GMT 2021","Tue Dec 14 03:32:01 GMT 2021","14623","","Contract: ERC1155 like an ERC1155 safeBatchTransferFrom when sending to a valid receiver with data","","Contract: ERC1155 like an ERC1155 safeBatchTransferFrom when sending to a valid receiver with data","calls onERC1155Received","calls onERC1155Received",""
"passed","Tue Dec 14 03:34:12 GMT 2021","Tue Dec 14 03:34:16 GMT 2021","3409","","Contract: ERC1155 like an ERC1155 Contract interface ERC1155 safeBatchTransferFrom(address,address,uint256[],uint256[],bytes)","","Contract: ERC1155 like an ERC1155 Contract interface ERC1155 safeBatchTransferFrom(address,address,uint256[],uint256[],bytes)","has to be implemented","has to be implemented",""
"failed","Tue Dec 14 03:26:28 GMT 2021","Tue Dec 14 03:26:33 GMT 2021","4744","","Contract: TransparentUpgradeableProxy initialization with parameters reverting initialization","","Contract: TransparentUpgradeableProxy initialization with parameters reverting initialization","reverts","reverts",""
"passed","Tue Dec 14 03:41:19 GMT 2021","Tue Dec 14 03:41:38 GMT 2021","18648","","Contract: ERC721Enumerable with minted tokens transfers via safeTransferFrom with data to a valid receiver contract when called by the operator","","Contract: ERC721Enumerable with minted tokens transfers via safeTransferFrom with data to a valid receiver contract when called by the operator","transfers the ownership of the given token ID to the given address","transfers the ownership of the given token ID to the given address",""
"passed","Tue Dec 14 03:29:19 GMT 2021","Tue Dec 14 03:29:33 GMT 2021","14349","","Contract: ERC721Enumerable with minted tokens transfers via safeTransferFrom with data to a user account when called by the owner","","Contract: ERC721Enumerable with minted tokens transfers via safeTransferFrom with data to a user account when called by the owner","emits a Transfer event","emits a Transfer event",""
"broken","Tue Dec 14 04:05:42 GMT 2021","Tue Dec 14 04:06:12 GMT 2021","30031","","Contract: Governor Settings update setProposalThreshold","","Contract: Governor Settings update setProposalThreshold","run","run",""
"passed","Tue Dec 14 03:37:23 GMT 2021","Tue Dec 14 03:37:27 GMT 2021","4175","","Contract: SafeCast toUint224","","Contract: SafeCast toUint224","downcasts 2^224 - 1 (26959946667150639794667015087019630673637144422540572481103610249215)","downcasts 2^224 - 1 (26959946667150639794667015087019630673637144422540572481103610249215)",""
"passed","Tue Dec 14 04:08:29 GMT 2021","Tue Dec 14 04:08:38 GMT 2021","8618","","Contract: ERC721 with minted tokens safe mint via safeMint to a contract that does not implement the required function","","Contract: ERC721 with minted tokens safe mint via safeMint to a contract that does not implement the required function","reverts","reverts",""
"passed","Tue Dec 14 03:55:35 GMT 2021","Tue Dec 14 03:55:48 GMT 2021","13075","","Contract: ERC721 with minted tokens transfers via safeTransferFrom without data to a user account when the address to transfer the token to is the zero address","","Contract: ERC721 with minted tokens transfers via safeTransferFrom without data to a user account when the address to transfer the token to is the zero address","reverts","reverts",""
"skipped","Tue Dec 14 03:16:09 GMT 2021","Tue Dec 14 03:16:09 GMT 2021","0","","Contract: ERC20VotesComp Compound test suite numCheckpoints","","Contract: ERC20VotesComp Compound test suite numCheckpoints","returns the number of checkpoints for a delegate","returns the number of checkpoints for a delegate",""
"passed","Tue Dec 14 03:48:18 GMT 2021","Tue Dec 14 03:48:32 GMT 2021","14099","","Contract: ERC721 with minted tokens transfers via safeTransferFrom without data to a user account when called by the owner","","Contract: ERC721 with minted tokens transfers via safeTransferFrom without data to a user account when called by the owner","transfers the ownership of the given token ID to the given address","transfers the ownership of the given token ID to the given address",""
"passed","Tue Dec 14 03:12:52 GMT 2021","Tue Dec 14 03:12:54 GMT 2021","2150","tests.brownie.token.tests","test_approve","","","","test_approve_self",""
"passed","Tue Dec 14 03:37:15 GMT 2021","Tue Dec 14 03:37:19 GMT 2021","3800","","Contract: SafeCast toUint224","","Contract: SafeCast toUint224","downcasts 0","downcasts 0",""
"passed","Tue Dec 14 03:37:49 GMT 2021","Tue Dec 14 03:37:54 GMT 2021","4504","","Contract: SafeCast toUint256","","Contract: SafeCast toUint256","reverts when casting -1","reverts when casting -1",""
"passed","Tue Dec 14 03:37:37 GMT 2021","Tue Dec 14 03:37:42 GMT 2021","4378","","Contract: SafeMath with default revert message mod modulos correctly","","Contract: SafeMath with default revert message mod modulos correctly","when the dividend is a multiple of the divisor","when the dividend is a multiple of the divisor",""
"passed","Tue Dec 14 03:48:58 GMT 2021","Tue Dec 14 03:49:14 GMT 2021","15057","","Contract: ERC721 with minted tokens transfers via safeTransferFrom without data to a user account when called by the owner","","Contract: ERC721 with minted tokens transfers via safeTransferFrom without data to a user account when called by the owner","emits an Approval event","emits an Approval event",""
"passed","Tue Dec 14 03:30:28 GMT 2021","Tue Dec 14 03:30:39 GMT 2021","11116","","Contract: TransparentUpgradeableProxy transparent proxy when function names clash","","Contract: TransparentUpgradeableProxy transparent proxy when function names clash","when sender is proxy admin should run the proxy function","when sender is proxy admin should run the proxy function",""
"failed","Tue Dec 14 03:28:08 GMT 2021","Tue Dec 14 03:28:15 GMT 2021","6550","","Contract: PullPayment payments","","Contract: PullPayment payments","can record an async payment correctly","can record an async payment correctly",""
"skipped","Tue Dec 14 03:45:56 GMT 2021","Tue Dec 14 03:45:56 GMT 2021","7","","Contract: TimelockController methods batch schedule","","Contract: TimelockController methods batch schedule","length of batch parameter must match #1","length of batch parameter must match #1",""
"passed","Tue Dec 14 03:41:50 GMT 2021","Tue Dec 14 03:42:00 GMT 2021","9333","","Contract: Address functionStaticCall","","Contract: Address functionStaticCall","calls the requested function","calls the requested function",""
"passed","Tue Dec 14 03:26:53 GMT 2021","Tue Dec 14 03:26:58 GMT 2021","4892","","Contract: TransparentUpgradeableProxy upgradeTo when the sender is the admin when the given implementation is the zero address","","Contract: TransparentUpgradeableProxy upgradeTo when the sender is the admin when the given implementation is the zero address","reverts","reverts",""
"passed","Tue Dec 14 03:48:49 GMT 2021","Tue Dec 14 03:49:16 GMT 2021","27694","","Contract: PaymentSplitter once deployed distributes funds to payees","","Contract: PaymentSplitter once deployed distributes funds to payees","Token","Token",""
"passed","Tue Dec 14 04:13:00 GMT 2021","Tue Dec 14 04:13:10 GMT 2021","10178","","Contract: ERC721 with minted tokens getApproved when token has been minted  when account has been approved","","Contract: ERC721 with minted tokens getApproved when token has been minted  when account has been approved","returns approved account","returns approved account",""
"skipped","Tue Dec 14 03:45:21 GMT 2021","Tue Dec 14 03:45:21 GMT 2021","0","","Contract: GovernorTimelockCompound","","Contract: GovernorTimelockCompound","doesn't accept ether transfers","doesn't accept ether transfers",""
"failed","Tue Dec 14 03:31:21 GMT 2021","Tue Dec 14 03:31:31 GMT 2021","9722","","Contract: TimersBlockNumber","","Contract: TimersBlockNumber","pending","pending",""
"passed","Tue Dec 14 03:25:08 GMT 2021","Tue Dec 14 03:25:14 GMT 2021","5972","","Contract: Initializable complex testing with inheritance","","Contract: Initializable complex testing with inheritance","initializes human","initializes human",""
"passed","Tue Dec 14 03:35:09 GMT 2021","Tue Dec 14 03:35:27 GMT 2021","17892","","Contract: ERC721 with minted tokens transfers via safeTransferFrom with data to a user account when called by the owner without an approved user","","Contract: ERC721 with minted tokens transfers via safeTransferFrom with data to a user account when called by the owner without an approved user","adjusts owners balances","adjusts owners balances",""
"passed","Tue Dec 14 03:13:13 GMT 2021","Tue Dec 14 03:13:16 GMT 2021","2610","tests.brownie.token.tests","test_transfer","","","","test_transfer_full_balance",""
"passed","Tue Dec 14 03:16:19 GMT 2021","Tue Dec 14 03:16:27 GMT 2021","8234","","Contract: ERC20Permit permit","","Contract: ERC20Permit permit","accepts owner signature","accepts owner signature",""
"passed","Tue Dec 14 03:39:55 GMT 2021","Tue Dec 14 03:40:04 GMT 2021","8717","","Contract: EnumerableSet EnumerableUintSet add","","Contract: EnumerableSet EnumerableUintSet add","adds a value","adds a value",""
"passed","Tue Dec 14 04:05:26 GMT 2021","Tue Dec 14 04:05:42 GMT 2021","15531","","Contract: ERC721Enumerable with minted tokens transfers via safeTransferFrom without data to a valid receiver contract when the address to transfer the token to is the zero address","","Contract: ERC721Enumerable with minted tokens transfers via safeTransferFrom without data to a valid receiver contract when the address to transfer the token to is the zero address","reverts","reverts",""
"passed","Tue Dec 14 03:38:57 GMT 2021","Tue Dec 14 03:39:01 GMT 2021","3852","","Contract: SafeCast toInt16","","Contract: SafeCast toInt16","reverts when downcasting -2^15 - 1 (-32769)","reverts when downcasting -2^15 - 1 (-32769)",""
"passed","Tue Dec 14 03:43:42 GMT 2021","Tue Dec 14 03:44:02 GMT 2021","19517","","Contract: ERC721Enumerable with minted tokens transfers via safeTransferFrom with data to a valid receiver contract when called by the owner without an approved user","","Contract: ERC721Enumerable with minted tokens transfers via safeTransferFrom with data to a valid receiver contract when called by the owner without an approved user","clears the approval for the token ID","clears the approval for the token ID",""
"passed","Tue Dec 14 03:36:07 GMT 2021","Tue Dec 14 03:36:11 GMT 2021","4506","","Contract: SignedSafeMath sub","","Contract: SignedSafeMath sub","reverts on negative subtraction overflow","reverts on negative subtraction overflow",""
"passed","Tue Dec 14 03:19:48 GMT 2021","Tue Dec 14 03:19:57 GMT 2021","8453","","Contract: ERC721URIStorage token URI","","Contract: ERC721URIStorage token URI","can be set for a token id","can be set for a token id",""
"passed","Tue Dec 14 03:54:19 GMT 2021","Tue Dec 14 03:54:34 GMT 2021","14245","","Contract: ERC721Enumerable with minted tokens transfers via safeTransferFrom without data to a user account when sent to the owner","","Contract: ERC721Enumerable with minted tokens transfers via safeTransferFrom without data to a user account when sent to the owner","keeps the owner balance","keeps the owner balance",""
"broken","Tue Dec 14 03:10:27 GMT 2021","Tue Dec 14 03:10:27 GMT 2021","437","Ethers.js","","","","","testSigningMessages",""
"passed","Tue Dec 14 03:14:43 GMT 2021","Tue Dec 14 03:14:55 GMT 2021","11765","","Contract: TokenTimelock with token once deployed","","Contract: TokenTimelock with token once deployed","can get state","can get state",""
"passed","Tue Dec 14 04:05:27 GMT 2021","Tue Dec 14 04:05:42 GMT 2021","15362","","Contract: ERC721 with minted tokens transfers via safeTransferFrom without data to a valid receiver contract when the address to transfer the token to is the zero address","","Contract: ERC721 with minted tokens transfers via safeTransferFrom without data to a valid receiver contract when the address to transfer the token to is the zero address","reverts","reverts",""
"passed","Tue Dec 14 03:40:43 GMT 2021","Tue Dec 14 03:40:47 GMT 2021","4266","","Contract: SafeCast toInt128","","Contract: SafeCast toInt128","downcasts -2^127 (-170141183460469231731687303715884105728)","downcasts -2^127 (-170141183460469231731687303715884105728)",""
"passed","Tue Dec 14 03:29:22 GMT 2021","Tue Dec 14 03:29:31 GMT 2021","8830","","Contract: ReentrancyGuard","","Contract: ReentrancyGuard","nonReentrant function can be called","nonReentrant function can be called",""
"failed","Tue Dec 14 03:28:23 GMT 2021","Tue Dec 14 03:28:32 GMT 2021","8898","","Contract: PullPayment payments","","Contract: PullPayment payments","can add balances on multiple accounts","can add balances on multiple accounts",""
"passed","Tue Dec 14 03:48:19 GMT 2021","Tue Dec 14 03:48:39 GMT 2021","20169","","Contract: Governor Contract interface Governor COUNTING_MODE()","","Contract: Governor Contract interface Governor COUNTING_MODE()","has to be implemented","has to be implemented",""
"skipped","Tue Dec 14 03:14:40 GMT 2021","Tue Dec 14 03:14:40 GMT 2021","0","","Contract: ERC20Votes set delegation call","","Contract: ERC20Votes set delegation call","delegation with balance","delegation with balance",""
"skipped","Tue Dec 14 03:45:56 GMT 2021","Tue Dec 14 03:45:56 GMT 2021","0","","Contract: TimelockController methods batch execute with scheduled operation","","Contract: TimelockController methods batch execute with scheduled operation","revert if execution comes too early 2/2","revert if execution comes too early 2/2",""
"passed","Tue Dec 14 03:23:38 GMT 2021","Tue Dec 14 03:23:48 GMT 2021","9886","","Contract: ProxyAdmin #upgrade with authorized account","","Contract: ProxyAdmin #upgrade with authorized account","upgrades implementation","upgrades implementation",""
"skipped","Tue Dec 14 03:16:09 GMT 2021","Tue Dec 14 03:16:09 GMT 2021","0","","Contract: ERC20VotesComp Compound test suite getPriorVotes","","Contract: ERC20VotesComp Compound test suite getPriorVotes","returns zero if < first checkpoint block","returns zero if < first checkpoint block",""
"passed","Tue Dec 14 03:39:32 GMT 2021","Tue Dec 14 03:39:50 GMT 2021","18219","","Contract: ERC721 with minted tokens transfers via safeTransferFrom with data to a valid receiver contract when called by the owner","","Contract: ERC721 with minted tokens transfers via safeTransferFrom with data to a valid receiver contract when called by the owner","adjusts owners balances","adjusts owners balances",""
"skipped","Tue Dec 14 03:14:40 GMT 2021","Tue Dec 14 03:14:40 GMT 2021","0","","Contract: ERC20Votes change delegation","","Contract: ERC20Votes change delegation","call","call",""
"passed","Tue Dec 14 04:16:38 GMT 2021","Tue Dec 14 04:16:51 GMT 2021","12938","","Contract: ERC721Enumerable with minted tokens tokenOfOwnerByIndex after transferring all tokens to another user","","Contract: ERC721Enumerable with minted tokens tokenOfOwnerByIndex after transferring all tokens to another user","returns empty collection for original owner","returns empty collection for original owner",""
"passed","Tue Dec 14 03:27:40 GMT 2021","Tue Dec 14 03:27:54 GMT 2021","14264","","Contract: ERC721Enumerable with minted tokens transfers via transferFrom when sent to the owner","","Contract: ERC721Enumerable with minted tokens transfers via transferFrom when sent to the owner","keeps the owner balance","keeps the owner balance",""
"passed","Tue Dec 14 03:40:06 GMT 2021","Tue Dec 14 03:40:25 GMT 2021","18433","","Contract: ERC721 with minted tokens transfers via safeTransferFrom with data to a valid receiver contract when called by the approved individual","","Contract: ERC721 with minted tokens transfers via safeTransferFrom with data to a valid receiver contract when called by the approved individual","transfers the ownership of the given token ID to the given address","transfers the ownership of the given token ID to the given address",""
"passed","Tue Dec 14 03:36:31 GMT 2021","Tue Dec 14 03:36:43 GMT 2021","12351","","Contract: ERC721Enumerable with minted tokens transfers via safeTransferFrom with data to a user account when the sender is not authorized for the token id","","Contract: ERC721Enumerable with minted tokens transfers via safeTransferFrom with data to a user account when the sender is not authorized for the token id","reverts","reverts",""
"passed","Tue Dec 14 04:04:03 GMT 2021","Tue Dec 14 04:04:20 GMT 2021","17229","","Contract: ERC721Enumerable with minted tokens transfers via safeTransferFrom without data to a valid receiver contract when sent to the owner","","Contract: ERC721Enumerable with minted tokens transfers via safeTransferFrom without data to a valid receiver contract when sent to the owner","keeps the owner balance","keeps the owner balance",""
"passed","Tue Dec 14 03:36:10 GMT 2021","Tue Dec 14 03:36:18 GMT 2021","7401","","Contract: ERC165Checker ERC165 and many interfaces supported","","Contract: ERC165Checker ERC165 and many interfaces supported","supports none of the interfaces queried via getSupportedInterfaces","supports none of the interfaces queried via getSupportedInterfaces",""
"failed","Tue Dec 14 03:28:15 GMT 2021","Tue Dec 14 03:28:23 GMT 2021","8424","","Contract: PullPayment payments","","Contract: PullPayment payments","can add multiple balances on one account","can add multiple balances on one account",""
"failed","Tue Dec 14 03:41:34 GMT 2021","Tue Dec 14 03:41:41 GMT 2021","6973","","Contract: Address functionCallWithValue with non-zero value","","Contract: Address functionCallWithValue with non-zero value","calls the requested function with transaction funds","calls the requested function with transaction funds",""
"passed","Tue Dec 14 03:34:09 GMT 2021","Tue Dec 14 03:34:12 GMT 2021","3730","","Contract: ERC1155 like an ERC1155 Contract interface ERC1155 safeTransferFrom(address,address,uint256,uint256,bytes)","","Contract: ERC1155 like an ERC1155 Contract interface ERC1155 safeTransferFrom(address,address,uint256,uint256,bytes)","has to be implemented","has to be implemented",""
"skipped","Tue Dec 14 03:14:40 GMT 2021","Tue Dec 14 03:14:40 GMT 2021","0","","Contract: ERC20Votes transfers","","Contract: ERC20Votes transfers","no delegation","no delegation",""
"passed","Tue Dec 14 03:39:48 GMT 2021","Tue Dec 14 03:40:01 GMT 2021","12469","","Contract: Address sendValue when sender contract has funds with contract recipient","","Contract: Address sendValue when sender contract has funds with contract recipient","reverts on recipient revert","reverts on recipient revert",""
"passed","Tue Dec 14 03:49:59 GMT 2021","Tue Dec 14 03:50:20 GMT 2021","20222","","Contract: Governor Contract interface Governor votingDelay()","","Contract: Governor Contract interface Governor votingDelay()","has to be implemented","has to be implemented",""
"passed","Tue Dec 14 03:36:11 GMT 2021","Tue Dec 14 03:36:15 GMT 2021","3812","","Contract: ERC1155 ERC1155MetadataURI","","Contract: ERC1155 ERC1155MetadataURI","emits no URI event in constructor","emits no URI event in constructor",""
"passed","Tue Dec 14 03:24:55 GMT 2021","Tue Dec 14 03:25:02 GMT 2021","6949","","Contract: Initializable basic testing without inheritance after initialize","","Contract: Initializable basic testing without inheritance after initialize","initializer does not run again","initializer does not run again",""
"passed","Tue Dec 14 03:29:46 GMT 2021","Tue Dec 14 03:29:52 GMT 2021","5826","","Contract: ReentrancyGuard","","Contract: ReentrancyGuard","does not allow indirect local recursion","does not allow indirect local recursion",""
