"Status","Start Time","Stop Time","Duration in ms","Parent Suite","Suite","Sub Suite","Test Class","Test Method","Name","Description"
"skipped","Tue Dec 14 03:16:09 GMT 2021","Tue Dec 14 03:16:09 GMT 2021","0","","Contract: ERC20VotesComp","","Contract: ERC20VotesComp","domain separator","domain separator",""
"passed","Tue Dec 14 03:38:03 GMT 2021","Tue Dec 14 03:38:08 GMT 2021","4351","","Contract: SafeMath with custom revert message div","","Contract: SafeMath with custom revert message div","reverts on division by zero","reverts on division by zero",""
"passed","Tue Dec 14 03:15:06 GMT 2021","Tue Dec 14 03:15:17 GMT 2021","11208","","Contract: TokenTimelock with token once deployed","","Contract: TokenTimelock with token once deployed","cannot be released just before time limit","cannot be released just before time limit",""
"passed","Tue Dec 14 03:30:16 GMT 2021","Tue Dec 14 03:30:32 GMT 2021","15481","","Contract: ERC1155 like an ERC1155 safeBatchTransferFrom when sending to a valid receiver without data","","Contract: ERC1155 like an ERC1155 safeBatchTransferFrom when sending to a valid receiver without data","credits transferred balances to receiver","credits transferred balances to receiver",""
"failed","Tue Dec 14 03:48:01 GMT 2021","Tue Dec 14 03:48:10 GMT 2021","8923","","Contract: PaymentSplitter once deployed release Ether","","Contract: PaymentSplitter once deployed release Ether","reverts if no funds to claim","reverts if no funds to claim",""
"passed","Tue Dec 14 03:33:24 GMT 2021","Tue Dec 14 03:33:40 GMT 2021","15276","","Contract: ERC721Enumerable with minted tokens transfers via safeTransferFrom with data to a user account when called by the owner without an approved user","","Contract: ERC721Enumerable with minted tokens transfers via safeTransferFrom with data to a user account when called by the owner without an approved user","transfers the ownership of the given token ID to the given address","transfers the ownership of the given token ID to the given address",""
"passed","Tue Dec 14 03:44:17 GMT 2021","Tue Dec 14 03:44:23 GMT 2021","5996","","Contract: MinimalForwarder with message execute invalid signature","","Contract: MinimalForwarder with message execute invalid signature","tampered data","tampered data",""
"passed","Tue Dec 14 03:33:44 GMT 2021","Tue Dec 14 03:33:50 GMT 2021","5276","","Contract: MulticallToken","","Contract: MulticallToken","bubbles up revert reasons","bubbles up revert reasons",""
"passed","Tue Dec 14 03:31:17 GMT 2021","Tue Dec 14 03:31:30 GMT 2021","13147","","Contract: ERC721Enumerable with minted tokens transfers via safeTransferFrom with data to a user account when called by the approved individual","","Contract: ERC721Enumerable with minted tokens transfers via safeTransferFrom with data to a user account when called by the approved individual","emits an Approval event","emits an Approval event",""
"passed","Tue Dec 14 03:44:32 GMT 2021","Tue Dec 14 03:44:52 GMT 2021","19819","","Contract: ERC721 with minted tokens transfers via safeTransferFrom with data to a valid receiver contract when called by the owner without an approved user","","Contract: ERC721 with minted tokens transfers via safeTransferFrom with data to a valid receiver contract when called by the owner without an approved user","emits an Approval event","emits an Approval event",""
"passed","Tue Dec 14 03:10:26 GMT 2021","Tue Dec 14 03:10:26 GMT 2021","4","Ethers.js","","","","","testStateChangingMethods",""
"skipped","Tue Dec 14 03:45:56 GMT 2021","Tue Dec 14 03:45:56 GMT 2021","0","","Contract: TimelockController methods operation hashing","","Contract: TimelockController methods operation hashing","hashOperation","hashOperation",""
"passed","Tue Dec 14 03:49:40 GMT 2021","Tue Dec 14 03:49:59 GMT 2021","19378","","Contract: Governor Contract interface Governor proposalDeadline(uint256)","","Contract: Governor Contract interface Governor proposalDeadline(uint256)","has to be implemented","has to be implemented",""
"passed","Tue Dec 14 03:24:13 GMT 2021","Tue Dec 14 03:24:21 GMT 2021","7505","","Contract: TransparentUpgradeableProxy without initialization when not sending balance","","Contract: TransparentUpgradeableProxy without initialization when not sending balance","initializes the proxy","initializes the proxy",""
"passed","Tue Dec 14 03:21:58 GMT 2021","Tue Dec 14 03:22:02 GMT 2021","4426","","Contract: ERC721PresetMinterPauserAutoId Contract interface AccessControl renounceRole(bytes32,address)","","Contract: ERC721PresetMinterPauserAutoId Contract interface AccessControl renounceRole(bytes32,address)","has to be implemented","has to be implemented",""
"passed","Tue Dec 14 03:36:29 GMT 2021","Tue Dec 14 03:36:33 GMT 2021","4313","","Contract: ERC165Checker account address does not support ERC165","","Contract: ERC165Checker account address does not support ERC165","does not support mock interface via supportsInterface","does not support mock interface via supportsInterface",""
"passed","Tue Dec 14 03:41:09 GMT 2021","Tue Dec 14 03:41:13 GMT 2021","4427","","Contract: SafeCast toInt256","","Contract: SafeCast toInt256","casts 0","casts 0",""
"broken","Tue Dec 14 03:54:34 GMT 2021","Tue Dec 14 03:55:00 GMT 2021","26724","","Contract: Governor scenario receiver revert without reason","","Contract: Governor scenario receiver revert without reason","run","run",""
"passed","Tue Dec 14 03:38:45 GMT 2021","Tue Dec 14 03:38:49 GMT 2021","4250","","Contract: SafeCast toInt16","","Contract: SafeCast toInt16","downcasts -1","downcasts -1",""
"passed","Tue Dec 14 03:26:11 GMT 2021","Tue Dec 14 03:26:25 GMT 2021","14389","","Contract: ERC1155 like an ERC1155 safeTransferFrom when sending to a valid receiver with data","","Contract: ERC1155 like an ERC1155 safeTransferFrom when sending to a valid receiver with data","debits transferred balance from sender","debits transferred balance from sender",""
"passed","Tue Dec 14 03:37:05 GMT 2021","Tue Dec 14 03:37:09 GMT 2021","3783","","Contract: SafeMath with default revert message div","","Contract: SafeMath with default revert message div","divides correctly","divides correctly",""
"passed","Tue Dec 14 03:55:28 GMT 2021","Tue Dec 14 03:55:58 GMT 2021","30101","","Contract: Governor scenario missing proposal","","Contract: Governor scenario missing proposal","run","run",""
"passed","Tue Dec 14 03:43:45 GMT 2021","Tue Dec 14 03:43:53 GMT 2021","8324","","Contract: Counters reset non null counter","","Contract: Counters reset non null counter","reset to 0","reset to 0",""
"passed","Tue Dec 14 03:28:22 GMT 2021","Tue Dec 14 03:28:37 GMT 2021","14961","","Contract: ERC721Enumerable with minted tokens transfers via transferFrom when the sender is not authorized for the token id","","Contract: ERC721Enumerable with minted tokens transfers via transferFrom when the sender is not authorized for the token id","reverts","reverts",""
"passed","Tue Dec 14 03:10:22 GMT 2021","Tue Dec 14 03:10:22 GMT 2021","1","Ethers.js","","","","","testSigner",""
"passed","Tue Dec 14 03:27:30 GMT 2021","Tue Dec 14 03:27:46 GMT 2021","16201","","Contract: ERC721 with minted tokens transfers via transferFrom when called by the owner without an approved user","","Contract: ERC721 with minted tokens transfers via transferFrom when called by the owner without an approved user","adjusts owners tokens by index","adjusts owners tokens by index",""
"passed","Tue Dec 14 03:40:27 GMT 2021","Tue Dec 14 03:40:31 GMT 2021","4008","","Contract: SafeCast toInt64","","Contract: SafeCast toInt64","reverts when downcasting 2^63 + 1 (9223372036854775809)","reverts when downcasting 2^63 + 1 (9223372036854775809)",""
"passed","Tue Dec 14 03:13:36 GMT 2021","Tue Dec 14 03:13:41 GMT 2021","4144","tests.brownie.token.tests","test_transferFrom","","","","test_caller_balance_not_affected",""
"skipped","Tue Dec 14 04:06:12 GMT 2021","Tue Dec 14 04:06:12 GMT 2021","0","","Contract: Governor Settings update update protected","","Contract: Governor Settings update update protected","setVotingPeriod","setVotingPeriod",""
"passed","Tue Dec 14 03:55:28 GMT 2021","Tue Dec 14 03:55:39 GMT 2021","11891","","Contract: ERC721Enumerable with minted tokens transfers via safeTransferFrom without data to a user account when the address to transfer the token to is the zero address","","Contract: ERC721Enumerable with minted tokens transfers via safeTransferFrom without data to a user account when the address to transfer the token to is the zero address","reverts","reverts",""
"passed","Tue Dec 14 03:30:43 GMT 2021","Tue Dec 14 03:30:57 GMT 2021","14373","","Contract: AccessControl enumerating","","Contract: AccessControl enumerating","role bearers can be enumerated","role bearers can be enumerated",""
"passed","Tue Dec 14 04:14:55 GMT 2021","Tue Dec 14 04:15:01 GMT 2021","5907","","Contract: ERC721Enumerable metadata token URI","","Contract: ERC721Enumerable metadata token URI","return empty string by default","return empty string by default",""
"passed","Tue Dec 14 03:26:37 GMT 2021","Tue Dec 14 03:26:42 GMT 2021","4646","","Contract: TransparentUpgradeableProxy implementation","","Contract: TransparentUpgradeableProxy implementation","delegates to the implementation","delegates to the implementation",""
"passed","Tue Dec 14 03:45:39 GMT 2021","Tue Dec 14 03:45:55 GMT 2021","16452","","Contract: ERC721Enumerable with minted tokens transfers via safeTransferFrom with data to a valid receiver contract when sent to the owner","","Contract: ERC721Enumerable with minted tokens transfers via safeTransferFrom with data to a valid receiver contract when sent to the owner","emits only a transfer event","emits only a transfer event",""
"failed","Tue Dec 14 03:24:43 GMT 2021","Tue Dec 14 03:24:50 GMT 2021","6791","","Contract: Clones cloneDeterministic initialization without parameters payable when sending some balance","","Contract: Clones cloneDeterministic initialization without parameters payable when sending some balance","has expected balance","has expected balance",""
"passed","Tue Dec 14 03:28:01 GMT 2021","Tue Dec 14 03:28:15 GMT 2021","14194","","Contract: ERC721 with minted tokens transfers via transferFrom when sent to the owner","","Contract: ERC721 with minted tokens transfers via transferFrom when sent to the owner","clears the approval for the token ID","clears the approval for the token ID",""
"passed","Tue Dec 14 03:31:31 GMT 2021","Tue Dec 14 03:31:46 GMT 2021","14296","","Contract: ERC721 with minted tokens transfers via safeTransferFrom with data to a user account when called by the approved individual","","Contract: ERC721 with minted tokens transfers via safeTransferFrom with data to a user account when called by the approved individual","emits a Transfer event","emits a Transfer event",""
"passed","Tue Dec 14 03:42:49 GMT 2021","Tue Dec 14 03:42:54 GMT 2021","5699","","Contract: Counters increment starting from 0","","Contract: Counters increment starting from 0","increments the current value by one","increments the current value by one",""
"passed","Tue Dec 14 03:38:20 GMT 2021","Tue Dec 14 03:38:25 GMT 2021","4835","","Contract: SafeCast toInt8","","Contract: SafeCast toInt8","reverts when downcasting -2^7 - 1 (-129)","reverts when downcasting -2^7 - 1 (-129)",""
"skipped","Tue Dec 14 03:16:09 GMT 2021","Tue Dec 14 03:16:09 GMT 2021","0","","Contract: ERC20VotesComp getPastTotalSupply","","Contract: ERC20VotesComp getPastTotalSupply","returns zero if < first checkpoint block","returns zero if < first checkpoint block",""
"passed","Tue Dec 14 03:44:21 GMT 2021","Tue Dec 14 03:44:40 GMT 2021","19543","","Contract: ERC721Enumerable with minted tokens transfers via safeTransferFrom with data to a valid receiver contract when called by the owner without an approved user","","Contract: ERC721Enumerable with minted tokens transfers via safeTransferFrom with data to a valid receiver contract when called by the owner without an approved user","adjusts owners balances","adjusts owners balances",""
"broken","Tue Dec 14 03:55:58 GMT 2021","Tue Dec 14 03:56:25 GMT 2021","27652","","Contract: Governor scenario duplicate pending proposal","","Contract: Governor scenario duplicate pending proposal","run","run",""
"passed","Tue Dec 14 03:22:32 GMT 2021","Tue Dec 14 03:22:40 GMT 2021","7710","","Contract: ERC1155 like an ERC1155 setApprovalForAll","","Contract: ERC1155 like an ERC1155 setApprovalForAll","sets approval status which can be queried via isApprovedForAll","sets approval status which can be queried via isApprovedForAll",""
"passed","Tue Dec 14 03:42:54 GMT 2021","Tue Dec 14 03:43:04 GMT 2021","9723","","Contract: Counters increment starting from 0","","Contract: Counters increment starting from 0","can be called multiple times","can be called multiple times",""
"passed","Tue Dec 14 04:13:26 GMT 2021","Tue Dec 14 04:13:33 GMT 2021","7188","","Contract: ERC721Enumerable _mint(address, uint256) with minted token","","Contract: ERC721Enumerable _mint(address, uint256) with minted token","creates the token","creates the token",""
"passed","Tue Dec 14 04:10:10 GMT 2021","Tue Dec 14 04:10:22 GMT 2021","11888","","Contract: ERC721 with minted tokens approve when approving a non-zero address when there was a prior approval to a different address","","Contract: ERC721 with minted tokens approve when approving a non-zero address when there was a prior approval to a different address","emits an approval event","emits an approval event",""
"passed","Tue Dec 14 03:34:45 GMT 2021","Tue Dec 14 03:34:52 GMT 2021","6998","","Contract: ERC165Checker ERC165 supported","","Contract: ERC165Checker ERC165 supported","does not support mock interface via getSupportedInterfaces","does not support mock interface via getSupportedInterfaces",""
"passed","Tue Dec 14 03:20:49 GMT 2021","Tue Dec 14 03:20:57 GMT 2021","8060","","Contract: ERC721Pausable when token is paused isApprovedForAll","","Contract: ERC721Pausable when token is paused isApprovedForAll","returns the approval of the operator","returns the approval of the operator",""
"passed","Tue Dec 14 04:13:56 GMT 2021","Tue Dec 14 04:14:06 GMT 2021","10163","","Contract: ERC721 _burn with minted tokens with burnt token","","Contract: ERC721 _burn with minted tokens with burnt token","deletes the token","deletes the token",""
"passed","Tue Dec 14 03:26:06 GMT 2021","Tue Dec 14 03:26:22 GMT 2021","15636","","Contract: ERC721Enumerable with minted tokens transfers via transferFrom when called by the owner without an approved user","","Contract: ERC721Enumerable with minted tokens transfers via transferFrom when called by the owner without an approved user","emits an Approval event","emits an Approval event",""
"passed","Tue Dec 14 03:37:08 GMT 2021","Tue Dec 14 03:37:25 GMT 2021","16699","","Contract: ERC721Enumerable with minted tokens transfers via safeTransferFrom with data to a valid receiver contract","","Contract: ERC721Enumerable with minted tokens transfers via safeTransferFrom with data to a valid receiver contract","calls onERC721Received","calls onERC721Received",""
"passed","Tue Dec 14 03:23:55 GMT 2021","Tue Dec 14 03:24:07 GMT 2021","12680","","Contract: ERC1155 like an ERC1155 safeTransferFrom when called by the multiTokenHolder","","Contract: ERC1155 like an ERC1155 safeTransferFrom when called by the multiTokenHolder","preserves existing balances which are not transferred by multiTokenHolder","preserves existing balances which are not transferred by multiTokenHolder",""
"passed","Tue Dec 14 03:14:21 GMT 2021","Tue Dec 14 03:14:26 GMT 2021","4594","tests.brownie.token.tests","test_transferFrom","","","","test_transfer_to_self",""
"passed","Tue Dec 14 03:24:58 GMT 2021","Tue Dec 14 03:25:12 GMT 2021","14278","","Contract: ERC1155 like an ERC1155 safeTransferFrom when called by an operator on behalf of the multiTokenHolder when operator is approved by multiTokenHolder","","Contract: ERC1155 like an ERC1155 safeTransferFrom when called by an operator on behalf of the multiTokenHolder when operator is approved by multiTokenHolder","preserves operator's balances not involved in the transfer","preserves operator's balances not involved in the transfer",""
"skipped","Tue Dec 14 03:16:09 GMT 2021","Tue Dec 14 03:16:09 GMT 2021","0","","Contract: ERC20VotesComp Compound test suite getPriorVotes","","Contract: ERC20VotesComp Compound test suite getPriorVotes","reverts if block number >= current block","reverts if block number >= current block",""
"passed","Tue Dec 14 03:19:15 GMT 2021","Tue Dec 14 03:19:20 GMT 2021","4540","","Contract: ERC721Enumerable Contract interface ERC165 ERC165's supportsInterface(bytes4)","","Contract: ERC721Enumerable Contract interface ERC165 ERC165's supportsInterface(bytes4)","claims support [skip-on-coverage]","claims support [skip-on-coverage]",""
"passed","Tue Dec 14 04:05:42 GMT 2021","Tue Dec 14 04:05:58 GMT 2021","16282","","Contract: ERC721 with minted tokens transfers via safeTransferFrom without data to a valid receiver contract with an invalid token id","","Contract: ERC721 with minted tokens transfers via safeTransferFrom without data to a valid receiver contract with an invalid token id","reverts","reverts",""
"passed","Tue Dec 14 03:12:54 GMT 2021","Tue Dec 14 03:12:56 GMT 2021","2007","tests.brownie.token.tests","test_approve","","","","test_only_affects_target",""
"passed","Tue Dec 14 03:35:03 GMT 2021","Tue Dec 14 03:35:17 GMT 2021","14446","","Contract: ERC721Enumerable with minted tokens transfers via safeTransferFrom with data to a user account when sent to the owner","","Contract: ERC721Enumerable with minted tokens transfers via safeTransferFrom with data to a user account when sent to the owner","keeps ownership of the token","keeps ownership of the token",""
"passed","Tue Dec 14 03:38:50 GMT 2021","Tue Dec 14 03:39:03 GMT 2021","13309","","Contract: BitMap set","","Contract: BitMap set","adds several consecutive keys","adds several consecutive keys",""
"passed","Tue Dec 14 04:04:54 GMT 2021","Tue Dec 14 04:05:11 GMT 2021","16467","","Contract: ERC721Enumerable with minted tokens transfers via safeTransferFrom without data to a valid receiver contract when the sender is not authorized for the token id","","Contract: ERC721Enumerable with minted tokens transfers via safeTransferFrom without data to a valid receiver contract when the sender is not authorized for the token id","reverts","reverts",""
"passed","Tue Dec 14 03:36:11 GMT 2021","Tue Dec 14 03:36:15 GMT 2021","3993","","Contract: SafeMath with flag mod","","Contract: SafeMath with flag mod","reverts with a 0 divisor","reverts with a 0 divisor",""
"passed","Tue Dec 14 04:07:30 GMT 2021","Tue Dec 14 04:07:43 GMT 2021","12902","","Contract: ERC721 with minted tokens safe mint via safeMint","","Contract: ERC721 with minted tokens safe mint via safeMint","calls onERC721Received — without data","calls onERC721Received — without data",""
"passed","Tue Dec 14 03:13:09 GMT 2021","Tue Dec 14 03:13:11 GMT 2021","2429","tests.brownie.token.tests","test_transfer","","","","test_total_supply_not_affected",""
"passed","Tue Dec 14 03:36:13 GMT 2021","Tue Dec 14 03:36:27 GMT 2021","14039","","Contract: ERC721 with minted tokens transfers via safeTransferFrom with data to a user account when sent to the owner","","Contract: ERC721 with minted tokens transfers via safeTransferFrom with data to a user account when sent to the owner","emits only a transfer event","emits only a transfer event",""
"broken","Tue Dec 14 04:03:37 GMT 2021","Tue Dec 14 04:04:08 GMT 2021","31018","","Contract: Governor Cancel After execution","","Contract: Governor Cancel After execution","run","run",""
"passed","Tue Dec 14 03:33:53 GMT 2021","Tue Dec 14 03:34:00 GMT 2021","7596","","Contract: ERC165Checker ERC165 not supported","","Contract: ERC165Checker ERC165 not supported","does not support ERC165","does not support ERC165",""
"passed","Tue Dec 14 03:40:22 GMT 2021","Tue Dec 14 03:40:27 GMT 2021","4209","","Contract: SafeCast toInt64","","Contract: SafeCast toInt64","reverts when downcasting 2^63 (9223372036854775808)","reverts when downcasting 2^63 (9223372036854775808)",""
"passed","Tue Dec 14 03:40:31 GMT 2021","Tue Dec 14 03:40:35 GMT 2021","4408","","Contract: SafeCast toInt128","","Contract: SafeCast toInt128","downcasts 0","downcasts 0",""
"passed","Tue Dec 14 03:34:27 GMT 2021","Tue Dec 14 03:34:45 GMT 2021","18222","","Contract: ERC721Enumerable with minted tokens transfers via safeTransferFrom with data to a user account when called by the owner without an approved user","","Contract: ERC721Enumerable with minted tokens transfers via safeTransferFrom with data to a user account when called by the owner without an approved user","adjusts owners balances","adjusts owners balances",""
"passed","Tue Dec 14 03:44:28 GMT 2021","Tue Dec 14 03:44:40 GMT 2021","11429","","Contract: ERC2771Context when receiving a relayed call msgData","","Contract: ERC2771Context when receiving a relayed call msgData","returns the relayed transaction original data","returns the relayed transaction original data",""
"passed","Tue Dec 14 03:54:30 GMT 2021","Tue Dec 14 03:54:45 GMT 2021","14510","","Contract: ERC721 with minted tokens transfers via safeTransferFrom without data to a user account when sent to the owner","","Contract: ERC721 with minted tokens transfers via safeTransferFrom without data to a user account when sent to the owner","keeps the owner balance","keeps the owner balance",""
"passed","Tue Dec 14 03:35:15 GMT 2021","Tue Dec 14 03:35:22 GMT 2021","7221","","Contract: ERC165Checker ERC165 and single interface supported","","Contract: ERC165Checker ERC165 and single interface supported","supports mock interface via getSupportedInterfaces","supports mock interface via getSupportedInterfaces",""
"passed","Tue Dec 14 03:43:23 GMT 2021","Tue Dec 14 03:43:42 GMT 2021","19059","","Contract: ERC721Enumerable with minted tokens transfers via safeTransferFrom with data to a valid receiver contract when called by the owner without an approved user","","Contract: ERC721Enumerable with minted tokens transfers via safeTransferFrom with data to a valid receiver contract when called by the owner without an approved user","emits a Transfer event","emits a Transfer event",""
"passed","Tue Dec 14 03:41:00 GMT 2021","Tue Dec 14 03:41:04 GMT 2021","4248","","Contract: SafeCast toInt128","","Contract: SafeCast toInt128","reverts when downcasting 2^127 (170141183460469231731687303715884105728)","reverts when downcasting 2^127 (170141183460469231731687303715884105728)",""
"passed","Tue Dec 14 03:19:34 GMT 2021","Tue Dec 14 03:19:41 GMT 2021","7239","","Contract: ERC721URIStorage token URI","","Contract: ERC721URIStorage token URI","it is empty by default","it is empty by default",""
"passed","Tue Dec 14 03:19:47 GMT 2021","Tue Dec 14 03:19:51 GMT 2021","3804","","Contract: ERC721Enumerable Contract interface ERC721 setApprovalForAll(address,bool)","","Contract: ERC721Enumerable Contract interface ERC721 setApprovalForAll(address,bool)","has to be implemented","has to be implemented",""
"broken","Tue Dec 14 03:18:50 GMT 2021","Tue Dec 14 03:18:57 GMT 2021","6746","","Contract: ERC777 relative order of hooks","","Contract: ERC777 relative order of hooks","send","send",""
"passed","Tue Dec 14 04:03:48 GMT 2021","Tue Dec 14 04:04:03 GMT 2021","15049","","Contract: ERC721Enumerable with minted tokens transfers via safeTransferFrom without data to a valid receiver contract when sent to the owner","","Contract: ERC721Enumerable with minted tokens transfers via safeTransferFrom without data to a valid receiver contract when sent to the owner","emits only a transfer event","emits only a transfer event",""
"passed","Tue Dec 14 03:16:52 GMT 2021","Tue Dec 14 03:16:57 GMT 2021","5585","","Contract: ERC20PresetMinterPauser","","Contract: ERC20PresetMinterPauser","minter and pauser role admin is the default admin","minter and pauser role admin is the default admin",""
"passed","Tue Dec 14 03:33:31 GMT 2021","Tue Dec 14 03:33:38 GMT 2021","7654","","Contract: ERC165Checker ERC165 missing return data","","Contract: ERC165Checker ERC165 missing return data","does not support mock interface via supportsInterface","does not support mock interface via supportsInterface",""
"passed","Tue Dec 14 03:31:59 GMT 2021","Tue Dec 14 03:32:13 GMT 2021","13563","","Contract: ERC721Enumerable with minted tokens transfers via safeTransferFrom with data to a user account when called by the operator","","Contract: ERC721Enumerable with minted tokens transfers via safeTransferFrom with data to a user account when called by the operator","transfers the ownership of the given token ID to the given address","transfers the ownership of the given token ID to the given address",""
"passed","Tue Dec 14 04:11:14 GMT 2021","Tue Dec 14 04:11:22 GMT 2021","8164","","Contract: ERC721Enumerable with minted tokens approve when the given token ID does not exist","","Contract: ERC721Enumerable with minted tokens approve when the given token ID does not exist","reverts","reverts",""
"broken","Tue Dec 14 03:45:25 GMT 2021","Tue Dec 14 03:46:04 GMT 2021","38666","","Contract: GovernorComp voting with comp token","","Contract: GovernorComp voting with comp token","run","run",""
"passed","Tue Dec 14 03:46:57 GMT 2021","Tue Dec 14 03:47:13 GMT 2021","16134","","Contract: ERC721 with minted tokens transfers via safeTransferFrom with data to a valid receiver contract when the address of the previous owner is incorrect","","Contract: ERC721 with minted tokens transfers via safeTransferFrom with data to a valid receiver contract when the address of the previous owner is incorrect","reverts","reverts",""
