"Status","Start Time","Stop Time","Duration in ms","Parent Suite","Suite","Sub Suite","Test Class","Test Method","Name","Description"
"passed","Thu Dec 02 17:48:03 GMT 2021","Thu Dec 02 17:48:32 GMT 2021","28977","","Contract: Governor Contract interface Governor ERC165's supportsInterface(bytes4)","","Contract: Governor Contract interface Governor ERC165's supportsInterface(bytes4)","uses less than 30k gas [skip-on-coverage]","uses less than 30k gas [skip-on-coverage]",""
"passed","Thu Dec 02 20:09:18 GMT 2021","Thu Dec 02 20:09:24 GMT 2021","5953","","Contract: Create2 deploy","","Contract: Create2 deploy","fails deploying a contract if the bytecode length is zero","fails deploying a contract if the bytecode length is zero",""
"passed","Thu Dec 02 20:06:27 GMT 2021","Thu Dec 02 20:06:32 GMT 2021","4813","","Contract: Math ceilDiv","","Contract: Math ceilDiv","does not overflow","does not overflow",""
"skipped","Thu Dec 02 19:57:17 GMT 2021","Thu Dec 02 19:57:24 GMT 2021","7464","","Contract: ERC721 metadata token URI base URI","","Contract: ERC721 metadata token URI base URI","base URI can be set","base URI can be set",""
"passed","Thu Dec 02 20:06:40 GMT 2021","Thu Dec 02 20:06:52 GMT 2021","12610","","Contract: EnumerableMap set","","Contract: EnumerableMap set","returns false when adding keys already in the set","returns false when adding keys already in the set",""
"failed","Thu Dec 02 18:31:11 GMT 2021","Thu Dec 02 18:31:19 GMT 2021","8304","","Contract: PullPayment payments","","Contract: PullPayment payments","can add multiple balances on one account","can add multiple balances on one account",""
"passed","Thu Dec 02 20:06:15 GMT 2021","Thu Dec 02 20:06:23 GMT 2021","7653","","Contract: BitMap","","Contract: BitMap","starts empty","starts empty",""
"passed","Thu Dec 02 18:41:46 GMT 2021","Thu Dec 02 18:41:54 GMT 2021","7120","","Contract: ERC721Enumerable Contract interface ERC165 ERC165's supportsInterface(bytes4)","","Contract: ERC721Enumerable Contract interface ERC165 ERC165's supportsInterface(bytes4)","uses less than 30k gas [skip-on-coverage]","uses less than 30k gas [skip-on-coverage]",""
"passed","Thu Dec 02 19:21:48 GMT 2021","Thu Dec 02 19:22:07 GMT 2021","19477","","Contract: ERC721 with minted tokens transfers via safeTransferFrom without data to a user account when called by the owner","","Contract: ERC721 with minted tokens transfers via safeTransferFrom without data to a user account when called by the owner","adjusts owners balances","adjusts owners balances",""
"passed","Thu Dec 02 19:21:10 GMT 2021","Thu Dec 02 19:21:29 GMT 2021","19655","","Contract: ERC721 with minted tokens transfers via safeTransferFrom without data to a user account when called by the owner","","Contract: ERC721 with minted tokens transfers via safeTransferFrom without data to a user account when called by the owner","clears the approval for the token ID","clears the approval for the token ID",""
"failed","Thu Dec 02 17:36:48 GMT 2021","Thu Dec 02 17:36:51 GMT 2021","2513","tests.brownie.token.tests","test_transferFrom","","","","test_no_approval",""
"passed","Thu Dec 02 20:08:32 GMT 2021","Thu Dec 02 20:08:37 GMT 2021","5065","","Contract: SafeMath with custom revert message sub","","Contract: SafeMath with custom revert message sub","reverts if subtraction result would be negative","reverts if subtraction result would be negative",""
"passed","Thu Dec 02 19:26:10 GMT 2021","Thu Dec 02 19:26:31 GMT 2021","21077","","Contract: ERC721 with minted tokens transfers via safeTransferFrom without data to a user account when called by the owner without an approved user","","Contract: ERC721 with minted tokens transfers via safeTransferFrom without data to a user account when called by the owner without an approved user","transfers the ownership of the given token ID to the given address","transfers the ownership of the given token ID to the given address",""
"passed","Thu Dec 02 18:59:13 GMT 2021","Thu Dec 02 18:59:33 GMT 2021","19265","","Contract: ERC721 with minted tokens transfers via safeTransferFrom with data to a user account when called by the operator","","Contract: ERC721 with minted tokens transfers via safeTransferFrom with data to a user account when called by the operator","transfers the ownership of the given token ID to the given address","transfers the ownership of the given token ID to the given address",""
"passed","Thu Dec 02 19:58:45 GMT 2021","Thu Dec 02 19:58:54 GMT 2021","8492","","Contract: ERC721Enumerable metadata token URI","","Contract: ERC721Enumerable metadata token URI","return empty string by default","return empty string by default",""
"passed","Thu Dec 02 20:05:31 GMT 2021","Thu Dec 02 20:05:40 GMT 2021","9201","","Contract: ERC165Checker ERC165 missing return data","","Contract: ERC165Checker ERC165 missing return data","does not support mock interface via supportsInterface","does not support mock interface via supportsInterface",""
"passed","Thu Dec 02 17:44:53 GMT 2021","Thu Dec 02 17:45:10 GMT 2021","16438","","Contract: PaymentSplitter once deployed release Token","","Contract: PaymentSplitter once deployed release Token","reverts if non-payee want to claim","reverts if non-payee want to claim",""
"passed","Thu Dec 02 19:50:32 GMT 2021","Thu Dec 02 19:50:44 GMT 2021","12022","","Contract: ERC721Enumerable with minted tokens approve when clearing approval when there was no prior approval","","Contract: ERC721Enumerable with minted tokens approve when clearing approval when there was no prior approval","emits an approval event","emits an approval event",""
"passed","Thu Dec 02 18:43:26 GMT 2021","Thu Dec 02 18:43:31 GMT 2021","5562","","Contract: ERC721 Contract interface ERC721 getApproved(uint256)","","Contract: ERC721 Contract interface ERC721 getApproved(uint256)","has to be implemented","has to be implemented",""
"passed","Thu Dec 02 19:39:36 GMT 2021","Thu Dec 02 19:40:02 GMT 2021","26157","","Contract: ERC721Enumerable with minted tokens transfers via safeTransferFrom without data to a valid receiver contract when called by the operator","","Contract: ERC721Enumerable with minted tokens transfers via safeTransferFrom without data to a valid receiver contract when called by the operator","adjusts owners balances","adjusts owners balances",""
"passed","Thu Dec 02 17:55:27 GMT 2021","Thu Dec 02 17:55:55 GMT 2021","27871","","Contract: Governor Contract interface Governor castVote(uint256,uint8)","","Contract: Governor Contract interface Governor castVote(uint256,uint8)","has to be implemented","has to be implemented",""
"passed","Thu Dec 02 19:08:32 GMT 2021","Thu Dec 02 19:08:44 GMT 2021","12134","","Contract: ERC1155 internal functions _burn with minted-then-burnt tokens","","Contract: ERC1155 internal functions _burn with minted-then-burnt tokens","accounts for both minting and burning","accounts for both minting and burning",""
"passed","Thu Dec 02 20:10:34 GMT 2021","Thu Dec 02 20:10:41 GMT 2021","6955","","Contract: StorageSlot bytes32 storage slot get","","Contract: StorageSlot bytes32 storage slot get","from other slot","from other slot",""
"passed","Thu Dec 02 20:08:11 GMT 2021","Thu Dec 02 20:08:18 GMT 2021","6464","","Contract: Arrays findUpperBound Array with gap","","Contract: Arrays findUpperBound Array with gap","returns index of first element in next filled range","returns index of first element in next filled range",""
"passed","Thu Dec 02 20:07:17 GMT 2021","Thu Dec 02 20:07:22 GMT 2021","5134","","Contract: SafeMath with default revert message sub","","Contract: SafeMath with default revert message sub","reverts if subtraction result would be negative","reverts if subtraction result would be negative",""
"passed","Thu Dec 02 19:26:22 GMT 2021","Thu Dec 02 19:26:41 GMT 2021","19494","","Contract: ERC721Enumerable with minted tokens transfers via safeTransferFrom without data to a user account when called by the operator","","Contract: ERC721Enumerable with minted tokens transfers via safeTransferFrom without data to a user account when called by the operator","adjusts owners balances","adjusts owners balances",""
"passed","Thu Dec 02 19:59:25 GMT 2021","Thu Dec 02 19:59:38 GMT 2021","13018","","Contract: ERC721Enumerable metadata token URI base URI","","Contract: ERC721Enumerable metadata token URI base URI","token URI can be changed by changing the base URI","token URI can be changed by changing the base URI",""
"passed","Thu Dec 02 20:10:25 GMT 2021","Thu Dec 02 20:10:30 GMT 2021","5059","","Contract: SafeCast toInt32","","Contract: SafeCast toInt32","downcasts 0","downcasts 0",""
"passed","Thu Dec 02 18:42:48 GMT 2021","Thu Dec 02 18:42:55 GMT 2021","6050","","Contract: ERC721 Contract interface ERC165 supportsInterface(bytes4)","","Contract: ERC721 Contract interface ERC165 supportsInterface(bytes4)","has to be implemented","has to be implemented",""
"passed","Thu Dec 02 20:02:59 GMT 2021","Thu Dec 02 20:03:07 GMT 2021","7259","","Contract: ERC721Enumerable _burn","","Contract: ERC721Enumerable _burn","reverts when burning a non-existent token id","reverts when burning a non-existent token id",""
"passed","Thu Dec 02 19:09:06 GMT 2021","Thu Dec 02 19:09:25 GMT 2021","18895","","Contract: ERC1155 internal functions _burnBatch with minted-then-burnt tokens","","Contract: ERC1155 internal functions _burnBatch with minted-then-burnt tokens","emits a TransferBatch event","emits a TransferBatch event",""
"skipped","Thu Dec 02 18:21:10 GMT 2021","Thu Dec 02 18:21:10 GMT 2021","0","","Contract: ERC1967Proxy initialization with parameters payable when sending some balance","","Contract: ERC1967Proxy initialization with parameters payable when sending some balance","sets the implementation address","sets the implementation address",""
"passed","Thu Dec 02 18:46:35 GMT 2021","Thu Dec 02 18:46:53 GMT 2021","18865","","Contract: ERC721 with minted tokens transfers via transferFrom when called by the owner","","Contract: ERC721 with minted tokens transfers via transferFrom when called by the owner","adjusts owners tokens by index","adjusts owners tokens by index",""
"passed","Thu Dec 02 20:07:01 GMT 2021","Thu Dec 02 20:07:09 GMT 2021","7203","","Contract: Arrays findUpperBound Even number of elements","","Contract: Arrays findUpperBound Even number of elements","returns correct index for the basic case","returns correct index for the basic case",""
"passed","Thu Dec 02 19:17:58 GMT 2021","Thu Dec 02 19:18:21 GMT 2021","23052","","Contract: ERC721Enumerable with minted tokens transfers via safeTransferFrom with data to a valid receiver contract when sent to the owner","","Contract: ERC721Enumerable with minted tokens transfers via safeTransferFrom with data to a valid receiver contract when sent to the owner","clears the approval for the token ID","clears the approval for the token ID",""
"passed","Thu Dec 02 18:44:16 GMT 2021","Thu Dec 02 18:44:48 GMT 2021","32318","","Contract: ERC20Snapshot balanceOfAt with initial snapshot with balance changes after the snapshot with a second snapshot after supply changes","","Contract: ERC20Snapshot balanceOfAt with initial snapshot with balance changes after the snapshot with a second snapshot after supply changes","snapshots return the balances before and after the changes","snapshots return the balances before and after the changes",""
"passed","Thu Dec 02 18:27:59 GMT 2021","Thu Dec 02 18:28:04 GMT 2021","5130","","Contract: TransparentUpgradeableProxy storage","","Contract: TransparentUpgradeableProxy storage","should store the implementation address in specified location","should store the implementation address in specified location",""
"passed","Thu Dec 02 19:03:44 GMT 2021","Thu Dec 02 19:04:12 GMT 2021","27545","","Contract: ERC1155 like an ERC1155 safeBatchTransferFrom to a receiver contract that reverts only on single transfers","","Contract: ERC1155 like an ERC1155 safeBatchTransferFrom to a receiver contract that reverts only on single transfers","debits transferred balances from sender","debits transferred balances from sender",""
"passed","Thu Dec 02 20:09:45 GMT 2021","Thu Dec 02 20:09:56 GMT 2021","11082","","Contract: TimersTimestamp","","Contract: TimersTimestamp","expired","expired",""
"passed","Thu Dec 02 19:59:38 GMT 2021","Thu Dec 02 19:59:44 GMT 2021","6540","","Contract: ERC721Enumerable Contract interface ERC721Enumerable ERC165's supportsInterface(bytes4)","","Contract: ERC721Enumerable Contract interface ERC721Enumerable ERC165's supportsInterface(bytes4)","uses less than 30k gas [skip-on-coverage]","uses less than 30k gas [skip-on-coverage]",""
"passed","Thu Dec 02 20:12:10 GMT 2021","Thu Dec 02 20:12:15 GMT 2021","4638","","Contract: SafeCast toInt128","","Contract: SafeCast toInt128","downcasts -2^127 (-170141183460469231731687303715884105728)","downcasts -2^127 (-170141183460469231731687303715884105728)",""
"passed","Thu Dec 02 18:45:29 GMT 2021","Thu Dec 02 18:45:37 GMT 2021","8028","","Contract: ERC20 approve when the spender is not the zero address when the sender does not have enough balance","","Contract: ERC20 approve when the spender is not the zero address when the sender does not have enough balance","emits an approval event","emits an approval event",""
"passed","Thu Dec 02 20:09:24 GMT 2021","Thu Dec 02 20:09:34 GMT 2021","9791","","Contract: TimersTimestamp","","Contract: TimersTimestamp","unset","unset",""
"passed","Thu Dec 02 20:08:52 GMT 2021","Thu Dec 02 20:09:30 GMT 2021","38143","","Contract: EnumerableSet EnumerableAddressSet remove","","Contract: EnumerableSet EnumerableAddressSet remove","adds and removes multiple values","adds and removes multiple values",""
"passed","Thu Dec 02 17:37:10 GMT 2021","Thu Dec 02 17:37:10 GMT 2021","6","tests.openzeppelin","test_openzeppelin","","","","test_contracts[input_data2]",""
"skipped","Thu Dec 02 18:41:22 GMT 2021","Thu Dec 02 18:41:22 GMT 2021","0","","Contract: ERC20VotesComp getPastTotalSupply","","Contract: ERC20VotesComp getPastTotalSupply","returns 0 if there are no checkpoints","returns 0 if there are no checkpoints",""
"passed","Thu Dec 02 19:42:22 GMT 2021","Thu Dec 02 19:42:50 GMT 2021","27904","","Contract: ERC721Enumerable with minted tokens transfers via safeTransferFrom without data to a valid receiver contract when called by the owner without an approved user","","Contract: ERC721Enumerable with minted tokens transfers via safeTransferFrom without data to a valid receiver contract when called by the owner without an approved user","adjusts owners balances","adjusts owners balances",""
"passed","Thu Dec 02 18:43:33 GMT 2021","Thu Dec 02 18:43:42 GMT 2021","9401","","Contract: ERC721PresetMinterPauserAutoId Contract interface ERC721 approve(address,uint256)","","Contract: ERC721PresetMinterPauserAutoId Contract interface ERC721 approve(address,uint256)","has to be implemented","has to be implemented",""
"passed","Thu Dec 02 19:03:25 GMT 2021","Thu Dec 02 19:03:44 GMT 2021","19600","","Contract: ERC1155 like an ERC1155 safeBatchTransferFrom to a receiver contract that reverts","","Contract: ERC1155 like an ERC1155 safeBatchTransferFrom to a receiver contract that reverts","reverts","reverts",""
"passed","Thu Dec 02 20:06:47 GMT 2021","Thu Dec 02 20:06:52 GMT 2021","5060","","Contract: ECDSA toEthSignedMessageHash","","Contract: ECDSA toEthSignedMessageHash","prefixes bytes32 data correctly","prefixes bytes32 data correctly",""
"passed","Thu Dec 02 20:05:46 GMT 2021","Thu Dec 02 20:05:50 GMT 2021","3748","","Contract: SafeMath with flag add","","Contract: SafeMath with flag add","reverts on addition overflow","reverts on addition overflow",""
"passed","Thu Dec 02 20:06:51 GMT 2021","Thu Dec 02 20:07:02 GMT 2021","10457","","Contract: ERC165Checker ERC165 supported","","Contract: ERC165Checker ERC165 supported","does not support mock interface via supportsAllInterfaces","does not support mock interface via supportsAllInterfaces",""
"passed","Thu Dec 02 20:12:20 GMT 2021","Thu Dec 02 20:12:25 GMT 2021","4964","","Contract: SafeCast toInt128","","Contract: SafeCast toInt128","reverts when downcasting -2^127 - 1 (-170141183460469231731687303715884105729)","reverts when downcasting -2^127 - 1 (-170141183460469231731687303715884105729)",""
"passed","Thu Dec 02 18:50:41 GMT 2021","Thu Dec 02 18:50:49 GMT 2021","7972","","Contract: ERC20 _burn for a non zero account for less amount than balance","","Contract: ERC20 _burn for a non zero account for less amount than balance","emits Transfer event","emits Transfer event",""
"broken","Thu Dec 02 17:46:36 GMT 2021","Thu Dec 02 17:46:49 GMT 2021","12944","","Contract: GovernorCompatibilityBravo nominal","","Contract: GovernorCompatibilityBravo nominal","run","run",""
"passed","Thu Dec 02 18:22:58 GMT 2021","Thu Dec 02 18:23:07 GMT 2021","8522","","Contract: Clones cloneDeterministic initialization with parameters non payable when not sending balance","","Contract: Clones cloneDeterministic initialization with parameters non payable when not sending balance","initializes the proxy","initializes the proxy",""
"passed","Thu Dec 02 20:09:27 GMT 2021","Thu Dec 02 20:09:31 GMT 2021","4636","","Contract: ERC165Checker account address does not support ERC165","","Contract: ERC165Checker account address does not support ERC165","does not support mock interface via supportsAllInterfaces","does not support mock interface via supportsAllInterfaces",""
"passed","Thu Dec 02 19:06:34 GMT 2021","Thu Dec 02 19:06:39 GMT 2021","4979","","Contract: ERC1155 like an ERC1155 Contract interface ERC1155 isApprovedForAll(address,address)","","Contract: ERC1155 like an ERC1155 Contract interface ERC1155 isApprovedForAll(address,address)","has to be implemented","has to be implemented",""
"passed","Thu Dec 02 18:42:17 GMT 2021","Thu Dec 02 18:42:27 GMT 2021","10319","","Contract: ERC20Permit permit","","Contract: ERC20Permit permit","rejects expired permit","rejects expired permit",""
"passed","Thu Dec 02 17:49:55 GMT 2021","Thu Dec 02 17:50:24 GMT 2021","28360","","Contract: Governor Contract interface Governor COUNTING_MODE()","","Contract: Governor Contract interface Governor COUNTING_MODE()","has to be implemented","has to be implemented",""
"passed","Thu Dec 02 19:03:22 GMT 2021","Thu Dec 02 19:03:41 GMT 2021","19365","","Contract: ERC721Enumerable with minted tokens transfers via safeTransferFrom with data to a user account when sent to the owner","","Contract: ERC721Enumerable with minted tokens transfers via safeTransferFrom with data to a user account when sent to the owner","keeps ownership of the token","keeps ownership of the token",""
"passed","Thu Dec 02 19:24:36 GMT 2021","Thu Dec 02 19:24:54 GMT 2021","18323","","Contract: ERC721 with minted tokens transfers via safeTransferFrom without data to a user account when called by the operator","","Contract: ERC721 with minted tokens transfers via safeTransferFrom without data to a user account when called by the operator","emits a Transfer event","emits a Transfer event",""
"passed","Thu Dec 02 20:05:21 GMT 2021","Thu Dec 02 20:05:31 GMT 2021","9674","","Contract: ERC165Checker ERC165 missing return data","","Contract: ERC165Checker ERC165 missing return data","does not support ERC165","does not support ERC165",""
"skipped","Thu Dec 02 17:46:36 GMT 2021","Thu Dec 02 17:46:36 GMT 2021","0","","Contract: TimelockController usage scenario","","Contract: TimelockController usage scenario","call reverting","call reverting",""
"passed","Thu Dec 02 18:43:02 GMT 2021","Thu Dec 02 18:43:08 GMT 2021","6169","","Contract: ERC721Enumerable Contract interface ERC721 safeTransferFrom(address,address,uint256)","","Contract: ERC721Enumerable Contract interface ERC721 safeTransferFrom(address,address,uint256)","has to be implemented","has to be implemented",""
"passed","Thu Dec 02 17:54:04 GMT 2021","Thu Dec 02 17:54:32 GMT 2021","27821","","Contract: Governor Contract interface Governor hasVoted(uint256,address)","","Contract: Governor Contract interface Governor hasVoted(uint256,address)","has to be implemented","has to be implemented",""
"passed","Thu Dec 02 19:00:48 GMT 2021","Thu Dec 02 19:01:15 GMT 2021","26944","","Contract: ERC1155 like an ERC1155 safeBatchTransferFrom when sending to a valid receiver without data","","Contract: ERC1155 like an ERC1155 safeBatchTransferFrom when sending to a valid receiver without data","calls onERC1155BatchReceived","calls onERC1155BatchReceived",""
"passed","Thu Dec 02 18:41:28 GMT 2021","Thu Dec 02 18:41:35 GMT 2021","6869","","Contract: ERC20FlashMint flashFee","","Contract: ERC20FlashMint flashFee","token match","token match",""
"passed","Thu Dec 02 19:51:14 GMT 2021","Thu Dec 02 19:51:27 GMT 2021","12828","","Contract: ERC721Enumerable with minted tokens approve when approving a non-zero address when there was no prior approval","","Contract: ERC721Enumerable with minted tokens approve when approving a non-zero address when there was no prior approval","sets the approval for the target address","sets the approval for the target address",""
"passed","Thu Dec 02 19:08:11 GMT 2021","Thu Dec 02 19:08:37 GMT 2021","25685","","Contract: ERC721Enumerable with minted tokens transfers via safeTransferFrom with data to a valid receiver contract when called by the owner","","Contract: ERC721Enumerable with minted tokens transfers via safeTransferFrom with data to a valid receiver contract when called by the owner","emits an Approval event","emits an Approval event",""
"passed","Thu Dec 02 19:08:20 GMT 2021","Thu Dec 02 19:08:32 GMT 2021","11784","","Contract: ERC1155 internal functions _burn with minted-then-burnt tokens","","Contract: ERC1155 internal functions _burn with minted-then-burnt tokens","emits a TransferSingle event","emits a TransferSingle event",""
"passed","Thu Dec 02 19:23:58 GMT 2021","Thu Dec 02 19:24:17 GMT 2021","18696","","Contract: ERC721 with minted tokens transfers via safeTransferFrom without data to a user account when called by the approved individual","","Contract: ERC721 with minted tokens transfers via safeTransferFrom without data to a user account when called by the approved individual","adjusts owners tokens by index","adjusts owners tokens by index",""
"passed","Thu Dec 02 18:46:53 GMT 2021","Thu Dec 02 18:47:13 GMT 2021","19134","","Contract: ERC721 with minted tokens transfers via transferFrom when called by the approved individual","","Contract: ERC721 with minted tokens transfers via transferFrom when called by the approved individual","transfers the ownership of the given token ID to the given address","transfers the ownership of the given token ID to the given address",""
"passed","Thu Dec 02 20:05:53 GMT 2021","Thu Dec 02 20:05:58 GMT 2021","4919","","Contract: Math min","","Contract: Math min","is correctly detected in second argument position","is correctly detected in second argument position",""
"passed","Thu Dec 02 19:08:24 GMT 2021","Thu Dec 02 19:08:50 GMT 2021","26708","","Contract: ERC721 with minted tokens transfers via safeTransferFrom with data to a valid receiver contract when called by the owner","","Contract: ERC721 with minted tokens transfers via safeTransferFrom with data to a valid receiver contract when called by the owner","adjusts owners balances","adjusts owners balances",""
"passed","Thu Dec 02 20:06:32 GMT 2021","Thu Dec 02 20:06:37 GMT 2021","4788","","Contract: Math ceilDiv","","Contract: Math ceilDiv","correctly computes max uint256 divided by 1","correctly computes max uint256 divided by 1",""
"passed","Thu Dec 02 18:41:30 GMT 2021","Thu Dec 02 18:41:31 GMT 2021","1039","","Contract: ERC20PresetFixedSupply","","Contract: ERC20PresetFixedSupply","deployer has the balance equal to initial supply","deployer has the balance equal to initial supply",""
"passed","Thu Dec 02 20:07:00 GMT 2021","Thu Dec 02 20:07:06 GMT 2021","5846","","Contract: SafeMath with default revert message add","","Contract: SafeMath with default revert message add","adds correctly","adds correctly",""
"passed","Thu Dec 02 18:46:08 GMT 2021","Thu Dec 02 18:46:16 GMT 2021","7841","","Contract: ERC20 decrease allowance when the spender is not the zero address when the sender has enough balance when there was no approved amount before","","Contract: ERC20 decrease allowance when the spender is not the zero address when the sender has enough balance when there was no approved amount before","reverts","reverts",""
"passed","Thu Dec 02 19:36:59 GMT 2021","Thu Dec 02 19:37:25 GMT 2021","26317","","Contract: ERC721Enumerable with minted tokens transfers via safeTransferFrom without data to a valid receiver contract when called by the approved individual","","Contract: ERC721Enumerable with minted tokens transfers via safeTransferFrom without data to a valid receiver contract when called by the approved individual","adjusts owners balances","adjusts owners balances",""
"passed","Thu Dec 02 18:46:35 GMT 2021","Thu Dec 02 18:46:55 GMT 2021","20369","","Contract: ERC1155Burnable burnBatch","","Contract: ERC1155Burnable burnBatch","holder can burn their tokens","holder can burn their tokens",""
"passed","Thu Dec 02 17:40:52 GMT 2021","Thu Dec 02 17:40:59 GMT 2021","7024","","Contract: AccessControl renouncing with granted role","","Contract: AccessControl renouncing with granted role","only the sender can renounce their roles","only the sender can renounce their roles",""
"passed","Thu Dec 02 20:06:55 GMT 2021","Thu Dec 02 20:07:06 GMT 2021","10647","","Contract: Address sendValue when sender contract has no funds","","Contract: Address sendValue when sender contract has no funds","sends 0 wei","sends 0 wei",""
"passed","Thu Dec 02 20:05:37 GMT 2021","Thu Dec 02 20:05:42 GMT 2021","5246","","Contract: SafeCast toUint8","","Contract: SafeCast toUint8","downcasts 2^8 - 1 (255)","downcasts 2^8 - 1 (255)",""
