"Status","Start Time","Stop Time","Duration in ms","Parent Suite","Suite","Sub Suite","Test Class","Test Method","Name","Description"
"passed","Thu Dec 02 20:05:37 GMT 2021","Thu Dec 02 20:05:43 GMT 2021","5194","","Contract: Math max","","Contract: Math max","is correctly detected in first argument position","is correctly detected in first argument position",""
"skipped","Thu Dec 02 18:41:22 GMT 2021","Thu Dec 02 18:41:22 GMT 2021","0","","Contract: ERC20VotesComp Compound test suite getPriorVotes","","Contract: ERC20VotesComp Compound test suite getPriorVotes","returns the latest block if >= last checkpoint block","returns the latest block if >= last checkpoint block",""
"passed","Thu Dec 02 20:08:24 GMT 2021","Thu Dec 02 20:08:34 GMT 2021","10469","","Contract: ERC165Checker ERC165 and many interfaces supported","","Contract: ERC165Checker ERC165 and many interfaces supported","supports none of the interfaces queried via supportsAllInterfaces","supports none of the interfaces queried via supportsAllInterfaces",""
"passed","Thu Dec 02 19:09:58 GMT 2021","Thu Dec 02 19:10:05 GMT 2021","7171","","Contract: ERC1155 ERC1155MetadataURI _setURI","","Contract: ERC1155 ERC1155MetadataURI _setURI","emits no URI event","emits no URI event",""
"failed","Thu Dec 02 17:42:43 GMT 2021","Thu Dec 02 17:42:51 GMT 2021","7984","","Contract: VestingWallet vesting schedule Eth vesting","","Contract: VestingWallet vesting schedule Eth vesting","check vesting schedule","check vesting schedule",""
"passed","Thu Dec 02 18:23:43 GMT 2021","Thu Dec 02 18:23:50 GMT 2021","6637","","Contract: TransparentUpgradeableProxy upgradeTo when the sender is the admin when the given implementation is different from the current one","","Contract: TransparentUpgradeableProxy upgradeTo when the sender is the admin when the given implementation is different from the current one","emits an event","emits an event",""
"passed","Thu Dec 02 18:20:20 GMT 2021","Thu Dec 02 18:20:29 GMT 2021","8273","","Contract: Initializable complex testing with inheritance","","Contract: Initializable complex testing with inheritance","initializes father","initializes father",""
"passed","Thu Dec 02 18:21:57 GMT 2021","Thu Dec 02 18:22:07 GMT 2021","9584","","Contract: Clones cloneDeterministic initialization without parameters non payable when not sending balance","","Contract: Clones cloneDeterministic initialization without parameters non payable when not sending balance","initializes the proxy","initializes the proxy",""
"passed","Thu Dec 02 20:05:24 GMT 2021","Thu Dec 02 20:05:32 GMT 2021","8087","","Contract: ERC165Storage","","Contract: ERC165Storage","register interface","register interface",""
"skipped","Thu Dec 02 18:41:22 GMT 2021","Thu Dec 02 18:41:22 GMT 2021","0","","Contract: ERC20VotesComp set delegation call","","Contract: ERC20VotesComp set delegation call","delegation without balance","delegation without balance",""
"passed","Thu Dec 02 20:10:02 GMT 2021","Thu Dec 02 20:10:14 GMT 2021","12247","","Contract: EnumerableSet EnumerableUintSet add","","Contract: EnumerableSet EnumerableUintSet add","returns false when adding values already in the set","returns false when adding values already in the set",""
"passed","Thu Dec 02 20:10:47 GMT 2021","Thu Dec 02 20:10:54 GMT 2021","6913","","Contract: StorageSlot uint256 storage slot get","","Contract: StorageSlot uint256 storage slot get","from right slot","from right slot",""
"passed","Thu Dec 02 19:46:54 GMT 2021","Thu Dec 02 19:47:13 GMT 2021","19245","","Contract: ERC721Enumerable with minted tokens transfers via safeTransferFrom to a receiver contract returning unexpected value","","Contract: ERC721Enumerable with minted tokens transfers via safeTransferFrom to a receiver contract returning unexpected value","reverts","reverts",""
"passed","Thu Dec 02 18:43:37 GMT 2021","Thu Dec 02 18:43:43 GMT 2021","5911","","Contract: ERC721 Contract interface ERC721 isApprovedForAll(address,address)","","Contract: ERC721 Contract interface ERC721 isApprovedForAll(address,address)","has to be implemented","has to be implemented",""
"passed","Thu Dec 02 20:09:48 GMT 2021","Thu Dec 02 20:10:02 GMT 2021","14268","","Contract: EnumerableSet EnumerableUintSet add","","Contract: EnumerableSet EnumerableUintSet add","adds several values","adds several values",""
"passed","Thu Dec 02 18:45:47 GMT 2021","Thu Dec 02 18:45:59 GMT 2021","12716","","Contract: ERC20 approve when the spender is not the zero address when the sender does not have enough balance when the spender had an approved amount","","Contract: ERC20 approve when the spender is not the zero address when the sender does not have enough balance when the spender had an approved amount","approves the requested amount and replaces the previous one","approves the requested amount and replaces the previous one",""
"passed","Thu Dec 02 19:32:18 GMT 2021","Thu Dec 02 19:32:43 GMT 2021","25160","","Contract: ERC721Enumerable with minted tokens transfers via safeTransferFrom without data to a valid receiver contract","","Contract: ERC721Enumerable with minted tokens transfers via safeTransferFrom without data to a valid receiver contract","calls onERC721Received from approved","calls onERC721Received from approved",""
"passed","Thu Dec 02 17:35:48 GMT 2021","Thu Dec 02 17:35:48 GMT 2021","4","ethjs","","","","","Connection test (js)",""
"passed","Thu Dec 02 18:41:19 GMT 2021","Thu Dec 02 18:41:28 GMT 2021","9387","","Contract: ERC20Permit","","Contract: ERC20Permit","initial nonce is 0","initial nonce is 0",""
"failed","Thu Dec 02 17:44:06 GMT 2021","Thu Dec 02 17:44:22 GMT 2021","16392","","Contract: PaymentSplitter once deployed release Ether","","Contract: PaymentSplitter once deployed release Ether","reverts if no funds to claim","reverts if no funds to claim",""
"passed","Thu Dec 02 20:12:39 GMT 2021","Thu Dec 02 20:12:44 GMT 2021","5386","","Contract: SafeCast toInt256","","Contract: SafeCast toInt256","casts 0","casts 0",""
"passed","Thu Dec 02 17:41:27 GMT 2021","Thu Dec 02 17:41:39 GMT 2021","12359","","Contract: AccessControl setting role admin","","Contract: AccessControl setting role admin","the new admin can revoke roles","the new admin can revoke roles",""
"passed","Thu Dec 02 19:51:39 GMT 2021","Thu Dec 02 19:51:55 GMT 2021","15243","","Contract: ERC721Enumerable with minted tokens approve when approving a non-zero address when there was a prior approval to the same address","","Contract: ERC721Enumerable with minted tokens approve when approving a non-zero address when there was a prior approval to the same address","sets the approval for the target address","sets the approval for the target address",""
"passed","Thu Dec 02 18:27:47 GMT 2021","Thu Dec 02 18:27:53 GMT 2021","6445","","Contract: TransparentUpgradeableProxy changeAdmin when the new proposed admin is not the zero address when the sender is not the admin","","Contract: TransparentUpgradeableProxy changeAdmin when the new proposed admin is not the zero address when the sender is not the admin","reverts","reverts",""
"passed","Thu Dec 02 19:29:31 GMT 2021","Thu Dec 02 19:29:49 GMT 2021","18114","","Contract: ERC721 with minted tokens transfers via safeTransferFrom without data to a user account when sent to the owner","","Contract: ERC721 with minted tokens transfers via safeTransferFrom without data to a user account when sent to the owner","keeps same tokens by index","keeps same tokens by index",""
"passed","Thu Dec 02 19:59:03 GMT 2021","Thu Dec 02 19:59:13 GMT 2021","10872","","Contract: ERC721Enumerable metadata token URI base URI","","Contract: ERC721Enumerable metadata token URI base URI","base URI can be set","base URI can be set",""
"passed","Thu Dec 02 20:07:10 GMT 2021","Thu Dec 02 20:07:15 GMT 2021","5266","","Contract: SafeCast toUint96","","Contract: SafeCast toUint96","downcasts 0","downcasts 0",""
"passed","Thu Dec 02 17:40:05 GMT 2021","Thu Dec 02 17:40:12 GMT 2021","6645","","Contract: AccessControl revoking","","Contract: AccessControl revoking","roles that are not had can be revoked","roles that are not had can be revoked",""
"passed","Thu Dec 02 19:47:10 GMT 2021","Thu Dec 02 19:47:30 GMT 2021","20082","","Contract: ERC721 with minted tokens safe mint via safeMint","","Contract: ERC721 with minted tokens safe mint via safeMint","calls onERC721Received — without data","calls onERC721Received — without data",""
"passed","Thu Dec 02 20:07:46 GMT 2021","Thu Dec 02 20:07:51 GMT 2021","5213","","Contract: SafeCast toUint128","","Contract: SafeCast toUint128","downcasts 2^128 - 1 (340282366920938463463374607431768211455)","downcasts 2^128 - 1 (340282366920938463463374607431768211455)",""
"passed","Thu Dec 02 20:05:43 GMT 2021","Thu Dec 02 20:05:48 GMT 2021","5110","","Contract: Math max","","Contract: Math max","is correctly detected in second argument position","is correctly detected in second argument position",""
"passed","Thu Dec 02 20:05:17 GMT 2021","Thu Dec 02 20:05:22 GMT 2021","5782","","Contract: Strings from uint256 - decimal format","","Contract: Strings from uint256 - decimal format","converts 0","converts 0",""
"passed","Thu Dec 02 18:47:30 GMT 2021","Thu Dec 02 18:47:41 GMT 2021","11632","","Contract: ERC20 decrease allowance when the spender is not the zero address when the sender does not have enough balance when the spender had an approved amount","","Contract: ERC20 decrease allowance when the spender is not the zero address when the sender does not have enough balance when the spender had an approved amount","sets the allowance to zero when all allowance is removed","sets the allowance to zero when all allowance is removed",""
"passed","Thu Dec 02 18:54:34 GMT 2021","Thu Dec 02 18:54:50 GMT 2021","15569","","Contract: ERC721Enumerable with minted tokens transfers via transferFrom when the given token ID does not exist","","Contract: ERC721Enumerable with minted tokens transfers via transferFrom when the given token ID does not exist","reverts","reverts",""
"passed","Thu Dec 02 19:39:31 GMT 2021","Thu Dec 02 19:39:57 GMT 2021","25960","","Contract: ERC721 with minted tokens transfers via safeTransferFrom without data to a valid receiver contract when called by the owner without an approved user","","Contract: ERC721 with minted tokens transfers via safeTransferFrom without data to a valid receiver contract when called by the owner without an approved user","emits a Transfer event","emits a Transfer event",""
"passed","Thu Dec 02 19:54:50 GMT 2021","Thu Dec 02 19:55:05 GMT 2021","15620","","Contract: ERC721Enumerable with minted tokens setApprovalForAll when the operator willing to approve is not the owner when the operator was set as not approved","","Contract: ERC721Enumerable with minted tokens setApprovalForAll when the operator willing to approve is not the owner when the operator was set as not approved","can unset the operator approval","can unset the operator approval",""
"passed","Thu Dec 02 18:48:46 GMT 2021","Thu Dec 02 18:48:54 GMT 2021","7400","","Contract: ERC1155PresetMinterPauser Contract interface AccessControl revokeRole(bytes32,address)","","Contract: ERC1155PresetMinterPauser Contract interface AccessControl revokeRole(bytes32,address)","has to be implemented","has to be implemented",""
"passed","Thu Dec 02 19:18:34 GMT 2021","Thu Dec 02 19:18:56 GMT 2021","21647","","Contract: ERC721 with minted tokens transfers via safeTransferFrom with data to a valid receiver contract when sent to the owner","","Contract: ERC721 with minted tokens transfers via safeTransferFrom with data to a valid receiver contract when sent to the owner","keeps same tokens by index","keeps same tokens by index",""
"passed","Thu Dec 02 20:00:02 GMT 2021","Thu Dec 02 20:00:07 GMT 2021","5389","","Contract: ERC721Enumerable Contract interface ERC721Enumerable tokenByIndex(uint256)","","Contract: ERC721Enumerable Contract interface ERC721Enumerable tokenByIndex(uint256)","has to be implemented","has to be implemented",""
"passed","Thu Dec 02 20:08:52 GMT 2021","Thu Dec 02 20:09:01 GMT 2021","8978","","Contract: RefundEscrow once deployed","","Contract: RefundEscrow once deployed","only the owner can enter closed state","only the owner can enter closed state",""
"skipped","Thu Dec 02 18:19:39 GMT 2021","Thu Dec 02 18:19:39 GMT 2021","0","","Contract: ERC1967Proxy without initialization when not sending balance","","Contract: ERC1967Proxy without initialization when not sending balance","sets the implementation address","sets the implementation address",""
"passed","Thu Dec 02 20:08:44 GMT 2021","Thu Dec 02 20:08:49 GMT 2021","5154","","Contract: SafeCast toUint256","","Contract: SafeCast toUint256","reverts when casting -1","reverts when casting -1",""
"passed","Thu Dec 02 19:53:45 GMT 2021","Thu Dec 02 19:53:57 GMT 2021","11390","","Contract: ERC721Enumerable with minted tokens approve when the given token ID does not exist","","Contract: ERC721Enumerable with minted tokens approve when the given token ID does not exist","reverts","reverts",""
"passed","Thu Dec 02 19:55:21 GMT 2021","Thu Dec 02 19:55:35 GMT 2021","14093","","Contract: ERC721Enumerable with minted tokens setApprovalForAll when the operator willing to approve is not the owner when the operator was already approved","","Contract: ERC721Enumerable with minted tokens setApprovalForAll when the operator willing to approve is not the owner when the operator was already approved","emits an approval event","emits an approval event",""
"passed","Thu Dec 02 20:11:57 GMT 2021","Thu Dec 02 20:12:11 GMT 2021","13772","","Contract: Address functionDelegateCall","","Contract: Address functionDelegateCall","delegate calls the requested function","delegate calls the requested function",""
"skipped","Thu Dec 02 18:41:22 GMT 2021","Thu Dec 02 18:41:22 GMT 2021","0","","Contract: ERC20VotesComp getPastTotalSupply","","Contract: ERC20VotesComp getPastTotalSupply","generally returns the voting balance at the appropriate checkpoint","generally returns the voting balance at the appropriate checkpoint",""
"passed","Thu Dec 02 18:43:02 GMT 2021","Thu Dec 02 18:43:18 GMT 2021","15920","","Contract: ERC721URIStorage token URI","","Contract: ERC721URIStorage token URI","token URI can be changed by changing the base URI","token URI can be changed by changing the base URI",""
"passed","Thu Dec 02 19:16:08 GMT 2021","Thu Dec 02 19:16:37 GMT 2021","28582","","Contract: ERC721 with minted tokens transfers via safeTransferFrom with data to a valid receiver contract when called by the owner without an approved user","","Contract: ERC721 with minted tokens transfers via safeTransferFrom with data to a valid receiver contract when called by the owner without an approved user","adjusts owners balances","adjusts owners balances",""
"passed","Thu Dec 02 18:48:36 GMT 2021","Thu Dec 02 18:48:45 GMT 2021","9342","","Contract: ERC20 increase allowance when the spender is not the zero address when the sender does not have enough balance when there was no approved amount before","","Contract: ERC20 increase allowance when the spender is not the zero address when the sender does not have enough balance when there was no approved amount before","approves the requested amount","approves the requested amount",""
"passed","Thu Dec 02 20:07:00 GMT 2021","Thu Dec 02 20:07:07 GMT 2021","7145","","Contract: EnumerableSet EnumerableBytes32Set remove","","Contract: EnumerableSet EnumerableBytes32Set remove","returns false when removing values not in the set","returns false when removing values not in the set",""
"passed","Thu Dec 02 19:43:57 GMT 2021","Thu Dec 02 19:44:18 GMT 2021","20564","","Contract: ERC721 with minted tokens transfers via safeTransferFrom without data to a valid receiver contract when the sender is not authorized for the token id","","Contract: ERC721 with minted tokens transfers via safeTransferFrom without data to a valid receiver contract when the sender is not authorized for the token id","reverts","reverts",""
"skipped","Thu Dec 02 17:46:36 GMT 2021","Thu Dec 02 17:46:36 GMT 2021","0","","Contract: TimelockController methods simple schedule","","Contract: TimelockController methods simple schedule","prevent overwritting active operation","prevent overwritting active operation",""
"passed","Thu Dec 02 18:44:50 GMT 2021","Thu Dec 02 18:45:10 GMT 2021","20268","","Contract: ERC721Enumerable with minted tokens transfers via transferFrom when called by the owner","","Contract: ERC721Enumerable with minted tokens transfers via transferFrom when called by the owner","clears the approval for the token ID","clears the approval for the token ID",""
"passed","Thu Dec 02 17:45:25 GMT 2021","Thu Dec 02 17:46:13 GMT 2021","47966","","Contract: PaymentSplitter once deployed distributes funds to payees","","Contract: PaymentSplitter once deployed distributes funds to payees","Token","Token",""
"passed","Thu Dec 02 20:09:04 GMT 2021","Thu Dec 02 20:09:10 GMT 2021","6329","","Contract: SafeCast toInt8","","Contract: SafeCast toInt8","downcasts -1","downcasts -1",""
"passed","Thu Dec 02 18:42:56 GMT 2021","Thu Dec 02 18:43:08 GMT 2021","12035","","Contract: ERC721Pausable when token is paused getApproved","","Contract: ERC721Pausable when token is paused getApproved","returns approved address","returns approved address",""
"passed","Thu Dec 02 19:20:33 GMT 2021","Thu Dec 02 19:20:52 GMT 2021","19043","","Contract: ERC721 with minted tokens transfers via safeTransferFrom without data to a user account when called by the owner","","Contract: ERC721 with minted tokens transfers via safeTransferFrom without data to a user account when called by the owner","transfers the ownership of the given token ID to the given address","transfers the ownership of the given token ID to the given address",""
"passed","Thu Dec 02 19:44:18 GMT 2021","Thu Dec 02 19:44:38 GMT 2021","19968","","Contract: ERC721 with minted tokens transfers via safeTransferFrom without data to a valid receiver contract when the given token ID does not exist","","Contract: ERC721 with minted tokens transfers via safeTransferFrom without data to a valid receiver contract when the given token ID does not exist","reverts","reverts",""
"passed","Thu Dec 02 19:27:02 GMT 2021","Thu Dec 02 19:27:24 GMT 2021","22140","","Contract: ERC721Enumerable with minted tokens transfers via safeTransferFrom without data to a user account when called by the owner without an approved user","","Contract: ERC721Enumerable with minted tokens transfers via safeTransferFrom without data to a user account when called by the owner without an approved user","transfers the ownership of the given token ID to the given address","transfers the ownership of the given token ID to the given address",""
"passed","Thu Dec 02 20:01:11 GMT 2021","Thu Dec 02 20:01:32 GMT 2021","21248","","Contract: ERC721Enumerable with minted tokens tokenOfOwnerByIndex after transferring all tokens to another user","","Contract: ERC721Enumerable with minted tokens tokenOfOwnerByIndex after transferring all tokens to another user","returns empty collection for original owner","returns empty collection for original owner",""
"passed","Thu Dec 02 19:22:44 GMT 2021","Thu Dec 02 19:23:02 GMT 2021","17891","","Contract: ERC721 with minted tokens transfers via safeTransferFrom without data to a user account when called by the approved individual","","Contract: ERC721 with minted tokens transfers via safeTransferFrom without data to a user account when called by the approved individual","emits a Transfer event","emits a Transfer event",""
"broken","Thu Dec 02 18:09:01 GMT 2021","Thu Dec 02 18:09:48 GMT 2021","46958","","Contract: Governor state Executed","","Contract: Governor state Executed","run","run",""
"passed","Thu Dec 02 20:05:33 GMT 2021","Thu Dec 02 20:05:38 GMT 2021","4100","","Contract: ERC165 Contract interface ERC165 supportsInterface(bytes4)","","Contract: ERC165 Contract interface ERC165 supportsInterface(bytes4)","has to be implemented","has to be implemented",""
"passed","Thu Dec 02 20:09:20 GMT 2021","Thu Dec 02 20:09:25 GMT 2021","5331","","Contract: SafeMath with custom revert message mod modulos correctly","","Contract: SafeMath with custom revert message mod modulos correctly","when the dividend is a multiple of the divisor","when the dividend is a multiple of the divisor",""
"passed","Thu Dec 02 18:45:01 GMT 2021","Thu Dec 02 18:45:19 GMT 2021","17991","","Contract: ERC1155Holder Contract interface ERC1155Receiver ERC165's supportsInterface(bytes4)","","Contract: ERC1155Holder Contract interface ERC1155Receiver ERC165's supportsInterface(bytes4)","uses less than 30k gas [skip-on-coverage]","uses less than 30k gas [skip-on-coverage]",""
"passed","Thu Dec 02 18:50:21 GMT 2021","Thu Dec 02 18:50:32 GMT 2021","10656","","Contract: ERC20 _burn for a non zero account for less amount than balance","","Contract: ERC20 _burn for a non zero account for less amount than balance","decrements totalSupply","decrements totalSupply",""
"skipped","Thu Dec 02 17:46:36 GMT 2021","Thu Dec 02 17:46:36 GMT 2021","0","","Contract: TimelockController usage scenario","","Contract: TimelockController usage scenario","call out of gas","call out of gas",""
"passed","Thu Dec 02 20:02:14 GMT 2021","Thu Dec 02 20:02:34 GMT 2021","19730","","Contract: ERC721Enumerable with minted tokens tokenByIndex","","Contract: ERC721Enumerable with minted tokens tokenByIndex","returns all tokens after burning token 79217 and minting new tokens","returns all tokens after burning token 79217 and minting new tokens",""
"failed","Thu Dec 02 18:20:22 GMT 2021","Thu Dec 02 18:20:28 GMT 2021","5616","","Contract: ERC1967Proxy initialization without parameters payable when not sending balance","","Contract: ERC1967Proxy initialization without parameters payable when not sending balance","has expected balance","has expected balance",""
"passed","Thu Dec 02 18:06:21 GMT 2021","Thu Dec 02 18:06:51 GMT 2021","29674","","Contract: Governor state Unset","","Contract: Governor state Unset","run","run",""
"passed","Thu Dec 02 19:50:08 GMT 2021","Thu Dec 02 19:50:20 GMT 2021","11441","","Contract: ERC721Enumerable with minted tokens safe mint via safeMint to a contract that does not implement the required function","","Contract: ERC721Enumerable with minted tokens safe mint via safeMint to a contract that does not implement the required function","reverts","reverts",""
"passed","Thu Dec 02 17:37:10 GMT 2021","Thu Dec 02 17:37:10 GMT 2021","5","tests.truffle","test_truffle","","","","test_truffle_migration",""
"passed","Thu Dec 02 18:44:00 GMT 2021","Thu Dec 02 18:44:08 GMT 2021","8555","","Contract: ERC721PresetMinterPauserAutoId Contract interface ERC721 isApprovedForAll(address,address)","","Contract: ERC721PresetMinterPauserAutoId Contract interface ERC721 isApprovedForAll(address,address)","has to be implemented","has to be implemented",""
"passed","Thu Dec 02 18:45:07 GMT 2021","Thu Dec 02 18:45:22 GMT 2021","14866","","Contract: ERC1155Supply after burn single","","Contract: ERC1155Supply after burn single","exist","exist",""
"passed","Thu Dec 02 18:43:15 GMT 2021","Thu Dec 02 18:43:24 GMT 2021","8748","","Contract: ERC721PresetMinterPauserAutoId Contract interface ERC721 balanceOf(address)","","Contract: ERC721PresetMinterPauserAutoId Contract interface ERC721 balanceOf(address)","has to be implemented","has to be implemented",""
"passed","Thu Dec 02 18:42:38 GMT 2021","Thu Dec 02 18:42:43 GMT 2021","5501","","Contract: ERC721Enumerable Contract interface ERC721 getApproved(uint256)","","Contract: ERC721Enumerable Contract interface ERC721 getApproved(uint256)","has to be implemented","has to be implemented",""
"passed","Thu Dec 02 19:02:13 GMT 2021","Thu Dec 02 19:02:34 GMT 2021","21341","","Contract: ERC721 with minted tokens transfers via safeTransferFrom with data to a user account when called by the owner without an approved user","","Contract: ERC721 with minted tokens transfers via safeTransferFrom with data to a user account when called by the owner without an approved user","emits an Approval event","emits an Approval event",""
"passed","Thu Dec 02 20:08:37 GMT 2021","Thu Dec 02 20:08:43 GMT 2021","5268","","Contract: SafeMath with custom revert message div","","Contract: SafeMath with custom revert message div","divides correctly","divides correctly",""
"passed","Thu Dec 02 18:50:13 GMT 2021","Thu Dec 02 18:50:21 GMT 2021","8375","","Contract: ERC20 _burn for a non zero account for entire balance","","Contract: ERC20 _burn for a non zero account for entire balance","emits Transfer event","emits Transfer event",""
"skipped","Thu Dec 02 17:46:36 GMT 2021","Thu Dec 02 17:46:36 GMT 2021","0","","Contract: TimelockController methods batch execute with scheduled operation on time","","Contract: TimelockController methods batch execute with scheduled operation on time","prevent non-executor from revealing","prevent non-executor from revealing",""
"failed","Thu Dec 02 20:07:30 GMT 2021","Thu Dec 02 20:07:46 GMT 2021","16094","","Contract: Address sendValue when sender contract has funds","","Contract: Address sendValue when sender contract has funds","sends non-zero amounts","sends non-zero amounts",""
"passed","Thu Dec 02 20:07:50 GMT 2021","Thu Dec 02 20:08:01 GMT 2021","10831","","Contract: ERC165Checker ERC165 and many interfaces supported","","Contract: ERC165Checker ERC165 and many interfaces supported","supports ERC165","supports ERC165",""
"passed","Thu Dec 02 18:54:30 GMT 2021","Thu Dec 02 18:54:54 GMT 2021","23440","","Contract: ERC1155 like an ERC1155 safeTransferFrom when sending to a valid receiver with data","","Contract: ERC1155 like an ERC1155 safeTransferFrom when sending to a valid receiver with data","calls onERC1155Received","calls onERC1155Received",""
