"Status","Start Time","Stop Time","Duration in ms","Parent Suite","Suite","Sub Suite","Test Class","Test Method","Name","Description"
"passed","Thu Dec 02 18:47:01 GMT 2021","Thu Dec 02 18:47:08 GMT 2021","7630","","Contract: ERC20 decrease allowance when the spender is not the zero address when the sender does not have enough balance when there was no approved amount before","","Contract: ERC20 decrease allowance when the spender is not the zero address when the sender does not have enough balance when there was no approved amount before","reverts","reverts",""
"passed","Thu Dec 02 19:32:29 GMT 2021","Thu Dec 02 19:32:54 GMT 2021","24654","","Contract: ERC721 with minted tokens transfers via safeTransferFrom without data to a valid receiver contract when called by the owner","","Contract: ERC721 with minted tokens transfers via safeTransferFrom without data to a valid receiver contract when called by the owner","clears the approval for the token ID","clears the approval for the token ID",""
"passed","Thu Dec 02 18:20:12 GMT 2021","Thu Dec 02 18:20:20 GMT 2021","8138","","Contract: Initializable complex testing with inheritance","","Contract: Initializable complex testing with inheritance","initializes gramps","initializes gramps",""
"passed","Thu Dec 02 19:58:03 GMT 2021","Thu Dec 02 19:58:09 GMT 2021","6272","","Contract: ERC721Enumerable Contract interface ERC721Metadata ERC165's supportsInterface(bytes4)","","Contract: ERC721Enumerable Contract interface ERC721Metadata ERC165's supportsInterface(bytes4)","uses less than 30k gas [skip-on-coverage]","uses less than 30k gas [skip-on-coverage]",""
"passed","Thu Dec 02 18:44:05 GMT 2021","Thu Dec 02 18:44:11 GMT 2021","6574","","Contract: ERC1155Supply before mint","","Contract: ERC1155Supply before mint","exist","exist",""
"passed","Thu Dec 02 18:24:17 GMT 2021","Thu Dec 02 18:24:28 GMT 2021","11632","","Contract: TransparentUpgradeableProxy upgradeToAndCall without migrations when the call does not fail when the sender is the admin","","Contract: TransparentUpgradeableProxy upgradeToAndCall without migrations when the call does not fail when the sender is the admin","emits an event","emits an event",""
"passed","Thu Dec 02 20:07:09 GMT 2021","Thu Dec 02 20:07:16 GMT 2021","6910","","Contract: Arrays findUpperBound Even number of elements","","Contract: Arrays findUpperBound Even number of elements","returns 0 for the first element","returns 0 for the first element",""
"passed","Thu Dec 02 18:44:27 GMT 2021","Thu Dec 02 18:44:44 GMT 2021","17292","","Contract: ERC1155Holder Contract interface ERC165 ERC165's supportsInterface(bytes4)","","Contract: ERC1155Holder Contract interface ERC165 ERC165's supportsInterface(bytes4)","claims support [skip-on-coverage]","claims support [skip-on-coverage]",""
"passed","Thu Dec 02 17:40:44 GMT 2021","Thu Dec 02 17:40:52 GMT 2021","8355","","Contract: AccessControl renouncing with granted role","","Contract: AccessControl renouncing with granted role","bearer can renounce role","bearer can renounce role",""
"passed","Thu Dec 02 18:43:29 GMT 2021","Thu Dec 02 18:43:41 GMT 2021","12272","","Contract: ERC721URIStorage token URI","","Contract: ERC721URIStorage token URI","tokens without URI can be burnt ","tokens without URI can be burnt ",""
"passed","Thu Dec 02 18:41:42 GMT 2021","Thu Dec 02 18:41:49 GMT 2021","7019","","Contract: ERC20","","Contract: ERC20","has 18 decimals","has 18 decimals",""
"passed","Thu Dec 02 19:12:04 GMT 2021","Thu Dec 02 19:12:31 GMT 2021","26965","","Contract: ERC721Enumerable with minted tokens transfers via safeTransferFrom with data to a valid receiver contract when called by the operator","","Contract: ERC721Enumerable with minted tokens transfers via safeTransferFrom with data to a valid receiver contract when called by the operator","transfers the ownership of the given token ID to the given address","transfers the ownership of the given token ID to the given address",""
"passed","Thu Dec 02 19:21:29 GMT 2021","Thu Dec 02 19:21:48 GMT 2021","18706","","Contract: ERC721Enumerable with minted tokens transfers via safeTransferFrom without data to a user account when called by the owner","","Contract: ERC721Enumerable with minted tokens transfers via safeTransferFrom without data to a user account when called by the owner","emits a Transfer event","emits a Transfer event",""
"passed","Thu Dec 02 20:11:46 GMT 2021","Thu Dec 02 20:11:50 GMT 2021","4766","","Contract: SafeCast toInt64","","Contract: SafeCast toInt64","reverts when downcasting 2^63 (9223372036854775808)","reverts when downcasting 2^63 (9223372036854775808)",""
"passed","Thu Dec 02 18:58:16 GMT 2021","Thu Dec 02 18:58:34 GMT 2021","18429","","Contract: ERC721 with minted tokens transfers via safeTransferFrom with data to a user account when called by the approved individual","","Contract: ERC721 with minted tokens transfers via safeTransferFrom with data to a user account when called by the approved individual","emits an Approval event","emits an Approval event",""
"passed","Thu Dec 02 19:32:43 GMT 2021","Thu Dec 02 19:33:08 GMT 2021","25594","","Contract: ERC721Enumerable with minted tokens transfers via safeTransferFrom without data to a valid receiver contract when called by the owner","","Contract: ERC721Enumerable with minted tokens transfers via safeTransferFrom without data to a valid receiver contract when called by the owner","transfers the ownership of the given token ID to the given address","transfers the ownership of the given token ID to the given address",""
"passed","Thu Dec 02 19:58:15 GMT 2021","Thu Dec 02 19:58:21 GMT 2021","5335","","Contract: ERC721Enumerable Contract interface ERC721Metadata name()","","Contract: ERC721Enumerable Contract interface ERC721Metadata name()","has to be implemented","has to be implemented",""
"passed","Thu Dec 02 20:07:57 GMT 2021","Thu Dec 02 20:08:02 GMT 2021","5472","","Contract: SafeCast toUint128","","Contract: SafeCast toUint128","reverts when downcasting 2^128 + 1 (340282366920938463463374607431768211457)","reverts when downcasting 2^128 + 1 (340282366920938463463374607431768211457)",""
"passed","Thu Dec 02 18:56:17 GMT 2021","Thu Dec 02 18:56:33 GMT 2021","15652","","Contract: ERC1155 like an ERC1155 safeBatchTransferFrom","","Contract: ERC1155 like an ERC1155 safeBatchTransferFrom","reverts when transferring to zero address","reverts when transferring to zero address",""
"passed","Thu Dec 02 17:34:58 GMT 2021","Thu Dec 02 17:34:58 GMT 2021","206","tests.brownie.token.tests","test_approve","","","","test_initial_approval_is_zero[1]",""
"skipped","Thu Dec 02 18:41:22 GMT 2021","Thu Dec 02 18:41:22 GMT 2021","0","","Contract: ERC20VotesComp set delegation with signature","","Contract: ERC20VotesComp set delegation with signature","rejects reused signature","rejects reused signature",""
"passed","Thu Dec 02 17:34:59 GMT 2021","Thu Dec 02 17:34:59 GMT 2021","210","tests.brownie.token.tests","test_approve","","","","test_initial_approval_is_zero[3]",""
"passed","Thu Dec 02 18:54:06 GMT 2021","Thu Dec 02 18:54:30 GMT 2021","24432","","Contract: ERC1155 like an ERC1155 safeTransferFrom when sending to a valid receiver with data","","Contract: ERC1155 like an ERC1155 safeTransferFrom when sending to a valid receiver with data","emits a TransferSingle log","emits a TransferSingle log",""
"passed","Thu Dec 02 18:51:17 GMT 2021","Thu Dec 02 18:51:39 GMT 2021","21810","","Contract: ERC1155 like an ERC1155 safeTransferFrom when called by an operator on behalf of the multiTokenHolder when operator is approved by multiTokenHolder","","Contract: ERC1155 like an ERC1155 safeTransferFrom when called by an operator on behalf of the multiTokenHolder when operator is approved by multiTokenHolder","preserves operator's balances not involved in the transfer","preserves operator's balances not involved in the transfer",""
"failed","Thu Dec 02 18:21:22 GMT 2021","Thu Dec 02 18:21:24 GMT 2021","1541","","Contract: ERC1967Proxy initialization with parameters reverting initialization","","Contract: ERC1967Proxy initialization with parameters reverting initialization","reverts","reverts",""
"passed","Thu Dec 02 20:08:22 GMT 2021","Thu Dec 02 20:08:27 GMT 2021","5727","","Contract: SafeMath with default revert message mod modulos correctly","","Contract: SafeMath with default revert message mod modulos correctly","when the dividend is a multiple of the divisor","when the dividend is a multiple of the divisor",""
"passed","Thu Dec 02 20:06:34 GMT 2021","Thu Dec 02 20:06:42 GMT 2021","8949","","Contract: ERC165Checker ERC165 supported","","Contract: ERC165Checker ERC165 supported","supports ERC165","supports ERC165",""
"passed","Thu Dec 02 19:41:54 GMT 2021","Thu Dec 02 19:42:22 GMT 2021","27515","","Contract: ERC721Enumerable with minted tokens transfers via safeTransferFrom without data to a valid receiver contract when called by the owner without an approved user","","Contract: ERC721Enumerable with minted tokens transfers via safeTransferFrom without data to a valid receiver contract when called by the owner without an approved user","emits an Approval event","emits an Approval event",""
"passed","Thu Dec 02 20:06:08 GMT 2021","Thu Dec 02 20:06:13 GMT 2021","4871","","Contract: SafeMath with flag mul","","Contract: SafeMath with flag mul","reverts on multiplication overflow","reverts on multiplication overflow",""
"passed","Thu Dec 02 19:55:18 GMT 2021","Thu Dec 02 19:55:25 GMT 2021","7088","","Contract: ERC721 _burn","","Contract: ERC721 _burn","reverts when burning a non-existent token id","reverts when burning a non-existent token id",""
"passed","Thu Dec 02 20:06:50 GMT 2021","Thu Dec 02 20:06:55 GMT 2021","5108","","Contract: SafeMath with flag mod modulos correctly","","Contract: SafeMath with flag mod modulos correctly","when the dividend is larger than the divisor","when the dividend is larger than the divisor",""
"passed","Thu Dec 02 18:46:23 GMT 2021","Thu Dec 02 18:46:32 GMT 2021","8429","","Contract: ERC1155 like an ERC1155 balanceOf when accounts don't own tokens","","Contract: ERC1155 like an ERC1155 balanceOf when accounts don't own tokens","returns zero for given addresses","returns zero for given addresses",""
"passed","Thu Dec 02 19:06:28 GMT 2021","Thu Dec 02 19:06:34 GMT 2021","5291","","Contract: ERC1155 like an ERC1155 Contract interface ERC1155 setApprovalForAll(address,bool)","","Contract: ERC1155 like an ERC1155 Contract interface ERC1155 setApprovalForAll(address,bool)","has to be implemented","has to be implemented",""
"failed","Thu Dec 02 18:20:52 GMT 2021","Thu Dec 02 18:20:57 GMT 2021","5172","","Contract: ERC1967Proxy initialization with parameters non payable when sending some balance","","Contract: ERC1967Proxy initialization with parameters non payable when sending some balance","reverts","reverts",""
"passed","Thu Dec 02 19:00:21 GMT 2021","Thu Dec 02 19:00:48 GMT 2021","27297","","Contract: ERC1155 like an ERC1155 safeBatchTransferFrom when sending to a valid receiver without data","","Contract: ERC1155 like an ERC1155 safeBatchTransferFrom when sending to a valid receiver without data","emits a TransferBatch log","emits a TransferBatch log",""
"passed","Thu Dec 02 20:11:36 GMT 2021","Thu Dec 02 20:11:41 GMT 2021","4937","","Contract: SafeCast toInt64","","Contract: SafeCast toInt64","reverts when downcasting -2^63 - 1 (-9223372036854775809)","reverts when downcasting -2^63 - 1 (-9223372036854775809)",""
"passed","Thu Dec 02 17:44:22 GMT 2021","Thu Dec 02 17:44:39 GMT 2021","16813","","Contract: PaymentSplitter once deployed release Ether","","Contract: PaymentSplitter once deployed release Ether","reverts if non-payee want to claim","reverts if non-payee want to claim",""
"passed","Thu Dec 02 18:51:47 GMT 2021","Thu Dec 02 18:52:06 GMT 2021","19688","","Contract: ERC721 with minted tokens transfers via transferFrom when called by the owner without an approved user","","Contract: ERC721 with minted tokens transfers via transferFrom when called by the owner without an approved user","emits an Approval event","emits an Approval event",""
"passed","Thu Dec 02 18:17:33 GMT 2021","Thu Dec 02 18:17:40 GMT 2021","7030","","Contract: MinimalForwarder with message verify invalid signature","","Contract: MinimalForwarder with message verify invalid signature","tampered from","tampered from",""
"passed","Thu Dec 02 19:21:09 GMT 2021","Thu Dec 02 19:21:29 GMT 2021","20146","","Contract: ERC721Enumerable with minted tokens transfers via safeTransferFrom without data to a user account when called by the owner","","Contract: ERC721Enumerable with minted tokens transfers via safeTransferFrom without data to a user account when called by the owner","transfers the ownership of the given token ID to the given address","transfers the ownership of the given token ID to the given address",""
"passed","Thu Dec 02 18:46:09 GMT 2021","Thu Dec 02 18:46:18 GMT 2021","8840","","Contract: ERC721PresetMinterPauserAutoId Contract interface AccessControl revokeRole(bytes32,address)","","Contract: ERC721PresetMinterPauserAutoId Contract interface AccessControl revokeRole(bytes32,address)","has to be implemented","has to be implemented",""
"passed","Thu Dec 02 18:31:28 GMT 2021","Thu Dec 02 18:31:34 GMT 2021","5918","","Contract: ReentrancyGuard","","Contract: ReentrancyGuard","does not allow indirect local recursion","does not allow indirect local recursion",""
"passed","Thu Dec 02 19:54:18 GMT 2021","Thu Dec 02 19:54:30 GMT 2021","11632","","Contract: ERC721 with minted tokens getApproved when token has been minted ","","Contract: ERC721 with minted tokens getApproved when token has been minted ","should return the zero address","should return the zero address",""
"passed","Thu Dec 02 19:19:08 GMT 2021","Thu Dec 02 19:19:31 GMT 2021","23056","","Contract: ERC721Enumerable with minted tokens transfers via safeTransferFrom with data to a valid receiver contract when sent to the owner","","Contract: ERC721Enumerable with minted tokens transfers via safeTransferFrom with data to a valid receiver contract when sent to the owner","keeps same tokens by index","keeps same tokens by index",""
"passed","Thu Dec 02 20:08:37 GMT 2021","Thu Dec 02 20:08:45 GMT 2021","7441","","Contract: EnumerableMap read tryGet","","Contract: EnumerableMap read tryGet","missing value","missing value",""
"passed","Thu Dec 02 18:41:54 GMT 2021","Thu Dec 02 18:42:01 GMT 2021","6915","","Contract: ERC721Enumerable Contract interface ERC165 ERC165's supportsInterface(bytes4)","","Contract: ERC721Enumerable Contract interface ERC165 ERC165's supportsInterface(bytes4)","claims support [skip-on-coverage]","claims support [skip-on-coverage]",""
"skipped","Thu Dec 02 18:41:22 GMT 2021","Thu Dec 02 18:41:22 GMT 2021","0","","Contract: ERC20VotesComp Compound test suite numCheckpoints","","Contract: ERC20VotesComp Compound test suite numCheckpoints","does not add more than one checkpoint in a block","does not add more than one checkpoint in a block",""
"passed","Thu Dec 02 19:42:31 GMT 2021","Thu Dec 02 19:42:53 GMT 2021","21857","","Contract: ERC721 with minted tokens transfers via safeTransferFrom without data to a valid receiver contract when sent to the owner","","Contract: ERC721 with minted tokens transfers via safeTransferFrom without data to a valid receiver contract when sent to the owner","emits only a transfer event","emits only a transfer event",""
"failed","Thu Dec 02 20:09:24 GMT 2021","Thu Dec 02 20:09:36 GMT 2021","11669","","Contract: Create2 deploy","","Contract: Create2 deploy","fails deploying a contract if factory contract does not have sufficient balance","fails deploying a contract if factory contract does not have sufficient balance",""
"passed","Thu Dec 02 19:47:52 GMT 2021","Thu Dec 02 19:48:11 GMT 2021","19506","","Contract: ERC721Enumerable with minted tokens transfers via safeTransferFrom to a receiver contract that panics","","Contract: ERC721Enumerable with minted tokens transfers via safeTransferFrom to a receiver contract that panics","reverts","reverts",""
"passed","Thu Dec 02 19:52:39 GMT 2021","Thu Dec 02 19:52:50 GMT 2021","11383","","Contract: ERC721Enumerable with minted tokens approve when the address that receives the approval is the owner","","Contract: ERC721Enumerable with minted tokens approve when the address that receives the approval is the owner","reverts","reverts",""
"passed","Thu Dec 02 20:05:43 GMT 2021","Thu Dec 02 20:05:48 GMT 2021","5179","","Contract: Strings from uint256 - hex format","","Contract: Strings from uint256 - hex format","converts MAX_UINT256","converts MAX_UINT256",""
"passed","Thu Dec 02 20:09:10 GMT 2021","Thu Dec 02 20:09:15 GMT 2021","5028","","Contract: SafeCast toInt8","","Contract: SafeCast toInt8","downcasts -2^7 (-128)","downcasts -2^7 (-128)",""
"passed","Thu Dec 02 19:20:52 GMT 2021","Thu Dec 02 19:21:10 GMT 2021","17804","","Contract: ERC721 with minted tokens transfers via safeTransferFrom without data to a user account when called by the owner","","Contract: ERC721 with minted tokens transfers via safeTransferFrom without data to a user account when called by the owner","emits a Transfer event","emits a Transfer event",""
"broken","Thu Dec 02 18:12:05 GMT 2021","Thu Dec 02 18:13:01 GMT 2021","55872","","Contract: Governor Cancel After deadline","","Contract: Governor Cancel After deadline","run","run",""
"passed","Thu Dec 02 17:53:08 GMT 2021","Thu Dec 02 17:53:35 GMT 2021","26321","","Contract: Governor Contract interface Governor quorum(uint256)","","Contract: Governor Contract interface Governor quorum(uint256)","has to be implemented","has to be implemented",""
"broken","Thu Dec 02 18:10:18 GMT 2021","Thu Dec 02 18:11:10 GMT 2021","51647","","Contract: Governor Cancel After proposal","","Contract: Governor Cancel After proposal","run","run",""
"passed","Thu Dec 02 19:08:03 GMT 2021","Thu Dec 02 19:08:10 GMT 2021","6683","","Contract: ERC1155 internal functions _burn","","Contract: ERC1155 internal functions _burn","reverts when burning a non-existent token id","reverts when burning a non-existent token id",""
"passed","Thu Dec 02 19:09:25 GMT 2021","Thu Dec 02 19:09:45 GMT 2021","19448","","Contract: ERC1155 internal functions _burnBatch with minted-then-burnt tokens","","Contract: ERC1155 internal functions _burnBatch with minted-then-burnt tokens","accounts for both minting and burning","accounts for both minting and burning",""
"passed","Thu Dec 02 18:22:33 GMT 2021","Thu Dec 02 18:22:44 GMT 2021","11493","","Contract: TransparentUpgradeableProxy initialization with parameters payable when not sending balance","","Contract: TransparentUpgradeableProxy initialization with parameters payable when not sending balance","initializes the proxy","initializes the proxy",""
"passed","Thu Dec 02 18:55:25 GMT 2021","Thu Dec 02 18:55:44 GMT 2021","18988","","Contract: ERC721 with minted tokens transfers via safeTransferFrom with data to a user account when called by the owner","","Contract: ERC721 with minted tokens transfers via safeTransferFrom with data to a user account when called by the owner","transfers the ownership of the given token ID to the given address","transfers the ownership of the given token ID to the given address",""
"failed","Thu Dec 02 18:23:49 GMT 2021","Thu Dec 02 18:23:57 GMT 2021","8272","","Contract: Clones cloneDeterministic initialization with parameters payable when sending some balance","","Contract: Clones cloneDeterministic initialization with parameters payable when sending some balance","has expected balance","has expected balance",""
"passed","Thu Dec 02 20:06:20 GMT 2021","Thu Dec 02 20:06:25 GMT 2021","4919","","Contract: SafeCast toUint32","","Contract: SafeCast toUint32","downcasts 0","downcasts 0",""
"passed","Thu Dec 02 18:50:27 GMT 2021","Thu Dec 02 18:50:44 GMT 2021","17813","","Contract: ERC721 with minted tokens transfers via transferFrom when called by the operator","","Contract: ERC721 with minted tokens transfers via transferFrom when called by the operator","adjusts owners tokens by index","adjusts owners tokens by index",""
"passed","Thu Dec 02 18:20:40 GMT 2021","Thu Dec 02 18:20:46 GMT 2021","6003","","Contract: ERC1967Proxy initialization with parameters non payable when not sending balance","","Contract: ERC1967Proxy initialization with parameters non payable when not sending balance","initializes the proxy","initializes the proxy",""
"passed","Thu Dec 02 18:00:10 GMT 2021","Thu Dec 02 18:00:53 GMT 2021","42492","","Contract: Governor scenario missing proposal","","Contract: Governor scenario missing proposal","run","run",""
"passed","Thu Dec 02 20:12:59 GMT 2021","Thu Dec 02 20:13:04 GMT 2021","4952","","Contract: SafeCast toInt256","","Contract: SafeCast toInt256","reverts when casting UINT256_MAX (115792089237316195423570985008687907853269984665640564039457584007913129639935)","reverts when casting UINT256_MAX (115792089237316195423570985008687907853269984665640564039457584007913129639935)",""
"failed","Thu Dec 02 18:21:47 GMT 2021","Thu Dec 02 18:21:59 GMT 2021","11725","","Contract: TransparentUpgradeableProxy initialization without parameters payable when sending some balance","","Contract: TransparentUpgradeableProxy initialization without parameters payable when sending some balance","has expected balance","has expected balance",""
"passed","Thu Dec 02 18:17:47 GMT 2021","Thu Dec 02 18:17:53 GMT 2021","6589","","Contract: MinimalForwarder with message verify invalid signature","","Contract: MinimalForwarder with message verify invalid signature","tampered value","tampered value",""
"passed","Thu Dec 02 18:42:41 GMT 2021","Thu Dec 02 18:42:54 GMT 2021","12451","","Contract: ERC20FlashMint flashLoan","","Contract: ERC20FlashMint flashLoan","more than maxFlashLoan","more than maxFlashLoan",""
"passed","Thu Dec 02 18:31:19 GMT 2021","Thu Dec 02 18:31:25 GMT 2021","6001","","Contract: Pausable when unpaused when paused","","Contract: Pausable when unpaused when paused","emits a Paused event","emits a Paused event",""
"skipped","Thu Dec 02 18:41:22 GMT 2021","Thu Dec 02 18:41:22 GMT 2021","0","","Contract: ERC20VotesComp set delegation with signature","","Contract: ERC20VotesComp set delegation with signature","accept signed delegation","accept signed delegation",""
"passed","Thu Dec 02 18:46:27 GMT 2021","Thu Dec 02 18:46:37 GMT 2021","9993","","Contract: ERC721PresetMinterPauserAutoId Contract interface AccessControlEnumerable ERC165's supportsInterface(bytes4)","","Contract: ERC721PresetMinterPauserAutoId Contract interface AccessControlEnumerable ERC165's supportsInterface(bytes4)","uses less than 30k gas [skip-on-coverage]","uses less than 30k gas [skip-on-coverage]",""
"passed","Thu Dec 02 18:21:33 GMT 2021","Thu Dec 02 18:21:47 GMT 2021","13937","","Contract: TransparentUpgradeableProxy initialization without parameters payable when sending some balance","","Contract: TransparentUpgradeableProxy initialization without parameters payable when sending some balance","initializes the proxy","initializes the proxy",""
"passed","Thu Dec 02 18:43:08 GMT 2021","Thu Dec 02 18:43:20 GMT 2021","11599","","Contract: ERC721Pausable when token is paused balanceOf","","Contract: ERC721Pausable when token is paused balanceOf","returns the amount of tokens owned by the given address","returns the amount of tokens owned by the given address",""
"passed","Thu Dec 02 18:29:16 GMT 2021","Thu Dec 02 18:29:39 GMT 2021","22506","","Contract: TransparentUpgradeableProxy regression","","Contract: TransparentUpgradeableProxy regression","should remove function","should remove function",""
"passed","Thu Dec 02 18:41:31 GMT 2021","Thu Dec 02 18:41:32 GMT 2021","999","","Contract: ERC20PresetFixedSupply","","Contract: ERC20PresetFixedSupply","total supply is equal to initial supply","total supply is equal to initial supply",""
"passed","Thu Dec 02 19:34:24 GMT 2021","Thu Dec 02 19:34:50 GMT 2021","26145","","Contract: ERC721Enumerable with minted tokens transfers via safeTransferFrom without data to a valid receiver contract when called by the owner","","Contract: ERC721Enumerable with minted tokens transfers via safeTransferFrom without data to a valid receiver contract when called by the owner","adjusts owners balances","adjusts owners balances",""
"passed","Thu Dec 02 19:00:29 GMT 2021","Thu Dec 02 19:00:49 GMT 2021","19815","","Contract: ERC721 with minted tokens transfers via safeTransferFrom with data to a user account when called by the operator","","Contract: ERC721 with minted tokens transfers via safeTransferFrom with data to a user account when called by the operator","adjusts owners balances","adjusts owners balances",""
"skipped","Thu Dec 02 18:21:10 GMT 2021","Thu Dec 02 18:21:10 GMT 2021","0","","Contract: TransparentUpgradeableProxy initialization without parameters payable when not sending balance","","Contract: TransparentUpgradeableProxy initialization without parameters payable when not sending balance","sets the implementation address","sets the implementation address",""
"passed","Thu Dec 02 18:52:06 GMT 2021","Thu Dec 02 18:52:27 GMT 2021","20737","","Contract: ERC721 with minted tokens transfers via transferFrom when called by the owner without an approved user","","Contract: ERC721 with minted tokens transfers via transferFrom when called by the owner without an approved user","adjusts owners balances","adjusts owners balances",""
"passed","Thu Dec 02 20:09:21 GMT 2021","Thu Dec 02 20:09:26 GMT 2021","5243","","Contract: SafeCast toInt8","","Contract: SafeCast toInt8","reverts when downcasting -2^7 - 1 (-129)","reverts when downcasting -2^7 - 1 (-129)",""
