"Status","Start Time","Stop Time","Duration in ms","Parent Suite","Suite","Sub Suite","Test Class","Test Method","Name","Description"
"passed","Wed Dec 08 15:42:24 GMT 2021","Wed Dec 08 15:42:41 GMT 2021","17126","","Contract: Math min","","Contract: Math min","is correctly detected in second argument position","is correctly detected in second argument position",""
"skipped","Wed Dec 08 15:04:47 GMT 2021","Wed Dec 08 15:04:47 GMT 2021","0","","Contract: TimelockController methods simple schedule","","Contract: TimelockController methods simple schedule","prevent overwritting active operation","prevent overwritting active operation",""
"passed","Wed Dec 08 15:46:17 GMT 2021","Wed Dec 08 15:46:27 GMT 2021","9960","","Contract: TimersTimestamp","","Contract: TimersTimestamp","pending","pending",""
"skipped","Wed Dec 08 15:12:25 GMT 2021","Wed Dec 08 15:12:25 GMT 2021","0","","Contract: ERC1967Proxy initialization without parameters payable when sending some balance","","Contract: ERC1967Proxy initialization without parameters payable when sending some balance","sets the implementation address","sets the implementation address",""
"passed","Wed Dec 08 15:34:58 GMT 2021","Wed Dec 08 15:35:04 GMT 2021","6757","","Contract: SafeERC20 with address that has no contract code","","Contract: SafeERC20 with address that has no contract code","reverts on increaseAllowance","reverts on increaseAllowance",""
"broken","Wed Dec 08 15:19:56 GMT 2021","Wed Dec 08 15:21:38 GMT 2021","102153","","Contract: Pausable when unpaused","","Contract: Pausable when unpaused","cannot take drastic measure in non-pause","cannot take drastic measure in non-pause",""
"passed","Wed Dec 08 15:38:51 GMT 2021","Wed Dec 08 15:39:07 GMT 2021","15236","","Contract: ERC721 Contract interface ERC165 ERC165's supportsInterface(bytes4)","","Contract: ERC721 Contract interface ERC165 ERC165's supportsInterface(bytes4)","uses less than 30k gas [skip-on-coverage]","uses less than 30k gas [skip-on-coverage]",""
"skipped","Wed Dec 08 15:34:40 GMT 2021","Wed Dec 08 15:34:40 GMT 2021","0","","Contract: ERC20Votes getPastTotalSupply","","Contract: ERC20Votes getPastTotalSupply","reverts if block number >= current block","reverts if block number >= current block",""
"broken","Wed Dec 08 15:08:41 GMT 2021","Wed Dec 08 15:09:55 GMT 2021","73420","","Contract: ProxyAdmin","","Contract: ProxyAdmin","has an owner","has an owner",""
"passed","Wed Dec 08 15:48:45 GMT 2021","Wed Dec 08 15:48:51 GMT 2021","5938","","Contract: EnumerableSet EnumerableAddressSet","","Contract: EnumerableSet EnumerableAddressSet","starts empty","starts empty",""
"passed","Wed Dec 08 15:35:28 GMT 2021","Wed Dec 08 15:35:40 GMT 2021","12143","","Contract: ERC20 total supply","","Contract: ERC20 total supply","returns the total amount of tokens","returns the total amount of tokens",""
"passed","Wed Dec 08 15:42:54 GMT 2021","Wed Dec 08 15:43:01 GMT 2021","7023","","Contract: ERC1820Implementer with registered interfaces","","Contract: ERC1820Implementer with registered interfaces","returns false when interface implementation for non-supported addresses is queried","returns false when interface implementation for non-supported addresses is queried",""
"broken","Wed Dec 08 15:38:55 GMT 2021","Wed Dec 08 15:40:53 GMT 2021","118052","","Contract: ERC1155Holder","","Contract: ERC1155Holder","receives ERC1155 tokens from a single ID","receives ERC1155 tokens from a single ID",""
"skipped","Wed Dec 08 15:34:24 GMT 2021","Wed Dec 08 15:34:24 GMT 2021","0","","Contract: ERC20VotesComp transfers","","Contract: ERC20VotesComp transfers","full delegation","full delegation",""
"passed","Wed Dec 08 15:08:46 GMT 2021","Wed Dec 08 15:08:59 GMT 2021","13266","","Contract: Initializable basic testing without inheritance after initialize","","Contract: Initializable basic testing without inheritance after initialize","initializer does not run again","initializer does not run again",""
"passed","Wed Dec 08 15:35:22 GMT 2021","Wed Dec 08 15:35:58 GMT 2021","35937","","Contract: ERC721Holder","","Contract: ERC721Holder","receives an ERC721 token","receives an ERC721 token",""
"passed","Wed Dec 08 15:13:10 GMT 2021","Wed Dec 08 15:13:24 GMT 2021","14300","","Contract: UUPSUpgradeable","","Contract: UUPSUpgradeable","reject proxy address as implementation","reject proxy address as implementation",""
"passed","Wed Dec 08 15:42:51 GMT 2021","Wed Dec 08 15:43:30 GMT 2021","39338","","Contract: SafeMath with flag mul","","Contract: SafeMath with flag mul","multiplies correctly","multiplies correctly",""
"skipped","Wed Dec 08 15:34:24 GMT 2021","Wed Dec 08 15:34:24 GMT 2021","0","","Contract: ERC20VotesComp set delegation with signature","","Contract: ERC20VotesComp set delegation with signature","rejects reused signature","rejects reused signature",""
"passed","Wed Dec 08 15:09:34 GMT 2021","Wed Dec 08 15:09:48 GMT 2021","13424","","Contract: Initializable complex testing with inheritance","","Contract: Initializable complex testing with inheritance","initializes gramps","initializes gramps",""
"passed","Wed Dec 08 15:43:05 GMT 2021","Wed Dec 08 15:43:14 GMT 2021","8356","","Contract: Strings from uint256 - hex format","","Contract: Strings from uint256 - hex format","converts MAX_UINT256","converts MAX_UINT256",""
"skipped","Wed Dec 08 15:34:24 GMT 2021","Wed Dec 08 15:34:24 GMT 2021","0","","Contract: ERC20VotesComp Compound test suite getPriorVotes","","Contract: ERC20VotesComp Compound test suite getPriorVotes","reverts if block number >= current block","reverts if block number >= current block",""
"broken","Wed Dec 08 15:04:46 GMT 2021","Wed Dec 08 15:06:29 GMT 2021","102716","","Contract: GovernorComp voting with comp token","","Contract: GovernorComp voting with comp token","run","run",""
"passed","Wed Dec 08 15:01:24 GMT 2021","Wed Dec 08 15:01:25 GMT 2021","1064","Ethers.js","","","","","shouldCheckStaticJsonRpcProvider",""
"passed","Wed Dec 08 15:43:17 GMT 2021","Wed Dec 08 15:43:22 GMT 2021","4178","","Contract: Strings from uint256 - fixed hex format","","Contract: Strings from uint256 - fixed hex format","converts a positive number (short)","converts a positive number (short)",""
"skipped","Wed Dec 08 15:04:47 GMT 2021","Wed Dec 08 15:04:47 GMT 2021","0","","Contract: TimelockController usage scenario","","Contract: TimelockController usage scenario","call payable with eth","call payable with eth",""
"passed","Wed Dec 08 15:35:17 GMT 2021","Wed Dec 08 15:35:52 GMT 2021","34957","","Contract: ERC20Pausable pausable token transfer from","","Contract: ERC20Pausable pausable token transfer from","allows to transfer from when unpaused","allows to transfer from when unpaused",""
"passed","Wed Dec 08 15:17:31 GMT 2021","Wed Dec 08 15:17:37 GMT 2021","5956","","Contract: ERC1967Proxy initialization with parameters payable when sending some balance","","Contract: ERC1967Proxy initialization with parameters payable when sending some balance","initializes the proxy","initializes the proxy",""
"skipped","Wed Dec 08 15:10:07 GMT 2021","Wed Dec 08 15:10:07 GMT 2021","0","","Contract: TransparentUpgradeableProxy without initialization when sending some balance","","Contract: TransparentUpgradeableProxy without initialization when sending some balance","sets the implementation address","sets the implementation address",""
"passed","Wed Dec 08 15:36:28 GMT 2021","Wed Dec 08 15:36:58 GMT 2021","29295","","Contract: ERC20 transfer when the recipient is not the zero address when the sender transfers all balance","","Contract: ERC20 transfer when the recipient is not the zero address when the sender transfers all balance","emits a transfer event","emits a transfer event",""
"passed","Wed Dec 08 15:43:35 GMT 2021","Wed Dec 08 15:43:49 GMT 2021","13353","","Contract: MulticallToken","","Contract: MulticallToken","reverts previous calls","reverts previous calls",""
"passed","Wed Dec 08 15:38:42 GMT 2021","Wed Dec 08 15:39:00 GMT 2021","17995","","Contract: ERC721URIStorage token URI","","Contract: ERC721URIStorage token URI","can be set for a token id","can be set for a token id",""
"skipped","Wed Dec 08 15:34:40 GMT 2021","Wed Dec 08 15:34:40 GMT 2021","0","","Contract: ERC20Votes getPastTotalSupply","","Contract: ERC20Votes getPastTotalSupply","returns zero if < first checkpoint block","returns zero if < first checkpoint block",""
"broken","Wed Dec 08 15:11:22 GMT 2021","Wed Dec 08 15:12:25 GMT 2021","62513","","Contract: ERC1967Proxy initialization without parameters payable when not sending balance","","Contract: ERC1967Proxy initialization without parameters payable when not sending balance","initializes the proxy","initializes the proxy",""
"passed","Wed Dec 08 15:41:50 GMT 2021","Wed Dec 08 15:41:51 GMT 2021","899","","Contract: SignatureChecker (ERC1271) ERC1271 wallet","","Contract: SignatureChecker (ERC1271) ERC1271 wallet","with invalid signer","with invalid signer",""
"passed","Wed Dec 08 15:43:46 GMT 2021","Wed Dec 08 15:43:57 GMT 2021","11329","","Contract: SafeMath with flag div","","Contract: SafeMath with flag div","divides correctly","divides correctly",""
"failed","Wed Dec 08 15:46:08 GMT 2021","Wed Dec 08 15:46:48 GMT 2021","39738","","Contract: Escrow as an escrow deposits","","Contract: Escrow as an escrow deposits","can accept a single deposit","can accept a single deposit",""
"failed","Wed Dec 08 15:10:45 GMT 2021","Wed Dec 08 15:11:01 GMT 2021","16392","","Contract: BeaconProxy bad beacon is not accepted","","Contract: BeaconProxy bad beacon is not accepted","non-contract implementation","non-contract implementation",""
"skipped","Wed Dec 08 15:34:40 GMT 2021","Wed Dec 08 15:34:40 GMT 2021","0","","Contract: ERC20Votes Compound test suite getPastVotes","","Contract: ERC20Votes Compound test suite getPastVotes","returns 0 if there are no checkpoints","returns 0 if there are no checkpoints",""
"broken","Wed Dec 08 15:36:56 GMT 2021","Wed Dec 08 15:38:37 GMT 2021","101519","","Contract: ERC20PresetMinterPauser pausing","","Contract: ERC20PresetMinterPauser pausing","cannot mint while paused","cannot mint while paused",""
"passed","Wed Dec 08 15:08:59 GMT 2021","Wed Dec 08 15:09:07 GMT 2021","8583","","Contract: Initializable basic testing without inheritance after nested initialize","","Contract: Initializable basic testing without inheritance after nested initialize","initializer has run","initializer has run",""
"skipped","Wed Dec 08 15:04:47 GMT 2021","Wed Dec 08 15:04:47 GMT 2021","0","","Contract: TimelockController methods batch execute","","Contract: TimelockController methods batch execute","revert if operation is not scheduled","revert if operation is not scheduled",""
"skipped","Wed Dec 08 15:04:47 GMT 2021","Wed Dec 08 15:04:47 GMT 2021","0","","Contract: TimelockController usage scenario","","Contract: TimelockController usage scenario","call out of gas","call out of gas",""
"passed","Wed Dec 08 15:15:42 GMT 2021","Wed Dec 08 15:15:49 GMT 2021","6996","","Contract: ERC1967Proxy initialization with parameters payable when not sending balance","","Contract: ERC1967Proxy initialization with parameters payable when not sending balance","initializes the proxy","initializes the proxy",""
"skipped","Wed Dec 08 15:34:40 GMT 2021","Wed Dec 08 15:34:40 GMT 2021","0","","Contract: ERC20Votes transfers","","Contract: ERC20Votes transfers","full delegation","full delegation",""
"passed","Wed Dec 08 15:34:43 GMT 2021","Wed Dec 08 15:34:53 GMT 2021","9415","","Contract: SafeERC20 with address that has no contract code","","Contract: SafeERC20 with address that has no contract code","reverts on transferFrom","reverts on transferFrom",""
"passed","Wed Dec 08 15:08:47 GMT 2021","Wed Dec 08 15:09:05 GMT 2021","17745","","Contract: ERC1967Proxy without initialization when not sending balance","","Contract: ERC1967Proxy without initialization when not sending balance","initializes the proxy","initializes the proxy",""
"passed","Wed Dec 08 15:02:30 GMT 2021","Wed Dec 08 15:02:30 GMT 2021","146","tests.brownie.token.tests","test_approve","","","","test_initial_approval_is_zero[4]",""
"passed","Wed Dec 08 15:44:17 GMT 2021","Wed Dec 08 15:44:21 GMT 2021","4184","","Contract: Create2 computeAddress","","Contract: Create2 computeAddress","computes the correct contract address","computes the correct contract address",""
"passed","Wed Dec 08 15:09:56 GMT 2021","Wed Dec 08 15:10:02 GMT 2021","5891","","Contract: ERC1967Proxy without initialization when sending some balance","","Contract: ERC1967Proxy without initialization when sending some balance","initializes the proxy","initializes the proxy",""
"skipped","Wed Dec 08 15:34:24 GMT 2021","Wed Dec 08 15:34:24 GMT 2021","0","","Contract: ERC20VotesComp getPastTotalSupply","","Contract: ERC20VotesComp getPastTotalSupply","returns the latest block if >= last checkpoint block","returns the latest block if >= last checkpoint block",""
"passed","Wed Dec 08 15:42:30 GMT 2021","Wed Dec 08 15:42:51 GMT 2021","21501","","Contract: SignedSafeMath add","","Contract: SignedSafeMath add","adds correctly if it does not overflow and the result is negative","adds correctly if it does not overflow and the result is negative",""
"passed","Wed Dec 08 15:34:53 GMT 2021","Wed Dec 08 15:34:58 GMT 2021","5665","","Contract: ERC20Snapshot totalSupplyAt","","Contract: ERC20Snapshot totalSupplyAt","reverts with a snapshot id of 0","reverts with a snapshot id of 0",""
"passed","Wed Dec 08 15:44:03 GMT 2021","Wed Dec 08 15:44:13 GMT 2021","9186","","Contract: ECDSA recover with valid signature with v0 signature","","Contract: ECDSA recover with valid signature with v0 signature","reverts with wrong version","reverts with wrong version",""
"passed","Wed Dec 08 15:35:12 GMT 2021","Wed Dec 08 15:35:19 GMT 2021","7561","","Contract: ERC20","","Contract: ERC20","has 18 decimals","has 18 decimals",""
"skipped","Wed Dec 08 15:04:47 GMT 2021","Wed Dec 08 15:04:47 GMT 2021","0","","Contract: TimelockController methods cancel","","Contract: TimelockController methods cancel","cannot cancel invalid operation","cannot cancel invalid operation",""
"skipped","Wed Dec 08 15:04:47 GMT 2021","Wed Dec 08 15:04:47 GMT 2021","0","","Contract: TimelockController methods batch schedule","","Contract: TimelockController methods batch schedule","enforce minimum delay","enforce minimum delay",""
"broken","Wed Dec 08 15:39:01 GMT 2021","Wed Dec 08 15:40:49 GMT 2021","108284","","Contract: ERC1155Burnable burn","","Contract: ERC1155Burnable burn","holder can burn their tokens","holder can burn their tokens",""
"passed","Wed Dec 08 15:36:17 GMT 2021","Wed Dec 08 15:36:56 GMT 2021","38771","","Contract: ERC20PresetMinterPauser pausing","","Contract: ERC20PresetMinterPauser pausing","deployer can unpause","deployer can unpause",""
"passed","Wed Dec 08 15:35:33 GMT 2021","Wed Dec 08 15:35:42 GMT 2021","8950","","Contract: SafeERC20 with token that returns false on all calls","","Contract: SafeERC20 with token that returns false on all calls","reverts on approve","reverts on approve",""
"passed","Wed Dec 08 15:43:43 GMT 2021","Wed Dec 08 15:43:49 GMT 2021","6215","","Contract: BitMap","","Contract: BitMap","starts empty","starts empty",""
"passed","Wed Dec 08 15:36:11 GMT 2021","Wed Dec 08 15:36:19 GMT 2021","8257","","Contract: ERC20Permit permit","","Contract: ERC20Permit permit","rejects expired permit","rejects expired permit",""
"passed","Wed Dec 08 15:41:36 GMT 2021","Wed Dec 08 15:41:44 GMT 2021","8007","","Contract: ECDSA recover with invalid signature","","Contract: ECDSA recover with invalid signature","with short signature","with short signature",""
"skipped","Wed Dec 08 15:04:47 GMT 2021","Wed Dec 08 15:04:47 GMT 2021","0","","Contract: TimelockController methods batch schedule","","Contract: TimelockController methods batch schedule","prevent non-proposer from commiting","prevent non-proposer from commiting",""
"broken","Wed Dec 08 15:36:59 GMT 2021","Wed Dec 08 15:38:41 GMT 2021","101539","","Contract: SafeERC20 with token that returns true on all calls approvals with zero allowance","","Contract: SafeERC20 with token that returns true on all calls approvals with zero allowance","doesn't revert when approving a zero allowance","doesn't revert when approving a zero allowance",""
"passed","Wed Dec 08 15:42:13 GMT 2021","Wed Dec 08 15:42:54 GMT 2021","41189","","Contract: ERC1820Implementer with registered interfaces","","Contract: ERC1820Implementer with registered interfaces","returns false when interface implementation for non-supported interfaces is queried","returns false when interface implementation for non-supported interfaces is queried",""
"skipped","Wed Dec 08 15:34:24 GMT 2021","Wed Dec 08 15:34:24 GMT 2021","0","","Contract: ERC20VotesComp Compound test suite getPriorVotes","","Contract: ERC20VotesComp Compound test suite getPriorVotes","returns 0 if there are no checkpoints","returns 0 if there are no checkpoints",""
"passed","Wed Dec 08 15:02:50 GMT 2021","Wed Dec 08 15:02:52 GMT 2021","1675","tests.brownie.token.tests","test_transfer","","","","test_total_supply_not_affected",""
"broken","Wed Dec 08 15:17:25 GMT 2021","Wed Dec 08 15:17:25 GMT 2021","0","","Contract: Clones cloneDeterministic","","Contract: Clones cloneDeterministic","""before all"" hook: deploy implementation for ""address already used""","""before all"" hook: deploy implementation for ""address already used""",""
"broken","Wed Dec 08 15:04:04 GMT 2021","Wed Dec 08 15:04:04 GMT 2021","0","tests.brownie.token.tests","test_transferFrom","","","","test_caller_approval_affected",""
"broken","Wed Dec 08 15:34:55 GMT 2021","Wed Dec 08 15:35:01 GMT 2021","6316","","Contract: ERC777 with default operators","","Contract: ERC777 with default operators","does not emit AuthorizedOperator events for default operators","does not emit AuthorizedOperator events for default operators",""
"failed","Wed Dec 08 15:10:34 GMT 2021","Wed Dec 08 15:10:49 GMT 2021","14959","","Contract: Clones clone initialization without parameters payable when sending some balance","","Contract: Clones clone initialization without parameters payable when sending some balance","has expected balance","has expected balance",""
"passed","Wed Dec 08 15:35:52 GMT 2021","Wed Dec 08 15:36:09 GMT 2021","17332","","Contract: SafeERC20 with token that returns false on all calls","","Contract: SafeERC20 with token that returns false on all calls","reverts on decreaseAllowance","reverts on decreaseAllowance",""
"passed","Wed Dec 08 15:35:40 GMT 2021","Wed Dec 08 15:35:55 GMT 2021","14748","","Contract: ERC20 balanceOf when the requested account has no tokens","","Contract: ERC20 balanceOf when the requested account has no tokens","returns zero","returns zero",""
"passed","Wed Dec 08 15:08:56 GMT 2021","Wed Dec 08 15:09:20 GMT 2021","23205","","Contract: BeaconProxy","","Contract: BeaconProxy","upgrade a proxy by upgrading its beacon","upgrade a proxy by upgrading its beacon",""
"passed","Wed Dec 08 15:43:42 GMT 2021","Wed Dec 08 15:43:46 GMT 2021","3322","","Contract: SafeMath with flag mul","","Contract: SafeMath with flag mul","reverts on multiplication overflow","reverts on multiplication overflow",""
"broken","Wed Dec 08 15:04:05 GMT 2021","Wed Dec 08 15:04:05 GMT 2021","0","tests.brownie.token.tests","test_transferFrom","","","","test_insufficient_approval",""
"broken","Wed Dec 08 15:12:43 GMT 2021","Wed Dec 08 15:13:51 GMT 2021","67934","","Contract: Clones clone initialization with parameters payable when not sending balance","","Contract: Clones clone initialization with parameters payable when not sending balance","initializes the proxy","initializes the proxy",""
"skipped","Wed Dec 08 15:04:47 GMT 2021","Wed Dec 08 15:04:47 GMT 2021","0","","Contract: TimelockController methods simple execute with scheduled operation on time","","Contract: TimelockController methods simple execute with scheduled operation on time","prevent non-executor from revealing","prevent non-executor from revealing",""
"passed","Wed Dec 08 15:41:57 GMT 2021","Wed Dec 08 15:42:06 GMT 2021","9209","","Contract: ERC165 Contract interface ERC165 supportsInterface(bytes4)","","Contract: ERC165 Contract interface ERC165 supportsInterface(bytes4)","has to be implemented","has to be implemented",""
"skipped","Wed Dec 08 15:04:47 GMT 2021","Wed Dec 08 15:04:47 GMT 2021","0","","Contract: TimelockController methods simple execute with scheduled operation","","Contract: TimelockController methods simple execute with scheduled operation","revert if execution comes too early 2/2","revert if execution comes too early 2/2",""
"failed","Wed Dec 08 15:09:05 GMT 2021","Wed Dec 08 15:09:56 GMT 2021","51390","","Contract: ERC1967Proxy without initialization when not sending balance","","Contract: ERC1967Proxy without initialization when not sending balance","has expected balance","has expected balance",""
"skipped","Wed Dec 08 15:04:47 GMT 2021","Wed Dec 08 15:04:47 GMT 2021","0","","Contract: TimelockController methods batch execute with scheduled operation","","Contract: TimelockController methods batch execute with scheduled operation","revert if execution comes too early 1/2","revert if execution comes too early 1/2",""
"skipped","Wed Dec 08 15:34:40 GMT 2021","Wed Dec 08 15:34:40 GMT 2021","0","","Contract: ERC20Votes Compound test suite balanceOf","","Contract: ERC20Votes Compound test suite balanceOf","grants to initial account","grants to initial account",""
"failed","Wed Dec 08 15:09:12 GMT 2021","Wed Dec 08 15:09:20 GMT 2021","8247","","Contract: Clones clone initialization without parameters non payable when sending some balance","","Contract: Clones clone initialization without parameters non payable when sending some balance","reverts","reverts",""
"passed","Wed Dec 08 15:13:51 GMT 2021","Wed Dec 08 15:14:00 GMT 2021","9594","","Contract: Clones clone initialization with parameters payable when sending some balance","","Contract: Clones clone initialization with parameters payable when sending some balance","initializes the proxy","initializes the proxy",""
"passed","Wed Dec 08 15:12:53 GMT 2021","Wed Dec 08 15:13:10 GMT 2021","17124","","Contract: UUPSUpgradeable","","Contract: UUPSUpgradeable","reject upgrade to non uups implementation","reject upgrade to non uups implementation",""
"passed","Wed Dec 08 15:43:05 GMT 2021","Wed Dec 08 15:43:10 GMT 2021","4985","","Contract: SafeCast toUint16","","Contract: SafeCast toUint16","downcasts 0","downcasts 0",""
"failed","Wed Dec 08 15:11:30 GMT 2021","Wed Dec 08 15:12:43 GMT 2021","72925","","Contract: Clones clone initialization with parameters non payable when sending some balance","","Contract: Clones clone initialization with parameters non payable when sending some balance","reverts","reverts",""
"skipped","Wed Dec 08 15:04:47 GMT 2021","Wed Dec 08 15:04:47 GMT 2021","0","","Contract: TimelockController methods simple execute","","Contract: TimelockController methods simple execute","revert if operation is not scheduled","revert if operation is not scheduled",""
"passed","Wed Dec 08 15:36:12 GMT 2021","Wed Dec 08 15:37:05 GMT 2021","53042","","Contract: ERC20Snapshot totalSupplyAt with initial snapshot with supply changes after the snapshot with multiple snapshots after supply changes","","Contract: ERC20Snapshot totalSupplyAt with initial snapshot with supply changes after the snapshot with multiple snapshots after supply changes","all posterior snapshots return the supply after the changes","all posterior snapshots return the supply after the changes",""
"broken","Wed Dec 08 15:04:04 GMT 2021","Wed Dec 08 15:04:04 GMT 2021","0","tests.brownie.token.tests","test_transferFrom","","","","test_returns_true",""
"broken","Wed Dec 08 15:46:02 GMT 2021","Wed Dec 08 15:46:17 GMT 2021","14869","","Contract: ConditionalEscrow when withdrawal is allowed as an escrow deposits","","Contract: ConditionalEscrow when withdrawal is allowed as an escrow deposits","can accept a single deposit","can accept a single deposit",""
"broken","Wed Dec 08 15:36:58 GMT 2021","Wed Dec 08 15:38:39 GMT 2021","101488","","Contract: ERC20 transfer when the recipient is not the zero address when the sender transfers zero tokens","","Contract: ERC20 transfer when the recipient is not the zero address when the sender transfers zero tokens","transfers the requested amount","transfers the requested amount",""
"broken","Wed Dec 08 15:04:05 GMT 2021","Wed Dec 08 15:04:05 GMT 2021","0","tests.brownie.token.tests","test_transferFrom","","","","test_no_approval",""
"broken","Wed Dec 08 15:04:04 GMT 2021","Wed Dec 08 15:04:04 GMT 2021","0","tests.brownie.token.tests","test_transferFrom","","","","test_transfer_full_balance",""
"passed","Wed Dec 08 15:02:49 GMT 2021","Wed Dec 08 15:02:50 GMT 2021","1677","tests.brownie.token.tests","test_transfer","","","","test_receiver_balance_increases",""
"passed","Wed Dec 08 15:35:19 GMT 2021","Wed Dec 08 15:35:28 GMT 2021","8461","","Contract: ERC20 set decimals","","Contract: ERC20 set decimals","can set decimals during construction","can set decimals during construction",""
"broken","Wed Dec 08 15:04:46 GMT 2021","Wed Dec 08 15:06:05 GMT 2021","79139","","Contract: Governor Contract interface ERC165 ERC165's supportsInterface(bytes4)","","Contract: Governor Contract interface ERC165 ERC165's supportsInterface(bytes4)","uses less than 30k gas [skip-on-coverage]","uses less than 30k gas [skip-on-coverage]",""
"failed","Wed Dec 08 15:12:30 GMT 2021","Wed Dec 08 15:12:57 GMT 2021","26575","","Contract: ERC1967Proxy initialization without parameters payable when sending some balance","","Contract: ERC1967Proxy initialization without parameters payable when sending some balance","has expected balance","has expected balance",""
