"Status","Start Time","Stop Time","Duration in ms","Parent Suite","Suite","Sub Suite","Test Class","Test Method","Name","Description"
"passed","Fri Feb 04 03:24:06 GMT 2022","Fri Feb 04 03:24:10 GMT 2022","4103","Contract: ERC721Enumerable","with minted tokens","transfers > via safeTransferFrom > without data > to a valid receiver contract > when called by the operator","","","emits a Transfer event",""
"passed","Fri Feb 04 03:16:28 GMT 2022","Fri Feb 04 03:16:32 GMT 2022","4096","Contract: ERC721Enumerable","with minted tokens","transfers > via safeTransferFrom > with data > to a user account > when called by the owner","","","transfers the ownership of the given token ID to the given address",""
"passed","Fri Feb 04 03:16:39 GMT 2022","Fri Feb 04 03:16:54 GMT 2022","15381","Contract: Governor","Cancel","After deadline","","","run",""
"passed","Fri Feb 04 03:09:37 GMT 2022","Fri Feb 04 03:09:38 GMT 2022","1164","Contract: MinimalForwarder","with message","verify > invalid signature","","","tampered data",""
"passed","Fri Feb 04 03:12:18 GMT 2022","Fri Feb 04 03:12:37 GMT 2022","18478","Contract: Governor","scenario","send ethers","","","run",""
"passed","Fri Feb 04 03:14:56 GMT 2022","Fri Feb 04 03:15:07 GMT 2022","11254","Contract: Governor","scenario","vote not over","","","run",""
"passed","Fri Feb 04 03:09:46 GMT 2022","Fri Feb 04 03:09:48 GMT 2022","1299","Contract: MinimalForwarder","with message","execute > invalid signature","","","tampered data",""
"passed","Fri Feb 04 03:18:08 GMT 2022","Fri Feb 04 03:18:12 GMT 2022","3381","Contract: ERC721Enumerable","with minted tokens","transfers > via safeTransferFrom > with data > to a user account > when sent to the owner","","","keeps the owner balance",""
"passed","Fri Feb 04 03:20:06 GMT 2022","Fri Feb 04 03:20:10 GMT 2022","4266","Contract: ERC721","with minted tokens","transfers > via safeTransferFrom > with data > to a valid receiver contract > when called by the owner without an approved user","","","clears the approval for the token ID",""
"broken","Fri Feb 04 03:17:06 GMT 2022","Fri Feb 04 03:17:08 GMT 2022","1421","Contract: RefundEscrow","once deployed","refund state","","","does not allow beneficiary withdrawal",""
"passed","Fri Feb 04 03:15:53 GMT 2022","Fri Feb 04 03:15:55 GMT 2022","2199","Contract: Counters","increment","starting from 0","","","can be called multiple times",""
"passed","Fri Feb 04 03:17:47 GMT 2022","Fri Feb 04 03:17:50 GMT 2022","2248","Contract: SafeMath","with default revert message","div","","","divides correctly",""
"passed","Fri Feb 04 03:25:09 GMT 2022","Fri Feb 04 03:25:13 GMT 2022","4191","Contract: ERC721Enumerable","with minted tokens","transfers > via safeTransferFrom > without data > to a valid receiver contract > when sent to the owner","","","keeps the owner balance",""
"passed","Fri Feb 04 03:10:29 GMT 2022","Fri Feb 04 03:10:36 GMT 2022","7237","Contract: Clones","cloneDeterministic","initialization without parameters > payable > when not sending balance","","","initializes the proxy",""
"passed","Fri Feb 04 03:18:00 GMT 2022","Fri Feb 04 03:18:01 GMT 2022","1205","Contract: StorageSlot","address storage slot","get","","","from other slot",""
"passed","Fri Feb 04 03:13:09 GMT 2022","Fri Feb 04 03:13:12 GMT 2022","2659","tests.brownie.token.tests","test_transfer","","","","test_transfer_full_balance",""
"passed","Fri Feb 04 03:17:38 GMT 2022","Fri Feb 04 03:17:39 GMT 2022","1345","Contract: SafeMath","with default revert message","add","","","adds correctly",""
"passed","Fri Feb 04 03:13:05 GMT 2022","Fri Feb 04 03:13:06 GMT 2022","1312","Contract: ERC20Snapshot","balanceOfAt","","","","reverts with a snapshot id of 0",""
"passed","Fri Feb 04 03:28:06 GMT 2022","Fri Feb 04 03:28:07 GMT 2022","1118","Contract: ERC721Enumerable","Contract interface","ERC721Enumerable > ERC165's supportsInterface(bytes4)","","","claims support [skip-on-coverage]",""
"passed","Fri Feb 04 03:13:00 GMT 2022","Fri Feb 04 03:13:02 GMT 2022","1943","Contract: ERC20","_mint","for a non zero account","","","increments totalSupply",""
"passed","Fri Feb 04 03:15:15 GMT 2022","Fri Feb 04 03:15:20 GMT 2022","4404","Contract: ERC721","with minted tokens","transfers > via transferFrom > when called by the operator","","","emits a Transfer event",""
"passed","Fri Feb 04 03:10:25 GMT 2022","Fri Feb 04 03:10:37 GMT 2022","11938","Contract: Governor","Contract interface","Governor > votingDelay()","","","has to be implemented",""
"passed","Fri Feb 04 03:12:58 GMT 2022","Fri Feb 04 03:13:15 GMT 2022","17631","Contract: GovernorTimelockCompound","deplicated underlying call","","","","run",""
"passed","Fri Feb 04 03:16:24 GMT 2022","Fri Feb 04 03:16:24 GMT 2022","123","Contract: SignatureChecker (ERC1271)","ERC1271 wallet","","","","with invalid signer",""
"passed","Fri Feb 04 03:17:43 GMT 2022","Fri Feb 04 03:17:48 GMT 2022","5197","Contract: ERC721Enumerable","with minted tokens","transfers > via safeTransferFrom > with data > to a user account > when called by the owner without an approved user","","","emits an Approval event",""
"passed","Fri Feb 04 03:15:04 GMT 2022","Fri Feb 04 03:15:06 GMT 2022","2304","Contract: ERC1155","internal functions","_burnBatch > with minted-then-burnt tokens","","","accounts for both minting and burning",""
"passed","Fri Feb 04 03:18:19 GMT 2022","Fri Feb 04 03:18:21 GMT 2022","1648","Contract: EnumerableMap","set","","","","adds a key",""
"passed","Fri Feb 04 03:08:45 GMT 2022","Fri Feb 04 03:08:47 GMT 2022","1491","Contract: Ownable","renounce ownership","","","","loses owner after renouncement",""
"passed","Fri Feb 04 03:21:14 GMT 2022","Fri Feb 04 03:21:17 GMT 2022","3233","Contract: ERC721","with minted tokens","transfers > via safeTransferFrom > without data > to a user account > when called by the owner","","","emits an Approval event",""
"passed","Fri Feb 04 03:13:34 GMT 2022","Fri Feb 04 03:13:37 GMT 2022","3160","Contract: TokenTimelock","with token","once deployed","","","cannot be released before time limit",""
"broken","Fri Feb 04 03:09:23 GMT 2022","Fri Feb 04 03:09:23 GMT 2022","5","ethjs","","","","","test01",""
"passed","Fri Feb 04 03:11:43 GMT 2022","Fri Feb 04 03:11:46 GMT 2022","3369","Contract: ERC1155","like an ERC1155","safeTransferFrom > when called by an operator on behalf of the multiTokenHolder > when operator is approved by multiTokenHolder","","","credits transferred balance to receiver",""
"passed","Fri Feb 04 03:14:48 GMT 2022","Fri Feb 04 03:14:51 GMT 2022","2415","Contract: SafeERC20","with token that returns no boolean values","approvals > with non-zero allowance","","","doesn't revert when increasing the allowance",""
"passed","Fri Feb 04 03:22:06 GMT 2022","Fri Feb 04 03:22:10 GMT 2022","3634","Contract: ERC721","with minted tokens","transfers > via safeTransferFrom > without data > to a user account > when called by the owner without an approved user","","","emits a Transfer event",""
"passed","Fri Feb 04 03:15:26 GMT 2022","Fri Feb 04 03:15:29 GMT 2022","3002","Contract: ERC721Holder","","","","","receives an ERC721 token",""
"passed","Fri Feb 04 03:26:45 GMT 2022","Fri Feb 04 03:26:49 GMT 2022","3091","Contract: ERC721","with minted tokens","approve > when the sender is an operator","","","emits an approval event",""
"passed","Fri Feb 04 03:09:55 GMT 2022","Fri Feb 04 03:09:56 GMT 2022","1328","Contract: ERC1967Proxy","without initialization","when not sending balance","","","initializes the proxy",""
"passed","Fri Feb 04 03:22:53 GMT 2022","Fri Feb 04 03:22:56 GMT 2022","2831","Contract: ERC721Enumerable","with minted tokens","transfers > via safeTransferFrom > without data > to a user account > when the given token ID does not exist","","","reverts",""
"passed","Fri Feb 04 03:10:45 GMT 2022","Fri Feb 04 03:10:47 GMT 2022","2507","Contract: TransparentUpgradeableProxy","initialization with parameters","payable > when sending some balance","","","initializes the proxy",""
"passed","Fri Feb 04 03:10:14 GMT 2022","Fri Feb 04 03:10:16 GMT 2022","1924","Contract: Clones","clone","initialization with parameters > payable > when not sending balance","","","has expected balance",""
"passed","Fri Feb 04 03:15:00 GMT 2022","Fri Feb 04 03:15:04 GMT 2022","4222","Contract: ERC721","with minted tokens","transfers > via transferFrom > when called by the approved individual","","","emits an Approval event",""
"passed","Fri Feb 04 03:15:39 GMT 2022","Fri Feb 04 03:15:41 GMT 2022","1394","Contract: ERC721PresetMinterPauserAutoId","Contract interface","ERC721Enumerable > ERC165's supportsInterface(bytes4)","","","uses less than 30k gas [skip-on-coverage]",""
"passed","Fri Feb 04 03:26:22 GMT 2022","Fri Feb 04 03:26:25 GMT 2022","2916","Contract: ERC721Enumerable","with minted tokens","approve > when clearing approval > when there was a prior approval","","","clears approval for the token",""
"passed","Fri Feb 04 03:18:03 GMT 2022","Fri Feb 04 03:18:04 GMT 2022","1319","Contract: SafeCast","toInt8","","","","downcasts 1",""
"passed","Fri Feb 04 03:10:38 GMT 2022","Fri Feb 04 03:10:39 GMT 2022","1360","Contract: TransparentUpgradeableProxy","initialization with parameters","non payable > when sending some balance","","","reverts",""
"passed","Fri Feb 04 03:21:17 GMT 2022","Fri Feb 04 03:21:21 GMT 2022","3348","Contract: ERC721Enumerable","with minted tokens","transfers > via safeTransferFrom > without data > to a user account > when called by the owner","","","emits an Approval event",""
"passed","Fri Feb 04 03:18:54 GMT 2022","Fri Feb 04 03:18:58 GMT 2022","4102","Contract: ERC721Enumerable","with minted tokens","transfers > via safeTransferFrom > with data > to a valid receiver contract > when called by the owner","","","adjusts owners balances",""
"passed","Fri Feb 04 03:10:24 GMT 2022","Fri Feb 04 03:10:26 GMT 2022","1833","Contract: Clones","cloneDeterministic","initialization without parameters > non payable > when not sending balance","","","initializes the proxy",""
"passed","Fri Feb 04 03:08:56 GMT 2022","Fri Feb 04 03:08:57 GMT 2022","1226","Contract: AccessControl","revoking","","","","roles that are not had can be revoked",""
"passed","Fri Feb 04 03:09:30 GMT 2022","Fri Feb 04 03:09:31 GMT 2022","1274","Contract: MinimalForwarder","with message","verify > valid signature","","","success",""
"passed","Fri Feb 04 03:16:38 GMT 2022","Fri Feb 04 03:16:40 GMT 2022","2005","Contract: RefundEscrow","once deployed","","","","only the owner can enter refund state",""
"passed","Fri Feb 04 03:20:48 GMT 2022","Fri Feb 04 03:20:52 GMT 2022","3723","Contract: ERC721Enumerable","with minted tokens","transfers > via safeTransferFrom > with data > to a valid receiver contract > when the address of the previous owner is incorrect","","","reverts",""
"passed","Fri Feb 04 03:17:51 GMT 2022","Fri Feb 04 03:17:52 GMT 2022","1204","Contract: SafeCast","toUint224","","","","downcasts 2^224 - 1 (26959946667150639794667015087019630673637144422540572481103610249215)",""
"passed","Fri Feb 04 03:11:26 GMT 2022","Fri Feb 04 03:11:28 GMT 2022","1614","Contract: ERC1155PresetMinterPauser","Contract interface","ERC1155 > ERC165's supportsInterface(bytes4)","","","claims support [skip-on-coverage]",""
"passed","Fri Feb 04 03:13:04 GMT 2022","Fri Feb 04 03:13:06 GMT 2022","1852","Contract: ERC20PresetMinterPauser","","","","","deployer has the minter role",""
"passed","Fri Feb 04 03:08:54 GMT 2022","Fri Feb 04 03:08:57 GMT 2022","2479","Contract: PaymentSplitter","once deployed","shares","","","does not store shares if address is not payee",""
"passed","Fri Feb 04 03:10:12 GMT 2022","Fri Feb 04 03:10:15 GMT 2022","2486","Contract: ProxyAdmin","#getProxyImplementation","","","","returns proxy implementation address",""
"passed","Fri Feb 04 03:17:34 GMT 2022","Fri Feb 04 03:17:35 GMT 2022","1210","Contract: ERC165Checker","account address does not support ERC165","","","","does not support mock interface via supportsAllInterfaces",""
"passed","Fri Feb 04 03:26:22 GMT 2022","Fri Feb 04 03:26:25 GMT 2022","2458","Contract: ERC721","with minted tokens","approve > when approving a non-zero address > when there was no prior approval","","","emits an approval event",""
"passed","Fri Feb 04 03:10:17 GMT 2022","Fri Feb 04 03:10:20 GMT 2022","2544","Contract: ProxyAdmin","#upgrade","with unauthorized account","","","fails to upgrade",""
"passed","Fri Feb 04 03:12:19 GMT 2022","Fri Feb 04 03:12:21 GMT 2022","2241","Contract: ERC20Burnable","burn","when the given amount is not greater than balance of the sender > for a non-zero amount","","","emits a transfer event",""
"passed","Fri Feb 04 03:27:34 GMT 2022","Fri Feb 04 03:27:37 GMT 2022","2627","Contract: ERC721","_burn","with minted tokens > with burnt token","","","reverts when burning a token id that has been deleted",""
"passed","Fri Feb 04 03:19:08 GMT 2022","Fri Feb 04 03:19:16 GMT 2022","7955","Contract: EnumerableSet","EnumerableUintSet","remove","","","adds and removes multiple values",""
"skipped","Fri Feb 04 03:12:48 GMT 2022","Fri Feb 04 03:12:48 GMT 2022","0","Contract: ERC20Votes","transfers","","","","receiver delegation",""
"passed","Fri Feb 04 03:26:38 GMT 2022","Fri Feb 04 03:26:41 GMT 2022","2870","Contract: ERC721Enumerable","with minted tokens","approve > when approving a non-zero address > when there was a prior approval to a different address","","","sets the approval for the target address",""
"passed","Fri Feb 04 03:12:34 GMT 2022","Fri Feb 04 03:12:35 GMT 2022","1615","Contract: ERC20Pausable","pausable token","transfer","","","reverts when trying to transfer when paused",""
"passed","Fri Feb 04 03:13:47 GMT 2022","Fri Feb 04 03:13:49 GMT 2022","2562","Contract: SafeERC20","with token that returns true on all calls","","","","doesn't revert on transfer",""
"passed","Fri Feb 04 03:18:39 GMT 2022","Fri Feb 04 03:18:43 GMT 2022","3990","Contract: ERC721","with minted tokens","transfers > via safeTransferFrom > with data > to a valid receiver contract > when called by the owner","","","emits a Transfer event",""
"passed","Fri Feb 04 03:26:03 GMT 2022","Fri Feb 04 03:26:06 GMT 2022","3001","Contract: ERC721","with minted tokens","safe mint > via safeMint > to a receiver contract that panics","","","reverts",""
"passed","Fri Feb 04 03:12:41 GMT 2022","Fri Feb 04 03:12:43 GMT 2022","2027","Contract: ERC20","decrease allowance","when the spender is not the zero address > when the sender does not have enough balance > when the spender had an approved amount","","","sets the allowance to zero when all allowance is removed",""
"passed","Fri Feb 04 03:12:51 GMT 2022","Fri Feb 04 03:12:53 GMT 2022","2334","Contract: ERC20","","","","","has a name",""
"passed","Fri Feb 04 03:08:59 GMT 2022","Fri Feb 04 03:09:06 GMT 2022","6261","Contract: Governor","Contract interface","ERC165 > ERC165's supportsInterface(bytes4)","","","uses less than 30k gas [skip-on-coverage]",""
"broken","Fri Feb 04 03:13:43 GMT 2022","Fri Feb 04 03:13:46 GMT 2022","2553","Contract: TokenTimelock","with token","once deployed","","","can be released after time limit",""
"passed","Fri Feb 04 03:10:14 GMT 2022","Fri Feb 04 03:10:17 GMT 2022","2414","Contract: TransparentUpgradeableProxy","initialization without parameters","non payable > when not sending balance","","","has expected balance",""
"passed","Fri Feb 04 03:16:29 GMT 2022","Fri Feb 04 03:16:36 GMT 2022","7107","Contract: ConditionalEscrow","when withdrawal is allowed","as an escrow > deposits","","","can accept an empty deposit",""
"passed","Fri Feb 04 03:12:26 GMT 2022","Fri Feb 04 03:12:34 GMT 2022","7905","Contract: GovernorTimelockControl","Contract interface","GovernorTimelock > queue(address[],uint256[],bytes[],bytes32)","","","has to be implemented",""
"passed","Fri Feb 04 03:15:02 GMT 2022","Fri Feb 04 03:15:07 GMT 2022","4548","Contract: ERC20","erc20 behaviour","approve > when the spender is not the zero address > when the sender has enough balance","","","emits an approval event",""
"passed","Fri Feb 04 03:22:38 GMT 2022","Fri Feb 04 03:22:42 GMT 2022","3590","Contract: ERC721","with minted tokens","transfers > via safeTransferFrom > without data > to a user account > when sent to the owner","","","keeps same tokens by index",""
"skipped","Fri Feb 04 03:14:09 GMT 2022","Fri Feb 04 03:14:09 GMT 2022","0","Contract: GovernorTimelockCompound","updateTimelock","","","","protected",""
"broken","Fri Feb 04 03:13:15 GMT 2022","Fri Feb 04 03:13:33 GMT 2022","18106","Contract: GovernorTimelockCompound","re-queue / re-execute","","","","run",""
"passed","Fri Feb 04 03:12:44 GMT 2022","Fri Feb 04 03:12:47 GMT 2022","2816","Contract: ERC1155","like an ERC1155","safeBatchTransferFrom","","","reverts when transferring to zero address",""
"passed","Fri Feb 04 03:24:34 GMT 2022","Fri Feb 04 03:24:38 GMT 2022","4627","Contract: ERC721","with minted tokens","transfers > via safeTransferFrom > without data > to a valid receiver contract > when called by the owner without an approved user","","","emits an Approval event",""
"passed","Fri Feb 04 03:15:20 GMT 2022","Fri Feb 04 03:15:24 GMT 2022","3650","Contract: ERC20","erc20 behaviour","approve > when the spender is not the zero address > when the sender does not have enough balance > when there was no approved amount before","","","approves the requested amount",""
"passed","Fri Feb 04 03:09:56 GMT 2022","Fri Feb 04 03:09:57 GMT 2022","1109","Contract: ERC1967Proxy","without initialization","when not sending balance","","","has expected balance",""
"passed","Fri Feb 04 03:18:38 GMT 2022","Fri Feb 04 03:18:39 GMT 2022","1150","Contract: SafeCast","toInt64","","","","downcasts -1",""
"passed","Fri Feb 04 03:26:53 GMT 2022","Fri Feb 04 03:26:56 GMT 2022","2918","Contract: ERC721","with minted tokens","setApprovalForAll > when the operator willing to approve is not the owner > when there is no operator approval set by the sender","","","emits an approval event",""
"passed","Fri Feb 04 03:09:45 GMT 2022","Fri Feb 04 03:09:52 GMT 2022","6542","Contract: GovernorTimelockCompound","Contract interface","Governor > state(uint256)","","","has to be implemented",""
"passed","Fri Feb 04 03:13:29 GMT 2022","Fri Feb 04 03:13:47 GMT 2022","17715","Contract: Governor","scenario","duplicate executed proposal","","","run",""
"passed","Fri Feb 04 03:25:29 GMT 2022","Fri Feb 04 03:25:33 GMT 2022","4309","Contract: ERC721","with minted tokens","transfers > via safeTransferFrom > to a receiver contract returning unexpected value","","","reverts",""
"passed","Fri Feb 04 03:11:37 GMT 2022","Fri Feb 04 03:11:39 GMT 2022","2944","Contract: ERC1155","like an ERC1155","safeTransferFrom > when called by an operator on behalf of the multiTokenHolder > when operator is not approved by multiTokenHolder","","","reverts",""
"passed","Fri Feb 04 03:14:34 GMT 2022","Fri Feb 04 03:14:36 GMT 2022","1359","Contract: ERC1155","internal functions","_mint > with minted tokens","","","emits a TransferSingle event",""
"failed","Fri Feb 04 03:16:41 GMT 2022","Fri Feb 04 03:16:58 GMT 2022","16996","tests.truffle","test_truffle","","","","test_issue_364_self_destruct_contract",""
"passed","Fri Feb 04 03:15:45 GMT 2022","Fri Feb 04 03:15:46 GMT 2022","1245","Contract: ERC721PresetMinterPauserAutoId","Contract interface","ERC721Enumerable > tokenByIndex(uint256)","","","has to be implemented",""
"passed","Fri Feb 04 03:27:02 GMT 2022","Fri Feb 04 03:27:05 GMT 2022","2855","Contract: ERC721","with minted tokens","setApprovalForAll > when the operator willing to approve is not the owner > when the operator was set as not approved","","","can unset the operator approval",""
"passed","Fri Feb 04 03:12:09 GMT 2022","Fri Feb 04 03:12:11 GMT 2022","2125","Contract: ERC20","transfer from","when the token owner is not the zero address > when the recipient is the zero address","","","reverts",""
"passed","Fri Feb 04 03:26:59 GMT 2022","Fri Feb 04 03:27:02 GMT 2022","2891","Contract: ERC721","with minted tokens","setApprovalForAll > when the operator willing to approve is not the owner > when the operator was set as not approved","","","emits an approval event",""
"passed","Fri Feb 04 03:16:43 GMT 2022","Fri Feb 04 03:16:50 GMT 2022","6819","Contract: ConditionalEscrow","when withdrawal is allowed","as an escrow > deposits","","","emits a deposited event",""
"broken","Fri Feb 04 03:13:17 GMT 2022","Fri Feb 04 03:13:17 GMT 2022","493","tests.brownie.token.tests","test_transfer","","","","test_insufficient_balance",""
"passed","Fri Feb 04 03:17:57 GMT 2022","Fri Feb 04 03:17:59 GMT 2022","2222","Contract: StorageSlot","address storage slot","","","","set",""
"passed","Fri Feb 04 03:12:41 GMT 2022","Fri Feb 04 03:12:43 GMT 2022","2003","Contract: ERC20Pausable","pausable token","transfer from","","","reverts when trying to transfer from when paused",""
"passed","Fri Feb 04 03:26:15 GMT 2022","Fri Feb 04 03:26:17 GMT 2022","2480","Contract: ERC721Enumerable","with minted tokens","safe mint > via safeMint > to a contract that does not implement the required function","","","reverts",""
"passed","Fri Feb 04 03:10:39 GMT 2022","Fri Feb 04 03:10:45 GMT 2022","5659","Contract: GovernorTimelockCompound","Contract interface","Governor > propose(address[],uint256[],bytes[],string)","","","has to be implemented",""
"passed","Fri Feb 04 03:12:23 GMT 2022","Fri Feb 04 03:12:24 GMT 2022","1863","Contract: ERC20Capped","once deployed","capped token","","","fails to mint if the amount exceeds the cap",""
"passed","Fri Feb 04 03:15:19 GMT 2022","Fri Feb 04 03:15:21 GMT 2022","2096","Contract: ERC721Pausable","when token is paused","exists","","","returns token existence",""
"passed","Fri Feb 04 03:17:03 GMT 2022","Fri Feb 04 03:17:07 GMT 2022","3714","Contract: ERC721Enumerable","with minted tokens","transfers > via safeTransferFrom > with data > to a user account > when called by the approved individual","","","adjusts owners balances",""
"skipped","Fri Feb 04 03:08:40 GMT 2022","Fri Feb 04 03:08:40 GMT 2022","0","Contract: GovernorTimelockCompound","","","","","doesn't accept ether transfers",""
"passed","Fri Feb 04 03:17:00 GMT 2022","Fri Feb 04 03:17:02 GMT 2022","2187","Contract: ERC165Checker","ERC165 supported","","","","supports ERC165",""
"passed","Fri Feb 04 03:15:36 GMT 2022","Fri Feb 04 03:15:37 GMT 2022","1109","Contract: Arrays","findUpperBound","Even number of elements","","","returns correct index for the basic case",""
"passed","Fri Feb 04 03:13:42 GMT 2022","Fri Feb 04 03:13:44 GMT 2022","2668","Contract: SafeERC20","with token that returns false on all calls","","","","reverts on increaseAllowance",""
"passed","Fri Feb 04 03:18:11 GMT 2022","Fri Feb 04 03:18:15 GMT 2022","3219","Contract: ERC721","with minted tokens","transfers > via safeTransferFrom > with data > to a user account > when sent to the owner","","","keeps same tokens by index",""
"passed","Fri Feb 04 03:18:25 GMT 2022","Fri Feb 04 03:18:27 GMT 2022","1750","Contract: TimersBlockNumber","","","","","expired",""
"passed","Fri Feb 04 03:17:19 GMT 2022","Fri Feb 04 03:17:27 GMT 2022","7179","Contract: ConditionalEscrow","when withdrawal is allowed","as an escrow > withdrawals","","","only the owner can withdraw",""
"passed","Fri Feb 04 03:12:40 GMT 2022","Fri Feb 04 03:12:40 GMT 2022","178","tests.brownie.token.tests","test_approve","","","","test_initial_approval_is_zero[4]",""
"passed","Fri Feb 04 03:10:08 GMT 2022","Fri Feb 04 03:10:09 GMT 2022","1206","Contract: ERC1967Proxy","initialization with parameters","non payable > when not sending balance","","","has expected balance",""
"passed","Fri Feb 04 03:11:25 GMT 2022","Fri Feb 04 03:11:28 GMT 2022","2908","Contract: ERC1155Pausable","when token is paused","isApprovedForAll","","","returns the approval of the operator",""
"passed","Fri Feb 04 03:10:13 GMT 2022","Fri Feb 04 03:10:14 GMT 2022","1167","Contract: ERC1967Proxy","initialization with parameters","payable > when sending some balance","","","has expected balance",""
"passed","Fri Feb 04 03:17:56 GMT 2022","Fri Feb 04 03:17:58 GMT 2022","1590","Contract: SafeCast","toUint256","","","","casts 1",""
"passed","Fri Feb 04 03:09:43 GMT 2022","Fri Feb 04 03:09:45 GMT 2022","1951","Contract: UpgradeableBeacon","once deployed","","","","returns implementation",""
"passed","Fri Feb 04 03:10:05 GMT 2022","Fri Feb 04 03:10:07 GMT 2022","2359","Contract: TransparentUpgradeableProxy","without initialization","when not sending balance","","","has expected balance",""
"passed","Fri Feb 04 03:12:26 GMT 2022","Fri Feb 04 03:12:28 GMT 2022","2004","Contract: ERC20Burnable","burnFrom","on success > for a zero amount","","","emits a transfer event",""
"passed","Fri Feb 04 03:14:15 GMT 2022","Fri Feb 04 03:14:20 GMT 2022","4553","Contract: ERC1155","like an ERC1155","Contract interface > ERC165 > ERC165's supportsInterface(bytes4)","","","uses less than 30k gas [skip-on-coverage]",""
"passed","Fri Feb 04 03:16:32 GMT 2022","Fri Feb 04 03:16:33 GMT 2022","1361","Contract: Escrow","as an escrow","deposits","","","emits a deposited event",""
"passed","Fri Feb 04 03:18:13 GMT 2022","Fri Feb 04 03:18:14 GMT 2022","1206","Contract: SafeMath","memory leakage","","","","sub",""
"passed","Fri Feb 04 03:08:40 GMT 2022","Fri Feb 04 03:08:40 GMT 2022","314","Contract: PaymentSplitter","","","","","rejects an empty set of payees",""
"passed","Fri Feb 04 03:08:52 GMT 2022","Fri Feb 04 03:08:54 GMT 2022","2510","Contract: PaymentSplitter","once deployed","shares","","","stores shares if address is payee",""
"passed","Fri Feb 04 03:15:03 GMT 2022","Fri Feb 04 03:15:07 GMT 2022","3575","Contract: ERC721Enumerable","with minted tokens","transfers > via transferFrom > when called by the approved individual","","","adjusts owners balances",""
