"Status","Start Time","Stop Time","Duration in ms","Parent Suite","Suite","Sub Suite","Test Class","Test Method","Name","Description"
"passed","Fri Oct 29 09:34:42 GMT 2021","Fri Oct 29 09:34:56 GMT 2021","14550","","Contract: ERC721Enumerable Contract interface ERC721 safeTransferFrom(address,address,uint256,bytes)","","Contract: ERC721Enumerable Contract interface ERC721 safeTransferFrom(address,address,uint256,bytes)","has to be implemented","has to be implemented",""
"passed","Fri Oct 29 08:52:28 GMT 2021","Fri Oct 29 08:52:48 GMT 2021","20748","","Contract: ERC20Permit permit","","Contract: ERC20Permit permit","rejects expired permit","rejects expired permit",""
"passed","Fri Oct 29 09:29:43 GMT 2021","Fri Oct 29 09:30:09 GMT 2021","26089","","Contract: ERC721 _mint(address, uint256) with minted token","","Contract: ERC721 _mint(address, uint256) with minted token","creates the token","creates the token",""
"passed","Fri Oct 29 09:19:02 GMT 2021","Fri Oct 29 09:19:12 GMT 2021","10272","","Contract: SafeERC20 with address that has no contract code","","Contract: SafeERC20 with address that has no contract code","reverts on approve","reverts on approve",""
"broken","Fri Oct 29 08:15:12 GMT 2021","Fri Oct 29 08:15:22 GMT 2021","10552","","Contract: ERC20VotesComp transfers","","Contract: ERC20VotesComp transfers","full delegation","full delegation",""
"passed","Fri Oct 29 08:23:15 GMT 2021","Fri Oct 29 08:23:26 GMT 2021","11326","","Contract: Clones cloneDeterministic initialization without parameters payable when not sending balance","","Contract: Clones cloneDeterministic initialization without parameters payable when not sending balance","initializes the proxy","initializes the proxy",""
"broken","Fri Oct 29 08:52:05 GMT 2021","Fri Oct 29 08:52:41 GMT 2021","36056","","Contract: ERC20Votes change delegation","","Contract: ERC20Votes change delegation","call","call",""
"passed","Fri Oct 29 09:21:49 GMT 2021","Fri Oct 29 09:22:10 GMT 2021","20388","","Contract: SafeERC20 with token that returns true on all calls","","Contract: SafeERC20 with token that returns true on all calls","doesn't revert on transferFrom","doesn't revert on transferFrom",""
"broken","Fri Oct 29 08:24:26 GMT 2021","Fri Oct 29 08:24:36 GMT 2021","10175","","Contract: Clones cloneDeterministic initialization with parameters payable when not sending balance","","Contract: Clones cloneDeterministic initialization with parameters payable when not sending balance","initializes the proxy","initializes the proxy",""
"passed","Fri Oct 29 09:30:57 GMT 2021","Fri Oct 29 09:31:15 GMT 2021","18240","","Contract: ERC721 _burn with minted tokens with burnt token","","Contract: ERC721 _burn with minted tokens with burnt token","emits a Transfer event","emits a Transfer event",""
"passed","Fri Oct 29 07:29:52 GMT 2021","Fri Oct 29 07:30:13 GMT 2021","20177","","Contract: AccessControl onlyRole modifier","","Contract: AccessControl onlyRole modifier","do not revert if sender has role","do not revert if sender has role",""
"passed","Fri Oct 29 08:02:05 GMT 2021","Fri Oct 29 08:02:18 GMT 2021","12954","","Contract: ProxyAdmin #changeProxyAdmin","","Contract: ProxyAdmin #changeProxyAdmin","fails to change proxy admin if its not the proxy owner","fails to change proxy admin if its not the proxy owner",""
"passed","Fri Oct 29 09:18:06 GMT 2021","Fri Oct 29 09:18:15 GMT 2021","9216","","Contract: ERC20PresetMinterPauser pausing","","Contract: ERC20PresetMinterPauser pausing","other accounts cannot pause","other accounts cannot pause",""
"passed","Fri Oct 29 09:35:32 GMT 2021","Fri Oct 29 09:35:43 GMT 2021","10486","","Contract: ERC721PresetMinterPauserAutoId","","Contract: ERC721PresetMinterPauserAutoId","deployer has the minter role","deployer has the minter role",""
"passed","Fri Oct 29 08:43:24 GMT 2021","Fri Oct 29 08:43:37 GMT 2021","12578","","Contract: ERC1155PresetMinterPauser Contract interface ERC1155 ERC165's supportsInterface(bytes4)","","Contract: ERC1155PresetMinterPauser Contract interface ERC1155 ERC165's supportsInterface(bytes4)","claims support [skip-on-coverage]","claims support [skip-on-coverage]",""
"broken","Fri Oct 29 09:42:06 GMT 2021","Fri Oct 29 09:42:26 GMT 2021","20427","","Contract: Arrays findUpperBound Array with gap","","Contract: Arrays findUpperBound Array with gap","returns index of first element in next filled range","returns index of first element in next filled range",""
"failed","Fri Oct 29 08:26:52 GMT 2021","Fri Oct 29 08:27:03 GMT 2021","10824","","Contract: ERC1967Proxy initialization without parameters non payable when sending some balance","","Contract: ERC1967Proxy initialization without parameters non payable when sending some balance","reverts","reverts",""
"broken","Fri Oct 29 08:56:07 GMT 2021","Fri Oct 29 08:56:19 GMT 2021","12449","","Contract: ERC20Votes getPastTotalSupply","","Contract: ERC20Votes getPastTotalSupply","returns zero if < first checkpoint block","returns zero if < first checkpoint block",""
"passed","Fri Oct 29 09:54:32 GMT 2021","Fri Oct 29 09:54:41 GMT 2021","8613","","Contract: SafeCast toUint64","","Contract: SafeCast toUint64","reverts when downcasting 2^64 + 1 (18446744073709551617)","reverts when downcasting 2^64 + 1 (18446744073709551617)",""
"passed","Fri Oct 29 08:57:35 GMT 2021","Fri Oct 29 08:58:06 GMT 2021","30190","","Contract: ERC20Snapshot snapshot","","Contract: ERC20Snapshot snapshot","creates increasing snapshots ids, starting from 1","creates increasing snapshots ids, starting from 1",""
"broken","Fri Oct 29 08:37:38 GMT 2021","Fri Oct 29 08:37:46 GMT 2021","7997","","Contract: RefundEscrow once deployed active state","","Contract: RefundEscrow once deployed active state","does not allow beneficiary withdrawal","does not allow beneficiary withdrawal",""
"passed","Fri Oct 29 07:42:50 GMT 2021","Fri Oct 29 07:43:48 GMT 2021","57530","","Contract: TimelockController methods simple schedule","","Contract: TimelockController methods simple schedule","prevent overwritting active operation","prevent overwritting active operation",""
"broken","Fri Oct 29 08:27:40 GMT 2021","Fri Oct 29 08:27:57 GMT 2021","16755","","Contract: ERC1967Proxy initialization without parameters payable when sending some balance","","Contract: ERC1967Proxy initialization without parameters payable when sending some balance","sets the implementation address","sets the implementation address",""
"passed","Fri Oct 29 08:31:06 GMT 2021","Fri Oct 29 08:31:12 GMT 2021","5776","","Contract: Arrays findUpperBound Odd number of elements","","Contract: Arrays findUpperBound Odd number of elements","returns first index after last element if searched value is over the upper boundary","returns first index after last element if searched value is over the upper boundary",""
"broken","Fri Oct 29 06:14:28 GMT 2021","Fri Oct 29 06:14:37 GMT 2021","9024","","Contract: PaymentSplitter once deployed shares","","Contract: PaymentSplitter once deployed shares","stores shares if address is payee","stores shares if address is payee",""
"passed","Fri Oct 29 09:20:18 GMT 2021","Fri Oct 29 09:20:42 GMT 2021","23912","","Contract: ERC721Enumerable with minted tokens transfers via transferFrom when called by the approved individual","","Contract: ERC721Enumerable with minted tokens transfers via transferFrom when called by the approved individual","emits an Approval event","emits an Approval event",""
"passed","Fri Oct 29 08:43:58 GMT 2021","Fri Oct 29 08:44:06 GMT 2021","7822","","Contract: ERC1155PresetMinterPauser Contract interface ERC1155 isApprovedForAll(address,address)","","Contract: ERC1155PresetMinterPauser Contract interface ERC1155 isApprovedForAll(address,address)","has to be implemented","has to be implemented",""
"passed","Fri Oct 29 09:59:51 GMT 2021","Fri Oct 29 10:00:00 GMT 2021","8958","","Contract: StorageSlot uint256 storage slot get","","Contract: StorageSlot uint256 storage slot get","from other slot","from other slot",""
"passed","Fri Oct 29 08:35:03 GMT 2021","Fri Oct 29 08:35:29 GMT 2021","25567","","Contract: Initializable basic testing without inheritance after nested initialize","","Contract: Initializable basic testing without inheritance after nested initialize","initializer has run","initializer has run",""
"broken","Fri Oct 29 08:28:32 GMT 2021","Fri Oct 29 08:28:35 GMT 2021","3251","","Contract: ERC1967Proxy initialization with parameters payable when not sending balance","","Contract: ERC1967Proxy initialization with parameters payable when not sending balance","initializes the proxy","initializes the proxy",""
"passed","Fri Oct 29 09:36:51 GMT 2021","Fri Oct 29 09:37:06 GMT 2021","15342","","Contract: ERC721Enumerable _burn with minted tokens with burnt token","","Contract: ERC721Enumerable _burn with minted tokens with burnt token","emits a Transfer event","emits a Transfer event",""
"broken","Fri Oct 29 08:30:23 GMT 2021","Fri Oct 29 08:30:27 GMT 2021","4201","","Contract: Address functionCallWithValue with non-zero value","","Contract: Address functionCallWithValue with non-zero value","reverts when calling non-payable functions","reverts when calling non-payable functions",""
"passed","Fri Oct 29 08:43:47 GMT 2021","Fri Oct 29 08:44:00 GMT 2021","12775","","Contract: ERC20Capped once deployed capped token","","Contract: ERC20Capped once deployed capped token","fails to mint if the amount exceeds the cap","fails to mint if the amount exceeds the cap",""
"passed","Fri Oct 29 08:34:22 GMT 2021","Fri Oct 29 08:34:51 GMT 2021","28455","","Contract: Initializable basic testing without inheritance after initialize","","Contract: Initializable basic testing without inheritance after initialize","initializer has run","initializer has run",""
"broken","Fri Oct 29 09:41:04 GMT 2021","Fri Oct 29 09:41:04 GMT 2021","1","","Contract: ERC777PresetFixedSupply","","Contract: ERC777PresetFixedSupply","""before all"" hook for ""returns the name""","""before all"" hook for ""returns the name""",""
"broken","Fri Oct 29 09:01:47 GMT 2021","Fri Oct 29 09:01:57 GMT 2021","9578","","Contract: ERC20Votes set delegation with signature","","Contract: ERC20Votes set delegation with signature","rejects bad nonce","rejects bad nonce",""
"passed","Fri Oct 29 08:14:51 GMT 2021","Fri Oct 29 08:14:58 GMT 2021","7028","","Contract: MinimalForwarder with message verify invalid signature","","Contract: MinimalForwarder with message verify invalid signature","tampered signature","tampered signature",""
"broken","Fri Oct 29 10:04:27 GMT 2021","Fri Oct 29 10:05:11 GMT 2021","43608","","Contract: EnumerableMap","","Contract: EnumerableMap","starts empty","starts empty",""
"passed","Fri Oct 29 09:17:24 GMT 2021","Fri Oct 29 09:17:31 GMT 2021","7067","","Contract: ERC20PresetMinterPauser minting","","Contract: ERC20PresetMinterPauser minting","other accounts cannot mint tokens","other accounts cannot mint tokens",""
"passed","Fri Oct 29 08:45:12 GMT 2021","Fri Oct 29 08:46:03 GMT 2021","51184","","Contract: ERC1155Holder","","Contract: ERC1155Holder","receives ERC1155 tokens from a multiple IDs","receives ERC1155 tokens from a multiple IDs",""
"passed","Fri Oct 29 08:50:58 GMT 2021","Fri Oct 29 08:51:11 GMT 2021","12408","","Contract: ERC20 transfer when the recipient is not the zero address when the sender transfers all balance","","Contract: ERC20 transfer when the recipient is not the zero address when the sender transfers all balance","transfers the requested amount","transfers the requested amount",""
"passed","Fri Oct 29 08:03:49 GMT 2021","Fri Oct 29 08:03:59 GMT 2021","9758","","Contract: AccessControl granting","","Contract: AccessControl granting","non-admin cannot grant role to other accounts","non-admin cannot grant role to other accounts",""
"passed","Fri Oct 29 09:33:14 GMT 2021","Fri Oct 29 09:33:43 GMT 2021","28601","","Contract: ERC721URIStorage token URI","","Contract: ERC721URIStorage token URI","tokenId is appended to base URI for tokens with no URI","tokenId is appended to base URI for tokens with no URI",""
"passed","Fri Oct 29 08:13:21 GMT 2021","Fri Oct 29 08:13:37 GMT 2021","16212","","Contract: MinimalForwarder with message verify invalid signature","","Contract: MinimalForwarder with message verify invalid signature","tampered from","tampered from",""
"broken","Fri Oct 29 09:42:46 GMT 2021","Fri Oct 29 09:43:07 GMT 2021","20450","","Contract: Context msgSender","","Contract: Context msgSender","returns the transaction sender when called from an EOA","returns the transaction sender when called from an EOA",""
"passed","Fri Oct 29 08:56:43 GMT 2021","Fri Oct 29 08:56:54 GMT 2021","11398","","Contract: ERC20Pausable pausable token transfer","","Contract: ERC20Pausable pausable token transfer","reverts when trying to transfer when paused","reverts when trying to transfer when paused",""
"passed","Fri Oct 29 08:53:57 GMT 2021","Fri Oct 29 08:54:03 GMT 2021","6715","","Contract: ERC20FlashMint flashFee","","Contract: ERC20FlashMint flashFee","token mismatch","token mismatch",""
"broken","Fri Oct 29 08:42:27 GMT 2021","Fri Oct 29 08:42:50 GMT 2021","23457","","Contract: ERC1155PresetMinterPauser","","Contract: ERC1155PresetMinterPauser","deployer has the pauser role","deployer has the pauser role",""
"broken","Fri Oct 29 08:45:48 GMT 2021","Fri Oct 29 08:45:52 GMT 2021","4002","","Contract: SafeMath with flag div","","Contract: SafeMath with flag div","divides correctly","divides correctly",""
"passed","Fri Oct 29 09:27:21 GMT 2021","Fri Oct 29 09:27:44 GMT 2021","23666","","Contract: ERC721Enumerable with minted tokens transfers via transferFrom when the sender is not authorized for the token id","","Contract: ERC721Enumerable with minted tokens transfers via transferFrom when the sender is not authorized for the token id","reverts","reverts",""
"passed","Fri Oct 29 06:38:19 GMT 2021","Fri Oct 29 06:38:27 GMT 2021","7375","","Contract: ERC20Pausable pausable token burn","","Contract: ERC20Pausable pausable token burn","reverts when trying to burn when paused","reverts when trying to burn when paused",""
"broken","Fri Oct 29 10:09:42 GMT 2021","Fri Oct 29 10:10:23 GMT 2021","40796","","Contract: EnumerableSet EnumerableBytes32Set","","Contract: EnumerableSet EnumerableBytes32Set","starts empty","starts empty",""
"passed","Fri Oct 29 06:09:41 GMT 2021","Fri Oct 29 06:09:41 GMT 2021","548","","org.neonlabs.compatibility.ConnectionKtTest","","org.neonlabs.compatibility.ConnectionKtTest","shouldConnectToNetwork","shouldConnectToNetwork()","Connection"
"passed","Fri Oct 29 08:27:38 GMT 2021","Fri Oct 29 08:28:04 GMT 2021","25478","","Contract: UUPSUpgradeable","","Contract: UUPSUpgradeable","reject upgrade to broken upgradeable implementation","reject upgrade to broken upgradeable implementation",""
"passed","Fri Oct 29 07:42:43 GMT 2021","Fri Oct 29 07:43:19 GMT 2021","35189","","Contract: ERC165Checker ERC165 not supported","","Contract: ERC165Checker ERC165 not supported","does not support mock interface via supportsAllInterfaces","does not support mock interface via supportsAllInterfaces",""
"passed","Fri Oct 29 08:25:09 GMT 2021","Fri Oct 29 08:25:32 GMT 2021","23305","","Contract: ERC1967Proxy without initialization when not sending balance","","Contract: ERC1967Proxy without initialization when not sending balance","initializes the proxy","initializes the proxy",""
"failed","Fri Oct 29 09:35:51 GMT 2021","Fri Oct 29 09:36:00 GMT 2021","9348","","Contract: ERC721PresetMinterPauserAutoId Contract interface ERC721 ERC165's supportsInterface(bytes4)","","Contract: ERC721PresetMinterPauserAutoId Contract interface ERC721 ERC165's supportsInterface(bytes4)","uses less than 30k gas [skip-on-coverage]","uses less than 30k gas [skip-on-coverage]",""
"passed","Fri Oct 29 10:06:06 GMT 2021","Fri Oct 29 10:06:34 GMT 2021","27797","","Contract: EnumerableMap set","","Contract: EnumerableMap set","adds several keys","adds several keys",""
"passed","Fri Oct 29 08:40:17 GMT 2021","Fri Oct 29 08:40:47 GMT 2021","29316","","Contract: ERC1155Supply before mint","","Contract: ERC1155Supply before mint","exist","exist",""
"passed","Fri Oct 29 08:30:02 GMT 2021","Fri Oct 29 08:30:14 GMT 2021","11408","","Contract: TransparentUpgradeableProxy without initialization when not sending balance","","Contract: TransparentUpgradeableProxy without initialization when not sending balance","initializes the proxy","initializes the proxy",""
"broken","Fri Oct 29 06:22:11 GMT 2021","Fri Oct 29 06:22:11 GMT 2021","0","","Contract: BeaconProxy","","Contract: BeaconProxy","""before all"" hook: deploy implementation for ""upgrade a proxy by upgrading its beacon""","""before all"" hook: deploy implementation for ""upgrade a proxy by upgrading its beacon""",""
"broken","Fri Oct 29 09:40:21 GMT 2021","Fri Oct 29 09:40:43 GMT 2021","22020","","Contract: ERC777 with default operators","","Contract: ERC777 with default operators","does not emit AuthorizedOperator events for default operators","does not emit AuthorizedOperator events for default operators",""
"broken","Fri Oct 29 09:41:25 GMT 2021","Fri Oct 29 09:41:45 GMT 2021","20261","","Contract: Arrays findUpperBound Even number of elements","","Contract: Arrays findUpperBound Even number of elements","returns correct index for the basic case","returns correct index for the basic case",""
"passed","Fri Oct 29 08:33:06 GMT 2021","Fri Oct 29 08:33:23 GMT 2021","16893","","Contract: ERC1155 like an ERC1155 setApprovalForAll","","Contract: ERC1155 like an ERC1155 setApprovalForAll","can unset approval for an operator","can unset approval for an operator",""
"broken","Fri Oct 29 08:23:40 GMT 2021","Fri Oct 29 08:23:40 GMT 2021","0","","Contract: TransparentUpgradeableProxy","","Contract: TransparentUpgradeableProxy","""before all"" hook: deploy implementation for ""cannot be initialized with a non-contract address""","""before all"" hook: deploy implementation for ""cannot be initialized with a non-contract address""",""
"passed","Fri Oct 29 08:58:06 GMT 2021","Fri Oct 29 08:58:20 GMT 2021","14175","","Contract: ERC20Snapshot totalSupplyAt","","Contract: ERC20Snapshot totalSupplyAt","reverts with a snapshot id of 0","reverts with a snapshot id of 0",""
"failed","Fri Oct 29 08:24:07 GMT 2021","Fri Oct 29 08:24:26 GMT 2021","18572","","Contract: Clones cloneDeterministic initialization with parameters non payable when sending some balance","","Contract: Clones cloneDeterministic initialization with parameters non payable when sending some balance","reverts","reverts",""
"passed","Fri Oct 29 08:47:00 GMT 2021","Fri Oct 29 08:47:40 GMT 2021","39616","","Contract: ERC1155Holder Contract interface ERC165 supportsInterface(bytes4)","","Contract: ERC1155Holder Contract interface ERC165 supportsInterface(bytes4)","has to be implemented","has to be implemented",""
"passed","Fri Oct 29 06:13:32 GMT 2021","Fri Oct 29 06:13:32 GMT 2021","6","tests.truffle","test_truffle","","","","test_truffle_migration",""
"passed","Fri Oct 29 08:29:24 GMT 2021","Fri Oct 29 08:29:34 GMT 2021","9820","","Contract: Pausable when unpaused when paused","","Contract: Pausable when unpaused when paused","reverts when re-pausing","reverts when re-pausing",""
"broken","Fri Oct 29 08:54:29 GMT 2021","Fri Oct 29 08:54:42 GMT 2021","13870","","Contract: ERC20Votes Compound test suite numCheckpoints","","Contract: ERC20Votes Compound test suite numCheckpoints","returns the number of checkpoints for a delegate","returns the number of checkpoints for a delegate",""
"broken","Fri Oct 29 10:11:24 GMT 2021","Fri Oct 29 10:11:55 GMT 2021","31201","","Contract: TimersBlockNumber","","Contract: TimersBlockNumber","unset","unset",""
"passed","Fri Oct 29 09:10:22 GMT 2021","Fri Oct 29 09:10:42 GMT 2021","19761","","Contract: TokenTimelock with token once deployed","","Contract: TokenTimelock with token once deployed","can get state","can get state",""
"passed","Fri Oct 29 08:31:01 GMT 2021","Fri Oct 29 08:31:09 GMT 2021","8230","","Contract: ReentrancyGuard","","Contract: ReentrancyGuard","does not allow local recursion","does not allow local recursion",""
"broken","Fri Oct 29 09:11:45 GMT 2021","Fri Oct 29 09:12:04 GMT 2021","18238","","Contract: TokenTimelock with token once deployed","","Contract: TokenTimelock with token once deployed","cannot be released twice","cannot be released twice",""
"failed","Fri Oct 29 08:23:51 GMT 2021","Fri Oct 29 08:24:03 GMT 2021","12168","","Contract: Clones cloneDeterministic initialization without parameters payable when sending some balance","","Contract: Clones cloneDeterministic initialization without parameters payable when sending some balance","has expected balance","has expected balance",""
"passed","Fri Oct 29 07:22:33 GMT 2021","Fri Oct 29 07:22:50 GMT 2021","17610","","Contract: ERC165Checker ERC165 and single interface supported","","Contract: ERC165Checker ERC165 and single interface supported","supports mock interface via supportsInterface","supports mock interface via supportsInterface",""
"passed","Fri Oct 29 10:08:12 GMT 2021","Fri Oct 29 10:08:19 GMT 2021","7445","","Contract: EnumerableMap read get","","Contract: EnumerableMap read get","missing value","missing value",""
"passed","Fri Oct 29 09:58:34 GMT 2021","Fri Oct 29 09:58:43 GMT 2021","9252","","Contract: StorageSlot boolean storage slot get","","Contract: StorageSlot boolean storage slot get","from other slot","from other slot",""
"passed","Fri Oct 29 08:22:55 GMT 2021","Fri Oct 29 08:23:04 GMT 2021","9621","","Contract: Clones cloneDeterministic initialization without parameters non payable when not sending balance","","Contract: Clones cloneDeterministic initialization without parameters non payable when not sending balance","initializes the proxy","initializes the proxy",""
"failed","Fri Oct 29 08:40:07 GMT 2021","Fri Oct 29 08:40:29 GMT 2021","21530","","Contract: SignedSafeMath div","","Contract: SignedSafeMath div","reverts on overflow, negative second","reverts on overflow, negative second",""
"passed","Fri Oct 29 08:02:49 GMT 2021","Fri Oct 29 08:02:58 GMT 2021","9198","","Contract: AccessControl Contract interface AccessControl revokeRole(bytes32,address)","","Contract: AccessControl Contract interface AccessControl revokeRole(bytes32,address)","has to be implemented","has to be implemented",""
"passed","Fri Oct 29 09:34:56 GMT 2021","Fri Oct 29 09:35:26 GMT 2021","29441","","Contract: ERC721Enumerable with minted tokens balanceOf when the given address owns some tokens","","Contract: ERC721Enumerable with minted tokens balanceOf when the given address owns some tokens","returns the amount of tokens owned by the given address","returns the amount of tokens owned by the given address",""
"failed","Fri Oct 29 07:48:58 GMT 2021","Fri Oct 29 07:49:27 GMT 2021","28890","","Contract: ERC2771Context when receiving a relayed call msgSender","","Contract: ERC2771Context when receiving a relayed call msgSender","returns the relayed transaction original sender","returns the relayed transaction original sender",""
"failed","Fri Oct 29 08:17:15 GMT 2021","Fri Oct 29 08:17:21 GMT 2021","6185","","Contract: UpgradeableBeacon","","Contract: UpgradeableBeacon","cannot be created with non-contract implementation","cannot be created with non-contract implementation",""
"passed","Fri Oct 29 08:51:17 GMT 2021","Fri Oct 29 08:51:26 GMT 2021","9301","","Contract: ERC20Permit","","Contract: ERC20Permit","initial nonce is 0","initial nonce is 0",""
"passed","Fri Oct 29 08:36:42 GMT 2021","Fri Oct 29 08:36:51 GMT 2021","9161","","Contract: Initializable complex testing with inheritance","","Contract: Initializable complex testing with inheritance","initializes child","initializes child",""
"failed","Fri Oct 29 08:32:40 GMT 2021","Fri Oct 29 08:33:08 GMT 2021","28909","","Contract: TransparentUpgradeableProxy initialization without parameters payable when sending some balance","","Contract: TransparentUpgradeableProxy initialization without parameters payable when sending some balance","has expected balance","has expected balance",""
"passed","Fri Oct 29 08:38:40 GMT 2021","Fri Oct 29 08:38:53 GMT 2021","13403","","Contract: ERC165 Contract interface ERC165 ERC165's supportsInterface(bytes4)","","Contract: ERC165 Contract interface ERC165 ERC165's supportsInterface(bytes4)","claims support [skip-on-coverage]","claims support [skip-on-coverage]",""
"failed","Fri Oct 29 09:37:57 GMT 2021","Fri Oct 29 09:38:04 GMT 2021","7670","","Contract: ERC721Enumerable Contract interface ERC721Metadata ERC165's supportsInterface(bytes4)","","Contract: ERC721Enumerable Contract interface ERC721Metadata ERC165's supportsInterface(bytes4)","uses less than 30k gas [skip-on-coverage]","uses less than 30k gas [skip-on-coverage]",""
"failed","Fri Oct 29 08:19:33 GMT 2021","Fri Oct 29 08:19:56 GMT 2021","23043","","Contract: Clones cloneDeterministic initialization with parameters payable when sending some balance","","Contract: Clones cloneDeterministic initialization with parameters payable when sending some balance","has expected balance","has expected balance",""
"passed","Fri Oct 29 08:38:10 GMT 2021","Fri Oct 29 08:38:30 GMT 2021","20668","","Contract: ERC1155 like an ERC1155 balanceOf","","Contract: ERC1155 like an ERC1155 balanceOf","reverts when queried about the zero address","reverts when queried about the zero address",""
"passed","Fri Oct 29 09:15:25 GMT 2021","Fri Oct 29 09:15:32 GMT 2021","7130","","Contract: ERC20PresetFixedSupply burning","","Contract: ERC20PresetFixedSupply burning","holders can burn their tokens","holders can burn their tokens",""
"passed","Fri Oct 29 09:13:48 GMT 2021","Fri Oct 29 09:14:13 GMT 2021","24267","","Contract: ERC20 erc20 behaviour transfer when the recipient is the zero address","","Contract: ERC20 erc20 behaviour transfer when the recipient is the zero address","reverts","reverts",""
