"Status","Start Time","Stop Time","Duration in ms","Parent Suite","Suite","Sub Suite","Test Class","Test Method","Name","Description"
"passed","Fri Oct 29 07:41:56 GMT 2021","Fri Oct 29 07:42:07 GMT 2021","11026","","Contract: ERC165Checker ERC165 missing return data","","Contract: ERC165Checker ERC165 missing return data","does not support mock interface via getSupportedInterfaces","does not support mock interface via getSupportedInterfaces",""
"broken","Fri Oct 29 08:42:13 GMT 2021","Fri Oct 29 08:42:37 GMT 2021","23979","","Contract: ERC20Burnable burnFrom on success for a non-zero amount","","Contract: ERC20Burnable burnFrom on success for a non-zero amount","burns the requested amount","burns the requested amount",""
"broken","Fri Oct 29 08:28:59 GMT 2021","Fri Oct 29 08:29:07 GMT 2021","8647","","Contract: Address sendValue when sender contract has funds with contract recipient","","Contract: Address sendValue when sender contract has funds with contract recipient","sends funds","sends funds",""
"broken","Fri Oct 29 08:06:38 GMT 2021","Fri Oct 29 08:06:53 GMT 2021","15848","","Contract: GovernorCompatibilityBravo","","Contract: GovernorCompatibilityBravo","deployment check","deployment check",""
"passed","Fri Oct 29 09:48:58 GMT 2021","Fri Oct 29 09:49:08 GMT 2021","10196","","Contract: ERC1820Implementer with registered interfaces","","Contract: ERC1820Implementer with registered interfaces","returns false when interface implementation for non-supported addresses is queried","returns false when interface implementation for non-supported addresses is queried",""
"failed","Fri Oct 29 08:05:18 GMT 2021","Fri Oct 29 08:05:24 GMT 2021","6251","","Contract: VestingWallet","","Contract: VestingWallet","rejects zero address for beneficiary","rejects zero address for beneficiary",""
"passed","Fri Oct 29 08:32:01 GMT 2021","Fri Oct 29 08:32:15 GMT 2021","14351","","Contract: Counters decrement starting from 1","","Contract: Counters decrement starting from 1","decrements the current value by one","decrements the current value by one",""
"broken","Fri Oct 29 07:35:08 GMT 2021","Fri Oct 29 07:35:19 GMT 2021","11499","","Contract: AccessControl revoking with granted role","","Contract: AccessControl revoking with granted role","a role can be revoked multiple times","a role can be revoked multiple times",""
"passed","Fri Oct 29 09:37:44 GMT 2021","Fri Oct 29 09:37:59 GMT 2021","15219","","Contract: Address sendValue when sender contract has funds","","Contract: Address sendValue when sender contract has funds","sends 0 wei","sends 0 wei",""
"broken","Fri Oct 29 08:37:18 GMT 2021","Fri Oct 29 08:37:25 GMT 2021","6326","","Contract: UUPSUpgradeable","","Contract: UUPSUpgradeable","upgrade to upgradeable implementation","upgrade to upgradeable implementation",""
"broken","Fri Oct 29 06:09:04 GMT 2021","Fri Oct 29 06:09:05 GMT 2021","423","Ethers.js","","","","","shouldCreateAcccountWithEthersJs",""
"broken","Fri Oct 29 08:25:02 GMT 2021","Fri Oct 29 08:25:28 GMT 2021","25518","","Contract: ECDSA recover with valid signature with v0 signature","","Contract: ECDSA recover with valid signature with v0 signature","works with 27 as version value","works with 27 as version value",""
"broken","Fri Oct 29 08:40:23 GMT 2021","Fri Oct 29 08:40:42 GMT 2021","18510","","Contract: ERC165Checker ERC165 supported","","Contract: ERC165Checker ERC165 supported","does not support mock interface via supportsInterface","does not support mock interface via supportsInterface",""
"failed","Fri Oct 29 09:01:50 GMT 2021","Fri Oct 29 09:01:56 GMT 2021","6197","","Contract: EnumerableSet EnumerableUintSet at","","Contract: EnumerableSet EnumerableUintSet at","reverts when retrieving non-existent elements","reverts when retrieving non-existent elements",""
"passed","Fri Oct 29 09:23:52 GMT 2021","Fri Oct 29 09:24:19 GMT 2021","27084","","Contract: ERC721Enumerable with minted tokens transfers via transferFrom when called by the operator","","Contract: ERC721Enumerable with minted tokens transfers via transferFrom when called by the operator","adjusts owners tokens by index","adjusts owners tokens by index",""
"passed","Fri Oct 29 08:47:46 GMT 2021","Fri Oct 29 08:48:02 GMT 2021","15182","","Contract: SignedSafeMath mul","","Contract: SignedSafeMath mul","multiplies correctly","multiplies correctly",""
"passed","Fri Oct 29 10:00:56 GMT 2021","Fri Oct 29 10:01:07 GMT 2021","10337","","Contract: BitMap","","Contract: BitMap","starts empty","starts empty",""
"passed","Fri Oct 29 09:53:50 GMT 2021","Fri Oct 29 09:54:06 GMT 2021","16394","","Contract: SafeCast toUint64","","Contract: SafeCast toUint64","downcasts 0","downcasts 0",""
"broken","Fri Oct 29 09:38:19 GMT 2021","Fri Oct 29 09:38:39 GMT 2021","20415","","Contract: ERC721Enumerable Contract interface ERC721Metadata name()","","Contract: ERC721Enumerable Contract interface ERC721Metadata name()","has to be implemented","has to be implemented",""
"passed","Fri Oct 29 09:55:32 GMT 2021","Fri Oct 29 09:56:08 GMT 2021","36076","","Contract: SafeCast toUint128","","Contract: SafeCast toUint128","downcasts 0","downcasts 0",""
"passed","Fri Oct 29 08:09:28 GMT 2021","Fri Oct 29 08:10:21 GMT 2021","52951","","Contract: Governor","","Contract: Governor","deployment check","deployment check",""
"broken","Fri Oct 29 09:36:54 GMT 2021","Fri Oct 29 09:37:03 GMT 2021","9192","","Contract: ERC777 relative order of hooks","","Contract: ERC777 relative order of hooks","send","send",""
"passed","Fri Oct 29 08:49:50 GMT 2021","Fri Oct 29 08:49:56 GMT 2021","6177","","Contract: MulticallToken","","Contract: MulticallToken","bubbles up revert reasons","bubbles up revert reasons",""
"passed","Fri Oct 29 09:02:44 GMT 2021","Fri Oct 29 09:04:22 GMT 2021","98512","","Contract: EnumerableSet EnumerableUintSet remove","","Contract: EnumerableSet EnumerableUintSet remove","adds and removes multiple values","adds and removes multiple values",""
"passed","Fri Oct 29 07:48:28 GMT 2021","Fri Oct 29 07:48:41 GMT 2021","13020","","Contract: ERC2771Context when called directly msgData","","Contract: ERC2771Context when called directly msgData","returns the transaction data when called from an EOA","returns the transaction data when called from an EOA",""
"passed","Fri Oct 29 08:45:31 GMT 2021","Fri Oct 29 08:45:37 GMT 2021","5903","","Contract: SafeMath with flag mul","","Contract: SafeMath with flag mul","multiplies correctly","multiplies correctly",""
"passed","Fri Oct 29 08:23:39 GMT 2021","Fri Oct 29 08:23:51 GMT 2021","12117","","Contract: Clones cloneDeterministic initialization without parameters payable when sending some balance","","Contract: Clones cloneDeterministic initialization without parameters payable when sending some balance","initializes the proxy","initializes the proxy",""
"passed","Fri Oct 29 08:39:18 GMT 2021","Fri Oct 29 08:39:26 GMT 2021","7982","","Contract: ERC1155 like an ERC1155 balanceOfBatch when accounts don't own tokens","","Contract: ERC1155 like an ERC1155 balanceOfBatch when accounts don't own tokens","returns zeros for each account","returns zeros for each account",""
"passed","Fri Oct 29 09:19:25 GMT 2021","Fri Oct 29 09:20:18 GMT 2021","52518","","Contract: ERC721Enumerable with minted tokens transfers via transferFrom when called by the approved individual","","Contract: ERC721Enumerable with minted tokens transfers via transferFrom when called by the approved individual","clears the approval for the token ID","clears the approval for the token ID",""
"broken","Fri Oct 29 08:32:00 GMT 2021","Fri Oct 29 08:32:14 GMT 2021","14014","","Contract: TransparentUpgradeableProxy initialization without parameters payable when sending some balance","","Contract: TransparentUpgradeableProxy initialization without parameters payable when sending some balance","sets the implementation address","sets the implementation address",""
"passed","Fri Oct 29 09:54:25 GMT 2021","Fri Oct 29 09:54:32 GMT 2021","7419","","Contract: SafeCast toUint64","","Contract: SafeCast toUint64","reverts when downcasting 2^64 (18446744073709551616)","reverts when downcasting 2^64 (18446744073709551616)",""
"passed","Fri Oct 29 07:37:56 GMT 2021","Fri Oct 29 07:38:24 GMT 2021","27999","","Contract: SafeMath with flag div","","Contract: SafeMath with flag div","returns complete number result on non-even division","returns complete number result on non-even division",""
"passed","Fri Oct 29 09:31:16 GMT 2021","Fri Oct 29 09:31:28 GMT 2021","12662","","Contract: ERC721URIStorage token URI","","Contract: ERC721URIStorage token URI","reverts when setting for non existent token id","reverts when setting for non existent token id",""
"passed","Fri Oct 29 09:07:57 GMT 2021","Fri Oct 29 09:08:13 GMT 2021","16416","","Contract: ERC20 deposit","","Contract: ERC20 deposit","missing balance","missing balance",""
"passed","Fri Oct 29 09:22:47 GMT 2021","Fri Oct 29 09:23:04 GMT 2021","17142","","Contract: SafeERC20 with token that returns true on all calls approvals with zero allowance","","Contract: SafeERC20 with token that returns true on all calls approvals with zero allowance","doesn't revert when increasing the allowance","doesn't revert when increasing the allowance",""
"broken","Fri Oct 29 08:35:34 GMT 2021","Fri Oct 29 08:35:54 GMT 2021","19471","","Contract: ERC1155Supply after mint batch","","Contract: ERC1155Supply after mint batch","exist","exist",""
"failed","Fri Oct 29 08:19:25 GMT 2021","Fri Oct 29 08:19:40 GMT 2021","14431","","Contract: Clones clone initialization without parameters non payable when sending some balance","","Contract: Clones clone initialization without parameters non payable when sending some balance","reverts","reverts",""
"failed","Fri Oct 29 08:04:57 GMT 2021","Fri Oct 29 08:04:59 GMT 2021","1431","","Contract: PaymentSplitter","","Contract: PaymentSplitter","rejects an empty set of payees","rejects an empty set of payees",""
"passed","Fri Oct 29 08:44:16 GMT 2021","Fri Oct 29 08:44:30 GMT 2021","14148","","Contract: Math ceilDiv","","Contract: Math ceilDiv","does not overflow","does not overflow",""
"broken","Fri Oct 29 09:26:43 GMT 2021","Fri Oct 29 09:27:02 GMT 2021","18797","","Contract: ERC721Enumerable with minted tokens transfers via transferFrom when sent to the owner","","Contract: ERC721Enumerable with minted tokens transfers via transferFrom when sent to the owner","keeps ownership of the token","keeps ownership of the token",""
"passed","Fri Oct 29 09:26:47 GMT 2021","Fri Oct 29 09:26:54 GMT 2021","7579","","Contract: ERC721 Contract interface ERC721 ERC165's supportsInterface(bytes4)","","Contract: ERC721 Contract interface ERC721 ERC165's supportsInterface(bytes4)","claims support [skip-on-coverage]","claims support [skip-on-coverage]",""
"passed","Fri Oct 29 08:38:53 GMT 2021","Fri Oct 29 08:38:58 GMT 2021","4301","","Contract: ERC165 Contract interface ERC165 supportsInterface(bytes4)","","Contract: ERC165 Contract interface ERC165 supportsInterface(bytes4)","has to be implemented","has to be implemented",""
"failed","Fri Oct 29 08:06:07 GMT 2021","Fri Oct 29 08:06:38 GMT 2021","30930","","Contract: VestingWallet vesting schedule ERC20 vesting","","Contract: VestingWallet vesting schedule ERC20 vesting","execute vesting schedule","execute vesting schedule",""
"passed","Fri Oct 29 08:33:23 GMT 2021","Fri Oct 29 08:33:37 GMT 2021","14257","","Contract: ERC1155 like an ERC1155 setApprovalForAll","","Contract: ERC1155 like an ERC1155 setApprovalForAll","reverts if attempting to approve self as an operator","reverts if attempting to approve self as an operator",""
"passed","Fri Oct 29 08:39:10 GMT 2021","Fri Oct 29 08:39:18 GMT 2021","8307","","Contract: ERC1155 like an ERC1155 balanceOfBatch","","Contract: ERC1155 like an ERC1155 balanceOfBatch","reverts when one of the addresses is the zero address","reverts when one of the addresses is the zero address",""
"passed","Fri Oct 29 08:54:43 GMT 2021","Fri Oct 29 08:54:57 GMT 2021","14069","","Contract: ERC20FlashMint flashLoan","","Contract: ERC20FlashMint flashLoan","missing approval","missing approval",""
"failed","Fri Oct 29 08:39:56 GMT 2021","Fri Oct 29 08:40:07 GMT 2021","11534","","Contract: SignedSafeMath div","","Contract: SignedSafeMath div","reverts on division by zero","reverts on division by zero",""
"broken","Fri Oct 29 08:25:01 GMT 2021","Fri Oct 29 08:25:09 GMT 2021","8011","","Contract: ERC1967Proxy without initialization when not sending balance","","Contract: ERC1967Proxy without initialization when not sending balance","sets the implementation address","sets the implementation address",""
"passed","Fri Oct 29 08:59:26 GMT 2021","Fri Oct 29 09:00:52 GMT 2021","86357","","Contract: EnumerableSet EnumerableAddressSet remove","","Contract: EnumerableSet EnumerableAddressSet remove","adds and removes multiple values","adds and removes multiple values",""
"passed","Fri Oct 29 08:31:44 GMT 2021","Fri Oct 29 08:31:49 GMT 2021","5807","","Contract: Counters increment starting from 0","","Contract: Counters increment starting from 0","increments the current value by one","increments the current value by one",""
"broken","Fri Oct 29 08:33:08 GMT 2021","Fri Oct 29 08:33:21 GMT 2021","12076","","Contract: TransparentUpgradeableProxy initialization with parameters non payable when not sending balance","","Contract: TransparentUpgradeableProxy initialization with parameters non payable when not sending balance","sets the implementation address","sets the implementation address",""
"passed","Fri Oct 29 06:09:06 GMT 2021","Fri Oct 29 06:09:06 GMT 2021","2","Ethers.js","","","","","testSigner",""
"passed","Fri Oct 29 07:28:17 GMT 2021","Fri Oct 29 07:28:39 GMT 2021","22018","","Contract: AccessControl setting role admin","","Contract: AccessControl setting role admin","the new admin can grant roles","the new admin can grant roles",""
"passed","Fri Oct 29 09:16:20 GMT 2021","Fri Oct 29 09:16:42 GMT 2021","22654","","Contract: ERC20PresetMinterPauser","","Contract: ERC20PresetMinterPauser","deployer has the minter role","deployer has the minter role",""
"broken","Fri Oct 29 08:29:26 GMT 2021","Fri Oct 29 08:29:34 GMT 2021","7384","","Contract: Address functionCall with valid contract receiver","","Contract: Address functionCall with valid contract receiver","reverts when the called function reverts, bubbling up the revert reason","reverts when the called function reverts, bubbling up the revert reason",""
"broken","Fri Oct 29 08:21:05 GMT 2021","Fri Oct 29 08:21:21 GMT 2021","15947","","Contract: Clones clone initialization with parameters payable when not sending balance","","Contract: Clones clone initialization with parameters payable when not sending balance","has expected balance","has expected balance",""
"passed","Fri Oct 29 09:04:48 GMT 2021","Fri Oct 29 09:04:57 GMT 2021","8287","","Contract: TimersBlockNumber","","Contract: TimersBlockNumber","expired","expired",""
"broken","Fri Oct 29 08:09:17 GMT 2021","Fri Oct 29 08:09:28 GMT 2021","10680","","Contract: GovernorVotesQuorumFraction","","Contract: GovernorVotesQuorumFraction","deployment check","deployment check",""
"broken","Fri Oct 29 09:44:08 GMT 2021","Fri Oct 29 09:44:29 GMT 2021","20572","","Contract: ECDSA recover with invalid signature","","Contract: ECDSA recover with invalid signature","with short signature","with short signature",""
"passed","Fri Oct 29 07:39:07 GMT 2021","Fri Oct 29 07:39:18 GMT 2021","11310","","Contract: SafeMath with flag mod modulos correctly","","Contract: SafeMath with flag mod modulos correctly","when the dividend is larger than the divisor","when the dividend is larger than the divisor",""
"passed","Fri Oct 29 08:39:01 GMT 2021","Fri Oct 29 08:39:10 GMT 2021","9066","","Contract: ERC1155 like an ERC1155 balanceOfBatch","","Contract: ERC1155 like an ERC1155 balanceOfBatch","reverts when input arrays don't match up","reverts when input arrays don't match up",""
"passed","Fri Oct 29 08:45:09 GMT 2021","Fri Oct 29 08:45:13 GMT 2021","4784","","Contract: SafeMath with flag add","","Contract: SafeMath with flag add","reverts on addition overflow","reverts on addition overflow",""
"passed","Fri Oct 29 08:33:10 GMT 2021","Fri Oct 29 08:33:20 GMT 2021","10074","","Contract: ECDSA recover with invalid signature","","Contract: ECDSA recover with invalid signature","with long signature","with long signature",""
"broken","Fri Oct 29 09:31:15 GMT 2021","Fri Oct 29 09:31:47 GMT 2021","31670","","Contract: ERC721 _burn with minted tokens with burnt token","","Contract: ERC721 _burn with minted tokens with burnt token","emits an Approval event","emits an Approval event",""
"failed","Fri Oct 29 09:26:18 GMT 2021","Fri Oct 29 09:26:26 GMT 2021","7670","","Contract: ERC721 Contract interface ERC165 ERC165's supportsInterface(bytes4)","","Contract: ERC721 Contract interface ERC165 ERC165's supportsInterface(bytes4)","uses less than 30k gas [skip-on-coverage]","uses less than 30k gas [skip-on-coverage]",""
"passed","Fri Oct 29 09:54:22 GMT 2021","Fri Oct 29 09:54:41 GMT 2021","18949","","Contract: EnumerableSet EnumerableAddressSet add","","Contract: EnumerableSet EnumerableAddressSet add","adds several values","adds several values",""
"broken","Fri Oct 29 09:37:05 GMT 2021","Fri Oct 29 09:37:06 GMT 2021","1415","","Contract: ERC777PresetFixedSupply","","Contract: ERC777PresetFixedSupply","returns the name","returns the name",""
"broken","Fri Oct 29 09:23:04 GMT 2021","Fri Oct 29 09:23:08 GMT 2021","4145","","Contract: SafeERC20 with token that returns true on all calls approvals with zero allowance","","Contract: SafeERC20 with token that returns true on all calls approvals with zero allowance","reverts when decreasing the allowance","reverts when decreasing the allowance",""
"broken","Fri Oct 29 09:51:58 GMT 2021","Fri Oct 29 09:52:02 GMT 2021","4351","","Contract: Math ceilDiv","","Contract: Math ceilDiv","does not round up on exact division","does not round up on exact division",""
"passed","Fri Oct 29 09:54:50 GMT 2021","Fri Oct 29 09:54:57 GMT 2021","7387","","Contract: SafeCast toUint96","","Contract: SafeCast toUint96","downcasts 1","downcasts 1",""
"passed","Fri Oct 29 09:52:10 GMT 2021","Fri Oct 29 09:52:21 GMT 2021","10671","","Contract: EnumerableSet EnumerableBytes32Set add","","Contract: EnumerableSet EnumerableBytes32Set add","returns false when adding values already in the set","returns false when adding values already in the set",""
"broken","Fri Oct 29 06:17:24 GMT 2021","Fri Oct 29 06:18:33 GMT 2021","69801","","Contract: Governor Contract interface ERC165 supportsInterface(bytes4)","","Contract: Governor Contract interface ERC165 supportsInterface(bytes4)","has to be implemented","has to be implemented",""
"broken","Fri Oct 29 09:06:26 GMT 2021","Fri Oct 29 09:06:30 GMT 2021","4298","","Contract: ERC20VotesComp change delegation","","Contract: ERC20VotesComp change delegation","call","call",""
"passed","Fri Oct 29 06:09:41 GMT 2021","Fri Oct 29 06:09:41 GMT 2021","565","","org.neonlabs.compatibility.ConnectionTest","","org.neonlabs.compatibility.ConnectionTest","shouldConnectToNetwork","shouldConnectToNetwork()","Connection web3j"
"broken","Fri Oct 29 09:18:00 GMT 2021","Fri Oct 29 09:18:26 GMT 2021","25802","","Contract: ERC721Enumerable with minted tokens transfers via transferFrom when called by the owner","","Contract: ERC721Enumerable with minted tokens transfers via transferFrom when called by the owner","clears the approval for the token ID","clears the approval for the token ID",""
"passed","Fri Oct 29 08:44:00 GMT 2021","Fri Oct 29 08:44:18 GMT 2021","18348","","Contract: ERC20Capped once deployed capped token","","Contract: ERC20Capped once deployed capped token","fails to mint after cap is reached","fails to mint after cap is reached",""
"passed","Fri Oct 29 08:45:13 GMT 2021","Fri Oct 29 08:45:25 GMT 2021","11435","","Contract: SafeMath with flag sub","","Contract: SafeMath with flag sub","subtracts correctly","subtracts correctly",""
"passed","Fri Oct 29 09:33:16 GMT 2021","Fri Oct 29 09:33:36 GMT 2021","20023","","Contract: ERC721Enumerable Contract interface ERC721 balanceOf(address)","","Contract: ERC721Enumerable Contract interface ERC721 balanceOf(address)","has to be implemented","has to be implemented",""
"passed","Fri Oct 29 09:54:41 GMT 2021","Fri Oct 29 09:54:50 GMT 2021","9102","","Contract: SafeCast toUint96","","Contract: SafeCast toUint96","downcasts 0","downcasts 0",""
"passed","Fri Oct 29 09:34:14 GMT 2021","Fri Oct 29 09:34:51 GMT 2021","36731","","Contract: ERC721URIStorage token URI","","Contract: ERC721URIStorage token URI","tokens with URI can be burnt ","tokens with URI can be burnt ",""
"passed","Fri Oct 29 06:13:32 GMT 2021","Fri Oct 29 06:13:32 GMT 2021","7","tests.openzeppelin","test_openzeppelin","","","","test_contracts[input_data1]",""
"passed","Fri Oct 29 09:31:28 GMT 2021","Fri Oct 29 09:32:03 GMT 2021","34769","","Contract: ERC721URIStorage token URI","","Contract: ERC721URIStorage token URI","base URI can be set","base URI can be set",""
"broken","Fri Oct 29 08:25:47 GMT 2021","Fri Oct 29 08:25:55 GMT 2021","7912","","Contract: ERC1967Proxy without initialization when sending some balance","","Contract: ERC1967Proxy without initialization when sending some balance","sets the implementation address","sets the implementation address",""
"passed","Fri Oct 29 09:25:49 GMT 2021","Fri Oct 29 09:26:18 GMT 2021","29074","","Contract: ERC721Enumerable with minted tokens transfers via transferFrom when called by the owner without an approved user","","Contract: ERC721Enumerable with minted tokens transfers via transferFrom when called by the owner without an approved user","adjusts owners balances","adjusts owners balances",""
"passed","Fri Oct 29 09:51:29 GMT 2021","Fri Oct 29 09:51:47 GMT 2021","18107","","Contract: Math average","","Contract: Math average","is correctly calculated with two even numbers","is correctly calculated with two even numbers",""
"broken","Fri Oct 29 06:15:51 GMT 2021","Fri Oct 29 06:15:56 GMT 2021","4824","","Contract: Ownable renounce ownership","","Contract: Ownable renounce ownership","prevents non-owners from renouncement","prevents non-owners from renouncement",""
"passed","Fri Oct 29 08:23:59 GMT 2021","Fri Oct 29 08:24:06 GMT 2021","7110","","Contract: ECDSA recover with valid signature using web3.eth.sign","","Contract: ECDSA recover with valid signature using web3.eth.sign","returns signer address with correct signature","returns signer address with correct signature",""
"passed","Fri Oct 29 08:27:17 GMT 2021","Fri Oct 29 08:27:26 GMT 2021","8312","","Contract: ERC1967Proxy initialization without parameters payable when not sending balance","","Contract: ERC1967Proxy initialization without parameters payable when not sending balance","initializes the proxy","initializes the proxy",""
"passed","Fri Oct 29 08:15:02 GMT 2021","Fri Oct 29 08:15:02 GMT 2021","4","","migrate-imports.js","","migrate-imports.js","every new path exists","every new path exists",""
"passed","Fri Oct 29 10:08:36 GMT 2021","Fri Oct 29 10:09:22 GMT 2021","46108","","Contract: EnumerableMap read get with message","","Contract: EnumerableMap read get with message","missing value","missing value",""
"broken","Fri Oct 29 06:30:13 GMT 2021","Fri Oct 29 06:30:13 GMT 2021","0","","Contract: ProxyAdmin","","Contract: ProxyAdmin","""before all"" hook: set implementations for ""has an owner""","""before all"" hook: set implementations for ""has an owner""",""
"passed","Fri Oct 29 09:25:57 GMT 2021","Fri Oct 29 09:26:13 GMT 2021","15857","","Contract: SafeERC20 with token that returns no boolean values approvals with non-zero allowance","","Contract: SafeERC20 with token that returns no boolean values approvals with non-zero allowance","reverts when decreasing the allowance to a negative value","reverts when decreasing the allowance to a negative value",""
"passed","Fri Oct 29 08:46:00 GMT 2021","Fri Oct 29 08:46:11 GMT 2021","11327","","Contract: SignedSafeMath add","","Contract: SignedSafeMath add","adds correctly if it does not overflow and the result is negative","adds correctly if it does not overflow and the result is negative",""
"passed","Fri Oct 29 08:25:28 GMT 2021","Fri Oct 29 08:25:58 GMT 2021","30286","","Contract: ECDSA recover with valid signature with v0 signature","","Contract: ECDSA recover with valid signature with v0 signature","reverts with wrong version","reverts with wrong version",""
"passed","Fri Oct 29 09:59:43 GMT 2021","Fri Oct 29 09:59:51 GMT 2021","8559","","Contract: StorageSlot uint256 storage slot get","","Contract: StorageSlot uint256 storage slot get","from right slot","from right slot",""
"broken","Fri Oct 29 06:56:45 GMT 2021","Fri Oct 29 06:57:06 GMT 2021","20995","","Contract: ERC721PresetMinterPauserAutoId Contract interface ERC721 isApprovedForAll(address,address)","","Contract: ERC721PresetMinterPauserAutoId Contract interface ERC721 isApprovedForAll(address,address)","has to be implemented","has to be implemented",""
"passed","Fri Oct 29 06:38:02 GMT 2021","Fri Oct 29 06:38:19 GMT 2021","17341","","Contract: ERC20Pausable pausable token burn","","Contract: ERC20Pausable pausable token burn","allows to burn when paused and then unpaused","allows to burn when paused and then unpaused",""
"passed","Fri Oct 29 07:39:11 GMT 2021","Fri Oct 29 07:39:34 GMT 2021","23593","","Contract: PaymentSplitter once deployed","","Contract: PaymentSplitter once deployed","has payees","has payees",""
"passed","Fri Oct 29 09:37:35 GMT 2021","Fri Oct 29 09:37:44 GMT 2021","8210","","Contract: Address sendValue when sender contract has no funds","","Contract: Address sendValue when sender contract has no funds","reverts when sending non-zero amounts","reverts when sending non-zero amounts",""
