"Status","Start Time","Stop Time","Duration in ms","Parent Suite","Suite","Sub Suite","Test Class","Test Method","Name","Description"
"passed","Wed Mar 23 00:50:09 GMT 2022","Wed Mar 23 00:50:11 GMT 2022","1779","Contract: SafeERC20","with address that has no contract code","","","","reverts on decreaseAllowance",""
"passed","Wed Mar 23 00:54:20 GMT 2022","Wed Mar 23 00:54:27 GMT 2022","6399","Contract: Address","functionDelegateCall","","","","delegate calls the requested function",""
"passed","Wed Mar 23 01:06:39 GMT 2022","Wed Mar 23 01:06:42 GMT 2022","3530","Contract: ERC721Enumerable","with minted tokens","approve > when approving a non-zero address > when there was a prior approval to the same address","","","sets the approval for the target address",""
"passed","Wed Mar 23 01:00:19 GMT 2022","Wed Mar 23 01:00:24 GMT 2022","5225","Contract: ERC721","with minted tokens","transfers > via safeTransferFrom > with data > to a valid receiver contract > when sent to the owner","","","keeps the owner balance",""
"broken","Wed Mar 23 00:49:17 GMT 2022","Wed Mar 23 00:49:17 GMT 2022","0","Contract: GovernorTimelockControl","nominal","","","","""after each"" hook for ""run""",""
"passed","Wed Mar 23 00:48:43 GMT 2022","Wed Mar 23 00:48:52 GMT 2022","8980","Contract: GovernorTimelockControl","Contract interface","GovernorTimelock > queue(address[],uint256[],bytes[],bytes32)","","","has to be implemented",""
"skipped","Wed Mar 23 00:54:48 GMT 2022","Wed Mar 23 00:54:48 GMT 2022","0","Contract: Governor","Proposal length","","","","missmatch #3",""
"passed","Wed Mar 23 00:44:44 GMT 2022","Wed Mar 23 00:44:46 GMT 2022","1656","Contract: TransparentUpgradeableProxy","","","","","cannot be initialized with a non-contract address",""
"passed","Wed Mar 23 00:53:20 GMT 2022","Wed Mar 23 00:53:24 GMT 2022","3610","Contract: Address","functionCall","with valid contract receiver","","","calls the requested function",""
"passed","Wed Mar 23 00:53:59 GMT 2022","Wed Mar 23 00:54:13 GMT 2022","13657","Contract: ConditionalEscrow","when withdrawal is allowed","as an escrow > deposits","","","only the owner can deposit",""
"passed","Wed Mar 23 01:02:38 GMT 2022","Wed Mar 23 01:02:41 GMT 2022","3055","Contract: ERC721","with minted tokens","transfers > via safeTransferFrom > without data > to a user account > when the address of the previous owner is incorrect","","","reverts",""
"passed","Wed Mar 23 00:48:25 GMT 2022","Wed Mar 23 00:48:33 GMT 2022","8194","Contract: ERC1155","like an ERC1155","safeTransferFrom > to a receiver contract returning unexpected value","","","reverts",""
"passed","Wed Mar 23 00:56:37 GMT 2022","Wed Mar 23 00:56:38 GMT 2022","1460","Contract: SafeCast","toInt32","","","","reverts when downcasting 2^31 + 1 (2147483649)",""
"passed","Wed Mar 23 00:48:08 GMT 2022","Wed Mar 23 00:48:10 GMT 2022","1782","Contract: ERC20Capped","once deployed","capped token","","","starts with the correct cap",""
"passed","Wed Mar 23 00:54:40 GMT 2022","Wed Mar 23 00:54:45 GMT 2022","5144","Contract: ERC721","with minted tokens","transfers > via transferFrom > when sent to the owner","","","keeps same tokens by index",""
"passed","Wed Mar 23 00:57:09 GMT 2022","Wed Mar 23 00:57:11 GMT 2022","2540","Contract: EnumerableSet","EnumerableUintSet","add","","","returns false when adding values already in the set",""
"passed","Wed Mar 23 00:44:38 GMT 2022","Wed Mar 23 00:44:41 GMT 2022","2364","Contract: Clones","clone","initialization without parameters > payable > when sending some balance","","","has expected balance",""
"passed","Wed Mar 23 00:45:37 GMT 2022","Wed Mar 23 00:45:40 GMT 2022","2564","Contract: ReentrancyGuard","","","","","does not allow remote callback",""
"passed","Wed Mar 23 01:02:16 GMT 2022","Wed Mar 23 01:02:21 GMT 2022","4251","Contract: ERC721","with minted tokens","transfers > via safeTransferFrom > without data > to a user account > when called by the owner without an approved user","","","adjusts owners tokens by index",""
"passed","Wed Mar 23 00:49:20 GMT 2022","Wed Mar 23 00:49:23 GMT 2022","2195","Contract: ERC20","increase allowance","when the spender is not the zero address > when the sender does not have enough balance > when there was no approved amount before","","","approves the requested amount",""
"passed","Wed Mar 23 01:07:02 GMT 2022","Wed Mar 23 01:07:05 GMT 2022","2966","Contract: ERC721Enumerable","with minted tokens","approve > when the sender is an operator","","","emits an approval event",""
"passed","Wed Mar 23 00:43:43 GMT 2022","Wed Mar 23 00:44:01 GMT 2022","18063","Contract: Governor","Contract interface","ERC165 > ERC165's supportsInterface(bytes4)","","","claims support [skip-on-coverage]",""
"passed","Wed Mar 23 00:54:53 GMT 2022","Wed Mar 23 00:54:55 GMT 2022","1196","Contract: Math","ceilDiv","","","","correctly computes max uint256 divided by 1",""
"passed","Wed Mar 23 00:45:44 GMT 2022","Wed Mar 23 00:45:49 GMT 2022","4632","Contract: TransparentUpgradeableProxy","initialization with parameters","payable > when sending some balance","","","initializes the proxy",""
"skipped","Wed Mar 23 00:45:20 GMT 2022","Wed Mar 23 00:45:20 GMT 2022","1","Contract: TransparentUpgradeableProxy","initialization without parameters","payable > when not sending balance","","","sets the implementation address",""
"skipped","Wed Mar 23 00:48:54 GMT 2022","Wed Mar 23 00:48:54 GMT 2022","0","Contract: ERC20Votes","Compound test suite","getPastVotes","","","reverts if block number >= current block",""
"passed","Wed Mar 23 00:53:14 GMT 2022","Wed Mar 23 00:53:16 GMT 2022","1806","Contract: ECDSA","recover with valid signature","","","","reverts with high-s value signature",""
"passed","Wed Mar 23 01:03:28 GMT 2022","Wed Mar 23 01:03:33 GMT 2022","5228","Contract: ERC721","with minted tokens","transfers > via safeTransferFrom > without data > to a valid receiver contract > when called by the approved individual","","","transfers the ownership of the given token ID to the given address",""
"passed","Wed Mar 23 00:55:46 GMT 2022","Wed Mar 23 00:55:49 GMT 2022","3332","Contract: StorageSlot","address storage slot","get","","","from other slot",""
"passed","Wed Mar 23 01:04:23 GMT 2022","Wed Mar 23 01:04:27 GMT 2022","4469","Contract: ERC721","with minted tokens","transfers > via safeTransferFrom > without data > to a valid receiver contract > when called by the operator","","","adjusts owners tokens by index",""
"passed","Wed Mar 23 01:06:25 GMT 2022","Wed Mar 23 01:06:28 GMT 2022","2429","Contract: ERC721Enumerable","with minted tokens","approve > when clearing approval > when there was no prior approval","","","emits an approval event",""
"passed","Wed Mar 23 00:48:18 GMT 2022","Wed Mar 23 00:48:25 GMT 2022","6897","Contract: ERC1155","like an ERC1155","safeTransferFrom > when sending to a valid receiver > with data","","","calls onERC1155Received",""
"passed","Wed Mar 23 00:43:08 GMT 2022","Wed Mar 23 00:43:14 GMT 2022","5940","Contract: GovernorTimelockCompound","Contract interface","ERC165 > ERC165's supportsInterface(bytes4)","","","claims support [skip-on-coverage]",""
"passed","Wed Mar 23 00:49:08 GMT 2022","Wed Mar 23 00:49:18 GMT 2022","9831","Contract: ERC1155","like an ERC1155","safeBatchTransferFrom > when called by an operator on behalf of the multiTokenHolder > when operator is not approved by multiTokenHolder","","","reverts",""
"skipped","Wed Mar 23 00:43:33 GMT 2022","Wed Mar 23 00:43:33 GMT 2022","1","Contract: TimelockController","usage scenario","","","","call reverting",""
"passed","Wed Mar 23 00:48:17 GMT 2022","Wed Mar 23 00:48:27 GMT 2022","10305","Contract: GovernorTimelockControl","Contract interface","GovernorTimelock > timelock()","","","has to be implemented",""
"passed","Wed Mar 23 00:56:21 GMT 2022","Wed Mar 23 00:56:23 GMT 2022","1255","Contract: SafeCast","toInt32","","","","downcasts 1",""
"passed","Wed Mar 23 00:47:02 GMT 2022","Wed Mar 23 00:47:12 GMT 2022","10318","Contract: TransparentUpgradeableProxy","upgradeToAndCall","with migrations > when the sender is the admin > when upgrading to V1 > when upgrading to V2 > when upgrading to V3","","","upgrades to the requested version and emits an event",""
"passed","Wed Mar 23 00:48:30 GMT 2022","Wed Mar 23 00:48:33 GMT 2022","3011","Contract: ERC20","decrease allowance","when the spender is not the zero address > when the sender has enough balance > when there was no approved amount before","","","reverts",""
"failed","Wed Mar 23 00:48:02 GMT 2022","Wed Mar 23 00:48:21 GMT 2022","18779","tests.truffle","test_truffle","","","","test_truffle_migration",""
"passed","Wed Mar 23 00:47:19 GMT 2022","Wed Mar 23 00:47:22 GMT 2022","2826","Contract: ERC1155PresetMinterPauser","Contract interface","AccessControl > renounceRole(bytes32,address)","","","has to be implemented",""
"passed","Wed Mar 23 00:45:07 GMT 2022","Wed Mar 23 00:45:21 GMT 2022","14379","Contract: Initializable","complex testing with inheritance","","","","initializes gramps",""
"passed","Wed Mar 23 00:55:11 GMT 2022","Wed Mar 23 00:55:16 GMT 2022","4920","Contract: ERC721","with minted tokens","transfers > via safeTransferFrom > with data > to a user account > when called by the owner","","","transfers the ownership of the given token ID to the given address",""
"passed","Wed Mar 23 00:43:52 GMT 2022","Wed Mar 23 00:44:02 GMT 2022","9934","Contract: AccessControl","setting role admin","","","","the new admin can grant roles",""
"passed","Wed Mar 23 01:02:24 GMT 2022","Wed Mar 23 01:02:28 GMT 2022","3750","Contract: ERC721Enumerable","with minted tokens","transfers > via safeTransferFrom > without data > to a user account > when sent to the owner","","","emits only a transfer event",""
"passed","Wed Mar 23 00:52:01 GMT 2022","Wed Mar 23 00:52:04 GMT 2022","2814","Contract: ERC721URIStorage","token URI","","","","reverts when setting for non existent token id",""
"passed","Wed Mar 23 00:57:34 GMT 2022","Wed Mar 23 00:57:37 GMT 2022","3413","Contract: ERC721Enumerable","with minted tokens","transfers > via safeTransferFrom > with data > to a user account > when sent to the owner","","","keeps the owner balance",""
"passed","Wed Mar 23 00:58:17 GMT 2022","Wed Mar 23 00:58:22 GMT 2022","4554","Contract: ERC721Enumerable","with minted tokens","transfers > via safeTransferFrom > with data > to a valid receiver contract > when called by the owner","","","emits an Approval event",""
"passed","Wed Mar 23 00:51:39 GMT 2022","Wed Mar 23 00:51:50 GMT 2022","10352","Contract: ERC721Enumerable","with minted tokens","transfers > via transferFrom > when called by the owner","","","clears the approval for the token ID",""
"passed","Wed Mar 23 00:53:19 GMT 2022","Wed Mar 23 00:53:22 GMT 2022","2619","Contract: ECDSA","recover with valid signature","using web3.eth.sign","","","returns a different address",""
"skipped","Wed Mar 23 00:46:35 GMT 2022","Wed Mar 23 00:46:35 GMT 2022","0","tests.hardhat","test_hardhat","","","","test_hardhat_simple",""
"passed","Wed Mar 23 00:57:15 GMT 2022","Wed Mar 23 00:57:17 GMT 2022","1917","Contract: EnumerableSet","EnumerableUintSet","remove","","","returns false when removing values not in the set",""
"broken","Wed Mar 23 00:50:00 GMT 2022","Wed Mar 23 00:50:22 GMT 2022","21734","Contract: GovernorTimelockCompound","updateTimelock","using workflow","","","run",""
"passed","Wed Mar 23 00:52:50 GMT 2022","Wed Mar 23 00:52:52 GMT 2022","2138","Contract: Arrays","findUpperBound","Odd number of elements","","","returns first index after last element if searched value is over the upper boundary",""
"passed","Wed Mar 23 01:04:13 GMT 2022","Wed Mar 23 01:04:17 GMT 2022","4675","Contract: ERC721","with minted tokens","transfers > via safeTransferFrom > without data > to a valid receiver contract > when called by the operator","","","emits an Approval event",""
"passed","Wed Mar 23 01:08:57 GMT 2022","Wed Mar 23 01:09:00 GMT 2022","2598","Contract: ERC721Enumerable","_burn","with minted tokens > with burnt token","","","adjusts all tokens list",""
"passed","Wed Mar 23 00:44:22 GMT 2022","Wed Mar 23 00:44:25 GMT 2022","3438","Contract: BeaconProxy","","","","","upgrade a proxy by upgrading its beacon",""
"passed","Wed Mar 23 00:54:48 GMT 2022","Wed Mar 23 00:54:50 GMT 2022","1639","Contract: SafeCast","toUint16","","","","downcasts 0",""
"passed","Wed Mar 23 00:54:05 GMT 2022","Wed Mar 23 00:54:08 GMT 2022","3713","Contract: Address","functionCallWithValue","with non-zero value","","","reverts when calling non-payable functions",""
"passed","Wed Mar 23 00:46:41 GMT 2022","Wed Mar 23 00:46:49 GMT 2022","7602","Contract: TransparentUpgradeableProxy","upgradeToAndCall","with migrations > when the sender is the admin > when upgrading to V1","","","calls the 'initialize' function and sends given value to the proxy",""
"passed","Wed Mar 23 00:53:29 GMT 2022","Wed Mar 23 00:53:36 GMT 2022","6839","Contract: ERC721","with minted tokens","transfers > via transferFrom > when called by the owner without an approved user","","","transfers the ownership of the given token ID to the given address",""
"passed","Wed Mar 23 00:55:53 GMT 2022","Wed Mar 23 00:55:56 GMT 2022","3227","Contract: StorageSlot","bytes32 storage slot","get","","","from right slot",""
"passed","Wed Mar 23 01:07:19 GMT 2022","Wed Mar 23 01:07:22 GMT 2022","3026","Contract: ERC721Enumerable","with minted tokens","setApprovalForAll > when the operator willing to approve is not the owner > when the operator was set as not approved","","","can unset the operator approval",""
"passed","Wed Mar 23 00:58:27 GMT 2022","Wed Mar 23 00:58:32 GMT 2022","5133","Contract: ERC721Enumerable","with minted tokens","transfers > via safeTransferFrom > with data > to a valid receiver contract > when called by the owner","","","adjusts owners tokens by index",""
"passed","Wed Mar 23 00:43:42 GMT 2022","Wed Mar 23 00:43:45 GMT 2022","3517","Contract: AccessControl","renouncing","with granted role","","","a role can be renounced multiple times",""
"passed","Wed Mar 23 00:44:20 GMT 2022","Wed Mar 23 00:44:21 GMT 2022","1298","Contract: AccessControl","Contract interface","AccessControlEnumerable > ERC165's supportsInterface(bytes4)","","","claims support [skip-on-coverage]",""
"passed","Wed Mar 23 01:00:53 GMT 2022","Wed Mar 23 01:00:56 GMT 2022","3457","Contract: ERC721Enumerable","with minted tokens","transfers > via safeTransferFrom > without data > to a user account > when called by the owner","","","clears the approval for the token ID",""
"passed","Wed Mar 23 00:44:10 GMT 2022","Wed Mar 23 00:44:11 GMT 2022","1471","Contract: MinimalForwarder","with message","verify > invalid signature","","","tampered nonce",""
"passed","Wed Mar 23 00:47:48 GMT 2022","Wed Mar 23 00:47:54 GMT 2022","5960","Contract: ERC20","transfer from","when the token owner is not the zero address > when the recipient is not the zero address > when the spender has enough approved balance > when the token owner has enough balance","","","emits a transfer event",""
"skipped","Wed Mar 23 00:48:54 GMT 2022","Wed Mar 23 00:48:54 GMT 2022","0","Contract: ERC20Votes","Compound test suite","getPastVotes","","","returns 0 if there are no checkpoints",""
"passed","Wed Mar 23 00:46:03 GMT 2022","Wed Mar 23 00:46:04 GMT 2022","1598","Contract: TransparentUpgradeableProxy","upgradeTo","when the sender is the admin > when the given implementation is different from the current one","","","emits an event",""
"passed","Wed Mar 23 00:45:23 GMT 2022","Wed Mar 23 00:45:25 GMT 2022","1760","Contract: Initializable","complex testing with inheritance","","","","initializes child",""
"passed","Wed Mar 23 00:51:24 GMT 2022","Wed Mar 23 00:51:28 GMT 2022","3699","Contract: ERC721Pausable","when token is paused","","","","reverts when trying to burn",""
"skipped","Wed Mar 23 00:48:51 GMT 2022","Wed Mar 23 00:48:51 GMT 2022","0","Contract: ERC20VotesComp","Compound test suite","getPriorVotes","","","reverts if block number >= current block",""
"skipped","Wed Mar 23 00:43:33 GMT 2022","Wed Mar 23 00:43:33 GMT 2022","0","Contract: TimelockController","methods","batch > execute > with scheduled operation > on time","","","executor can reveal",""
"passed","Wed Mar 23 00:50:17 GMT 2022","Wed Mar 23 00:50:21 GMT 2022","4261","Contract: ERC20","erc20 behaviour","total supply","","","returns the total amount of tokens",""
"passed","Wed Mar 23 00:44:43 GMT 2022","Wed Mar 23 00:44:45 GMT 2022","1260","Contract: ERC1967Proxy","initialization without parameters","payable > when sending some balance","","","initializes the proxy",""
"passed","Wed Mar 23 01:03:35 GMT 2022","Wed Mar 23 01:03:40 GMT 2022","4918","Contract: ERC721Enumerable","with minted tokens","transfers > via safeTransferFrom > without data > to a valid receiver contract > when called by the approved individual","","","clears the approval for the token ID",""
"passed","Wed Mar 23 00:53:52 GMT 2022","Wed Mar 23 00:54:05 GMT 2022","12422","Contract: Address","functionCallWithValue","with non-zero value","","","calls the requested function with transaction funds",""
"passed","Wed Mar 23 00:53:25 GMT 2022","Wed Mar 23 00:53:29 GMT 2022","4630","Contract: ERC721","with minted tokens","transfers > via transferFrom > when called by the operator","","","adjusts owners tokens by index",""
"passed","Wed Mar 23 00:52:34 GMT 2022","Wed Mar 23 00:52:35 GMT 2022","1277","Contract: ERC721PresetMinterPauserAutoId","Contract interface","ERC721 > approve(address,uint256)","","","has to be implemented",""
"skipped","Wed Mar 23 00:48:54 GMT 2022","Wed Mar 23 00:48:54 GMT 2022","0","Contract: ERC20Votes","getPastTotalSupply","","","","returns zero if < first checkpoint block",""
"passed","Wed Mar 23 00:43:01 GMT 2022","Wed Mar 23 00:43:21 GMT 2022","19670","Contract: GovernorComp","voting with comp token","","","","run",""
"passed","Wed Mar 23 00:50:01 GMT 2022","Wed Mar 23 00:50:23 GMT 2022","22671","Contract: Governor","scenario","duplicate executed proposal","","","run",""
"passed","Wed Mar 23 00:55:08 GMT 2022","Wed Mar 23 00:55:10 GMT 2022","1555","Contract: ERC165Checker","account address does not support ERC165","","","","does not support ERC165",""
"passed","Wed Mar 23 00:48:07 GMT 2022","Wed Mar 23 00:48:09 GMT 2022","2771","Contract: ERC20","transfer from","when the token owner is not the zero address > when the recipient is the zero address","","","reverts",""
"passed","Wed Mar 23 01:07:45 GMT 2022","Wed Mar 23 01:07:48 GMT 2022","3268","Contract: ERC721","_burn","with minted tokens > with burnt token","","","emits a Transfer event",""
"failed","Wed Mar 23 00:49:17 GMT 2022","Wed Mar 23 00:49:17 GMT 2022","0","Contract: GovernorTimelockCompound","re-queue / re-execute","","","","""after each"" hook for ""run""",""
"passed","Wed Mar 23 00:53:02 GMT 2022","Wed Mar 23 00:53:07 GMT 2022","4838","Contract: ERC721Enumerable","with minted tokens","transfers > via transferFrom > when called by the operator","","","emits a Transfer event",""
"passed","Wed Mar 23 00:43:39 GMT 2022","Wed Mar 23 00:43:43 GMT 2022","4704","Contract: ERC2771Context","when called directly","msgSender","","","returns the transaction sender when called from an EOA",""
"passed","Wed Mar 23 00:44:26 GMT 2022","Wed Mar 23 00:44:28 GMT 2022","1356","Contract: Clones","clone","initialization without parameters > non payable > when sending some balance","","","reverts",""
"passed","Wed Mar 23 00:51:22 GMT 2022","Wed Mar 23 00:51:30 GMT 2022","7340","Contract: ERC721Enumerable","with minted tokens","transfers > via transferFrom > when called by the owner","","","transfers the ownership of the given token ID to the given address",""
"skipped","Wed Mar 23 00:43:33 GMT 2022","Wed Mar 23 00:43:33 GMT 2022","0","Contract: TimelockController","usage scenario","","","","call",""
"passed","Wed Mar 23 00:50:47 GMT 2022","Wed Mar 23 00:50:48 GMT 2022","1176","Contract: ERC721Enumerable","Contract interface","ERC721 > balanceOf(address)","","","has to be implemented",""
"passed","Wed Mar 23 00:44:31 GMT 2022","Wed Mar 23 00:44:32 GMT 2022","611","Contract: BeaconProxy","bad beacon is not accepted","","","","non-contract beacon",""
"passed","Wed Mar 23 00:57:31 GMT 2022","Wed Mar 23 00:57:34 GMT 2022","3294","Contract: ERC721Enumerable","with minted tokens","transfers > via safeTransferFrom > with data > to a user account > when sent to the owner","","","emits only a transfer event",""
"passed","Wed Mar 23 00:43:38 GMT 2022","Wed Mar 23 00:43:38 GMT 2022","4","Ethers.js","","","","","testContracts",""
"passed","Wed Mar 23 00:43:35 GMT 2022","Wed Mar 23 00:43:36 GMT 2022","655","Ethers.js","","","","","shouldConnectViaEthersJs",""
"passed","Wed Mar 23 01:01:52 GMT 2022","Wed Mar 23 01:01:56 GMT 2022","4175","Contract: ERC721Enumerable","with minted tokens","transfers > via safeTransferFrom > without data > to a user account > when called by the owner without an approved user","","","transfers the ownership of the given token ID to the given address",""
"passed","Wed Mar 23 00:56:08 GMT 2022","Wed Mar 23 00:56:09 GMT 2022","1283","Contract: SafeMath","memory leakage","","","","mul",""
"passed","Wed Mar 23 00:45:43 GMT 2022","Wed Mar 23 00:45:58 GMT 2022","14650","Contract: PullPayment","withdrawPayments","","","","can withdraw payment",""
"passed","Wed Mar 23 00:48:54 GMT 2022","Wed Mar 23 00:48:56 GMT 2022","2547","Contract: ERC20Pausable","pausable token","transfer from","","","allows to transfer from when unpaused",""
"passed","Wed Mar 23 01:02:00 GMT 2022","Wed Mar 23 01:02:03 GMT 2022","3929","Contract: ERC721Enumerable","with minted tokens","transfers > via safeTransferFrom > without data > to a user account > when called by the owner without an approved user","","","clears the approval for the token ID",""
"passed","Wed Mar 23 01:00:34 GMT 2022","Wed Mar 23 01:00:38 GMT 2022","4193","Contract: ERC721","with minted tokens","transfers > via safeTransferFrom > with data > to a valid receiver contract > when the sender is not authorized for the token id","","","reverts",""
"passed","Wed Mar 23 00:52:33 GMT 2022","Wed Mar 23 00:52:34 GMT 2022","1646","Contract: ERC721PresetMinterPauserAutoId","Contract interface","ERC721 > ownerOf(uint256)","","","has to be implemented",""
"passed","Wed Mar 23 01:07:12 GMT 2022","Wed Mar 23 01:07:15 GMT 2022","3279","Contract: ERC721","with minted tokens","setApprovalForAll > when the operator willing to approve is not the owner > when the operator was set as not approved","","","approves the operator",""
"passed","Wed Mar 23 00:53:42 GMT 2022","Wed Mar 23 00:53:44 GMT 2022","1455","Contract: Escrow","as an escrow","deposits","","","only the owner can deposit",""
"passed","Wed Mar 23 00:44:54 GMT 2022","Wed Mar 23 00:44:54 GMT 2022","117","Contract: ERC1967Proxy","initialization with parameters","reverting initialization","","","reverts",""
"passed","Wed Mar 23 00:49:36 GMT 2022","Wed Mar 23 00:49:36 GMT 2022","51","Contract: ERC20PresetFixedSupply","","","","","total supply is equal to initial supply",""
"passed","Wed Mar 23 00:53:51 GMT 2022","Wed Mar 23 00:53:53 GMT 2022","2018","Contract: RefundEscrow","once deployed","active state","","","does not allow beneficiary withdrawal",""
"passed","Wed Mar 23 00:47:10 GMT 2022","Wed Mar 23 00:47:21 GMT 2022","11454","Contract: ERC1155","like an ERC1155","safeTransferFrom > when called by an operator on behalf of the multiTokenHolder > when operator is approved by multiTokenHolder","","","credits transferred balance to receiver",""
"passed","Wed Mar 23 00:54:53 GMT 2022","Wed Mar 23 00:54:55 GMT 2022","1046","Contract: SafeMath","with flag","mul","","","multiplies correctly",""
"passed","Wed Mar 23 00:45:26 GMT 2022","Wed Mar 23 00:45:35 GMT 2022","8520","Contract: GovernorTimelockControl","Contract interface","Governor > proposalDeadline(uint256)","","","has to be implemented",""
"passed","Wed Mar 23 00:52:19 GMT 2022","Wed Mar 23 00:52:22 GMT 2022","2816","Contract: ERC721PresetMinterPauserAutoId","","","","","token has correct symbol",""
"passed","Wed Mar 23 00:44:41 GMT 2022","Wed Mar 23 00:44:43 GMT 2022","2428","Contract: ProxyAdmin","","","","","has an owner",""
"passed","Wed Mar 23 00:50:37 GMT 2022","Wed Mar 23 00:50:39 GMT 2022","1769","Contract: ERC721Enumerable","Contract interface","ERC165 > ERC165's supportsInterface(bytes4)","","","uses less than 30k gas [skip-on-coverage]",""
"passed","Wed Mar 23 00:47:54 GMT 2022","Wed Mar 23 00:47:59 GMT 2022","4776","Contract: ERC20","transfer from","when the token owner is not the zero address > when the recipient is not the zero address > when the spender has enough approved balance > when the token owner has enough balance","","","emits an approval event",""
"passed","Wed Mar 23 00:48:51 GMT 2022","Wed Mar 23 00:48:54 GMT 2022","3048","Contract: ERC20","decrease allowance","when the spender is not the zero address > when the sender does not have enough balance > when the spender had an approved amount","","","decreases the spender allowance subtracting the requested amount",""
"passed","Wed Mar 23 00:48:48 GMT 2022","Wed Mar 23 00:48:50 GMT 2022","2395","Contract: ERC20Snapshot","snapshot","","","","emits a snapshot event",""
"broken","Wed Mar 23 00:46:29 GMT 2022","Wed Mar 23 00:46:29 GMT 2022","0","tests.brownie.token.tests","test_approve","","","","test_initial_approval_is_zero[0]",""
"passed","Wed Mar 23 00:43:36 GMT 2022","Wed Mar 23 00:43:39 GMT 2022","3529","Contract: AccessControl","renouncing","with granted role","","","bearer can renounce role",""
"skipped","Wed Mar 23 00:45:44 GMT 2022","Wed Mar 23 00:45:44 GMT 2022","0","Contract: TransparentUpgradeableProxy","initialization with parameters","payable > when sending some balance","","","sets the implementation address",""
"passed","Wed Mar 23 00:43:43 GMT 2022","Wed Mar 23 00:43:51 GMT 2022","7702","Contract: ERC2771Context","when called directly","msgSender","","","returns the transaction sender when from another contract",""
