"Status","Start Time","Stop Time","Duration in ms","Parent Suite","Suite","Sub Suite","Test Class","Test Method","Name","Description"
"passed","Tue Dec 07 17:23:43 GMT 2021","Tue Dec 07 17:23:56 GMT 2021","13833","","Contract: ERC20 decrease allowance when the spender is not the zero address when the sender does not have enough balance when the spender had an approved amount","","Contract: ERC20 decrease allowance when the spender is not the zero address when the sender does not have enough balance when the spender had an approved amount","reverts when more than the full allowance is removed","reverts when more than the full allowance is removed",""
"skipped","Tue Dec 07 17:17:18 GMT 2021","Tue Dec 07 17:17:18 GMT 2021","0","","Contract: ERC20VotesComp Compound test suite getPriorVotes","","Contract: ERC20VotesComp Compound test suite getPriorVotes","reverts if block number >= current block","reverts if block number >= current block",""
"passed","Tue Dec 07 17:26:37 GMT 2021","Tue Dec 07 17:26:59 GMT 2021","21870","","Contract: ERC721 with minted tokens transfers via transferFrom when called by the approved individual","","Contract: ERC721 with minted tokens transfers via transferFrom when called by the approved individual","clears the approval for the token ID","clears the approval for the token ID",""
"passed","Tue Dec 07 18:51:31 GMT 2021","Tue Dec 07 18:51:40 GMT 2021","8523","","Contract: EnumerableSet EnumerableUintSet","","Contract: EnumerableSet EnumerableUintSet","starts empty","starts empty",""
"passed","Tue Dec 07 18:06:16 GMT 2021","Tue Dec 07 18:06:38 GMT 2021","22027","","Contract: ERC721Enumerable with minted tokens transfers via safeTransferFrom without data to a user account when called by the owner without an approved user","","Contract: ERC721Enumerable with minted tokens transfers via safeTransferFrom without data to a user account when called by the owner without an approved user","emits a Transfer event","emits a Transfer event",""
"passed","Tue Dec 07 18:28:29 GMT 2021","Tue Dec 07 18:28:52 GMT 2021","23092","","Contract: ERC721 with minted tokens transfers via safeTransferFrom to a receiver contract that panics","","Contract: ERC721 with minted tokens transfers via safeTransferFrom to a receiver contract that panics","reverts","reverts",""
"passed","Tue Dec 07 17:27:05 GMT 2021","Tue Dec 07 17:27:30 GMT 2021","24496","","Contract: ERC721Enumerable with minted tokens transfers via transferFrom when called by the operator","","Contract: ERC721Enumerable with minted tokens transfers via transferFrom when called by the operator","adjusts owners tokens by index","adjusts owners tokens by index",""
"passed","Tue Dec 07 18:14:40 GMT 2021","Tue Dec 07 18:15:04 GMT 2021","23370","","Contract: ERC721 with minted tokens transfers via safeTransferFrom without data to a valid receiver contract when called by the owner","","Contract: ERC721 with minted tokens transfers via safeTransferFrom without data to a valid receiver contract when called by the owner","emits an Approval event","emits an Approval event",""
"passed","Tue Dec 07 18:48:21 GMT 2021","Tue Dec 07 18:48:31 GMT 2021","10152","","Contract: ERC165Checker ERC165 and single interface supported","","Contract: ERC165Checker ERC165 and single interface supported","supports mock interface via supportsAllInterfaces","supports mock interface via supportsAllInterfaces",""
"passed","Tue Dec 07 18:05:08 GMT 2021","Tue Dec 07 18:05:28 GMT 2021","19470","","Contract: ERC721 with minted tokens transfers via safeTransferFrom without data to a user account when called by the approved individual","","Contract: ERC721 with minted tokens transfers via safeTransferFrom without data to a user account when called by the approved individual","adjusts owners tokens by index","adjusts owners tokens by index",""
"passed","Tue Dec 07 17:35:32 GMT 2021","Tue Dec 07 17:35:52 GMT 2021","19674","","Contract: ERC721Enumerable with minted tokens transfers via safeTransferFrom with data to a user account when called by the approved individual","","Contract: ERC721Enumerable with minted tokens transfers via safeTransferFrom with data to a user account when called by the approved individual","emits a Transfer event","emits a Transfer event",""
"skipped","Tue Dec 07 16:19:29 GMT 2021","Tue Dec 07 16:19:29 GMT 2021","0","","Contract: TimelockController usage scenario","","Contract: TimelockController usage scenario","call out of gas","call out of gas",""
"passed","Tue Dec 07 16:28:45 GMT 2021","Tue Dec 07 16:29:15 GMT 2021","29634","","Contract: Governor Contract interface Governor castVote(uint256,uint8)","","Contract: Governor Contract interface Governor castVote(uint256,uint8)","has to be implemented","has to be implemented",""
"passed","Tue Dec 07 17:18:17 GMT 2021","Tue Dec 07 17:18:31 GMT 2021","13675","","Contract: ERC20Pausable pausable token transfer from","","Contract: ERC20Pausable pausable token transfer from","reverts when trying to transfer from when paused","reverts when trying to transfer from when paused",""
"passed","Tue Dec 07 17:24:53 GMT 2021","Tue Dec 07 17:25:07 GMT 2021","13240","","Contract: ERC20 increase allowance when the spender is not the zero address when the sender does not have enough balance when the spender had an approved amount","","Contract: ERC20 increase allowance when the spender is not the zero address when the sender does not have enough balance when the spender had an approved amount","increases the spender allowance adding the requested amount","increases the spender allowance adding the requested amount",""
"passed","Tue Dec 07 18:27:43 GMT 2021","Tue Dec 07 18:28:06 GMT 2021","23034","","Contract: ERC721 with minted tokens transfers via safeTransferFrom to a receiver contract that reverts with message","","Contract: ERC721 with minted tokens transfers via safeTransferFrom to a receiver contract that reverts with message","reverts","reverts",""
"passed","Tue Dec 07 18:38:37 GMT 2021","Tue Dec 07 18:38:43 GMT 2021","6313","","Contract: ERC721Enumerable Contract interface ERC721Metadata ERC165's supportsInterface(bytes4)","","Contract: ERC721Enumerable Contract interface ERC721Metadata ERC165's supportsInterface(bytes4)","claims support [skip-on-coverage]","claims support [skip-on-coverage]",""
"passed","Tue Dec 07 17:38:06 GMT 2021","Tue Dec 07 17:38:24 GMT 2021","18323","","Contract: ERC1155 like an ERC1155 safeBatchTransferFrom when sending to a valid receiver with data","","Contract: ERC1155 like an ERC1155 safeBatchTransferFrom when sending to a valid receiver with data","emits a TransferBatch log","emits a TransferBatch log",""
"passed","Tue Dec 07 18:03:27 GMT 2021","Tue Dec 07 18:03:49 GMT 2021","21928","","Contract: ERC721Enumerable with minted tokens transfers via safeTransferFrom without data to a user account when called by the approved individual","","Contract: ERC721Enumerable with minted tokens transfers via safeTransferFrom without data to a user account when called by the approved individual","adjusts owners tokens by index","adjusts owners tokens by index",""
"passed","Tue Dec 07 18:26:57 GMT 2021","Tue Dec 07 18:27:20 GMT 2021","23116","","Contract: ERC721 with minted tokens transfers via safeTransferFrom without data to a valid receiver contract with an invalid token id","","Contract: ERC721 with minted tokens transfers via safeTransferFrom without data to a valid receiver contract with an invalid token id","reverts","reverts",""
"passed","Tue Dec 07 17:17:45 GMT 2021","Tue Dec 07 17:17:57 GMT 2021","12013","","Contract: ERC20Permit permit","","Contract: ERC20Permit permit","rejects reused signature","rejects reused signature",""
"passed","Tue Dec 07 17:06:32 GMT 2021","Tue Dec 07 17:06:45 GMT 2021","12798","","Contract: Pausable when unpaused when paused unpausing","","Contract: Pausable when unpaused when paused unpausing","is unpausable by the pauser","is unpausable by the pauser",""
"passed","Tue Dec 07 17:23:28 GMT 2021","Tue Dec 07 17:23:45 GMT 2021","16904","","Contract: SafeERC20 with token that returns no boolean values approvals with non-zero allowance","","Contract: SafeERC20 with token that returns no boolean values approvals with non-zero allowance","doesn't revert when increasing the allowance","doesn't revert when increasing the allowance",""
"passed","Tue Dec 07 17:21:53 GMT 2021","Tue Dec 07 17:21:58 GMT 2021","4835","","Contract: ERC721 Contract interface ERC721 balanceOf(address)","","Contract: ERC721 Contract interface ERC721 balanceOf(address)","has to be implemented","has to be implemented",""
"passed","Tue Dec 07 17:17:18 GMT 2021","Tue Dec 07 17:17:26 GMT 2021","8184","","Contract: ERC20Snapshot snapshot","","Contract: ERC20Snapshot snapshot","emits a snapshot event","emits a snapshot event",""
"passed","Tue Dec 07 18:50:23 GMT 2021","Tue Dec 07 18:50:28 GMT 2021","5550","","Contract: SafeMath with custom revert message div","","Contract: SafeMath with custom revert message div","returns complete number result on non-even division","returns complete number result on non-even division",""
"failed","Tue Dec 07 16:17:45 GMT 2021","Tue Dec 07 16:17:58 GMT 2021","12777","","Contract: PaymentSplitter once deployed distributes funds to payees","","Contract: PaymentSplitter once deployed distributes funds to payees","Ether","Ether",""
"passed","Tue Dec 07 17:46:41 GMT 2021","Tue Dec 07 17:47:05 GMT 2021","24159","","Contract: ERC721Enumerable with minted tokens transfers via safeTransferFrom with data to a valid receiver contract when called by the owner","","Contract: ERC721Enumerable with minted tokens transfers via safeTransferFrom with data to a valid receiver contract when called by the owner","emits an Approval event","emits an Approval event",""
"passed","Tue Dec 07 17:21:41 GMT 2021","Tue Dec 07 17:21:54 GMT 2021","12642","","Contract: ERC20 approve when the spender is not the zero address when the sender does not have enough balance when the spender had an approved amount","","Contract: ERC20 approve when the spender is not the zero address when the sender does not have enough balance when the spender had an approved amount","approves the requested amount and replaces the previous one","approves the requested amount and replaces the previous one",""
"passed","Tue Dec 07 18:50:15 GMT 2021","Tue Dec 07 18:50:20 GMT 2021","5606","","Contract: ERC165Checker account address does not support ERC165","","Contract: ERC165Checker account address does not support ERC165","does not support mock interface via supportsAllInterfaces","does not support mock interface via supportsAllInterfaces",""
"passed","Tue Dec 07 18:48:23 GMT 2021","Tue Dec 07 18:48:32 GMT 2021","8547","","Contract: EnumerableSet EnumerableBytes32Set remove","","Contract: EnumerableSet EnumerableBytes32Set remove","returns false when removing values not in the set","returns false when removing values not in the set",""
"passed","Tue Dec 07 16:11:39 GMT 2021","Tue Dec 07 16:11:49 GMT 2021","9871","","Contract: AccessControl renouncing with granted role","","Contract: AccessControl renouncing with granted role","only the sender can renounce their roles","only the sender can renounce their roles",""
"passed","Tue Dec 07 17:26:59 GMT 2021","Tue Dec 07 17:27:06 GMT 2021","7298","","Contract: ERC20 _transfer when the recipient is not the zero address when the sender does not have enough balance","","Contract: ERC20 _transfer when the recipient is not the zero address when the sender does not have enough balance","reverts","reverts",""
"passed","Tue Dec 07 18:08:13 GMT 2021","Tue Dec 07 18:08:36 GMT 2021","23292","","Contract: ERC721 with minted tokens transfers via safeTransferFrom without data to a user account when called by the owner without an approved user","","Contract: ERC721 with minted tokens transfers via safeTransferFrom without data to a user account when called by the owner without an approved user","clears the approval for the token ID","clears the approval for the token ID",""
"passed","Tue Dec 07 16:53:57 GMT 2021","Tue Dec 07 16:54:02 GMT 2021","5715","","Contract: ERC1967Proxy initialization without parameters non payable when not sending balance","","Contract: ERC1967Proxy initialization without parameters non payable when not sending balance","initializes the proxy","initializes the proxy",""
"passed","Tue Dec 07 18:48:42 GMT 2021","Tue Dec 07 18:48:48 GMT 2021","6000","","Contract: SafeCast toUint96","","Contract: SafeCast toUint96","reverts when downcasting 2^96 (79228162514264337593543950336)","reverts when downcasting 2^96 (79228162514264337593543950336)",""
"passed","Tue Dec 07 17:54:47 GMT 2021","Tue Dec 07 17:55:16 GMT 2021","28553","","Contract: ERC721Enumerable with minted tokens transfers via safeTransferFrom with data to a valid receiver contract when called by the owner without an approved user","","Contract: ERC721Enumerable with minted tokens transfers via safeTransferFrom with data to a valid receiver contract when called by the owner without an approved user","adjusts owners balances","adjusts owners balances",""
"skipped","Tue Dec 07 17:17:18 GMT 2021","Tue Dec 07 17:17:18 GMT 2021","0","","Contract: ERC20VotesComp transfers","","Contract: ERC20VotesComp transfers","sender delegation","sender delegation",""
"passed","Tue Dec 07 18:48:01 GMT 2021","Tue Dec 07 18:48:11 GMT 2021","10155","","Contract: ERC165Checker ERC165 and single interface supported","","Contract: ERC165Checker ERC165 and single interface supported","supports ERC165","supports ERC165",""
"passed","Tue Dec 07 17:24:45 GMT 2021","Tue Dec 07 17:25:03 GMT 2021","17529","","Contract: ERC1155Burnable burnBatch","","Contract: ERC1155Burnable burnBatch","holder can burn their tokens","holder can burn their tokens",""
"skipped","Tue Dec 07 17:17:26 GMT 2021","Tue Dec 07 17:17:26 GMT 2021","0","","Contract: ERC20Votes set delegation with signature","","Contract: ERC20Votes set delegation with signature","rejects reused signature","rejects reused signature",""
"passed","Tue Dec 07 15:58:19 GMT 2021","Tue Dec 07 15:58:20 GMT 2021","964","Ethers.js","","","","","shouldCheckStaticJsonRpcProvider",""
"passed","Tue Dec 07 18:52:32 GMT 2021","Tue Dec 07 18:52:38 GMT 2021","5925","","Contract: SafeCast toInt32","","Contract: SafeCast toInt32","reverts when downcasting -2^31 - 1 (-2147483649)","reverts when downcasting -2^31 - 1 (-2147483649)",""
"passed","Tue Dec 07 17:25:03 GMT 2021","Tue Dec 07 17:25:09 GMT 2021","6634","","Contract: ERC1155 like an ERC1155 balanceOfBatch","","Contract: ERC1155 like an ERC1155 balanceOfBatch","reverts when one of the addresses is the zero address","reverts when one of the addresses is the zero address",""
"passed","Tue Dec 07 17:22:01 GMT 2021","Tue Dec 07 17:22:07 GMT 2021","6531","","Contract: ERC721PresetMinterPauserAutoId Contract interface ERC721Enumerable tokenByIndex(uint256)","","Contract: ERC721PresetMinterPauserAutoId Contract interface ERC721Enumerable tokenByIndex(uint256)","has to be implemented","has to be implemented",""
"passed","Tue Dec 07 17:40:11 GMT 2021","Tue Dec 07 17:40:31 GMT 2021","20409","","Contract: ERC721 with minted tokens transfers via safeTransferFrom with data to a user account when called by the operator","","Contract: ERC721 with minted tokens transfers via safeTransferFrom with data to a user account when called by the operator","clears the approval for the token ID","clears the approval for the token ID",""
"passed","Tue Dec 07 16:26:50 GMT 2021","Tue Dec 07 16:27:20 GMT 2021","29058","","Contract: Governor Contract interface Governor getVotes(address,uint256)","","Contract: Governor Contract interface Governor getVotes(address,uint256)","has to be implemented","has to be implemented",""
"passed","Tue Dec 07 18:51:23 GMT 2021","Tue Dec 07 18:51:29 GMT 2021","5900","","Contract: Counters","","Contract: Counters","starts at zero","starts at zero",""
"passed","Tue Dec 07 17:27:29 GMT 2021","Tue Dec 07 17:27:53 GMT 2021","24773","","Contract: ERC20 erc20 behaviour transfer from when the token owner is not the zero address when the recipient is not the zero address when the spender does not have enough approved balance when the token owner has enough balance","","Contract: ERC20 erc20 behaviour transfer from when the token owner is not the zero address when the recipient is not the zero address when the spender does not have enough approved balance when the token owner has enough balance","reverts","reverts",""
"passed","Tue Dec 07 18:48:22 GMT 2021","Tue Dec 07 18:48:29 GMT 2021","7328","","Contract: SafeMath with default revert message add","","Contract: SafeMath with default revert message add","adds correctly","adds correctly",""
"passed","Tue Dec 07 18:49:01 GMT 2021","Tue Dec 07 18:49:06 GMT 2021","5554","","Contract: Arrays findUpperBound Even number of elements","","Contract: Arrays findUpperBound Even number of elements","returns index of the last element","returns index of the last element",""
"passed","Tue Dec 07 17:21:40 GMT 2021","Tue Dec 07 17:21:47 GMT 2021","6546","","Contract: ERC721 Contract interface ERC721 ERC165's supportsInterface(bytes4)","","Contract: ERC721 Contract interface ERC721 ERC165's supportsInterface(bytes4)","uses less than 30k gas [skip-on-coverage]","uses less than 30k gas [skip-on-coverage]",""
"passed","Tue Dec 07 17:22:19 GMT 2021","Tue Dec 07 17:22:24 GMT 2021","5150","","Contract: ERC721 Contract interface ERC721 isApprovedForAll(address,address)","","Contract: ERC721 Contract interface ERC721 isApprovedForAll(address,address)","has to be implemented","has to be implemented",""
"passed","Tue Dec 07 15:57:17 GMT 2021","Tue Dec 07 15:57:17 GMT 2021","173","tests.brownie.token.tests","test_approve","","","","test_initial_approval_is_zero[3]",""
"passed","Tue Dec 07 18:29:47 GMT 2021","Tue Dec 07 18:30:04 GMT 2021","16986","","Contract: ERC721 with minted tokens safe mint via safeMint to a receiver contract returning unexpected value","","Contract: ERC721 with minted tokens safe mint via safeMint to a receiver contract returning unexpected value","reverts","reverts",""
"passed","Tue Dec 07 18:52:21 GMT 2021","Tue Dec 07 18:52:33 GMT 2021","11877","","Contract: Address functionCallWithValue with zero value","","Contract: Address functionCallWithValue with zero value","calls the requested function","calls the requested function",""
"passed","Tue Dec 07 18:45:59 GMT 2021","Tue Dec 07 18:46:07 GMT 2021","8126","","Contract: EIP712","","Contract: EIP712","domain separator","domain separator",""
"passed","Tue Dec 07 18:47:59 GMT 2021","Tue Dec 07 18:48:05 GMT 2021","5954","","Contract: SafeMath with flag mod modulos correctly","","Contract: SafeMath with flag mod modulos correctly","when the dividend is smaller than the divisor","when the dividend is smaller than the divisor",""
"passed","Tue Dec 07 18:55:03 GMT 2021","Tue Dec 07 18:55:09 GMT 2021","5608","","Contract: SafeCast toInt256","","Contract: SafeCast toInt256","reverts when casting UINT256_MAX (115792089237316195423570985008687907853269984665640564039457584007913129639935)","reverts when casting UINT256_MAX (115792089237316195423570985008687907853269984665640564039457584007913129639935)",""
"passed","Tue Dec 07 17:20:13 GMT 2021","Tue Dec 07 17:20:22 GMT 2021","8513","","Contract: ERC721PresetMinterPauserAutoId","","Contract: ERC721PresetMinterPauserAutoId","deployer has the minter role","deployer has the minter role",""
"passed","Tue Dec 07 16:57:57 GMT 2021","Tue Dec 07 16:58:10 GMT 2021","13140","","Contract: TransparentUpgradeableProxy upgradeToAndCall without migrations when the call does not fail when the sender is the admin","","Contract: TransparentUpgradeableProxy upgradeToAndCall without migrations when the call does not fail when the sender is the admin","calls the initializer function","calls the initializer function",""
"passed","Tue Dec 07 17:41:11 GMT 2021","Tue Dec 07 17:41:31 GMT 2021","19529","","Contract: ERC721 with minted tokens transfers via safeTransferFrom with data to a user account when called by the operator","","Contract: ERC721 with minted tokens transfers via safeTransferFrom with data to a user account when called by the operator","adjusts owners tokens by index","adjusts owners tokens by index",""
"failed","Tue Dec 07 18:49:14 GMT 2021","Tue Dec 07 18:49:38 GMT 2021","24126","","Contract: Address sendValue when sender contract has funds","","Contract: Address sendValue when sender contract has funds","sends non-zero amounts","sends non-zero amounts",""
"passed","Tue Dec 07 17:26:37 GMT 2021","Tue Dec 07 17:27:04 GMT 2021","26737","","Contract: ERC20 erc20 behaviour transfer from when the token owner is not the zero address when the recipient is not the zero address when the spender has enough approved balance when the token owner has enough balance","","Contract: ERC20 erc20 behaviour transfer from when the token owner is not the zero address when the recipient is not the zero address when the spender has enough approved balance when the token owner has enough balance","emits an approval event","emits an approval event",""
"passed","Tue Dec 07 16:21:01 GMT 2021","Tue Dec 07 16:21:33 GMT 2021","31384","","Contract: Governor Contract interface Governor ERC165's supportsInterface(bytes4)","","Contract: Governor Contract interface Governor ERC165's supportsInterface(bytes4)","uses less than 30k gas [skip-on-coverage]","uses less than 30k gas [skip-on-coverage]",""
"passed","Tue Dec 07 17:31:37 GMT 2021","Tue Dec 07 17:31:55 GMT 2021","18333","","Contract: ERC1155 like an ERC1155 safeTransferFrom when sending to a valid receiver with data","","Contract: ERC1155 like an ERC1155 safeTransferFrom when sending to a valid receiver with data","emits a TransferSingle log","emits a TransferSingle log",""
"passed","Tue Dec 07 18:08:12 GMT 2021","Tue Dec 07 18:08:33 GMT 2021","20797","","Contract: ERC721Enumerable with minted tokens transfers via safeTransferFrom without data to a user account when sent to the owner","","Contract: ERC721Enumerable with minted tokens transfers via safeTransferFrom without data to a user account when sent to the owner","keeps ownership of the token","keeps ownership of the token",""
"skipped","Tue Dec 07 17:17:18 GMT 2021","Tue Dec 07 17:17:18 GMT 2021","0","","Contract: ERC20VotesComp getPastTotalSupply","","Contract: ERC20VotesComp getPastTotalSupply","reverts if block number >= current block","reverts if block number >= current block",""
"passed","Tue Dec 07 18:38:32 GMT 2021","Tue Dec 07 18:38:39 GMT 2021","7220","","Contract: ERC721 _burn","","Contract: ERC721 _burn","reverts when burning a non-existent token id","reverts when burning a non-existent token id",""
"passed","Tue Dec 07 18:48:11 GMT 2021","Tue Dec 07 18:48:21 GMT 2021","10140","","Contract: ERC165Checker ERC165 and single interface supported","","Contract: ERC165Checker ERC165 and single interface supported","supports mock interface via supportsInterface","supports mock interface via supportsInterface",""
"passed","Tue Dec 07 18:39:09 GMT 2021","Tue Dec 07 18:39:18 GMT 2021","9167","","Contract: ERC721Enumerable metadata token URI","","Contract: ERC721Enumerable metadata token URI","return empty string by default","return empty string by default",""
"passed","Tue Dec 07 17:22:50 GMT 2021","Tue Dec 07 17:23:02 GMT 2021","12676","","Contract: ERC1155Supply after burn single","","Contract: ERC1155Supply after burn single","exist","exist",""
"broken","Tue Dec 07 16:19:27 GMT 2021","Tue Dec 07 16:20:10 GMT 2021","43415","","Contract: GovernorVotesQuorumFraction quroum not reached","","Contract: GovernorVotesQuorumFraction quroum not reached","run","run",""
"passed","Tue Dec 07 16:25:24 GMT 2021","Tue Dec 07 16:25:53 GMT 2021","28698","","Contract: Governor Contract interface Governor votingDelay()","","Contract: Governor Contract interface Governor votingDelay()","has to be implemented","has to be implemented",""
"passed","Tue Dec 07 18:46:33 GMT 2021","Tue Dec 07 18:46:43 GMT 2021","9710","","Contract: ERC165Checker ERC165 missing return data","","Contract: ERC165Checker ERC165 missing return data","does not support mock interface via getSupportedInterfaces","does not support mock interface via getSupportedInterfaces",""
"passed","Tue Dec 07 18:52:44 GMT 2021","Tue Dec 07 18:52:52 GMT 2021","8518","","Contract: Counters reset null counter","","Contract: Counters reset null counter","does not throw","does not throw",""
"passed","Tue Dec 07 17:39:01 GMT 2021","Tue Dec 07 17:39:18 GMT 2021","17257","","Contract: ERC1155 like an ERC1155 safeBatchTransferFrom to a receiver contract that reverts","","Contract: ERC1155 like an ERC1155 safeBatchTransferFrom to a receiver contract that reverts","reverts","reverts",""
"passed","Tue Dec 07 17:24:16 GMT 2021","Tue Dec 07 17:24:25 GMT 2021","9169","","Contract: ERC20 increase allowance when the spender is not the zero address when the sender has enough balance when there was no approved amount before","","Contract: ERC20 increase allowance when the spender is not the zero address when the sender has enough balance when there was no approved amount before","approves the requested amount","approves the requested amount",""
"skipped","Tue Dec 07 17:17:18 GMT 2021","Tue Dec 07 17:17:18 GMT 2021","0","","Contract: ERC20VotesComp Compound test suite numCheckpoints","","Contract: ERC20VotesComp Compound test suite numCheckpoints","returns the number of checkpoints for a delegate","returns the number of checkpoints for a delegate",""
"passed","Tue Dec 07 17:32:11 GMT 2021","Tue Dec 07 17:32:34 GMT 2021","23500","","Contract: ERC721 with minted tokens transfers via transferFrom when called by the owner without an approved user","","Contract: ERC721 with minted tokens transfers via transferFrom when called by the owner without an approved user","adjusts owners tokens by index","adjusts owners tokens by index",""
