"Status","Start Time","Stop Time","Duration in ms","Parent Suite","Suite","Sub Suite","Test Class","Test Method","Name","Description"
"passed","Tue Dec 07 16:56:23 GMT 2021","Tue Dec 07 16:56:33 GMT 2021","10553","","Contract: TransparentUpgradeableProxy initialization with parameters payable when sending some balance","","Contract: TransparentUpgradeableProxy initialization with parameters payable when sending some balance","initializes the proxy","initializes the proxy",""
"passed","Tue Dec 07 18:49:28 GMT 2021","Tue Dec 07 18:49:34 GMT 2021","5939","","Contract: SafeCast toUint224","","Contract: SafeCast toUint224","downcasts 1","downcasts 1",""
"passed","Tue Dec 07 18:28:06 GMT 2021","Tue Dec 07 18:28:29 GMT 2021","23216","","Contract: ERC721 with minted tokens transfers via safeTransferFrom to a receiver contract that reverts without message","","Contract: ERC721 with minted tokens transfers via safeTransferFrom to a receiver contract that reverts without message","reverts","reverts",""
"broken","Tue Dec 07 15:58:20 GMT 2021","Tue Dec 07 15:58:20 GMT 2021","5","ethjs","","","","","test01",""
"passed","Tue Dec 07 18:49:42 GMT 2021","Tue Dec 07 18:49:59 GMT 2021","17022","","Contract: EnumerableSet EnumerableAddressSet add","","Contract: EnumerableSet EnumerableAddressSet add","adds several values","adds several values",""
"passed","Tue Dec 07 16:56:56 GMT 2021","Tue Dec 07 16:57:05 GMT 2021","9371","","Contract: Clones cloneDeterministic initialization with parameters non payable when not sending balance","","Contract: Clones cloneDeterministic initialization with parameters non payable when not sending balance","initializes the proxy","initializes the proxy",""
"passed","Tue Dec 07 17:22:44 GMT 2021","Tue Dec 07 17:22:50 GMT 2021","5993","","Contract: ERC721PresetMinterPauserAutoId Contract interface AccessControl renounceRole(bytes32,address)","","Contract: ERC721PresetMinterPauserAutoId Contract interface AccessControl renounceRole(bytes32,address)","has to be implemented","has to be implemented",""
"passed","Tue Dec 07 16:54:20 GMT 2021","Tue Dec 07 16:54:28 GMT 2021","8291","","Contract: UUPSUpgradeable","","Contract: UUPSUpgradeable","reject upgrade to non uups implementation","reject upgrade to non uups implementation",""
"passed","Tue Dec 07 17:18:26 GMT 2021","Tue Dec 07 17:18:34 GMT 2021","7378","","Contract: ERC20 transfer when the recipient is not the zero address when the sender does not have enough balance","","Contract: ERC20 transfer when the recipient is not the zero address when the sender does not have enough balance","reverts","reverts",""
"broken","Tue Dec 07 16:36:20 GMT 2021","Tue Dec 07 16:37:04 GMT 2021","43233","","Contract: Governor scenario double cast","","Contract: Governor scenario double cast","run","run",""
"passed","Tue Dec 07 17:24:14 GMT 2021","Tue Dec 07 17:24:32 GMT 2021","18412","","Contract: ERC1155Burnable burn","","Contract: ERC1155Burnable burn","approved operators can burn the holder's tokens","approved operators can burn the holder's tokens",""
"passed","Tue Dec 07 17:28:42 GMT 2021","Tue Dec 07 17:29:07 GMT 2021","24948","","Contract: ERC721Enumerable with minted tokens transfers via transferFrom when called by the owner without an approved user","","Contract: ERC721Enumerable with minted tokens transfers via transferFrom when called by the owner without an approved user","emits an Approval event","emits an Approval event",""
"passed","Tue Dec 07 18:19:31 GMT 2021","Tue Dec 07 18:19:54 GMT 2021","23752","","Contract: ERC721 with minted tokens transfers via safeTransferFrom without data to a valid receiver contract when called by the operator","","Contract: ERC721 with minted tokens transfers via safeTransferFrom without data to a valid receiver contract when called by the operator","emits an Approval event","emits an Approval event",""
"passed","Tue Dec 07 17:42:43 GMT 2021","Tue Dec 07 17:42:50 GMT 2021","7204","","Contract: ERC1155 internal functions _burn","","Contract: ERC1155 internal functions _burn","reverts when burning the zero account's tokens","reverts when burning the zero account's tokens",""
"skipped","Tue Dec 07 16:19:29 GMT 2021","Tue Dec 07 16:19:29 GMT 2021","0","","Contract: TimelockController methods batch execute","","Contract: TimelockController methods batch execute","revert if operation is not scheduled","revert if operation is not scheduled",""
"passed","Tue Dec 07 18:11:25 GMT 2021","Tue Dec 07 18:11:43 GMT 2021","18252","","Contract: ERC721 with minted tokens transfers via safeTransferFrom without data to a user account when the address of the previous owner is incorrect","","Contract: ERC721 with minted tokens transfers via safeTransferFrom without data to a user account when the address of the previous owner is incorrect","reverts","reverts",""
"passed","Tue Dec 07 17:40:16 GMT 2021","Tue Dec 07 17:40:35 GMT 2021","18865","","Contract: ERC1155 like an ERC1155 safeBatchTransferFrom to a receiver contract that reverts only on single transfers","","Contract: ERC1155 like an ERC1155 safeBatchTransferFrom to a receiver contract that reverts only on single transfers","calls onERC1155BatchReceived","calls onERC1155BatchReceived",""
"passed","Tue Dec 07 18:48:31 GMT 2021","Tue Dec 07 18:48:36 GMT 2021","5535","","Contract: SafeCast toUint96","","Contract: SafeCast toUint96","downcasts 1","downcasts 1",""
"passed","Tue Dec 07 17:27:06 GMT 2021","Tue Dec 07 17:27:17 GMT 2021","10443","","Contract: ERC20 _transfer when the recipient is not the zero address when the sender transfers all balance","","Contract: ERC20 _transfer when the recipient is not the zero address when the sender transfers all balance","transfers the requested amount","transfers the requested amount",""
"passed","Tue Dec 07 18:05:30 GMT 2021","Tue Dec 07 18:05:52 GMT 2021","22388","","Contract: ERC721Enumerable with minted tokens transfers via safeTransferFrom without data to a user account when called by the operator","","Contract: ERC721Enumerable with minted tokens transfers via safeTransferFrom without data to a user account when called by the operator","adjusts owners tokens by index","adjusts owners tokens by index",""
"passed","Tue Dec 07 17:54:50 GMT 2021","Tue Dec 07 17:55:18 GMT 2021","27414","","Contract: ERC721 with minted tokens transfers via safeTransferFrom with data to a valid receiver contract when called by the owner without an approved user","","Contract: ERC721 with minted tokens transfers via safeTransferFrom with data to a valid receiver contract when called by the owner without an approved user","transfers the ownership of the given token ID to the given address","transfers the ownership of the given token ID to the given address",""
"passed","Tue Dec 07 18:47:51 GMT 2021","Tue Dec 07 18:48:01 GMT 2021","9799","","Contract: ERC165Checker ERC165 supported","","Contract: ERC165Checker ERC165 supported","does not support mock interface via getSupportedInterfaces","does not support mock interface via getSupportedInterfaces",""
"skipped","Tue Dec 07 16:53:35 GMT 2021","Tue Dec 07 16:53:35 GMT 2021","0","","Contract: ERC1967Proxy without initialization when not sending balance","","Contract: ERC1967Proxy without initialization when not sending balance","sets the implementation address","sets the implementation address",""
"passed","Tue Dec 07 16:57:02 GMT 2021","Tue Dec 07 16:57:11 GMT 2021","8700","","Contract: TransparentUpgradeableProxy upgradeTo when the sender is the admin when the given implementation is different from the current one","","Contract: TransparentUpgradeableProxy upgradeTo when the sender is the admin when the given implementation is different from the current one","upgrades to the requested implementation","upgrades to the requested implementation",""
"passed","Tue Dec 07 17:37:46 GMT 2021","Tue Dec 07 17:38:06 GMT 2021","20362","","Contract: ERC1155 like an ERC1155 safeBatchTransferFrom when sending to a valid receiver with data","","Contract: ERC1155 like an ERC1155 safeBatchTransferFrom when sending to a valid receiver with data","credits transferred balances to receiver","credits transferred balances to receiver",""
"passed","Tue Dec 07 18:47:43 GMT 2021","Tue Dec 07 18:47:49 GMT 2021","5426","","Contract: SignedSafeMath sub","","Contract: SignedSafeMath sub","reverts on negative subtraction overflow","reverts on negative subtraction overflow",""
"passed","Tue Dec 07 15:58:44 GMT 2021","Tue Dec 07 15:58:47 GMT 2021","3439","tests.brownie.token.tests","test_transferFrom","","","","test_transfer_event_fires",""
"failed","Tue Dec 07 16:55:11 GMT 2021","Tue Dec 07 16:55:13 GMT 2021","2502","","Contract: ERC1967Proxy initialization with parameters reverting initialization","","Contract: ERC1967Proxy initialization with parameters reverting initialization","reverts","reverts",""
"passed","Tue Dec 07 17:29:53 GMT 2021","Tue Dec 07 17:30:13 GMT 2021","20580","","Contract: ERC1155 like an ERC1155 safeTransferFrom when sending to a valid receiver without data","","Contract: ERC1155 like an ERC1155 safeTransferFrom when sending to a valid receiver without data","credits transferred balance to receiver","credits transferred balance to receiver",""
"passed","Tue Dec 07 17:40:31 GMT 2021","Tue Dec 07 17:40:51 GMT 2021","19520","","Contract: ERC721 with minted tokens transfers via safeTransferFrom with data to a user account when called by the operator","","Contract: ERC721 with minted tokens transfers via safeTransferFrom with data to a user account when called by the operator","emits an Approval event","emits an Approval event",""
"passed","Tue Dec 07 17:19:14 GMT 2021","Tue Dec 07 17:19:29 GMT 2021","15055","","Contract: ERC20Pausable pausable token burn","","Contract: ERC20Pausable pausable token burn","allows to burn when paused and then unpaused","allows to burn when paused and then unpaused",""
"passed","Tue Dec 07 17:32:07 GMT 2021","Tue Dec 07 17:32:27 GMT 2021","19416","","Contract: ERC721Enumerable with minted tokens transfers via transferFrom when the sender is not authorized for the token id","","Contract: ERC721Enumerable with minted tokens transfers via transferFrom when the sender is not authorized for the token id","reverts","reverts",""
"passed","Tue Dec 07 17:24:19 GMT 2021","Tue Dec 07 17:24:26 GMT 2021","7878","","Contract: ERC721PresetMinterPauserAutoId pausing","","Contract: ERC721PresetMinterPauserAutoId pausing","other accounts cannot pause","other accounts cannot pause",""
"passed","Tue Dec 07 17:42:58 GMT 2021","Tue Dec 07 17:43:08 GMT 2021","10181","","Contract: ERC1155 internal functions _burn","","Contract: ERC1155 internal functions _burn","reverts when burning more than available tokens","reverts when burning more than available tokens",""
"passed","Tue Dec 07 18:47:55 GMT 2021","Tue Dec 07 18:48:03 GMT 2021","7296","","Contract: SignedSafeMath mul","","Contract: SignedSafeMath mul","multiplies by zero correctly","multiplies by zero correctly",""
"passed","Tue Dec 07 16:09:50 GMT 2021","Tue Dec 07 16:09:56 GMT 2021","6099","","Contract: AccessControl default admin","","Contract: AccessControl default admin","deployer has default admin role","deployer has default admin role",""
"passed","Tue Dec 07 16:22:03 GMT 2021","Tue Dec 07 16:22:31 GMT 2021","28646","","Contract: Governor Contract interface Governor name()","","Contract: Governor Contract interface Governor name()","has to be implemented","has to be implemented",""
"failed","Tue Dec 07 16:56:47 GMT 2021","Tue Dec 07 16:56:56 GMT 2021","8738","","Contract: Clones cloneDeterministic initialization without parameters payable when sending some balance","","Contract: Clones cloneDeterministic initialization without parameters payable when sending some balance","has expected balance","has expected balance",""
"passed","Tue Dec 07 17:18:13 GMT 2021","Tue Dec 07 17:18:25 GMT 2021","11651","","Contract: SafeERC20 with token that returns false on all calls","","Contract: SafeERC20 with token that returns false on all calls","reverts on transferFrom","reverts on transferFrom",""
"passed","Tue Dec 07 17:17:57 GMT 2021","Tue Dec 07 17:18:07 GMT 2021","10264","","Contract: ERC20 set decimals","","Contract: ERC20 set decimals","can set decimals during construction","can set decimals during construction",""
"skipped","Tue Dec 07 16:19:29 GMT 2021","Tue Dec 07 16:19:29 GMT 2021","0","","Contract: TimelockController methods batch schedule","","Contract: TimelockController methods batch schedule","proposer can schedule","proposer can schedule",""
"passed","Tue Dec 07 17:41:52 GMT 2021","Tue Dec 07 17:42:00 GMT 2021","7586","","Contract: ERC1155 internal functions _mint with minted tokens","","Contract: ERC1155 internal functions _mint with minted tokens","emits a TransferSingle event","emits a TransferSingle event",""
"passed","Tue Dec 07 16:11:28 GMT 2021","Tue Dec 07 16:11:39 GMT 2021","11118","","Contract: AccessControl renouncing with granted role","","Contract: AccessControl renouncing with granted role","bearer can renounce role","bearer can renounce role",""
"passed","Tue Dec 07 18:50:21 GMT 2021","Tue Dec 07 18:50:34 GMT 2021","12350","","Contract: Create2 deploy","","Contract: Create2 deploy","deploys a ERC20Mock with correct balances","deploys a ERC20Mock with correct balances",""
"passed","Tue Dec 07 18:35:25 GMT 2021","Tue Dec 07 18:35:42 GMT 2021","17621","","Contract: ERC721Enumerable with minted tokens setApprovalForAll when the operator willing to approve is not the owner when the operator was already approved","","Contract: ERC721Enumerable with minted tokens setApprovalForAll when the operator willing to approve is not the owner when the operator was already approved","keeps the approval to the given address","keeps the approval to the given address",""
"passed","Tue Dec 07 15:58:12 GMT 2021","Tue Dec 07 15:58:13 GMT 2021","1422","Ethers.js","","","","","shouldCountTransactions",""
"broken","Tue Dec 07 16:31:37 GMT 2021","Tue Dec 07 16:32:10 GMT 2021","33026","","Contract: Governor scenario send ethers","","Contract: Governor scenario send ethers","run","run",""
"passed","Tue Dec 07 17:25:54 GMT 2021","Tue Dec 07 17:26:01 GMT 2021","7192","","Contract: ERC20 _burn for a non zero account","","Contract: ERC20 _burn for a non zero account","rejects burning more than balance","rejects burning more than balance",""
"passed","Tue Dec 07 17:23:14 GMT 2021","Tue Dec 07 17:23:29 GMT 2021","14991","","Contract: ERC1155Supply after burn batch","","Contract: ERC1155Supply after burn batch","exist","exist",""
"passed","Tue Dec 07 18:19:06 GMT 2021","Tue Dec 07 18:19:31 GMT 2021","24890","","Contract: ERC721 with minted tokens transfers via safeTransferFrom without data to a valid receiver contract when called by the operator","","Contract: ERC721 with minted tokens transfers via safeTransferFrom without data to a valid receiver contract when called by the operator","clears the approval for the token ID","clears the approval for the token ID",""
"passed","Tue Dec 07 18:33:12 GMT 2021","Tue Dec 07 18:33:29 GMT 2021","17703","","Contract: ERC721 with minted tokens approve when approving a non-zero address when there was a prior approval to a different address","","Contract: ERC721 with minted tokens approve when approving a non-zero address when there was a prior approval to a different address","sets the approval for the target address","sets the approval for the target address",""
"passed","Tue Dec 07 17:23:43 GMT 2021","Tue Dec 07 17:24:12 GMT 2021","29415","","Contract: ERC721 with minted tokens transfers via transferFrom when called by the owner","","Contract: ERC721 with minted tokens transfers via transferFrom when called by the owner","transfers the ownership of the given token ID to the given address","transfers the ownership of the given token ID to the given address",""
"passed","Tue Dec 07 16:21:33 GMT 2021","Tue Dec 07 16:22:03 GMT 2021","30022","","Contract: Governor Contract interface Governor ERC165's supportsInterface(bytes4)","","Contract: Governor Contract interface Governor ERC165's supportsInterface(bytes4)","claims support [skip-on-coverage]","claims support [skip-on-coverage]",""
"passed","Tue Dec 07 18:53:03 GMT 2021","Tue Dec 07 18:53:11 GMT 2021","8421","","Contract: StorageSlot uint256 storage slot get","","Contract: StorageSlot uint256 storage slot get","from other slot","from other slot",""
"passed","Tue Dec 07 18:46:35 GMT 2021","Tue Dec 07 18:46:41 GMT 2021","5880","","Contract: SafeCast toUint8","","Contract: SafeCast toUint8","downcasts 1","downcasts 1",""
"passed","Tue Dec 07 18:26:11 GMT 2021","Tue Dec 07 18:26:33 GMT 2021","22631","","Contract: ERC721 with minted tokens transfers via safeTransferFrom without data to a valid receiver contract when the given token ID does not exist","","Contract: ERC721 with minted tokens transfers via safeTransferFrom without data to a valid receiver contract when the given token ID does not exist","reverts","reverts",""
"passed","Tue Dec 07 18:48:32 GMT 2021","Tue Dec 07 18:49:21 GMT 2021","49128","","Contract: EnumerableSet EnumerableBytes32Set remove","","Contract: EnumerableSet EnumerableBytes32Set remove","adds and removes multiple values","adds and removes multiple values",""
"passed","Tue Dec 07 16:09:54 GMT 2021","Tue Dec 07 16:10:00 GMT 2021","6740","","Contract: Ownable renounce ownership","","Contract: Ownable renounce ownership","prevents non-owners from renouncement","prevents non-owners from renouncement",""
"passed","Tue Dec 07 17:27:04 GMT 2021","Tue Dec 07 17:27:29 GMT 2021","24998","","Contract: ERC20 erc20 behaviour transfer from when the token owner is not the zero address when the recipient is not the zero address when the spender has enough approved balance when the token owner does not have enough balance","","Contract: ERC20 erc20 behaviour transfer from when the token owner is not the zero address when the recipient is not the zero address when the spender has enough approved balance when the token owner does not have enough balance","reverts","reverts",""
"passed","Tue Dec 07 18:50:25 GMT 2021","Tue Dec 07 18:50:31 GMT 2021","5647","","Contract: SafeCast toInt8","","Contract: SafeCast toInt8","downcasts 1","downcasts 1",""
"passed","Tue Dec 07 17:25:40 GMT 2021","Tue Dec 07 17:25:49 GMT 2021","9219","","Contract: ERC1155 like an ERC1155 setApprovalForAll","","Contract: ERC1155 like an ERC1155 setApprovalForAll","sets approval status which can be queried via isApprovedForAll","sets approval status which can be queried via isApprovedForAll",""
"passed","Tue Dec 07 18:13:52 GMT 2021","Tue Dec 07 18:14:16 GMT 2021","23901","","Contract: ERC721 with minted tokens transfers via safeTransferFrom without data to a valid receiver contract when called by the owner","","Contract: ERC721 with minted tokens transfers via safeTransferFrom without data to a valid receiver contract when called by the owner","emits a Transfer event","emits a Transfer event",""
"passed","Tue Dec 07 17:37:15 GMT 2021","Tue Dec 07 17:37:36 GMT 2021","20417","","Contract: ERC721Enumerable with minted tokens transfers via safeTransferFrom with data to a user account when called by the operator","","Contract: ERC721Enumerable with minted tokens transfers via safeTransferFrom with data to a user account when called by the operator","transfers the ownership of the given token ID to the given address","transfers the ownership of the given token ID to the given address",""
"passed","Tue Dec 07 18:48:20 GMT 2021","Tue Dec 07 18:48:32 GMT 2021","12380","","Contract: EnumerableMap remove","","Contract: EnumerableMap remove","removes added keys","removes added keys",""
"passed","Tue Dec 07 18:54:40 GMT 2021","Tue Dec 07 18:54:46 GMT 2021","5867","","Contract: SafeCast toInt256","","Contract: SafeCast toInt256","casts 0","casts 0",""
"passed","Tue Dec 07 17:19:27 GMT 2021","Tue Dec 07 17:19:39 GMT 2021","12313","","Contract: ERC20Snapshot balanceOfAt with initial snapshot with no balance changes after the snapshot","","Contract: ERC20Snapshot balanceOfAt with initial snapshot with no balance changes after the snapshot","returns the current balance for all accounts","returns the current balance for all accounts",""
"skipped","Tue Dec 07 17:17:18 GMT 2021","Tue Dec 07 17:17:18 GMT 2021","0","","Contract: ERC20VotesComp getPastTotalSupply","","Contract: ERC20VotesComp getPastTotalSupply","returns the latest block if >= last checkpoint block","returns the latest block if >= last checkpoint block",""
"passed","Tue Dec 07 17:41:17 GMT 2021","Tue Dec 07 17:41:22 GMT 2021","4828","","Contract: ERC1155 like an ERC1155 Contract interface ERC1155 balanceOf(address,uint256)","","Contract: ERC1155 like an ERC1155 Contract interface ERC1155 balanceOf(address,uint256)","has to be implemented","has to be implemented",""
"passed","Tue Dec 07 18:09:44 GMT 2021","Tue Dec 07 18:10:05 GMT 2021","20725","","Contract: ERC721 with minted tokens transfers via safeTransferFrom without data to a user account when sent to the owner","","Contract: ERC721 with minted tokens transfers via safeTransferFrom without data to a user account when sent to the owner","keeps ownership of the token","keeps ownership of the token",""
"passed","Tue Dec 07 18:46:52 GMT 2021","Tue Dec 07 18:47:02 GMT 2021","9670","","Contract: ERC165Checker ERC165 not supported","","Contract: ERC165Checker ERC165 not supported","does not support mock interface via supportsInterface","does not support mock interface via supportsInterface",""
"passed","Tue Dec 07 17:19:35 GMT 2021","Tue Dec 07 17:19:56 GMT 2021","21214","","Contract: ERC20 withdraw","","Contract: ERC20 withdraw","missing balance","missing balance",""
"passed","Tue Dec 07 17:28:59 GMT 2021","Tue Dec 07 17:29:07 GMT 2021","8124","","Contract: ERC20 _approve when the spender is the zero address","","Contract: ERC20 _approve when the spender is the zero address","reverts","reverts",""
"passed","Tue Dec 07 17:22:50 GMT 2021","Tue Dec 07 17:22:57 GMT 2021","6863","","Contract: ERC721PresetMinterPauserAutoId Contract interface AccessControlEnumerable ERC165's supportsInterface(bytes4)","","Contract: ERC721PresetMinterPauserAutoId Contract interface AccessControlEnumerable ERC165's supportsInterface(bytes4)","uses less than 30k gas [skip-on-coverage]","uses less than 30k gas [skip-on-coverage]",""
"passed","Tue Dec 07 17:27:30 GMT 2021","Tue Dec 07 17:27:53 GMT 2021","23803","","Contract: ERC721Enumerable with minted tokens transfers via transferFrom when called by the owner without an approved user","","Contract: ERC721Enumerable with minted tokens transfers via transferFrom when called by the owner without an approved user","transfers the ownership of the given token ID to the given address","transfers the ownership of the given token ID to the given address",""
"passed","Tue Dec 07 16:53:34 GMT 2021","Tue Dec 07 16:53:42 GMT 2021","7384","","Contract: TransparentUpgradeableProxy","","Contract: TransparentUpgradeableProxy","cannot be initialized with a non-contract address","cannot be initialized with a non-contract address",""
"passed","Tue Dec 07 17:17:42 GMT 2021","Tue Dec 07 17:17:50 GMT 2021","8005","","Contract: ERC20PresetMinterPauser","","Contract: ERC20PresetMinterPauser","deployer has the pauser role","deployer has the pauser role",""
"passed","Tue Dec 07 17:18:31 GMT 2021","Tue Dec 07 17:18:40 GMT 2021","9121","","Contract: ERC20Pausable pausable token mint","","Contract: ERC20Pausable pausable token mint","allows to mint when unpaused","allows to mint when unpaused",""
"passed","Tue Dec 07 18:50:35 GMT 2021","Tue Dec 07 18:50:43 GMT 2021","8559","","Contract: EnumerableSet EnumerableAddressSet remove","","Contract: EnumerableSet EnumerableAddressSet remove","returns false when removing values not in the set","returns false when removing values not in the set",""
"passed","Tue Dec 07 17:26:44 GMT 2021","Tue Dec 07 17:27:05 GMT 2021","21051","","Contract: ERC721Enumerable with minted tokens transfers via transferFrom when called by the operator","","Contract: ERC721Enumerable with minted tokens transfers via transferFrom when called by the operator","adjusts owners balances","adjusts owners balances",""
"passed","Tue Dec 07 18:40:09 GMT 2021","Tue Dec 07 18:40:15 GMT 2021","5917","","Contract: ERC721 metadata","","Contract: ERC721 metadata","has a symbol","has a symbol",""
"skipped","Tue Dec 07 17:17:26 GMT 2021","Tue Dec 07 17:17:26 GMT 2021","0","","Contract: ERC20Votes set delegation call","","Contract: ERC20Votes set delegation call","delegation with balance","delegation with balance",""
"passed","Tue Dec 07 17:19:55 GMT 2021","Tue Dec 07 17:20:07 GMT 2021","12270","","Contract: ERC20 transfer from when the token owner is not the zero address when the recipient is not the zero address when the spender has enough approved balance when the token owner has enough balance","","Contract: ERC20 transfer from when the token owner is not the zero address when the recipient is not the zero address when the spender has enough approved balance when the token owner has enough balance","emits an approval event","emits an approval event",""
"passed","Tue Dec 07 17:28:45 GMT 2021","Tue Dec 07 17:29:08 GMT 2021","22859","","Contract: ERC721 with minted tokens transfers via transferFrom when called by the operator","","Contract: ERC721 with minted tokens transfers via transferFrom when called by the operator","clears the approval for the token ID","clears the approval for the token ID",""
"passed","Tue Dec 07 18:46:00 GMT 2021","Tue Dec 07 18:46:06 GMT 2021","6461","","Contract: ECDSA recover with invalid signature","","Contract: ECDSA recover with invalid signature","with short signature","with short signature",""
"passed","Tue Dec 07 18:52:03 GMT 2021","Tue Dec 07 18:52:09 GMT 2021","5599","","Contract: SafeCast toInt32","","Contract: SafeCast toInt32","downcasts 0","downcasts 0",""
